id,created,updated,title,content,tags,product,topic,locale,answers,creator
1284276,2020-04-11 22:30:25 -0800,2020-04-12T20:32:32Z,"""Google Image Downloader"" extension to download my all image on google search engine but this not working properly","<p>Hello, </p><p>I'm Micky, I'm getting problem in ""<a href=""https://addons.mozilla.org/en-US/firefox/addon/google-images-downloader/"" rel=""nofollow"">Google Image Downloader</a>"" extension. Before a month i use this extension and it's working fine. now today i'm trying again to use this extension to download my image from google. unfortunately but it download empty file. I did same method what i did before a month. like i go to firefox then open google search engine and write my website name ""<a href=""https://vloggingguru.com"" rel=""nofollow"">Vlogging Guru</a>"" then go to images section then i click on Extension to download all image. But today i'm getting problem. is their any solution for it? Even i try this to another name like health, Fitness, Photographers but still not working.  </p><p>If anyone know this solution then please explain.! </p><p>Thanks </p>",firefox-750;desktop;fix-problems;windows-10;,firefox,fix-problems,en-US,1305003;1305005;1305079;1305083;1305084;1305085;,Adilmukhtarumt
1284274,2020-04-11 22:04:35 -0800,2020-04-12T01:28:15Z,Tengo problemas para ingresar a algunos sitios con https,"<p>Si ingreso a un sitio con https como por ejemplo este: <a href=""https://depelis.co"" rel=""nofollow"">https://depelis.co</a> escribiendolo directamente en la barra de navegación, puedo ingresar correctamente, ahora si trato de hacerlo desde Google, me ocurre un error, dejo la captura debajo. </p>",firefox-750;websites;desktop;windows-10;,firefox,websites,es,1304965;1304991;1304992;,contenidos
1284273,2020-04-11 20:52:13 -0800,2020-04-12T12:40:36Z,How do i turn bulit-in firefox ad blocker off? i want to see google ads when i search on somthing,<p>As you see in the image when i search on something on google Firefox blocks the ads i want to turn it off? i already turned off enhanced tracking protection but still blocking them </p>,privacy-and-security_1;firefox-750;desktop;windows-10;,firefox,privacy-and-security,en-US,1305007;1305159;1305185;,pmamir24
1284271,2020-04-11 20:10:47 -0800,2020-04-13T02:09:35Z,Every time I start firefox the address bar pops out and asks if I want to search or enter address How do I stop this crap?,"<p>Starting Firefox the address bar pops out and asks if I want to search or enter an address.  How do I stop it?  I have looked everywhere toggled everything and this will not stop. I just want it t stop, please can some one tell me how to put an end to this garbage? </p>",tabs;firefox-750;desktop;mac-os;megabar;,firefox,tabs,en-US,1304940;1304946;1304951;1304953;1304957;1304963;1304964;1304966;1304967;1304968;1304969;1304970;1304972;1304974;1305153;1305161;1305167;1305288;1305291;1305318;1305324;,mrbeta
1284270,2020-04-11 20:00:43 -0800,2020-04-12T04:01:11Z,Media focus management limited. Working as intended or how to get around it?,"<p>Been using this is Chrome for a while and it's awesome, but in Firefox it seems very limited or maybe i'm missing something (btw, how do i sort about:config by modified?) </p><p>In chrome it acts as a single instance kinda thing, but you can manually stop the focused page and play media from a background one. Not in Firefox even if the focus page doesnt have audio itself, so automatically muting the BG is unnecessary. </p>",firefox-750;customize;desktop;windows-7;,firefox,customize,en-US,1305009;1305019;,Yinmin
1284269,2020-04-11 19:50:27 -0800,2020-04-12T05:48:38Z,I am gettig popup in yahoo mail  about ad blocker and even after trying to delete it from yahoo mail it does not go away,<p>i do not want to see this popup how do i get rid of it </p>,privacy-and-security_1;firefox-750;desktop;windows-10;,firefox,privacy-and-security,en-US,1305052;,hymanbrodt
1284268,2020-04-11 19:32:12 -0800,2020-04-11T20:26:42Z,I don't want that search in the address bar. I want it turned off.,"<p>How do I turn off the address bar search? That other answer was for Linux. I have Windows, and I don't know about css and stuff. </p>",firefox-750;customize;desktop;windows-10;megabar;,firefox,customize,en-US,1304941;,ct99246
1284266,2020-04-11 18:05:29 -0800,2020-04-13T20:07:51Z,My font on Mozilla Firefox look weird,<p>I have comparison with Google Chrome It's like a bolder than normal </p>,firefox-740;other;desktop;mac-os;font;,firefox,other,en-US,1304938;1305287;1305289;1305299;1305433;1305539;,sodaarchan
1284265,2020-04-11 17:57:06 -0800,2020-04-11T19:24:50Z,malware called jackyhillty.net,"<p>Since last week been getting constant warnings about virus (from basic version of Avast) <a href=""https://jackyhillty.net"" rel=""nofollow"">https://jackyhillty.net</a> Ran scans with Malwarebytes, Spybot, but nothing showed up re this virus. Tried searching on Net but again, nothing. I am baffled. Anyone know about this and how to get rid?  screenshot included </p>",privacy-and-security_1;firefox-750;desktop;windows-10;,firefox,privacy-and-security,en-US,1304931;,tp3813
1284264,2020-04-11 17:06:41 -0800,2020-04-11T20:13:17Z,Deleting ALL Firefox data and traces as suggested doesn't work.,"<p>Firefox won't fully launch. It goes into process, but never comes to the foreground. I've tried everything that can be done without using Firefox (it won't open). I can see two instances of Firefox flickering in Process Explorer, and they're eating system resources without really DOING anything. I've tried: 1. Restart Windows 10, uninstall, restart, reinstall. 2. Deleting Firefox Maintenance folder in Programs (x86). Uninstall, restart, reinstall. 3. Deleting the profile folders in AppData. Uninstall, restart, reinstall. 4. Uninstall, scour registry of all traces. Restart, reinstall. 5. It works on my OTHER admin account, but not on this one. </p><p>While Firefox is doing this nothing business, I can't uninstall it with my uninstaller on THIS account, so I have to go to my other account to uninstall, and when I get back to this one, an error message is on the screen. </p><p>Firefox is currently uninstalled, so no luck at its inner workings. </p>",desktop;fix-problems;,firefox,fix-problems,en-US,1304900;1304901;1304915;1304924;1304937;,Gremlin.Bitten
1284260,2020-04-11 16:22:36 -0800,2020-04-12T21:06:14Z,How do I stop ten other url's popping up every time I highlight a url to copy it?,"<p>This just started recently.  Whenever I copy a URL, a list of ten other URLs pops up, and I have to click again to make it vanish.  How can I stop this annoyance? </p>",firefox-750;customize;desktop;megabar;,firefox,customize,en-US,1304983;1305257;1305284;,DiverDan
