id,created,updated,title,content,tags,product,topic,locale,answers,creator
1284835,2020-04-18 00:55:29 -0800,2020-04-18T18:17:47Z,10+ tabs of Firefox open in task manager,"<p>So, i open task manger to see this. <a href=""https://user-media-prod-cdn.itsre-sumo.mozilla.net/uploads/images/2020-04-18-00-50-31-f526c8.png"" rel=""nofollow"">https://user-media-prod-cdn.itsre-sumo.mozilla.net/uploads/images/2020-04-18-00-50-31-f526c8.png</a> And i go on to the firefox website to find a fix for it. I find a lot of really good one, but i have a major problem. <a href=""https://user-media-prod-cdn.itsre-sumo.mozilla.net/uploads/images/2020-04-18-00-51-37-701dee.png"" rel=""nofollow"">https://user-media-prod-cdn.itsre-sumo.mozilla.net/uploads/images/2020-04-18-00-51-37-701dee.png</a> Isn't there supposed to be a second one of these? Because there isn't one there for me. And i am getting pretty tired of having this problem. I have also used methods from a couple of sources and they just keep showing up. Sources used </p> <ul><li> <a href=""https://support.mozilla.org/en-US/questions/1147868"" rel=""nofollow"">https://support.mozilla.org/en-US/questions/1147868</a>  </li><li> <a href=""https://support.mozilla.org/en-US/questions/1217583"" rel=""nofollow"">https://support.mozilla.org/en-US/questions/1217583</a> </li></ul>",firefox-740;desktop;fix-problems;windows-10;,firefox,fix-problems,en-US,1306908;,mountaincloudwolf
1284834,2020-04-18 00:52:28 -0800,2020-04-18T03:25:18Z,Firefox opens but is unresponsive,"<p>New problem: not had a problem before with Firefox </p><p>I have tried opening Firefox, window opens but is unresponsive I have tried: Safe mode Refresh Uninstall and reinstall </p><p>Using version 75.0 64 bit on server 2019 </p>",desktop;fix-problems;,firefox,fix-problems,en-US,1306710;1306713;,hardingspecial
1284833,2020-04-18 00:40:59 -0800,2020-04-20T08:14:58Z,"Browser does not load ""https://overdrive.in"". Gives error.","<p>This used to load without issues until a couple of months ago. Now it does not. It has been a while since i visited the website but Other browsers are perfectly able to open it now. - Cleared history and cache and cookies. - Check for the ipv6, DNS prefetch and No proxy fixes in firefox.  - No malware found via BItdefender, Panda Cloud and Malwarebytes. </p><p>It specifically fails to load with the following error code: An error occurred while processing your request. Reference #97.15e51cb8.1587195116.5338f60  </p><p>Any pointers ? </p>",firefox-750;websites;desktop;windows-10;certificates;escalate;,firefox,websites,en-US,1306992;1306993;1307251;,rocker.manoranjan
1284832,2020-04-17 23:46:13 -0800,2020-04-18T03:17:37Z,I would like to hear an online radio site denied in FireFox- that other web browsers (Chrome/Edge) allow on the same OS/Computer,"<p>Hi </p><p>Accessing an online radio site when nothing is heard is not the best  </p><p><a href=""https://www.radiostationsolutions.com/radioplayer/radionewsprings"" rel=""nofollow"">https://www.radiostationsolutions.com/radioplayer/radionewsprings</a> </p><p>the following browsers allow use - noting that FireFox is absent - how can I fix it so this radio station will play? </p><p>Google Chrome - Microsoft Edge - Vivaldi - Opera - Brave - Maxthon Cloud - Epic </p>",firefox-750;other;desktop;windows-10;,firefox,other,en-US,1306695;1306696;1306704;1306711;1306712;,geof.spavins
1284831,2020-04-17 23:31:04 -0800,2020-04-17T23:31:04Z,Why does webgl fail for Firefox?,"<p>Sites that use WebGL fail for me on Firefox, and in the 'WebGL 1 Driver Renderer' field of about:support, I see the message: </p><p>WebGL creation failed:  </p> <ul><li> Refused to create native OpenGL context because of blacklist entry: FEATURE_FAILURE_GLXTEST_FAILED </li><li> Exhausted GL driver options. </li></ul> <p>I haven't been able to find information about this error by searching on these forums or the web. </p><p>It should be noted that WebGL works fine in Chrome on the same machine. </p><p>I'm running Ubuntu 20.04 with an Nvidia GeForce GTX 1070 card, running nvidia-driver-440 from the Ubuntu apt archive. </p>",firefox-750;desktop;fix-problems;linux;,firefox,fix-problems,en-US,"",cody.shepherd
1284830,2020-04-17 22:13:59 -0800,2020-04-18T10:21:09Z,Is There a Way to Add Icon to Search ?,<p>Is there a way to Add Icon to anything on the drop Down Menu like the Search Google? </p>,firefox-750;customize;desktop;windows-81;,firefox,customize,en-US,1306796;,mrbunnylamakins
1284825,2020-04-17 18:19:19 -0800,2020-04-18T15:24:02Z,"upgrade from 74 to 75 the browser won't go to any site.  The lovely new big address bar shows up, but that's about it. Other browsers no problem.","<p>So I generally keep Firefox up to date, letting the system manage itself, but this time I have had to disable this update.   When I update, either through the automatic updates, or even from a fresh install of 75 (or beta 76) the browser starts, I see the lovely new address bar, albeit blank, and the browser just hangs right there.  I can type in the nifty new bar, but nothing happens, no browsing to a site, no opening configs, nothing.   </p><p>I have this issue on windows 7, 8 and 10 machines, so it's not an OS issue.   </p><p>When an update does happen it chews up my profiles too and I have to end up rebuilding those.  Only when I go back to 74 does Firefox work again.   </p><p>I'm at a bit of a loss here. </p>",firefox-740;desktop;fix-problems;windows-7;escalate;download-and-install;,firefox,fix-problems,en-US,1306665;1306668;1306674;1306701;1306708;1306714;1306832;1306833;1306851;,swordstar
1284823,2020-04-17 18:09:42 -0800,2020-04-17T18:09:42Z,Sync only working one direction.,<p>I have Firefox 75 on my desktop. And Firefox Android 68.7.0 on my Pixel phone. My desktop items sync to my phone with no problem. But my phone will sync everything but my passwords back to my desktop. This started when I upgrade my desktop from Firefox 52 to 75. I also lost all my passwords on desktop when I upgraded.  </p><p>I do not have a oligarch password. </p><p>Am I required to use lockwise with Firefox 75 for passwords to sync back to it? </p>,sync;desktop;,firefox,sync,en-US,"",billkater1
1284822,2020-04-17 18:01:32 -0800,2020-04-18T22:16:30Z,"Reformatted pc, now Firefox not even recognizing McAfee Site Advisor installation like before, any suggestions? If it's blocked, good alternative?  Thanks :)","<p>Prior to formatting pc, I had McAfee Site Advisor installed, was recognized by Firefox, showing on top right of browser.  After formatting pc, McAfee Site Advisor installation now not recognized by Firefox, i.e., not showing up on top right of browser, not even showing up in add-ons.  Is it blocked now by FF, and if so, any good suggestions?  I like the idea of something next to a site showing level of safety.  Thanks so much :) </p>",firefox-750;customize;desktop;windows-81;,firefox,customize,en-US,1306666;1306671;1306856;1306946;1306952;,gerri
1284821,2020-04-17 17:41:48 -0800,2020-04-18T14:26:01Z,"Me robaron mi celular y mi laptop sincronizados. Puedo recuperar mis pestañas, marcadores, historial, y contraseñas de firefox?","<p>Buenas noches, tengo acceso a mi cuenta firefox pero lo perdí absolutamente todo. qu peduo hacer? </p>",firefox-750;other;desktop;windows-7;needsinfo;,firefox,other,es,1306838;,gb_12_8
1284819,2020-04-17 17:22:00 -0800,2020-04-18T15:32:27Z,drop down url box,"<p>the ""new firefox"" keeps filling my screen (slightly annoyingly) with what I am guessing is recent dropdown url suggestions </p><p>I dont want the dropdown suggestions - I dont want to delete history </p><p>I'd just like to revert back to the behaviour that......that previous version of firefox had </p><p>not possible? </p>",firefox-750;other;desktop;windows-7;,firefox,other,en-US,1306678;1306687;1306845;1306857;,tp_2346
1284818,2020-04-17 17:07:11 -0800,2020-04-20T09:07:26Z,Twitter on Firefox missing functions,"<p>Hello, this appears to be a Firefox-exclusive problem as any other browser used will fix the issues listed below. However, when I am using Firefox, the following happens: </p> <ul><li> I am unable to like or retweet anything, and cannot follow any accounts. Attempting to do so resets them if I refresh or click off the tab. </li><li> Notifications do not go away even when I view them </li><li> Any tweets I have cannot be deleted </li><li> Any info on my profile cannot be changed </li><li> I cannot log out </li></ul> <p>I've tried multiple ways to fix this, including clearing my cache, running in Safe Mode, and removing my saved login. None of these have worked, unfortunately. I've reached out to Twitter Support, but soon realized I wouldn't hear back about specific problems at all. Is there anything I can do to fix this problem? </p>",firefox-750;websites;desktop;windows-10;,firefox,websites,en-US,1306652;1307128;1307143;1307257;,mcpherson.angus
1284817,2020-04-17 17:06:08 -0800,2020-04-17T21:27:01Z,Why can't firefox save a file on my desktop creating a meaningful shortcut reflecting the logo of the icon's  identity ?,"<p>First I saved the file on my desktop with firefox. When I attempted to open it later, all I saw was a list of unscripted files that were meaningless. I then proceeded to save the original file on my desktop using internet explorer..proceeded to open it and all the pages and graphics were intact. So tell me why I should continue using firefox when all I see is jumbled java script. I need to save files on my desktop. </p><p>Basic TROUBLESOME issues like this, which are of prime necessity to this user, firefox seems to ignore . </p>",firefox-740;desktop;fix-problems;windows-7;needsinfo;,firefox,fix-problems,en-US,1306660;1306663;1306670;,RJK7
1284816,2020-04-17 16:38:39 -0800,2020-04-17T18:19:44Z,turn off private browsing for a tab,<p>I would like to turn off private browsing for one tab or for one instance of firefox without turning it off all the time.  Washington Post will not allow me to see content without subscription in private mode. </p>,tabs;firefox-750;desktop;windows-10;,firefox,tabs,en-US,1306644;,twowheels2go
1284815,2020-04-17 16:08:29 -0800,2020-04-18T10:26:38Z,"My SSL-secured website gets warning ""connection not secure"" when I access the site by IP:443","<p>When I access my own development website by domain name (with SSL signed by Digicert), it's fine, I see the lock symbol in FF. When I access it by typing https://[IP address]:443 , I get the ""not secure"" warning. The IP address has a valid reverse DNS that points to the domain name, which in turn has the valid SSL cert. The domain's A Record also points back to the same IP address. I'm curious why does Firefox do this, and is there anything I can do in my DNS settings to remove the warning for other users -- without changing FF settings? Thanks. </p>",privacy-and-security_1;firefox-720;desktop;windows-10;,firefox,privacy-and-security,en-US,1306616;1306633;1306690;1306739;1306799;,codewave1
