id,created,updated,title,content,tags,product,topic,locale,answers,creator
1285479,2020-04-26 15:32:35 -0800,2020-04-26T18:38:22Z,My Flutter web app can't display svg files in Firefox.,<p>The logo in my Flutter web app can't be displayed in the svg format. It works everywhere but Firefox. </p>,firefox-750;websites;desktop;windows-10;,firefox,websites,en-US,1308722;1308728;1308747;,diin.ferhatovic
1285477,2020-04-26 13:37:56 -0800,2020-04-26T13:37:56Z,firefox doesn't recognize my installed printer,"<p>When I click ""print"" my installed printer isn't listed, my choices are microsoft print to pdf, microsoft xps doc.writer, or one note. I can print to PDF, open the file with Acrobat reader and print from that application. How do I get Firefox to notice my printer? </p>",firefox-750;other;desktop;windows-10;,firefox,other,en-US,"",bruce_sam
1285475,2020-04-26 12:55:38 -0800,2020-04-26T13:49:07Z,"A certain website will redirect to Google, this only happens in firefox for desktop and doesn't happen on mobile or other browsers","<p>When I try to visit the below website I am redirected to Google (my home page) </p><p><a href=""https://www.juicydetailing.co.uk/"" rel=""nofollow"">https://www.juicydetailing.co.uk/</a> </p><p>This only happens on the desktop version of Firefox and does not happen on mobile or other browsers. </p><p>Tried to delete cache and history etc but no luck Disabled all addons but still facing the issue </p>",firefox-750;websites;desktop;windows-10;,firefox,websites,en-US,1308697;1308702;1308704;,awilkinson1991
1285474,2020-04-26 12:43:17 -0800,2020-04-26T13:31:18Z,i sent a message and don't know where to find reply,<p>I sent an email message re problem with autoplay and don't know where to find reply. </p>,firefox-750;other;desktop;windows-7;,firefox,other,en-US,1308698;1308701;,yafiinfo2008
1285470,2020-04-26 11:18:06 -0800,2020-04-27T01:57:38Z,Move mozilla data folder ~/.mozilla on Linux,"<p>I'm trying to move the ~/.mozilla folder to an arbitrary location on my system. I have seen ways to relocate profiles data (with the ""--profile"" parameter), but firefox keeps creating the ~/.mozilla folder. How can I give firefox a diferent path and avoid haveing ~/.mozilla on my home? I'm using Firefox ESR 68.7 on GNU/Linux Thank you. </p>",firefox-680;customize;desktop;linux;,firefox,customize,en-US,1308733;1308749;1308793;,lluise
1285469,2020-04-26 11:10:57 -0800,2020-04-27T08:53:55Z,I have encountered the problem. Flash player doesn't work on firefox.,<p>Firstly I thought that the web might have some inconsistencies but then another site also couldn't work. For example before I could pay from my VISA using form on website but now the form doesn't work. Or when I try to watch video at movies' site the flash player doesn't work. But when I open Microsoft Edge all the websites work. What's wrong with my firefox 75 at win 10 pro x64? </p>,firefox-750;customize;desktop;windows-10;,firefox,customize,en-US,1308699;1308703;1308718;1308721;1308801;1308807;1308841;1308857;,ieahsan
1285468,2020-04-26 10:29:16 -0800,2020-04-26T13:23:06Z,"After running a threat scan in malwarebytes, Firefox takes almost a minute to  load web pages","<p>Windows 10 pro 64 bit,  I'm running a full thread scan with Malwarebytes 4.1.0 premium and some time during the filesystem scan something happens that  causes Firefox to take almost a minute to load up a web page.  </p><p>In order to get things working again I have to restart my computer. Has anyone else seen this? If so any solutions? </p><p>I've contacted Malwarebytes but so far haven't got any kind of reason or resolution. </p><p>Thanks </p><pre>Nor </pre>",desktop;fix-problems;,firefox,fix-problems,en-US,1308700;,njsg1
1285466,2020-04-26 10:22:39 -0800,2020-04-26T10:48:07Z,Mouse scroll wheel does not scroll the page well.,"<p>Hey </p><p>Does anyone have issues with scrolling web-pages with mouse scroll wheel? Mine skips a lot. Sometimes it stops responding scrolling for several seconds. Usually if I once scrolled the page, after that it scrolls up and down without problems, its the first scroll down that isn't responsive. It is not mouse issue. On other programs scrolling is smooth. Same pages scroll smooth on other browsers like Edge or Chrome. My mouse is Logitech G502. </p>",firefox-750;desktop;fix-problems;windows-10;,firefox,fix-problems,en-US,1308675;,edmo.ounapuu
1285458,2020-04-26 08:38:21 -0800,2020-04-26T12:17:23Z,Firefox will not open Youtube videos,"<p>This is a new Dell laptop with latest updates of Window 10 and Firefox 75.0 (64-bit) . Last laptop did not have this problem. </p><p>When I try to open a Youtube video, this is the error message. ""The address wasn't understood. Firefox doesn't know how to open this address, because one of the following protocols (rtsp) isn't associated with any program or is not allowed in this context. You might need to install other software to open this address."" </p><p>How can I resolve this, please? </p>",firefox-750;other;desktop;windows-10;,firefox,other,en-US,1308690;,philip25
1285456,2020-04-26 07:25:33 -0800,2020-04-27T20:14:37Z,will not open home page,<p>When trying to open the home page will not come open nothing is happening </p>,firefox-750;other;desktop;windows-10;,firefox,other,en-US,1308664;1308901;1308982;1308983;,ddacs
1285455,2020-04-26 07:00:24 -0800,2020-04-26T21:14:59Z,Older versions of extensions?,"<p>My old PC died, luckily, I had a new (secondhand) one ready to go. </p><p>I am using a pre-quantum version of Firefox. </p><p>Where can I get legacy versions of extensions that I need? </p><p>Yes, they've all been updated and maintained, but, there are several whose functions are severaly depreciated - including one where I would now have to actually PAY MONEY to do what I used to be able to do with ease on the legacy version. </p><p>Urgently seeking legacy versions that all worked fine before my old PC hit the dust last week. </p>",firefox-560;customize;desktop;windows-7;,firefox,customize,en-US,1308619;1308642;1308657;1308667;1308717;1308724;1308738;1308754;1308766;,janglymark1
1285454,2020-04-26 06:51:08 -0800,2020-04-26T08:00:12Z,Bookmarks are missing after delete of Appdata folder,"<p>I have deleted data from Appdata folder(which includes browser data), then in my browser bookmarks were not showing, then I reinstalled Mozilla and started sync, Some of the recently made bookmarks are still missing.Can I recover those missing bookmarks.Could you please suggest. </p>",bookmarks;firefox-750;desktop;windows-10;,firefox,bookmarks,en-US,1308620;,pramodachar769
1285453,2020-04-26 06:48:38 -0800,2020-04-27T07:13:14Z,Why is windows security asking for my computer password when I copy a password from firefox password manager? and how do I stop this absolutly asinine feature?,<p>See above. the reason why the feature was so good IS BECAUSE I DON'T HAVE TO CONSTANTLY LOG IN... I could go on... </p>,privacy-and-security_1;beta;desktop;firefox-760;windows-10;,firefox,privacy-and-security,en-US,1308665;1308685;1308689;1308816;1308819;1308824;1308826;1308828;1308831;,louis.j.lawyer
1285451,2020-04-26 05:25:59 -0800,2020-04-26T06:43:56Z,"Olá, eu penso em migrar do chrome, qual navegador mozilla consome menos RAM no windows? Como consigo importar minhas senhas do chrome?",<p>Meu PC tem configurações muito básicas como 1gb de RAM por isso estou indo para o firefox porque falam que o chrome consome muito </p>,download-and-install_1;desktop;,firefox,download-and-install,pt-BR,1308612;,fracarolilucas23
1285450,2020-04-26 04:54:40 -0800,2020-04-26T16:14:19Z,Can header & footer be suppressed in PrintPreview->SimplifyPage?,"<p>My OS is Ubuntu.  And I tried, but couldn't find an option in Cups, although something called a 'PrettyPage' flag seemed to be the closest thing I could find, but I know of no way to use it. </p>",customize;desktop;firefox-650;linux;,firefox,customize,en-US,1308726;,parsnogood
1285449,2020-04-26 04:05:34 -0800,2020-04-26T19:42:13Z,"Using Bitawarden in ""regular non-private"" Firefox window.","<p>I'm not very technically knowledgeable, but I have a question about using Bitwarden password manager.  I know there is a problem using Bitwarden in a Firefox Private Windows, which I like to use.  My question is:  can I get the same  privacy protections in a ""regular"" Firefox window as in a Private Window by setting privacy protections in Options?  That way I would not have to switch between regular and private windows.  I hope this is clear enough.  Thanks for any info. </p>",privacy-and-security_1;firefox-750;desktop;linux;,firefox,privacy-and-security,en-US,1308735;1308753;1308755;1308758;,7640
1285448,2020-04-26 04:04:18 -0800,2020-04-26T23:30:23Z,Change order of multi-account containers?,"<p>Is there some way of changing the order of the containers when they are shown in popups/lists etc? </p><p>I would like to re-order them but I can't figure out how do it, I'm probably missing something obvious but what? </p>",firefox-750;customize;desktop;mac-os;,firefox,customize,en-US,1308618;1308772;,reg16
1285447,2020-04-26 03:36:18 -0800,2020-04-26T08:01:12Z,How can I have one tab for opening all pdfs in?,"<p>I have to deal with a lot of PDFs for my school work so I would like to unclutter my tabs. I've noticed the the Firefox PDF viewer has a document selector panel on the left, however when I open a PDF it opens in a new tab. I was wondering if it was possible to open multiple PDFs in one tab. </p>",tabs;firefox-750;desktop;linux;,firefox,tabs,en-US,1308621;1308622;,jackjgoodall
1285446,2020-04-26 02:53:48 -0800,2020-04-28T08:49:52Z,firefox starts with transparency and garbage at ubuntu 20.04,"<p>gfx.webrender.all true        Makes firefox transparent with garbage at ubuntu 20.04 unreadable. gfx.webrender.all false       Does not run webgl applications. I wish to send a screenshot. </p><p><em>[Personal information removed by moderator. Please read <a href=""/en-US/kb/forum-rules-and-guidelines"" rel=""nofollow"">Forum rules and guidelines</a>, thanks.]</em> </p>",firefox-750;desktop;fix-problems;linux;,firefox,fix-problems,en-US,1308933;1309088;,sokorox
1285444,2020-04-26 01:26:02 -0800,2020-04-28T17:13:37Z,google sign in url doesn't work,"<p>When I try to access the URL ""<a href=""https://issuetracker.google.com/issues?q=componentid:190923%2B"" rel=""nofollow"">https://issuetracker.google.com/issues?q=componentid:190923%2B</a>"" I only get a blank screen. If I use another browser it works. </p><p>Why? </p>",firefox-750;websites;desktop;mac-os;,firefox,websites,en-US,1308590;1309182;1309186;,mace2
1285443,2020-04-26 00:41:23 -0800,2020-04-26T14:04:38Z,How do I know that I am not using the Chinese special version of Firefox and that my browser is not affilited with any Chinese company in any way?,"<p>I have been using the Chinese special version of Firefox for a long time until I realized it this afternoon. and Yes, I'm chinese. I Highly suspects that the company who is operating the Chinese firefox browser is sharing my personal data with the chinese government. I'm deeply concerned about this. I tried to downlaod a new install package from <a href=""http://mozilla.org"" rel=""nofollow"">mozilla.org</a>. Tried to install the browser in some sort of overwrite way. However, I noticed that some Chinese specific features were still on my <a href=""http://browser.eg"" rel=""nofollow"">browser.eg</a>:Pages on mobile device. I will be trying to uinstall the entire application and using the package downloaded from <a href=""http://mozilla.org"" rel=""nofollow"">mozilla.org</a> to try a new clean install.How do I know that I am not using the Chinese special version of Firefox and that my browser is not affilited with any Chinese company in any way? Thanks. </p>",download-and-install_1;firefox-750;desktop;windows-10;,firefox,download-and-install,en-US,1308587;1308595;1308705;,ksl73
1285440,2020-04-25 21:27:58 -0800,2020-04-26T01:23:50Z,How to join an unrecognizable search engine,<p>How to add some niche search engines (which Firefox does not recognize as search engines) to Firefox's search engine listings instead of adding them to “Add keywords for this search engine”？ </p>,firefox-750;customize;desktop;windows-10;,firefox,customize,en-US,1308539;1308561;,minecrafting698
1285439,2020-04-25 20:58:26 -0800,2020-04-26T01:22:42Z,How can I STOP reffreshing.,<p>How can I STOP reffreshing.? </p>,firefox-740;customize;desktop;windows-10;,firefox,customize,en-US,1308535;1308560;,doncole
1285437,2020-04-25 20:50:59 -0800,2020-04-25T22:14:39Z,Cannot sign into yahoo.com from firefox. I can login with safari.,"<p>Firefox will load <a href=""http://yahoo.com"" rel=""nofollow"">yahoo.com</a>, but when I try to login into my yahoo account it goes to <a href=""http://currently.att.com"" rel=""nofollow"">currently.att.com</a> and ask for password which asks for change in password but does not complete the signin saying bad request. The Safari browser is no problem, but I don't want to use Safari. </p>",firefox-750;other;desktop;mac-os;,firefox,other,en-US,1308540;,steven.getty
1285436,2020-04-25 20:37:50 -0800,2020-04-25T20:37:50Z,How do you prevent Firefox 75 from impacting RDP on Windows Server 2008 R2?,"<p>Ever since Firefox upgraded to version 75, using it has become impossible to use via RDP on Windows Server 2008 R2.  The behavior is like Firefox completely hogs down the machine, but more likely seems to be impacting the refresh rate of the RDP session.  With Firefox open, mouse begins to trail and button clicks and movement stack up and execute as much as a 5 minute delay at times.  I saw a similar report, but not 100% the same, here: <a href=""https://support.mozilla.org/en-US/questions/1278453"" rel=""nofollow"">https://support.mozilla.org/en-US/questions/1278453</a> </p><p>Here is what I know so far... </p><pre>* Specific to Windows Server 2008 R2, tested on multiple VMs on multiple hosts * Issue not present on Windows Server 2016, Windows 10, or Windows 7 * Size of Firefox window affects performance, leading to validate RDP refresh issue.  If half the screen is Firefox vs the whole screen, the lag is lessened * Safe Mode immediately resolves the issues * Safe Mode with all Add-Ons re-enabled still resolves the issue * Hardware acceleration on or off has no impact * Downgrading to Firefox 74 resolves the issue (but this could also be because it made me a new profile) </pre> <p>What other details can I provide?  Is there anything else I can try?  Does this qualify to report a bug on bugzilla? </p>",firefox-750;desktop;fix-problems;windows-10;,firefox,fix-problems,en-US,"",EarthBoundX5
1285435,2020-04-25 20:30:50 -0800,2020-04-25T22:44:08Z,"What is the bottom window space called on the browser showing images loading and url connecting, mine vanished?","<p>My browser lost the space at the bottom of the page below on the browser portion, it also had a resize capability and sometimes showed a lock for a secure site. How do I out it back t=so it functions as it did before the browser shot to full screen and I could not adjust it back because my display top third is grayed out &amp; I am unable to access the browser when it is hiding beneath that gray area. </p>",tips;firefox-750;desktop;windows-10;,firefox,tips,en-US,1308531;1308532;1308542;,jonalist
1285434,2020-04-25 20:27:24 -0800,2020-04-26T02:34:44Z,Is there way switch tabs using mouse wheel?,<p>Is there way switch tabs using mouse wheel? </p>,customize;desktop;linux;,firefox,customize,en-US,1308548;1308576;,uran987
1285433,2020-04-25 19:34:11 -0800,2020-04-26T09:43:14Z,"Firefox is taking almost a minute to close background proc's, then will issue a crash report. Other issues too...","<p>For several weeks, I've noticed that Firefox will no longer present the drop-down search history list on Ebay. Also, there have been frequent tab crashes, apparently for no reason, and independent of the Web site you are on. Now, after some troubleshooting, I see also where Firefox takes almost a minute to close the back- ground processes after you ""exit"", and then will generate a crash report. Seems like this may have happened after the 75.0 upgrade. I have: started FF in safe mode - still crashes, etc.; disabled my two extensions (AdBlock and Norton) - still crashes, etc.; cleared cache &amp; cookies (more than once) - still... ; reloaded FF 75.0 with fresh download installer - still...  BTW, on the Ebay drop-down, MS Edge works OK. FF used to work but stopped several weeks ago.  Environment is Windows 10 [10.0.18363.778], FF 75.0, Norton Security 2020. </p>",firefox-750;desktop;fix-problems;windows-10;,firefox,fix-problems,en-US,1308526;1308598;1308599;1308604;1308605;1308607;1308614;1308653;,wrjones28
1285432,2020-04-25 19:28:31 -0800,2020-04-25T19:28:31Z,How can I remove a black refresh for iCloud notes?,"<p>In using iCloud notes, every time the notes editing pane changes, a black repaint rectangle covers the pane momentarily. This happens every single time. I suspect it has something to do with the way Firefox utilizes WebGL. I have tried this in Microsoft Edge (i.e. Chromium) and this doesn't happen there. </p><p>I have some extensions installed but when I ran Firefox in safe mode, it turned off WebGL too, so that didn't help me troubleshoot the source of this issue. </p>",firefox-750;desktop;fix-problems;windows-10;,firefox,fix-problems,en-US,"",avery3
1285430,2020-04-25 18:30:43 -0800,2020-04-25T18:59:30Z,does using firefox require using google browser?,<p><strong>bold text</strong> </p>,other;desktop;,firefox,other,en-US,1308519;,mph44567
1285427,2020-04-25 17:01:45 -0800,2020-04-25T20:09:39Z,"Using same Mozilla login for 4+ years, I can only see bookmark backups from thismonth,are bookmarks not saved within my mozilla profile so I can acess anywhere?","<p>I have been changing my hardware a lot, and do clean installs of windows 2x a year anyway. I just went looking for some old pages that I bookmarked. I only have bookmarks, and bookmark backups from this month. I have always been able to, in the past, login to my mozilla account on firefox through another computer and access all of my bookmarks, same on my mobile. I am trying not to panic. Are bookmarks not stored within the mozilla account? I cannot fathom that. Well thank goodness they all appear to be on my mobile, why would they not be on my PC? What would I have to do to make all of the bookmarks that are on my phone show up on my PC? Thank you for your time and experience. </p>",bookmarks;firefox-750;desktop;windows-10;,firefox,bookmarks,en-US,1308527;1308528;,UberOriginal
1285425,2020-04-25 16:46:48 -0800,2020-04-26T11:31:24Z,Firefox won't load any websites including offline sites like about:config and other configuration tools,"<p>I can't access any of the firefox settings or any websites, only on firefox, and I have already tried restarting my computer, opening it in safe mode, deleting the profile, etc. I would rather not uninstall it because this is a school laptop and taking it to the school tech support to reinstall it will put it out of commission for a month. Also, yes, I have full authority from my school to mess with firefox files to get it working. I think it's also probably important to mention that clicking ""X"" to close firefox or clicking ""close window"" in the taskbar doesn't work, the only way to close it is by using ""taskkill /F /IM firefox.exe"". Any help would be appreciated, Thank you. </p>",desktop;fix-problems;,firefox,fix-problems,en-US,1308520;1308524;1308624;1308660;,dogantoro
1285424,2020-04-25 16:29:44 -0800,2020-04-26T01:05:41Z,Firefox automatically opens in fullscreen mode. How do I stop this?,<p>Whenever I open fire fox it automatically opens in fullscreen. Hitting F11 does nothing. I open it in safe mode and I see the address and search bar and everything but I am unable to click on them and honestly it doesn't even look right when I open it up in safe. I provided pictures. I have been all over the settings and looked into multiple forums that all say the same things and tells you how to get out of fullscreen mode but not anything on how to stop it from happening automatically on open.  I have uninstalled and re-installed as well.  </p><p>Anyone have any insight? </p>,firefox-750;desktop;fix-problems;windows-10;,firefox,fix-problems,en-US,1308529;1308557;,ab82189
