id,created,updated,title,content,tags,product,topic,locale,answers,creator
1284882,2020-04-18 15:45:36 -0800,2020-04-21T01:10:09Z,media keys,<p>when is firefox going to get the media keys function added? like controlling youtube with your keyboard to play or pause the video. </p>,customize;desktop;,firefox,customize,en-US,1306942;1306960;1306973;1306977;1306999;1307000;1307014;1307017;1307021;1307026;1307082;1307458;1307462;,thegamer99987
1284881,2020-04-18 15:28:41 -0800,2020-04-18T15:28:41Z,"A few weeks ago, Firefox stopped loading some websites (all Pinterest images, some others) that Chrome still accesses.","<p>A few weeks ago, FireFox suddenly changed its behavior.  Some websites that used to load when I clicked on their links in e-mail messages didn't load any more. This was most obvious with e-mails from Pinterest, but happened with some other links as well. Clicking on the link brought up a completely blank page, with nothing in the address bar.  I tried navigating to Pinterest directly, through the Search bar, and couldn't do it - I got the usual list of sites but clicking on them did nothing.  Clicking old links that dropped down in the address bar didn't work, either. Copying the links into Chrome brought me to the Pinterest site, and also an Atlantic article I couldn't reach through FireFox, without any problem. I've already tried eliminating AddIns, checking my Firewall settings, clearing my Cache and Cookies, turning off DNS pre-fetching, and the other suggestions in the ""Firefox can't load websites but other browsers can"" Help article.   NOTE: The problem is limited to only some websites.  In particular, I haven't had any trouble with Facebook, or most news websites, or YouTube. </p>",firefox-750;other;desktop;windows-7;,firefox,other,en-US,"",grappolt
1284880,2020-04-18 15:24:57 -0800,2020-04-18T21:59:33Z,Since some companies I have accounts with have updated their sites they are all broken in Firefox but not other browsers,<p>Since some of the companies that I have online accounts with have updated their sites I am finding they are all broken in Firefox but not Chrome. Either the pages do not load at all or they load but without the login boxes. I really do prefer Firefox. Can your next update resolve this? Soon I hope. </p><p>I am running Mac OS X 10.11.6 </p><p>Thanks </p>,firefox-750;desktop;fix-problems;mac-os;,firefox,fix-problems,en-US,1306853;1306904;1306947;,atkayce
1284878,2020-04-18 15:04:48 -0800,2020-04-18T17:16:22Z,Firefox crashes,"<p>Hola, buen día. </p><p>Mi navegador se cierra pocos segundos después de abrirlo, seguí los pasos del soporte y sigue sin funcionar, es la versión más reciente del navegador, reestablecí Firefox, lo reinicié, inicié el modo seguro pero se sigue cerrando, eliminé todos los archivos y el perfil que tenía y volví a instalarlo pero el problema persiste. </p><p>Los ID de error están en la imagen adjunta. </p><p>Agradezco cualquier ayuda, gracias! </p>",desktop;fix-problems;needsinfo;,firefox,fix-problems,es,1306886;,tomas_cortez14
1284877,2020-04-18 14:47:35 -0800,2020-04-18T22:55:17Z,autocomplete URL not working,"<p>Autocomplete of URLs used to work.  I cleared my history, and it has quit working.  For instance, if I had gone to <a href=""http://amazon.com"" rel=""nofollow"">amazon.com</a>, exit and start entering the URL again, it would autocomplete. </p><p>This page says that it does that: <a href=""https://support.mozilla.org/en-US/kb/address-bar-autocomplete-firefox#w_url-autocomplete"" rel=""nofollow"">https://support.mozilla.org/en-US/kb/address-bar-autocomplete-firefox#w_url-autocomplete</a> </p><p>But it has quit working for me and I can't find any option to turn it on.  I've looked in preferences#search and in privacy, but I don't see anything to set it. </p><p>Is there a way to turn it back on?  (I'm using version 75.0.) </p>",firefox-750;customize;desktop;windows-10;,firefox,customize,en-US,1306854;1306865;1306893;1306905;1306914;1306922;1306923;1306950;1306955;,JudsonMcCranie
1284876,2020-04-18 14:23:30 -0800,2020-04-19T13:33:23Z,Saved logins and passwords that have been deleted are reappearing when Firefox 75.0 (64-bit) syncs,<p>I want to clean up my logins and passwords as there are over 700 that are obsolete or are duplicates. I have gone through and deleted them several times and then they reappear after Firefox syncs. I removed all other devices from my account and then added them back after also uninstalling Firefox from those devices. However that did not solve the problem. I recall there used to be a place where you could set the browser on a device as the source to sync from but I can't seem to find that setting in 75.0 (64-bit). Hopefully someone can help me solve this issue. </p>,firefox-750;sync;desktop;windows-10;,firefox,sync,en-US,1306852;1307106;,subs4
1284873,2020-04-18 12:04:05 -0800,2020-04-20T16:43:50Z,I can't enter a website address on my camera and microphone settings.,"<p>Thank you for any assistance you can provide.  I very much appreciate it. I am able to join a conference on BigBlueButton.  However, I cannot activate my microphone or webcam. </p><p>I followed the Mozilla instructions for allowing microphone and webcam permission for this site. However, when I enter the web address for the site into the ""Settings-Camera Permissions"" or ""Settings-Microphone"" box, and hit ""Enter,"" it will not enter the website. </p><p>I'm on a mac ios, and I also followed the Mozilla instructions for changing the camera and microphone permissions in the system preferences&gt;privacy settings, but was unsuccessful there as well. </p><p>Again, thank you for any help you can provide. </p><p>Arthur </p><p><em>moved from Firefox for iOS to Firefox for Desktop - Andrew</em> </p>",desktop;firefox-750;permissions;preferences;,firefox,manage-preferences-and-add-ons-firefox,en-US,1306841;1307388;,epanterias1
1284872,2020-04-18 12:02:17 -0800,2020-04-18T18:31:14Z,"Lost authentacator app, no codes, just recovery key how to unlock acct",<p>I have a phone that the authentication app went away.  The account can not be logged in and other way of login does not show.  I have a recovery key but that's all.  Login process does not ask for recovery key. how to use? </p>,firefox-750;sync;desktop;windows-10;,firefox,sync,en-US,1306826;1306827;1306860;1306864;1306866;1306899;1306903;1306913;,bmazak
1284869,2020-04-18 10:45:47 -0800,2020-04-18T14:18:25Z,como tener mi historial durante varios años,"<p>anteriomente recuerdo que firefox guardaba mi historial de muchos años atras, cosa que me agradaba por si lo requeria pero recientemente veo q no es mayor a 1 año, necesito saber como conservarlo durante TODO el tiempo que quiera. </p>",firefox-750;other;desktop;windows-10;needsinfo;,firefox,other,es,1306835;,freddymmpeli
1284868,2020-04-18 10:34:08 -0800,2020-04-20T05:20:47Z,"Barra das extensões reiniciando/reinstalando sozinha. Todas as extensões são reiniciadas/reinstaladas, precisando configurar e organizar tudo do zero.","<p>Reiniciei meu notebook e ao abrir o Firefox novamente nenhum site carregava (nenhuma das abas já abertas carregavam e nenhuma nova aba carregava). </p><p>Além disso, todas as minhas extensões foram reiniciadas/reinstaladas e ficaram fora de ordem na barra de favoritos, sendo necessário configurar e ordenar todas elas (por exemplo, tive que me logar novamente na extensão do LastPass e tive que configurar a extensão Enhancer for Youtube tudo de novo, do zero. Citei apenas duas extensões mas foi necessário fazer isso em todas). </p><p>Consegui solucionar a questão do não carregamento de nenhum site abrindo o Firefox em modo de segurança porém não encontrei solução para o problema das extensões. </p><p>Como proceder? Sempre que eu reiniciar minha máquina terei esse trabalho de configurar e ordenar todas as extensões do zero? Nunca tive nenhum problema relacionado a isso com outros navegadores. </p><p>Estou utilizando o Firefox Browser Developer, versão 76.0b5 (64-bits), com canal de atualização aurora. </p>",beta;customize;desktop;firefox-760;windows-10;,firefox,customize,pt-BR,1306815;1306820;1307226;,rodrigoplc95
1284867,2020-04-18 10:31:09 -0800,2020-04-18T10:31:09Z,Firefox crashes,"<p>2020年に入り、firefoxが頻繁にクラッシュようになりました。 </p><p>『firefox』『Windows』『ドライバー』『セキュリティソフト』それぞれの更新は問題なし セーフモードでも頻繁にクラッシュが発生いたします。 firefoxのリフレッシュを行い、ブックマークやプラグインなども見直しましたが 改善されません。 また、同PC上の別ブラウザ（chromeなど）ではクラッシュなどの問題は発生いたしません。 </p><p>解決策がございましたら、ご教授いただけますと幸いです。 </p><p>クラッシュ ID: bp-9df6cbf6-acbc-4b8a-8cad-7575d0200418 </p><p><br> <em>duplicated. continue at <a href=""https://support.mozilla.org/questions/1284866"" rel=""nofollow"">https://support.mozilla.org/questions/1284866</a></em> </p>",firefox-750;desktop;fix-problems;windows-10;,firefox,fix-problems,en-US,"",maru9_the_fool
1284866,2020-04-18 10:30:55 -0800,2020-04-18T15:35:54Z,Firefox crashes,<p>2020年に入り、firefoxが頻繁にクラッシュようになりました。 </p><p>『firefox』『Windows』『ドライバー』『セキュリティソフト』それぞれの更新は問題なし セーフモードでも頻繁にクラッシュが発生いたします。 firefoxのリフレッシュを行い、ブックマークやプラグインなども見直しましたが 改善されません。 また、同PC上の別ブラウザ（chromeなど）ではクラッシュなどの問題は発生いたしません。 </p><p>解決策がございましたら、ご教授いただけますと幸いです。 </p><p>クラッシュ ID: bp-9df6cbf6-acbc-4b8a-8cad-7575d0200418 </p>,firefox-750;desktop;fix-problems;windows-10;,firefox,fix-problems,en-US,1306814;1306858;1306859;,maru9_the_fool
1284864,2020-04-18 10:21:16 -0800,2020-04-18T11:35:10Z,"Barra das extensões reiniciando/reinstalando sozinha. Todas as extensões são reiniciadas/reinstaladas, precisando configurar e organizar tudo do zero.","<p>Reiniciei meu notebook e ao abrir o Firefox após a máquina ter sido reiniciada não carregava nenhum site de nenhuma aba que já estava aberta ou de qualquer nova aba, ficando constantemente ""carregando"".  </p><p>Além desse problema do não carregamento de nenhum site, todas as minhas extensões foram reiniciadas/reinstaladas e ficaram fora de ordem na barra de favoritos, sendo necessário configurar e ordenar todas elas novamente (<em>por exemplo, tive que me logar novamente na extensão do LastPass e tive que configurar a extensão Enhancer for Youtube toda do zero. Citei apenas duas extensões mas tive que fazer isso em todas</em>). </p><p>Consegui solucionar o não carregamento de nenhum site ao abrir o Firefox no modo de segurança porém não encontrei solução para o problema das extensões.  </p><p><strong>Como proceder? Toda vez que eu reiniciar minha máquina terei esse trabalho de configurar todas as extensões do zero?</strong> </p><p>Estou utilizando o <strong>Firefox Browser Developer, versão 76.0b5 (64-bits), canal de atualização aurora</strong>. </p>","",firefox,customize,pt-BR,1306816;,rodrigoplc95
1284863,2020-04-18 10:10:28 -0800,2020-04-18T11:45:24Z,"Login on addons page: ""Invalid parameter: state""","<p>I hope I'm in the right place here, the support page is pretty confusingly laid out (for example ""contact"" forwards to help pages instead of an actual contact page). </p><p>I tried logging in on <a href=""http://addons.mozilla.org"" rel=""nofollow"">addons.mozilla.org</a>, both using the button in the top right and with the one that overlays the row of stars, but in both cases I get the error message ""Invalid parameter: state"". I also tried ""use a different"" account and entering the mail address again (Firefox did that for me), with the same result. I did not try ""forgot password"". Logging in in this forum, in Firefox in general, in the container extension etc. works fine. </p><p>If there's more information I can give, please tell me, but so far that's all I know, the website doesn't tell me more. </p>",firefox-750;other;desktop;,firefox,other,en-US,1306817;1306818;,fabianroeling
1284862,2020-04-18 09:11:30 -0800,2020-04-18T11:01:29Z,"When I clear my cache and history in Firefox 75.0, I seem to lose my preset Tools-Options-Zoom setting for all websites.",<p>My Zoom settings seem to default back to 100% whenever I clear the cache and history for Firefox.  I lose the 80% setting that I'd like to view each web page at.  Or is it something else I'm doing that causes this?  Thanks for your help. </p>,firefox-750;customize;desktop;windows-10;,firefox,customize,en-US,1306802;1306808;,mikesello0n
1284861,2020-04-18 08:17:31 -0800,2020-04-18T10:31:58Z,The computer is attempting to access Firefox,<p>While watching a film online it hung. I force quit but Firefox wouldn’t reopen so I restarted. Started watching the film but kept getting the same pop up saying The computer “x” is attempting to access Firefox on your computer’ with a different computer name each time.  </p><p>Every time I blocked another would come up with a different name. I selected to do the same action for all requests of this kind so it’s stopped but I don’t know what it means. </p><p>Do I have a problem? Is there anything I need/should do?  I’m on Mac 10.14.6 and Firefox 75.0. </p><p>Thanks in advance. </p>,privacy-and-security_1;desktop;,firefox,privacy-and-security,en-US,1306792;1306801;,tricia3
1284858,2020-04-18 08:05:48 -0800,2020-04-18T15:22:34Z,"I can't listen to muisc in Google Play Music and in vk.com services, but youtube works and I can listen to music in Chrome.","<p>When I press the play button the audio starts loading but then nothing happens, the slider doesn't move.  I tried to refresh Firefox, reinstall flash and the firefox, remove cookies, disable the DNS prefetching, but nothing helped. Also I tried to change the general.useragent.override field to ""Mozilla/5.0 (Windows NT 6.1; Win32; x86) AppleWebKit/537.36 (KHTML, like Gecko) Chromium/72.0.3626.96 Chrome/72.0.3626.96 Safari/537.36"" value and It helped for <a href=""http://vk.com"" rel=""nofollow"">vk.com</a>, but not for Google Play Music. </p>",firefox-750;websites;desktop;,firefox,websites,en-US,1306803;1306811;1306850;,mvarnar
1284856,2020-04-18 07:48:43 -0800,2020-04-18T10:16:45Z,How can I change the choices in preferences in firefox?,"<p>In Firefox preferences, I don't want to check the two check-boxes as below, especially later one. </p><p>'always check if firefox is your default browser' and  'Warn you when quitting the browser'  </p><p>But the check-boxes are locked, so I couldn't change that choices. How can I uncheck the choices? </p>",firefox-750;customize;desktop;linux;,firefox,customize,en-US,1306793;,gmlee0820
1284855,2020-04-18 07:46:21 -0800,2020-04-18T15:21:36Z,"Mozilla subdomain ""developers"" used invalid certificate",<p>per title </p>,firefox-750;other;desktop;linux;,firefox,other,en-US,1306849;,nathandu
1284853,2020-04-18 07:08:42 -0800,2020-04-21T03:40:54Z,"My Firefox on Mac crashed after message to quarantine Ransomware. Reinstalled v75, now working but only opens with Profile Manager using terminal command.","<p>Out of the blue I received a message stating I was being attacked on my Mac by software that maybe Ransomware. I was asked to close and delete the files. </p><p>I run Mac Os 10.14.6 and have never had any previous problems. After quarantining these files I quit Firefox and then could not open it. I therefore deleted the .app and reinstalled Firefox 75. I can only start up Firefox by using the Terminal Command window using the Profile manager. I created a new profile but cannot see my old profile within the Profile Manager. I can find the old profile under Profile's in Application Support/Users. So despite having a new default set created, I still cannot get the Firefox.app to open by clicking on it. I have now deleted the old profile and still cannot open the Firefox app from the dock or applications folder. </p><p>help please! </p><p>I could never find out why I got the message ""Ransomware may be trying to access my computer"", except two files  have appeared in my bin; Edgar Poe Murder and Righteous Games. </p><p>Any help appreciated. </p>",firefox-750;desktop;fix-problems;malware;escalate;,firefox,fix-problems,en-US,1306805;1306872;1306944;1306945;1307221;1307225;1307465;1307466;1307469;1307477;,blcweb
1284852,2020-04-18 06:43:26 -0800,2020-04-18T11:49:27Z,Can I separate taskbar icons by profiles?,"<p>I'm using firefox on Windows 10. I want to use different accounts for a website at the same time, so I created two profiles. But when I use these profiles at the same time, these icons are gruoped into one taskbar icon. I only can add one shortcut(for one profile) on my taskbar and start menu. </p><p>Is there any way to separate these icon by profiles? and add multiple profiles shortcuts on taskbar? </p>",firefox-750;other;desktop;windows-10;,firefox,other,en-US,1306819;,hando20021220
1284847,2020-04-18 05:21:24 -0800,2020-04-18T05:21:24Z,[Bug?] Cookies are not stored in Firefox - but in Chrome they are!,"<p>Hello, </p><p>so well, my cookies that I send from API backend <strong>127.0.0.1:8000</strong> to a cross domain frontend <strong><a href=""https://bd1.advena.me"" rel=""nofollow"">https://bd1.advena.me</a></strong> are not stored in Firefox. </p><p>But on the other hand, they are tough in Chrome. </p>",firefox-750;cookies;desktop;windows-10;,firefox,cookies,en-US,"",larstru
1284846,2020-04-18 04:58:49 -0800,2020-04-18T20:42:49Z,I disabled all cipher suites in Firefox; why am I still able to connect to some https:// sites?,"<p>I was experimenting with whether I could disable certain cipher suites in Firefox in order to force a remote website to negotiate a different one.  However I found that if I went into about:config and searched for settings with ""ssl3"" in the name, and set ALL of them to false (security.ssl3.dhe_rsa_aes_128_sha, security.ssl3.dhe_rsa_aes_256_sha, etc. -- there were 15 of them), I am still able to connect to <a href=""https://www.instagram.com/"" rel=""nofollow"">https://www.instagram.com/</a> , <a href=""https://www.google.com/"" rel=""nofollow"">https://www.google.com/</a> , and <a href=""https://www.paypal.com/"" rel=""nofollow"">https://www.paypal.com/</a> with no error, even after restarting. </p><p>However, <a href=""https://support.mozilla.org/"" rel=""nofollow"">https://support.mozilla.org/</a> does give me the ""Error code: SSL_ERROR_NO_CYPHER_OVERLAP"" error.  On the other hand, <a href=""https://www.mozilla.org/"" rel=""nofollow"">https://www.mozilla.org/</a> works with no error.  I cannot discern any pattern as to why some sites work and some don't, even after disabling all cipher suites.  Why are *any* of them accessible? </p>",privacy-and-security_1;desktop;windows-10;,firefox,privacy-and-security,en-US,1306746;1306930;1306931;,bennetthaselton
1284844,2020-04-18 04:32:02 -0800,2020-04-18T17:12:15Z,Mi sitio web no se muestra correctamente en Firefox,"<p>Buenas tardes, antes de nada, gracias por leerme. Os cuento mi sitio web que os muestro a continuación, se muestra bien en otros navegadores, pero está algo más que roto en Firefox. He adjuntado 2 capturas de pantalla de cómo se ve, en mi versión última de Firefox, navegando desde España. La dirección de mi web por si queréis probar vosotros es la siguiente: <a href=""https://www.convertidor.es"" rel=""nofollow"">https://www.convertidor.es</a> </p><p>Como puede ver, se ve algo raro y roo. He leído bastante sobre cuál podría ser el problema, pero todas las sugerencias que he encontrado no me quedan muy claras la verdad ... Por ejemplo, vaciar el caché, borrar las cookies, verificar el zoom, actualizar el navegador etc.… Si alguien le ha pasado antes, la verdad es que agradecería que me ayudase si es posible a como poder solventar el problema. </p><p>Cualquier ayuda sería de bastante utilidad para mí la verdad. </p><p>Un saludo. </p>",websites;desktop;,firefox,websites,es,1306837;1306847;1306885;,povedano12
1284843,2020-04-18 04:20:08 -0800,2020-04-18T11:57:18Z,No audio from Firefox only in Win 10,"<p>For some time now I have had no audio when playing media on Firefox. I'm on a Dell laptop using WIN 10 and system sounds, iTunes etc all work fine. </p><p>I tried the Audio mixer and when it starts there is a speaker with a little x beside it showing even though the number shows 100. Tried with 2 tabs - one plays a video from BBC iPlayer and the other Youtube. Playig with Audio Mixer settings I got the sound to come from BBC video - Youtube nothing. Of course resarting FF set the Audio Mixer back to normal settings again so that isn't a fix at all. </p><p>All drivers and Win system updates are in force and my Firefox updates automatically. I use the Sync settings in FF to work between Mac and PC so not being able to use it any more would be a major problem. Any ideas? </p>",firefox-750;desktop;fix-problems;windows-10;,firefox,fix-problems,en-US,1306821;,SUFTUM
1284841,2020-04-18 04:05:32 -0800,2020-04-20T08:11:15Z,autohide everything when not hovered anywhere on browser,"<p>all i want is the userchrome.css to hide everything until i hover anywhere on the browser. not just when i hover the titlebar, as my code does now </p><pre> #navigator-toolbox {    position: relative;    height: 20px;    margin-bottom: 0px;    opacity: .3;    overflow: auto; </pre> <pre> } </pre> <pre> #navigator-toolbox:hover {    height: auto;    margin-bottom: 0px;    opacity: 1;    overflow: show; </pre> <pre> } </pre> <p>if my mouse cursor is anywhere on the browser then i want nothing to be hidden. when my mouse cursor leaves firefox, then i want everything to be hidden. </p>",firefox-750;customize;desktop;windows-10;,firefox,customize,en-US,1306829;1306862;1307173;1307176;1307208;1307249;,rgrdgls69
1284840,2020-04-18 03:07:06 -0800,2020-04-19T23:21:59Z,Autofill form and larges font-size,"<p>I put the font-size large (20+) but the menus of autofill forms, in particular for login,  do not resize themselves, so I cannot read their content. </p>",other;desktop;,firefox,other,en-US,1306910;1306989;1307125;1307185;,matthieu.gomez
1284839,2020-04-18 02:29:05 -0800,2020-04-18T02:29:05Z,"FF Version: Developer edition 76.0b4 (64-bit) - hangs at start, needs to kill 3 out of 4 FF processes to make it work","<p>Version: Developer edition 76.0b4 (64-bit) Problems started recently, when FF is started it hangs. It shows 4 process in the Task manager. I have to sort it in the memory utilization way, such that top is the highest memory consumer. Then I kill the last 3 to get it working back. Also the 4 processes of FF do not indicate ""not responding"" which is strange. </p><p>The killing of last 3 ff process and keeping 1 seems to fix the issue but it has to be done manually every time. Not sure what is making the FF hung in first place. </p>",fix-problems;beta;desktop;firefox-760;windows-10;,firefox,fix-problems,en-US,"",vaibhav.gaikwad
1284837,2020-04-18 01:15:19 -0800,2020-04-18T03:06:52Z,'a web page is slowing down your browser'  Anyone got a solution?  This has started recently April 2020,<p>Updated to latest verion of Firefox in early April.  Now the error message appears when I try to log into Marks and Spencer's web site.  There's no way of clearing the message or of getting the site pages to download properly.  I know this has happened in the past but this is a recent occurance.  Help please </p>,firefox-750;desktop;fix-problems;windows-10;,firefox,fix-problems,en-US,1306709;,Oban
1284836,2020-04-18 01:02:32 -0800,2020-04-18T18:29:58Z,deactivate searchbar when clicking next to addressbar,"<p>first of all, the new searchbar is a PITA. why would you make it pop out and enlarge?! do you wanna appeal to the elderly to make them realize where they just clicked?! a simple colored border would be just enough. The dropdown would be alright, except when you actually wanted to click a bookmark. now you can press escape, but the searchbar uncomfortably hovers over the bookmark bar, which gives me a weird kind of claustrophobia. Even worse when you want to deactivate that hover you have to click somewhere on the site, not just on the free empty space left or right of the searchbar. And guess how much fun it is finding a spot to click that is not a link... </p>",firefox-750;customize;desktop;windows-10;,firefox,customize,en-US,1306912;,Christoph.Wolf1988
