id,created,updated,title,content,tags,product,topic,locale,answers,creator
1284450,2020-04-14 03:45:52 -0800,2020-04-14T12:48:51Z,I have tried every possible solution that I know but why does Firefox not recognise my passwords and I still have to log on to individual websites.,<p>as above question </p>,privacy-and-security_1;firefox-750;desktop;windows-10;,firefox,privacy-and-security,en-US,1305688;,John131
1284449,2020-04-14 03:37:38 -0800,2020-04-14T03:37:38Z,Oprávnění doplňků,"<p>Zdravím, nevím, jestli jsem dobře hledal, každopádně jsem nenašel. Jde nějak omezit oprávnění doplňků? Chtěl bych jednomu doplňku povolit přístup pouze k datům jejich vlastnímu webu, nikoli všech navštěvovaných stránek. Nikde jsem o této možnosti nečetl, ani jsem ji nenašel v nastavení, přesto bych se rád zeptal, jestli mi něco neuniklo. </p><p>Pěkný den. </p>",firefox-740;customize;desktop;,firefox,customize,cs,"",vojtasafr
1284446,2020-04-14 02:29:48 -0800,2020-04-14T02:48:26Z,"I've built firefox from source, and I'm having issues accessing some websites with it","<p>Using firefox built from source on Linux </p><p>It seems to be affecting mostly twitter (<a href=""https://twitter.com/"" rel=""nofollow"">https://twitter.com/</a>) Typing in the address bar or clicking links causes nothing to happen (nothing specials logged to the terminal, dev console shows no new requests). Oddly it works opening such links in a private window. I tried ""Restart with Addons Disabled"" but it doesn't fix it. </p>",desktop;fix-problems;linux;bug1621301;,firefox,fix-problems,en-US,1305595;1305596;,mattia.basaglia
1284445,2020-04-14 01:55:57 -0800,2020-04-14T20:44:35Z,How can I help making Firefox faster on macOS,"<p>I have recently switched from Chrome to Firefox because I share the open internet mission of Mozilla. However for almost all surfing I do, Firefox is much slower on macOS than Chrome or Safari. Are there efforts at Mozilla to work on this, and how can I help? </p><p>Thanks Jonas </p>",firefox-740;desktop;fix-problems;mac-os;,firefox,fix-problems,en-US,1305608;1305619;1305622;1305699;1305742;1305747;,jonas4
1284444,2020-04-14 01:54:06 -0800,2020-04-14T12:25:45Z,Add-on keeps getting re-added to firefox after I remove it,"<p>Hi all, </p><p>I hope you are well. I'm facing some weird problems with Firefox after upgrading to the latest version. One of these is that the IBM Rapport add-on keeps getting added to Firefox automatically every time I restart my computer. I remove it each time, but next morning there it is again. </p><p>I no longer need the add-on since my bank has changed the online banking methodology (which the add-on was used for), but it refuses to stay away! </p><p>I have run 3 full virus checks, and nothing came up. </p><p>I have made a new profile, but this didn't help. </p><p>Can anyone please advise how I can remove this add-on permanently? </p><p>Thank you very much for your help. </p><p>Michael. </p>",firefox-750;customize;desktop;windows-10;,firefox,customize,en-US,1305593;1305604;1305615;1305638;1305680;,indidginus
1284443,2020-04-14 01:48:32 -0800,2020-04-15T04:03:54Z,i can't login with smat card,<p>With version 75 (of MOzilla Firefox) it is not possible to log in using a smart card </p>,firefox-750;other;desktop;windows-10;,firefox,other,en-US,1305627;1305785;1305796;1305808;,giangavino.pasciu
1284441,2020-04-14 00:02:53 -0800,2020-04-14T00:02:53Z,Firefox Browser Crashes All the Time And Having Problem To Show Images In Website?,"<p>I am John Steve. I am a Medical Information Executive.  I have a Website on a health topic ( <a href=""https://healthcabinet.net"" rel=""nofollow"">https://healthcabinet.net</a> ) and most of the time I face problems while using Firefox browser. </p><p>Problem 1. I have recently installed Firefox Browser  on my Laptop but when I click over it, it does not open. Any solution to this will be highly appreciated, please. </p><p>Problem 2. Website images do not show off when Firefox browser  starts working. I did everything I could but failed. Now, I am here asking for your help and support. </p>",websites;desktop;windows-7;,firefox,websites,en-US,"",moojtv1981
1284440,2020-04-13 22:47:49 -0800,2020-04-13T22:47:49Z,Como quitar la nueva barra de busqueda impuesta en la version 75,"<p>Hola, buenas noches, queria saber si habia alguna manera de volver al diseño de la barra de la version 74, antes de la actualizacion ya que me resulta super molesta e incomoda, no me agrada para nada. Lo que hice fue instalar la version 74 pero cuando se siga actualizando firefox no me va a quedar otra. </p>",tabs;firefox-740;desktop;windows-10;,firefox,tabs,es,"",yomartin95
1284439,2020-04-13 22:00:43 -0800,2020-04-14T00:30:36Z,https://socialsecurity.mp.gov.in/,"<p><a href=""https://socialsecurity.mp.gov.in/"" rel=""nofollow"">https://socialsecurity.mp.gov.in/</a> </p>",other;beta;desktop;firefox-760;windows-7;needsinfo;,firefox,other,en-US,1305570;1305573;1305574;,manjhi1471991
1284435,2020-04-13 19:44:44 -0800,2020-04-13T22:57:01Z,using the scroll wheel on my mouse works down but not up.,"<p>Recently, the scroll wheel on my mouse lost the ability to scroll upward on the page.  But the scroll bar at right still works. </p>",firefox-750;desktop;fix-problems;windows-7;,firefox,fix-problems,en-US,1305538;1305543;1305583;,geodejerry1
1284431,2020-04-13 18:20:35 -0800,2020-04-13T19:33:10Z,"Toolbar No Longer Showing in Popups When ""dom.disable_window_open_feature.toolbar"" is Set to True.","<p>dom.disable_window_open_feature.toolbar has been set to true for the longest time as I use a password manager and those reduces status and toolbar popup windows are almost always for login purposes. However, I have logged in this morning to find that it is showing the same behaviour as the default. </p>",beta;customize;desktop;firefox-760;windows-10;,firefox,customize,en-US,1305527;1305530;,mr.cunningham
1284430,2020-04-13 17:58:43 -0800,2020-04-13T23:22:51Z,Finding the Firefox upgrade download on my Macbook,"<p>Hi,  I downloaded the Firefox upgrade to my Macbook, but now can't find it in my Applications folder and the icon has been deleted from the dock.  I know it is somewhere, but how do I find it? </p>",download-and-install_1;firefox-640;desktop;,firefox,download-and-install,en-US,1305587;,mjgrochala
1284429,2020-04-13 17:31:09 -0800,2020-04-14T05:31:14Z,How to Prevent Automatic Page Updates?,"<p>I thought there used to be a setting to prevent (or allow) pages to update either automatically, when their tabs are re-opened, or never.  If so, I can't find it now. </p><p>In FF 75.0 (and for some time before), I'm often finding unacceptably large CPU usage (and associated cooling-fan noise).  I can usually fix this by closing FF and then re-opening, but I shouldn't have to do this.  I'm wondering if it's caused by certain pages insisting to update regularly.  Any solution to this problem? -- Jclarkw </p><p>P.S. -- I'm usually running FF inside of Sandboxie, but that shouldn't matter... </p>",firefox-750;customize;desktop;windows-10;,firefox,customize,en-US,1305550;1305610;1305613;,jclarkw
1284427,2020-04-13 16:44:56 -0800,2020-04-14T06:46:42Z,Firefox 75.0 incapable of utilizing full download speeds,"<p>So I've recently upgrade my internet speeds the other week, from ATT 50Mbps down to now Spectrum 200Mbps down, and after the switch I was seeing full speeds on the browser when checking on <a href=""http://speedtest.net"" rel=""nofollow"">speedtest.net</a>. But with the update to Firefox 75.0 I'm only seeing a 1/10th of my download speeds now. I've done a complete fresh install of the browser so no addons or anything that may be causing the issue. I've checked other browsers(Chrome, Edge, Opera) and they get up to 200Mbps when checking on <a href=""http://speedtest.net"" rel=""nofollow"">speedtest.net</a>, so now I'm left wondering what the issue is with Firefox 75 that may be causing this issue. </p>",firefox-750;desktop;fix-problems;windows-10;,firefox,fix-problems,en-US,1305620;,xininjaxx
