id,created,updated,title,content,tags,product,topic,locale,answers,creator
1284190,2020-04-11 03:05:47 -0800,2020-04-12T22:37:02Z,Problem turning off URL-bar auto-suggestions in Firefox,"<p>(I remember posting this before, but I am unable to find it anywhere. Perhaps it wasn't stored. I apologize in advance for duplicate posting!) </p><p>I use Firefox 75.0 (64-bits) on mac OS X Catalina for browsing. It gives me the following issue. When I start typing a youtube… URL in the address bar, a specific sub-page to the YouTube domain pops up first. It refers to s specific clip on youtube. While I’m typing, in front of it a grey star appears, such a marking a favorite. However, it’s NOT in my favorites.  The auto-suggestions do not come from other opened tabs. This option is turned off.  I don’t use any Firefox subscription account services for storing favorites online. Suggestions from search engines are also toggled off.  I’ve tried all remaining suggestions on the following pages to get rid of this issue: <a href=""https://support.mozilla.org/en-US/kb/remove-websites-address-bar-suggestions"" rel=""nofollow"">https://support.mozilla.org/en-US/kb/remove-websites-address-bar-suggestions</a> 1st method for clearing a single item didn’t work; 3rd method to clear my browsing history didn’t work. </p><p><a href=""https://support.mozilla.org/en-US/questions/1213978"" rel=""nofollow"">https://support.mozilla.org/en-US/questions/1213978</a> I have turned off browser.urlbar.autoFill = false. Toggling this option, at least, got rid of unsolicited suggestions from the worldwide web such as <a href=""http://youtubemoneycalculator.com"" rel=""nofollow"">youtubemoneycalculator.com</a>. It’s a partial success! </p><p><a href=""https://support.mozilla.org/en-US/questions/1213978"" rel=""nofollow"">https://support.mozilla.org/en-US/questions/1213978</a> keyword.enabled is set to false, but toggling this won’t make any difference. browser.fixup.alternate.enabled is set to false, but toggling this won’t make any difference. </p><p><br> The only method that makes a difference is to turn off Addres bar suggestions from Favorites (in about:preferences#privacy). But then I don’t get any suggestions at all… </p><p>This example merely illustrates the issue with youtube… domain names, it happens with any address that I start typing in the address bar. Peculiarly, addresses that ARE stored in my favorites, do not appear first in the suggested domain names. Okay, I’ve done my homework! </p><p>My conclusion/question: Some (former) favorites are stored in a location that I have no access to. I would like to receive suggestions as to where I can find these. Preferably, I do not want to delete every single one of them one by one. </p><p><br> Bottom line: It would be nice if I had some sort of control over my favorites. The suggestions appear to be totally random. If the most recently or most frequently visited favorites would appear first, that would make sense. Or if the main page would appear first (<a href=""http://youtube.com"" rel=""nofollow"">youtube.com</a>) and not any other subpages. Does anyone know if this is possible and then, how to achieve this? </p><p>Lastly: I don’t understand why a browser that claims to be so concerned about my privacy allows for so many unwanted options. Also, it is a nuisance if these options are actually reset with every update Firefox installs. I have the impression that this happens. I did notice that now and then additional search engines are added to my one-click-search engines (about:preferences#search) without my prior notification. How does this comply with Firefox’s privacy concerns? </p>",privacy-and-security_1;firefox-750;desktop;mac-os;,firefox,privacy-and-security,en-US,1305294;1305296;,jan.past.op
1284186,2020-04-11 01:17:09 -0800,2020-04-11T22:15:12Z,Sites without SSL getting clickjacked,"<p>I am using Firefox 75 on MacOS Mojave. On sites without SSL, the clicks getting hijacked. This happens even on sites like <a href=""http://stopbadware.org"" rel=""nofollow"">stopbadware.org</a>. </p><p>I managed to find the file, cf.common.js which is doing this. Strangely, this JS file seems to be different when viewing from <a href=""http://stopbadware.org"" rel=""nofollow"">stopbadware.org</a> directly. Please see attached screenshots.  </p><p>cf.common.js seems to loading another js with random number as name without a .js extension file from a website <a href=""http://hobfadbig.com"" rel=""nofollow"">hobfadbig.com</a> </p><p>I am attaching FiddleJs URLs of cf.common.js and 7250 </p><p><a href=""https://jsfiddle.net/#&amp;togetherjs=VaxaRSMe9d"" rel=""nofollow"">https://jsfiddle.net/#&amp;togetherjs=VaxaRSMe9d</a> <a href=""https://jsfiddle.net/#&amp;togetherjs=yLSvHRy9jh"" rel=""nofollow"">https://jsfiddle.net/#&amp;togetherjs=yLSvHRy9jh</a> </p><p>I raised this question on Stackoverflow as well but i didn't get any answer.  </p><p>I have Avast free version installed on my Mac. And i do not have any funny extensions/plugins on Firefox.  </p><p>Thanks </p>",privacy-and-security_1;firefox-750;desktop;,firefox,privacy-and-security,en-US,1304660;1304661;1304678;1304687;1304956;,werty37
1284185,2020-04-11 00:58:09 -0800,2020-04-11T02:49:58Z,Can I download the latest Mozilla Firefox browser on an old HP laptop?,"<p>Please I want to know if I can download the latest version of Mozilla Firefox browser on my HP laptop, also to know if it is safe. </p><pre>HP Notebook  </pre> <p>Model -    NX-8220 Window - XP professional </p><p>Thanks </p>",download-and-install_1;windows-xp;,firefox,install-and-update-firefox,en-US,1304642;,emmaicqc
1284184,2020-04-11 00:48:15 -0800,2020-04-11T00:48:15Z,No reproduce hdr en youtube,"<p>Con hdr activado en windows 10, mi televisor indica hdr activado y todas las configuraciones correctas, Firefox en su ultima version ni en ninguna anterior, no reproduce hdr en youtube. Si en Edge, Opera y Chrome. En los otros navegadores como bien indico, me sale la opcion de escoger resolucion junto con hdr. Pero Firefox no lo hace, solo aparece escoger la resolucion y nada mas. No sale HDR. </p><p>Porque puede ser y como solucionarlo.  Esperando contestacion, un saludo y muchas gracias. </p>",firefox-750;other;desktop;windows-10;,firefox,other,es,"",victorarroyao
1284183,2020-04-11 00:45:37 -0800,2020-04-11T04:48:21Z,Where do the search suggestion come from?,"<p>The (german) help page about search suggestion does not tell me from where I get those suggestions. Is it a Mozilla service? Google? The default search engine (from the settings)? </p><p>Actually, I would expect or prefer that if choose a search engine during typing, that I get suggestions from this site. But I guess, this is not the case. So which engine gets used? </p>",firefox-750;customize;desktop;,firefox,customize,en-US,1304617;1304627;1304629;1304672;,robert.schneider
1284182,2020-04-11 00:25:37 -0800,2020-04-11T15:55:51Z,security code expired before email arrives,<p>How do I log in if the security code has expired before the email ( containing the code) has arrived? </p>,sync;desktop;,firefox,sync,en-US,1304679;1304682;1304695;1304717;1304805;1304812;1304822;1304876;,themissingelf
1284180,2020-04-10 23:43:42 -0800,2020-04-10T23:43:42Z,"I've lost a window full of tabs, and can't find it -- please add, a windows:bring-all-to-front, pull-down-menu-selection","<p>v75.0 for Mac laptop . mid-2015 15-inch Retina MacBook_Pro, running macOS_Catalina_v10.15.4 , with Supp._Update . </p>",firefox-750;desktop;fix-problems;mac-os;,firefox,fix-problems,en-US,"",rsblanchard
1284175,2020-04-10 23:00:39 -0800,2020-04-11T07:00:54Z,V75: Increase number of Top sites on address bar,"<p>v75 auto-installed, and my set of 10 topsites on the address bar dropdown has been reduced to 5. </p><p>My browser.urlbar.maxRichResults  value was already set to 10. I increased it to 15 but nothing changed. </p><p>Any ideas? Thanks a lot. </p>",firefox-750;other;desktop;windows-10;,firefox,other,en-US,1304686;1304694;,totalken
1284173,2020-04-10 22:27:36 -0800,2020-04-13T08:23:45Z,REALLY want my drop down arrow back on the address bar in V75! Any way to do that please?,<p>The drop down arrow is now gone in update 75. Is there an option to bring it back? Clicking on the URL is NOT the same thing. </p>,firefox-750;customize;desktop;windows-10;megabar;,firefox,customize,en-US,1304639;1304709;1304906;1304913;1304914;1304922;1304954;1304955;1305385;,melpotter1
1284172,2020-04-10 20:56:25 -0800,2020-04-11T16:44:28Z,"Can you change the setting for downloads to be ""save file"" instead of ""open"" as default?","<p>Can you change the setting for downloads to be ""save file"" instead of ""open"" as default? </p>",firefox-750;customize;desktop;windows-10;,firefox,customize,en-US,1304677;1304885;,dostrander
1284171,2020-04-10 20:35:58 -0800,2020-04-11T18:27:02Z,"Login to Udemy website, as I open the website in Mozilla, it opens up without asking for ID or pwd. Under Saved Logins it is not showing. How to get my password","<p>Normally in Mozilla we have Logins n password, where we can find all the passwords saved under it. In case, we forgot the password we can click on show passwords for that particular n get it. But my case, Udemy website is auto login and no data stored in regarding username n password. Bad part is the <a href=""http://outlook.com"" rel=""nofollow"">outlook.com</a> email id also i have lost it. If i give forgot password from Udemy website, it will land into <a href=""http://outlook.com"" rel=""nofollow"">outlook.com</a> email but i forgot that password. Any way to retrieve it since, Mozilla will be storing it somewhere. Can any one help me regarding this. </p>",other;desktop;windows-10;,firefox,other,en-US,1304605;1304909;,ktsuraj
1284170,2020-04-10 20:18:53 -0800,2020-04-11T19:05:12Z,"in the latest update, what happened to the the down arrow that brings up the list of web sites previously visited ???","<p>What happened to the down arrow that brings up the list of web sites previously visited, it was the principal reason i was using firefox over chrome, how can i bring it back? </p>",firefox-750;other;desktop;windows-10;megabar;,firefox,other,en-US,1304606;1304710;1304917;1304923;1304929;,hetzermx
1284168,2020-04-10 20:04:30 -0800,2020-04-10T20:13:29Z,"you screwed up my firefox, give me back my location bar as is ...that was just stupid, leave it alone","<p>you screwed up my firefox, give me back my location bar as is ...that was just stupid, leave it alone I want the old version back. Can't believe I gave netscape money 20+ years ago. </p>",firefox-750;other;desktop;windows-10;megabar;,firefox,other,en-US,1304587;,catchall2016
1284166,2020-04-10 19:11:40 -0800,2020-04-11T08:34:42Z,New tab does not work after 14-15 tabs.,"<p>Recently, if I have 14-15 tabs open, attempting to open a new tab using the new tab button, ctrl-t, or choosing to open a link in a new tab does not open any tabs. Choosing the add-ins menu, the preferences menu or the like from the hamburger menu still opens a new tab as normal even when the new tab functions are no longer working for browsing. </p>",tabs;desktop;linux;,firefox,tabs,en-US,1304600;1304708;,mothringer
1284160,2020-04-10 17:03:47 -0800,2020-04-12T17:33:38Z,browser redirect,"<p>I am getting apparently random redirects to mostly <a href=""http://r.svrtrack.com"" rel=""nofollow"">r.svrtrack.com</a>, there has been one other. </p><p>I checked my addons and installed programs and can't find anything unexpected. </p><p>I have scanned with Malwarebytes and Windows Security and they can't find anything. </p><p>I haven't captured a screenshot, will do so next time it happens. </p><p>Pls halp, Tim </p>",firefox-750;desktop;fix-problems;windows-10;,firefox,fix-problems,en-US,1304535;1304560;1304663;1305248;,tim.smith.ba
1284158,2020-04-10 16:40:34 -0800,2020-04-10T18:22:00Z,FF75: Disable urlbar expansion,"<p>Is there a preference to disable the expansion of the urlbar (aka address bar, awesome bar, mega bar) without disabling its new features? When expanded, it covers part of my bookmarks bar and makes it harder to click the bookmarks. Also I dislike the chunky UI look. </p><p>Things I've tried that did not solve my problem:   </p> <ul><li> <em>browser.urlbar.megabar</em>: This is gone in 75.0.   </li><li> <em>browser.urlbar.update1</em>: This disables the expansion, but also disables the new icons, suggestions, etc.   </li><li> <em>browser.urlbar.openViewOnFocus</em>: I don't know what this does but it wasn't it.   </li><li> <em>ui.prefersReducedMotion</em>: This disables the animation, but the bar is still expanded.   </li><li> <a href=""/en-US/kb/search-firefox-address-bar"" rel=""nofollow"">Search with the Firefox address bar</a>: There is no information there about the expansion.   </li></ul> <p>I'm hoping there is a <em>browser.urlbar.update1.expand</em> or similar that I can toggle off. If there definitely isn't, please confirm so I can submit a bug. </p>",firefox-750;customize;desktop;windows-10;megabar;,firefox,customize,en-US,1304561;,P1h3r1e3d13
1284157,2020-04-10 16:40:26 -0800,2020-04-10T16:40:26Z,I cannot print duplex because 2-sided option is grayed out in printing preferences dialog,"<p>When I try to print any website using either CTRL-P or clicking the Print button on the preview page, the output is always single-sided.  If I try to override by selecting 2-sided mode from the Printing Properties dialog, I cannot because the option is grayed out.  This does not happen in other programs such as Microsoft Word, where the same 2-sided option works.  My printer is a Brother MFC-J995DW. </p>",firefox-750;other;desktop;windows-81;printing;,firefox,other,en-US,"",briandelaney
