id,created,updated,title,content,tags,product,topic,locale,answers,creator
1282751,2020-03-24 16:25:38 -0800,2020-03-24T16:25:38Z,problems with my password,"<p>Try to enter laptop cannot but able to enter in phone or tablet </p><p><em>duplicate. continue at <a href=""https://support.mozilla.org/en-US/questions/1282750"" rel=""nofollow"">https://support.mozilla.org/en-US/questions/1282750</a></em> </p>",other;desktop;,firefox,other,en-US,"",claudinerivard
1282750,2020-03-24 16:25:38 -0800,2020-03-24T16:25:38Z,problems with my password,<p>Try to enter laptop cannot but able to enter in phone or tablet </p>,other;desktop;,firefox,other,en-US,"",claudinerivard
1282748,2020-03-24 16:13:08 -0800,2020-03-24T18:24:44Z,I cannot turn off dark mode in windows.,"<p>Every time I open up a search window (for both Google and DuckDuckGo) or Twitter, the entire page is dark with white lettering. I've been trying to turn this off, but cannot figure out how. Yes, I've searched all over before asking here. Any help would be appreciated! </p>",firefox-740;customize;desktop;,firefox,customize,en-US,1300030;1300037;,robertcoogan
1282747,2020-03-24 16:09:38 -0800,2020-03-24T16:09:38Z,"Any website I go to, at randoms times it will turn into TV static it looks like","<p>Title says it all and here is a screenshot that should clear it up </p><p><a href=""https://gyazo.com/d5948e707bebef4ec9c6fba057f760ee"" rel=""nofollow"">https://gyazo.com/d5948e707bebef4ec9c6fba057f760ee</a> </p>",firefox-740;desktop;fix-problems;windows-10;,firefox,fix-problems,en-US,"",thientrinh36
1282746,2020-03-24 16:06:05 -0800,2020-03-24T16:06:05Z,I am having problems with addons on the overflow menu not displaying correctly.,"<p>When an addon's icon (such as Video DownloadHelper, Session Sync, FVD Speed Dial, and others) is on the overflow menu (instead of on the tool bar) it does not display correctly when clicked. </p>",firefox-740;customize;desktop;linux;,firefox,customize,en-US,"",Chester.Cressman
