id,created,updated,title,content,tags,product,topic,locale,answers,creator
1282831,2020-03-25 15:54:32 -0800,2020-03-25T22:42:57Z,"How to change BG color of all visited sites?  i tried menu, options, colors, only-high-contrast","<p>I tried: Menu, then Options, then Colors, then Only High-Contrast Themes, then clicked OK. </p><p>But it just took me right back to the same screen (where i clicked Colors), without  displaying a color-wheel from which to choose which BG color i wish. </p>",firefox-740;customize;desktop;windows-10;needsinfo;,firefox,customize,en-US,1300293;1300343;,enkwirer
1282828,2020-03-25 15:13:27 -0800,2020-03-25T18:34:01Z,There is no option to autofill addresses,"<p>I can't even turn this on under my privacy settings, there is no option. Literally the only mention of autofill is for passwords. I would like firefox to save my address so I can autofill that on firms, why is this not an option? </p>",firefox-740;desktop;privacy-and-security_1;windows-10;,firefox,privacy-and-security,en-US,1300296;1300313;1300315;1300319;1300321;1300323;,missjanespark
1282827,2020-03-25 15:11:57 -0800,2020-03-25T15:11:57Z,"""Allow pages to choose their own fonts, instead of your selections above"" has no effect - revisited","<p>Using FF74.0 in Linux this Advanced option is still not corrected from a year ago. <a href=""https://support.mozilla.org/ca/questions/1242106"" rel=""nofollow"">https://support.mozilla.org/ca/questions/1242106</a>, even though I meet the conditions of an underlying font definition. </p>",firefox-740;customize;desktop;,firefox,customize,en-US,"",ineuw
1282825,2020-03-25 13:39:38 -0800,2020-03-25T18:46:00Z,Dissapears Top Sites after upgrade to Firefox 74,<p>After upgrade to Firefox 74 my New Tab page cannot be customized. Top Sites (links to frequently and recently visited sites) disappeared and I cannot set them to be visible in any way. </p><p>What can be possible cause of it? Did upgrade to the newest version of Firefox (which is 74.0 64 bit) changed or deleted the way of displaing Top Sites? </p><p>I'd appreciade any help how to restore an useful tool in the newest versoin of Firefox. Thanks in advandce. </p>,firefox-740;websites;desktop;windows-10;,firefox,websites,en-US,1300299;1300325;,nextrade
1282824,2020-03-25 13:35:47 -0800,2020-03-25T13:35:47Z,Firefox won't download images into Constant Contact,<p>I use Constant Contact to send out newsletters. For years I have been able to download images into my Constant Contact library and use them in my newsletters. No longer. The image does not appear in my library after I download it. </p><p>I can download the images through Chrome and use them with no problem. What is the issue with Firefox? </p>,firefox-740;other;desktop;windows-10;,firefox,other,en-US,"",sacred
1282821,2020-03-25 12:50:01 -0800,2020-03-25T12:50:01Z,many  identical tabs pop up,"<p>I'm running Ubuntu FireFox,  I go to a web site, browse a few seconds, look up and there 9 identical tabs opened. </p>",tabs;firefox-720;desktop;firefox-7201;linux;,firefox,tabs,en-US,"",mawil10131
1282820,2020-03-25 12:45:48 -0800,2020-03-25T12:49:36Z,"PDF crash Firefox or, the page keeps reloading over and over then crashes my PC",<p>I can not view any PDF files. when a page has PDF Firefox crashes or the page keeps reloading over an over i can't close Firefox then my PC will crash How can i stop this from happening and how can I view PDF files using Firefox? </p>,firefox-740;other;desktop;windows-10;,firefox,other,en-US,1300229;,Mr.Bobcat
1282819,2020-03-25 12:40:21 -0800,2020-03-25T12:40:21Z,"¿Cómo hago para que al utilizar la barra de direcciones para búsquedas, Firefox utilice Google? Ya lo configuré pero insiste en utilizar Yahoo!","<p>He configurado Firefox para que mi buscador por defecto sea Google pero al realizar una búsqueda en la barra de direcciones, Firefox siempre utiliza Yahoo! ¿Cómo hago para que use Google? Anexo 5 imágenes (imagen 1, imagen 2...hasta imagen 5) las cuales siguen un orden de acuerdo al correlativo que cada una tiene en su nombre. </p>",firefox-740;other;desktop;windows-10;,firefox,other,es,"",marioalfredo.campos
1282818,2020-03-25 12:34:03 -0800,2020-03-25T12:34:03Z,¿Como hago para que Firefox utilice Google en lugar de Yahoo! como motor de búsqueda cuando previamente ya configuré Google por defecto?,"<p>He configurado Firefox para que mi buscador por defecto sea Google pero al realizar una búsqueda en la barra de direcciones, Firefox siempre utiliza Yahoo! ¿Qué debo hacer para que deje de usar el motor de Yahoo!? Anexo 5 imágenes (imagen 1, imagen 2.... hasta imagen 5), que siguen un orden segun correlativo al final del nombre de cada una de ellas. </p>","",firefox,other,es,"",marioalfredo.campos
1282816,2020-03-25 12:25:54 -0800,2020-03-25T16:41:18Z,Background image disappears on Firefox 74.0 on Linux Mint 19.3 Cinnamon,"<p>I'm running Firefox 74.0 on a Linux Mint Cinnamon 19.3 OS. I've noticed that the background image on websites will disappear, but not the background color. I've attached two images to show what I'm talking about. I can have them reappear by simply reloading the page. This is not a major issue, but wondering if there is something I can do to correct it. I've also provided a screenshot showing my system hardware. Thank you! </p>",firefox-740;desktop;fix-problems;,firefox,fix-problems,en-US,1300231;1300234;1300246;1300256;1300301;,schafer4
1282815,2020-03-25 12:12:59 -0800,2020-03-25T12:53:41Z,can't get youtube. message says I need software to access,"<p>screen says: The address wasn't understood. </p><p>Foxfire doesn't now how to open this address, because one of the following protocols (rtsp) isn't associated with any programs or is not allowed in this context. </p><p>You might need to install other software to open this address. </p>",firefox-750;other;beta;desktop;mac-os;,firefox,other,en-US,1300232;,ebtp
1282814,2020-03-25 12:12:50 -0800,2020-03-25T16:59:17Z,Help wanted: Firefox 73+ background image handling,"<p>A change was introduced in Firefox 73.0 that makes it display background images contained in web pages, even if a Windows High Contrast color theme is in use and even if the ""Override the colors specified by the page"" option in Firefox is set to ""Always.""  Is there a way to override this behavior and make Firefox suppress background images the way it did in version 72?  As a low-vision user, I find that the new behavior interferes a lot with the readability of some web pages, and I haven't come across a page yet where the new behavior actually helps me.  Note that I don't want to suppress ALL images, only the background images, the way it works in version 72.  For now, I have reverted to version 72 of Firefox, but I don't like that as a permanent solution, since it would mean giving up on all future upgrades to Firefox. </p>",customize;desktop;firefox-720;,firefox,customize,en-US,1300241;1300309;,tonydwyer
1282806,2020-03-25 11:22:19 -0800,2020-03-25T15:48:12Z,Remove FF icon,"<p>A few weeks ago, when FF updated to 72, there was a FF icon that doubled the size of the menu box.  I found a few suggestions by Googling, and managed to delete the icon, but can't restore the box to its original size, and the larger box affects my browsing.  How do I resize the box? </p>",download-and-install_1;firefox-740;desktop;windows-10;,firefox,download-and-install,en-US,1300240;1300248;1300251;1300257;1300259;1300261;1300262;1300273;1300278;,mnosera
1282804,2020-03-25 10:56:32 -0800,2020-03-25T13:51:30Z,"Linux Firefox language setting is ""en-US"" and ""und""","<p>Can someone please tell me what is ""und"" in  language settings?  </p><p>Application Settings </p><p>Requested Locales 	[""en-US""] Available Locales 	[""en-US""] App Locales 	[""en-US"",""und""] Regional Preferences 	[""en-US""] Default Locale 	""und"" Operating System System Locales 	[""en-US""] Regional Preferences 	[""en-US""] </p>",download-and-install_1;firefox-740;desktop;language;,firefox,download-and-install,en-US,1300197;1300200;1300209;1300221;1300247;1300253;,ineuw
1282803,2020-03-25 10:32:05 -0800,2020-03-25T10:32:05Z,"I want to participate in a meeting in my university, but firefox can not connect through adobe connect. please guide me.","<p>I am a teacher. I want to teach by adobe connect in firefox, but I can not connect to class. I have installed updated adobe connect and adobe flash player in my computer. Screen shuts of my computer were attached. Please guide me. </p>",firefox-740;customize;desktop;windows-81;,firefox,customize,en-US,"",alihosseinnezhad2005
1282802,2020-03-25 10:24:02 -0800,2020-03-25T10:24:02Z,Problems with username Login in at Disney,"<p>Hello, my Login credentials at Disney+ (<a href=""https://www.disneyplus.com/de-de/"" rel=""nofollow"">https://www.disneyplus.com/de-de/</a>) are saved, but the loginname is empty and has to be entered every time, but the password is filled in. The problem seems to be that it is kind of a two phase login where you have to enter username (email) at first and the password in a second step / window. </p><p>Disney Plus help says (of course) it's a problem of Firefox. </p><p>My son is using the nightly build, where it's working, </p>",firefox-740;desktop;privacy-and-security_1;windows-10;,firefox,privacy-and-security,en-US,"",luc9
1282801,2020-03-25 10:19:02 -0800,2020-03-25T10:19:02Z,"Warum muss ich mich jedesmal wenn ich mein Windows neu strate, wieder manuel bei Firefox Sync anmelden?",<p>Warum ist das so? </p>,firefox-740;sync;desktop;windows-10;,firefox,sync,en-US,"",t.paroz
1282800,2020-03-25 10:01:51 -0800,2020-03-25T10:01:51Z,How do I allow access in Firefox to my Mac Docs folder?,<p>Upgraded to Catalina 10.15.4 this morning. Then my Firefox asked if I wanted to give access to my Doc folder. Never saw this before. I mistakenly said no. Firefox is selected in my SysPrefs-Security &amp; Privacy-Privacy. Can't find anything on web about this. Anyone know how permit access to my Mac Doc folder after clicking deny? </p>,firefox-740;other;desktop;,firefox,other,en-US,"",stuartg1
1282798,2020-03-25 09:17:10 -0800,2020-03-25T09:17:10Z,Change proxy configuration while browsing: Connection Settings window shaded !?,<p>I'm on windows 10. </p><p>Issue is simple but painful: I frequently change my proxy setting from a manual proxy to no proxy. Problem is when Firefox is open with some tabs the Connection Settings windows is shaded and can't be modified. I have to restart Firefox. Is that a bug or a feature ? </p><p>I tried to deactivate any plugin but it does not resolve the problem </p><p>Thanks </p>,firefox-740;desktop;fix-problems;windows-10;,firefox,fix-problems,en-US,"",kataklysme
1282796,2020-03-25 08:36:34 -0800,2020-03-25T15:31:07Z,Can't open VTR file from backup?,<p>My laptop account became corrupt so I created a new one and saved everything to a hard drive to put on it. I have files that are sent through firefox in my business and they won't open in firefox (keeps saying open with firefox default and then opening a new tab and saying the same thing over and over). I have logged into my firefox account on my browser and this hasn't fixed it. What should I do? It says the file is in VTR format. </p>,firefox-740;other;desktop;windows-81;,firefox,other,en-US,1300136;1300272;,c.griffis06
1282792,2020-03-25 07:53:32 -0800,2020-03-25T16:09:29Z,Portable double installation,"<p>I have been using a very old version of firefox on my desktop. Now I want to update it, but to somehow keep an installation of a pre-webextension version. IIRC two different installations can't live within the same Windows, so I'm looking for a portable installation of the old version. (Running a second instance of the same installation is no help). </p><p>The problem is that I already have an updated portable app on my usb stick. I am wondering, if I save an old, portable firefox (on a separate folder) on the same usb stick that already has a portable firefox installation, will it cause any trouble to either? </p>",download-and-install_1;mobile;,firefox,install-and-update-firefox,en-US,1300235;1300269;1300284;,trespda
1282791,2020-03-25 07:40:04 -0800,2020-03-25T09:33:35Z,Unable to use client authentication certificates from macOS Keychain inside Firefox,<p>Can Firefox use Personal Identity Certificate in the macOS keychain (delivered by MDM) for Authentication?  Our PING authentication requires the use of Personal Identity Certificates to confirm use of a managed device.  We have this working for Safari and Chrome but cannot seem to get it working with Firefox.   Please advise. </p>,firefox-740;other;desktop;mac-os;,firefox,other,en-US,1300123;,steven.swierczek
1282790,2020-03-25 07:31:20 -0800,2020-03-25T12:46:38Z,PR_END_OF_FILE_ERROR issues on multiple sites since upgrading to 74.0,"<p>I only experienced this issue when upgrading to 74.0, but it happens on websites multiple sites now.  I have also verified via other browsers that this is a specific Firefox issue. </p><p>I have tried all of the recommended solutions that I have been able to identify: removed AV extensions, created a new profile, reset proxy settings, cleared cache &amp; cookies, refreshed Firefox, restarted in safe mode to attempt to access the websites, turned off VPN, etc. </p><p>Looking for additional recommendations or solutions. </p>",other;desktop;,firefox,other,en-US,1300122;1300145;1300147;1300205;1300228;,jules.borghardt
1282788,2020-03-25 06:58:25 -0800,2020-03-25T09:33:35Z,"Streaks, smeared lines or blurry web pages while scrolling on Firefox","<p>After installing the 74.0 update as I scroll up or down the screen, Blurred text appears to ""Magnify"" or ""Smear"" horizontally across the screen. It effects about two - three lines at a time. I have dual monitors and it effects both screens. </p><p>I tried the temp fix indicated for Firefox version 49 but I can't locate the ""layers.allow-d3d9-fallback"" in the config files. Maybe because I'm running Windows 7-Pro? Are any fixes available yet for Update 74 for this issue?  </p><p>My Firefox page shows me using version 73.0.1 but my update history says 74.0 was installed on March 14, 2020 Successfully Installed AND version 74.0 installed on March 24, 2020 but this version is ""Install Pending"". </p><p>Any ideas? Thanks </p><p>Thanks </p>",firefox-730;desktop;fix-problems;,firefox,fix-problems,en-US,1300105;,double-j1
1282787,2020-03-25 06:54:24 -0800,2020-03-25T13:43:30Z,aktivace mikrofonu v aplikaci Duolingo. V Chromu funguje.,"<p>V ""Nastavení"" Duolinga - výuka Angličtiny-  se neobjeví ikona ZAP mikrofonu. Stejné je to v prohlížeči M.Edge. V G.Chrom funguje. V apce telefonu také. Dík za radu </p>",firefox-740;customize;desktop;windows-10;,firefox,customize,cs,1300223;1300245;1300249;,Jasima
1282786,2020-03-25 06:53:47 -0800,2020-03-25T09:33:35Z,html5 video not displaying,"<p>Trying to set up HTML5 peer-peer video conferencing. Its working on Chrome but not Firefox. I have looked at all the available solutions. I have reinstalled firefox; I have checked that media.windows.foundation is set to ""true""; I have checked in ""safe mode"".  </p><p>This challenge is an issue which occurs 90% of the time. I have yet to assess what conditions occur when html5 video is finally displayed. I can only say that display only occurrred once today and that was when I first inspected the site this morning.  </p><p>This situation is occurring both in Firefox and the developer edition. Firefox is latest edition and there are no plugins </p><p>Any suggestions? </p>",firefox-740;desktop;fix-problems;windows-10;,firefox,fix-problems,en-US,1300106;1300115;1300116;,iainhossack
1282785,2020-03-25 06:46:01 -0800,2020-03-25T22:15:10Z,"Since the last 74.0 update, the european localization of type number input fields doesnt work anymore.","<p>We live in Germany and need to use comma for float numbers in type number input fields, but this stopped working since the last 74.0 Firefox update. Tested on Windows 10 and Ubuntu 18.04. </p><p>It should be looking like in the image but instead of a comma there is a dot. </p>",firefox-740;websites;desktop;windows-10;,firefox,websites,en-US,1300107;1300342;,a.gorr
1282783,2020-03-25 05:54:43 -0800,2020-03-25T09:33:35Z,keeps needing to restart,"<p>Whenever I start Firefox, I get the usual ""Sorry. We just need ..."" and leaves me no option but to restart. I tried refreshing, removing the profile folder, the whole .mozilla folder, uninstalling and reinstalling, nothing works. If I change user on the same computer, everything works as normal. Can you suggest something? </p><p>Troubleshooting information below is copy-pasted from the faulty browser. I'm right now using a different one. </p>",firefox-740;desktop;fix-problems;linux;,firefox,fix-problems,en-US,1300094;1300113;,maximilien.chaumon
1282780,2020-03-25 04:19:26 -0800,2020-03-25T13:19:19Z,How to disable the allow button which appears everytime I open new website page or redirected?,<p>I would like to know how I can disable this pop up which appears every time I open a new web page or I am redirected. I have to click on the button 'allow' before it will load. Thanks in advance. </p>,firefox-740;desktop;privacy-and-security_1;windows-10;,firefox,privacy-and-security,en-US,1300099;1300239;,michael.c.neary
1282779,2020-03-25 04:00:08 -0800,2020-03-25T09:33:35Z,"Windows thinks my default browser is a previous version of Firefox, which is still installed for some reason. How do I uninstall previous versions?","<p>When I open a link through a different software than Firefox, it opens a new window of Firefox which looks basically identical, but I can't move the tab over to the window of Firefox I am actually using. In addition Firefox tells me that it is not the default browser, but at the same time it clearly is. </p><p>I'm running Firefox 74.0 </p>",download-and-install_1;firefox-740;desktop;windows-10;,firefox,download-and-install,en-US,1300077;1300114;,Fredrik.segel
1282778,2020-03-25 03:47:14 -0800,2020-03-25T10:23:07Z,Voice recognition icon missing from Google Translate,<p>On Firefox (and also Edge) Google Translate has no options for voice input. This isn't dependent on language concerning either translation - or website language. Is there a way to fix it? Thanks! </p>,firefox-740;websites;desktop;windows-10;,firefox,websites,en-US,1300081;1300088;1300090;1300172;,farkas.samu
1282776,2020-03-25 03:09:08 -0800,2020-03-25T13:28:37Z,Firefox crashes very often without reason and also there are issues with window resizing,"<p>The crashes are very frequent; often when I download something it freezes, and it has to be closed with CTRL+ALT+CANC (not with just ""close windows""). Also very often it starts to visualize its content flashing or partially (or both ways) so it has to be closed. Also very often the window grows by itself and hide the Windows lower bar; other times the window is very small and cannot be resized in any way. </p>",firefox-740;desktop;fix-problems;windows-10;,firefox,fix-problems,en-US,1300082;1300086;1300142;1300144;1300192;1300242;,andreagrasso77
1282774,2020-03-25 02:23:46 -0800,2020-03-25T09:33:35Z,I have trouble publishing a corrected version of Firefox theme.,"<p>""The email address used for your account is not allowed for add-on submission.""  For some reason, my email address is not suitable for theme submission.Unfortunately, I don't have access to e-mail with this address, because this address was provided by the <a href=""http://temp-mail.org"" rel=""nofollow"">temp-mail.org</a> service. However, I still have my Firefox account login and password.   Do I really need to delete my old account and create a new one? Why all these inconveniences? All themes are already moderated in full detail. This is just a set of color codes. What kind of security risk can these colors cause? </p>",firefox-680;other;desktop;linux;,firefox,other,en-US,1300100;,xawol
1282773,2020-03-25 01:42:58 -0800,2020-03-25T09:30:30Z,how i send my A/C firefox 2 Dwayne Johnson,<p>On messenger fb </p>,tips;desktop;,firefox,tips,en-US,1300083;1300091;1300149;,Cynthia780nn
1282772,2020-03-25 01:42:57 -0800,2020-03-25T09:33:35Z,how i send my A/C firefox 2 Dwayne Johnson,"<p>On messenger fb </p><p>continue at <a href=""https://support.mozilla.org/en-US/questions/1282773"" rel=""nofollow"">https://support.mozilla.org/en-US/questions/1282773</a> </p>",tips;desktop;,firefox,tips,en-US,1300110;1300120;,Cynthia780nn
1282771,2020-03-25 01:42:56 -0800,2020-03-25T09:33:35Z,how i send my A/C firefox 2 Dwayne Johnson,"<p>On messenger fb </p><p>continue at <a href=""https://support.mozilla.org/en-US/questions/1282773"" rel=""nofollow"">https://support.mozilla.org/en-US/questions/1282773</a> </p>",tips;desktop;,firefox,tips,en-US,1300111;,Cynthia780nn
1282770,2020-03-25 01:21:19 -0800,2020-03-25T04:39:12Z,Audiocontext,"<p>Snažím se použít rozhraní Audiocontext, pro změnu zvuku u jednotlivých kanálů (levý a pravý reproduktor). Bohužel v nejnovějších prohlížečích Firefox 74.0 a Firefox Firefox 68.6.0esr nemá rozhraní žádný efekt. Na ostatních prohlížečích jako Microsoft Edge 80.0.361.69 a Chrome 80.0.3987.149 mi web funguje. Kód je dělaný v posledním standardu (tedy použito např .createGain namísto .createGainNode atd.) </p>",other;desktop;,firefox,other,cs,1300079;1300080;,adam.tomasek
1282766,2020-03-25 01:09:17 -0800,2020-03-25T01:30:13Z,https://info.balboapress.com/ not working in firefix getting error Secure Connection Failed,<p>Secure Connection Failed error getting please let me know how i can fix that issue. </p>,firefox-740;desktop;privacy-and-security_1;mac-os;,firefox,privacy-and-security,en-US,1300067;,bpandey
1282765,2020-03-25 00:09:19 -0800,2020-03-25T01:04:44Z,Why ask cookies me?,<p>Thank you for helpful information </p>,cookies;desktop;needsinfo;,firefox,cookies,en-US,1300056;1300057;1300058;1300059;,fpasimd
1282763,2020-03-24 22:38:20 -0800,2020-03-25T15:37:09Z,"How can I clear history ""vlinks"" when Firefox exits?","<p>None of the options in ""clearing history"" reset 'visited' links to 'not visited'. Therefore, even days later, any links I've visited are still marked as 'visited'. </p>",privacy-and-security_1;firefox-560;desktop;,firefox,privacy-and-security,en-US,1300128;1300129;1300153;1300154;1300161;1300166;1300168;1300169;1300170;1300171;1300175;1300274;,dickguertin
1282762,2020-03-24 21:15:05 -0800,2020-03-25T18:34:00Z,When I use save image as Firefox shuts down.,"<p>To save an image from a website I use right click+save as. But Firefox started getting unresponsive and then shutting off without error messages. I refreshed it but still the same problem persists. Restarted computer, turned off hardware acceleration w/o success. Please help. </p>",firefox-740;desktop;fix-problems;windows-10;,firefox,fix-problems,en-US,1300085;1300320;1300322;,hufington
1282759,2020-03-24 18:04:12 -0800,2020-03-24T19:15:00Z,"After updating Ff and uninstalling old version, I no longer have bookmarks, passwords, etc. - I tried changing profiles, windows restore with no luck.","<p>After updating Firefox to the latest version (74.0), I realized I had 2 separate versions of Ff installed. I uninstalled the older one and then realized I no longer have any of the bookmarks or passwords that I have accumulated over the last 10+ years. </p>",download-and-install_1;firefox-740;desktop;windows-10;,firefox,download-and-install,en-US,1300042;,abcdejames
1282757,2020-03-24 17:22:54 -0800,2020-03-25T07:29:26Z,Firefox quits suddenly with no apparent reason or error message.,<p>Anyone have an idea what's happening? I'm using Firefox 74.0 on a MacMini running OS 10.3.6.  Firefox quits mostly when on another program like iMessage but it happens sometimes while using Firefox.  Any suggestions you have would be appreciated. </p>,firefox-740;desktop;fix-problems;mac-os;mac-osx-1013;,firefox,fix-problems,en-US,1300043;1300119;,dlhig33
1282756,2020-03-24 16:39:39 -0800,2020-03-25T12:45:48Z,"I tried to use Facebook Container, and now I can't log in to Facebook from any device, any browser.",<p>I can't log in to Facebook anymore since I tried to use Facebook container. Facebook thinks I'm a spammer. </p>,firefox-740;other;desktop;mac-os;,firefox,other,en-US,1300132;1300156;1300227;,cris1
1282755,2020-03-24 16:36:34 -0800,2020-03-24T17:38:14Z,firefox screen shots is missing,"<p>My system acted strangely earlier today and now that it's back, Firefox screen shots is nowhere to be found. </p>",firefox-740;other;desktop;windows-10;,firefox,other,en-US,1300024;1300025;1300026;1300027;,ds_gregg
1282754,2020-03-24 16:25:40 -0800,2020-03-24T16:25:40Z,problems with my password,"<p>Try to enter laptop cannot but able to enter in phone or tablet <em>duplicate. continue at <a href=""https://support.mozilla.org/en-US/questions/1282750"" rel=""nofollow"">https://support.mozilla.org/en-US/questions/1282750</a></em> </p>",other;desktop;,firefox,other,en-US,"",claudinerivard
1282753,2020-03-24 16:25:40 -0800,2020-03-24T16:25:40Z,problems with my password,"<p>Try to enter laptop cannot but able to enter in phone or tablet </p><p><em>duplicate. continue at <a href=""https://support.mozilla.org/en-US/questions/1282750"" rel=""nofollow"">https://support.mozilla.org/en-US/questions/1282750</a></em> </p>",other;desktop;,firefox,other,en-US,"",claudinerivard
1282752,2020-03-24 16:25:39 -0800,2020-03-24T16:25:39Z,problems with my password,"<p>Try to enter laptop cannot but able to enter in phone or tablet <em>duplicate. continue at <a href=""https://support.mozilla.org/en-US/questions/1282750"" rel=""nofollow"">https://support.mozilla.org/en-US/questions/1282750</a></em> </p>",other;desktop;,firefox,other,en-US,"",claudinerivard
