id,created,updated,title,content,tags,product,topic,locale,answers,creator
1290656,2020-06-10 09:55:21 -0800,2020-06-10T15:18:21Z,"Firefox Installer gives error ""VCRUNTIME140_1.dll was not found""","<p>I was cleaning out my hard drive and deleting old installs of Microsoft Visual Studio Redistributable packages, and I almost certainly deleted the one that Firefox relies on.  </p><p>I then attempted to start Firefox, getting the error, ""The code execution cannot proceed because VCRUNTIME140_1.dll was not found. Reinstalling the program may fix this problem."" </p><p>I uninstalled, following the clean install directions, and deleting the ""Program Files/Mozilla Firefox/"" directory. </p><p>Then, I ran the Firefox Installer, newly downloaded, and when running it, it gives the same error, ""The code execution cannot proceed because VCRUNTIME140_1.dll was not found. Reinstalling the program may fix this problem."" Selecting ""Restore Defaults"" has no effect either way. The installer then appears to complete in the background, and the Firefox directory is created, along with the executable. </p><p>When I run Firefox.exe, it seems to load the program, but any address I type in fails to begin loading. This includes websites (<a href=""http://www.google.com"" rel=""nofollow"">www.google.com</a>) and help/utility pages (about:config). I'm therefore unable to change any settings within Firefox. </p><p>I then tried re-installing the ""Visual C++ 2008"" and ""Visual C++ 2015-2019"" packages in an attempt to restore that DLL, but that had no effect after repeating the same steps above (clean uninstall, re-install). Which VC++ Redist Package should I be re-installing? Ideally, I should be able to just get a copy of VCRUNTIME140_1.dll and place it where Firefox is looking for it. </p>",download-and-install_1;desktop;,firefox,download-and-install,en-US,1322520;1322527;1322529;1322530;1322657;1322663;,trevorawestphal
1290655,2020-06-10 09:50:18 -0800,2020-06-10T10:01:36Z,Windows can't find Firefox-follow up,<p>I just posted a question asking for help because I kept getting an error message saying that Windows couldn't locate Firefox. </p><p>I just figured out how to fix it.  I copied the exe file and pasted it back into the program folder as a copy. </p><p>The copy file works fine. </p>,desktop;fix-problems;,firefox,fix-problems,en-US,1322517;,rcitti1
1290654,2020-06-10 09:46:54 -0800,2020-06-11T04:27:28Z,Is there a way to launch Firefox with multiple profiles like Chrome?,"<p>Containers are ok but don't really work well. Chrome's switching profiles, with separate sessions, bookmarks etc, in a new window is great.  </p><p>Will firefox release something similar soon? </p>",firefox-770;customize;desktop;mac-os;,firefox,customize,en-US,1322525;1322538;1322867;,dubbledef
1290653,2020-06-10 09:44:12 -0800,2020-06-10T19:31:40Z,Can't open Firefox,"<p>This morning, when I tried to open Firefox I got a message saying that Windows couldn't locate the file. </p><p>I originally just clicked on the icon on my screen. </p><p>I then tried going to the program file folder and opening by clicking on the exe file.  Same message. </p><p>I tried downloading a new copy of Firefox. </p><p>The same message came up when I tried to open it. </p><p>I made Firefox an exception on my security software.  No change. </p><p>Any ideas what to do next? </p>",desktop;fix-problems;,firefox,fix-problems,en-US,1322518;1322526;1322534;1322731;,rcitti1
1290651,2020-06-10 09:21:52 -0800,2020-06-10T10:25:08Z,MOUSE POINTER HANGS DURING PAGE LOAD (MACOS-MOJAVE),"<p>Firefox 77.0.1 (64-bit) - Sometimes when clicking on a URL, as the page starts to load Firefox grabs the mouse pointer and freezes it making it impossible to do anything else until the page completely loads.  Are there any settings that might cause this to occur or would prevent this from occurring? </p>",firefox-770;desktop;fix-problems;mac-os;,firefox,fix-problems,en-US,1322532;,cs-temp
1290650,2020-06-10 09:19:02 -0800,2020-06-10T18:50:13Z,Ebay Sign-in Toolbar,<p>I am using Firefox 64-bit version 77.0.1. All of a sudden when I load the Ebay webpage the sign-in toolbar at the top of the screen is missing. I tried loading the page on Microsoft Edge and it works ok. Has anyone else experienced this issue? </p>,firefox-770;other;desktop;windows-10;,firefox,other,en-US,1322535;1322583;1322716;,jbur1
1290649,2020-06-10 09:16:27 -0800,2020-06-10T18:53:13Z,Mozilla Firefox Send and Firefox Signin,"<p>Executive summary WS No. 01/10.06.2020:  <strong>Why does the login to my Firefox account under Firefox Send (see reference a,b, c) fail continuously? </strong> </p><p>Reference: a) Firefox 77.0.1 (64 bit) - Windows 10 - Firefox Send in connection with my Firefox account, b) <a href=""https://send.firefox.com/login/?utm_source=fxa-toolbar&amp;utm_medium=referral&amp;entrypoint=fxa_discoverability_native"" rel=""nofollow"">https://send.firefox.com/login/?utm_source=fxa-toolbar&amp;utm_medium=referral&amp;entrypoint=fxa_discoverability_native</a>    or c) <a href=""https://send.firefox.com/"" rel=""nofollow"">https://send.firefox.com/</a> </p><p>Cons:  So I can only use the default setting under Firefox Send. I have no options, even if I am logged in to other Mozilla services at the same time.  </p><p><br> Further notes:  </p><p>a) The login to the sync service is successful in all cases: <a href=""https://accounts.firefox.com/?context=fx_desktop_v3&amp;entrypoint=fxa_app_menu&amp;action=email&amp;service=sync"" rel=""nofollow"">https://accounts.firefox.com/?context=fx_desktop_v3&amp;entrypoint=fxa_app_menu&amp;action=email&amp;service=sync</a> </p><p>b) The login to the account settings is successful in all cases: <a href=""https://accounts.firefox.com/signin"" rel=""nofollow"">https://accounts.firefox.com/signin</a> </p><p>Thanks for your hints ! werner.schiedlmeier@t<a href=""http://-online.de"" rel=""nofollow"">-online.de</a> P.S.: I'm new here! How do I find my problem and possible solutions again? </p><p><br> Translated with <a href=""http://www.DeepL.com/Translator"" rel=""nofollow"">www.DeepL.com/Translator</a> (free version) </p>",firefox-770;sync;desktop;windows-10;,firefox,sync,en-US,1322649;1322717;,werner.schiedlmeier
1290648,2020-06-10 09:08:40 -0800,2020-06-10T09:25:47Z,Keeping personal and work matters separate,"<p>(Using Windows 10) I'm looking for a way to <strong>create separate ""workspaces<em> in Firefox</em></strong><em> for work-related stuff and personal stuff.  Ideally, I want to have two Firefox windows open simultaneously.  One window would be logged into my work email account (on Gmail), have access to work-related bookmarks, show custom toolbars, etc -- even a different color theme, so when I hover over the Firefox icon in taskbar, I can easily identify which workspace is which. </em> Ditto for a personal workspace: different email accounts (one on Gmail, one on a private domain), bookmarks, toolbars, theme. I'd be able -- just by switching to a different Firefox window -- to switch between these two ""workspaces"", without needing to log out of one and log into another.  Maybe I could even synch each workspace with the matching ""user"" on my Android phone, which is set up with two users, each tied with a diff email account. I could accomplish most of this by using different browsers for each workspace, but I've been using Firefox since forever, am most comfortable with it, and would love to use it for both. Is this a pipe dream? </p>",firefox-770;customize;desktop;windows-10;,firefox,customize,en-US,1322507;1322509;,sefridie
1290647,2020-06-10 09:04:45 -0800,2020-06-10T13:45:03Z,Email,"<p>Starting 2 days ago when I log into my webmail account using Firefox (mycci), all folders come up as empty. When I use other browsers, I can access messages in all my folders. Any ideas? Thank you. </p>",firefox-770;other;desktop;mac-os;,firefox,other,en-US,1322560;1322628;,cyotero
1290646,2020-06-10 09:02:24 -0800,2020-06-10T14:52:21Z,Background Images Bleed Between Tabs,"<p>When I am switching back and forth between tabs, occasionally the background image from one tab will overlay part of another tab. This is beyond annoying... </p><p>The images attached are as follows. 1. the lower right portion of a page as it should appear. 2. the lower right portion of another page, showing the blue background image (it is just a fade in this case) 3. the lower right portion of the 1st page with the image from the 2nd tab covering the lower right-hand section. </p><p>The first page is the left-most-tab of all my open tabs. It isn't the 1st tab I opened, but it is where I do a lot of work, and I keep that as the left-most tab </p><p>The image can come from any other tab. </p><p>77.0.1 Firefox Release June 3, 2020 (64-bit) Windows 10 version 1909 with updates as of June 9, 2020 </p><p>Various extensions including Privacy Badger, Cookie AutoDelete, uBlock Origin. None of which were impacting images a month ago... </p>",firefox-770;desktop;fix-problems;windows-10;,firefox,fix-problems,en-US,1322587;1322618;1322651;1322660;,DebraBk
1290645,2020-06-10 08:54:00 -0800,2020-06-11T03:45:56Z,Firefox 77.0.1 crashes when on Facebook,"<p>What might be the reason for Firefox crashing (becomes nonresponsive) when on Facebook? I am using 77.0.1 (64-bit). Same issues on Ubuntu and Win10. Happens pretty much every time. Only restarting the browser helps. Seems similar [[to this|<a href=""https://support.mozilla.org/en-US/questions/1153630?page=2"" rel=""nofollow"">https://support.mozilla.org/en-US/questions/1153630?page=2</a>]]. </p><p>Any suggestions? </p>",firefox-770;other;desktop;linux;escalate;freeze;,firefox,other,en-US,1322543;1322634;1322641;1322833;1322858;,robert165
1290644,2020-06-10 08:53:14 -0800,2020-06-10T08:56:38Z,Finding on app store,<p>The App Store on my MacBookPro OS Catalina. Version 10.15.5 Doesn’t produce the app to download. </p>,download-and-install_1;desktop;,firefox,download-and-install,en-US,1322497;,garethellzey
1290641,2020-06-10 08:46:18 -0800,2020-06-10T10:08:09Z,FFox 77.0.1 crashing continually,"<p>It just started this morning, what can I do to diagnose the problem?? I'm using chrome to post this! </p>",desktop;fix-problems;,firefox,fix-problems,en-US,1322494;1322499;1322502;1322503;1322505;1322506;1322521;,JoeFromSD
1290640,2020-06-10 08:46:14 -0800,2020-06-10T19:40:14Z,Failed Login Attempt,<p>Hello: I attempted to login to NYU Langone Medical Ctr. Patient Portal. The login was rejected.  I eventually used my cell phone and got through. Spoke with tech support at NYU and was told that it's probably an issue with Firefox. Can this be corrected?  Thank you. </p>,firefox-770;websites;desktop;windows-10;,firefox,websites,en-US,1322540;1322736;,joyzcho
1290638,2020-06-10 08:37:44 -0800,2020-06-10T16:19:59Z,"Print Formatting Problem re ""The Hill""","<p>I commonly use the ""Print Preview"" and ""Simplify Page"" buttons when printing news articles, and it usually works fine, but <em>The Hill</em> presents some special problems: </p><p>Here's the original article: <a href=""https://thehill.com/homenews/senate/501970-trump-tweets-spark-fresh-headache-for-republicans"" rel=""nofollow"">https://thehill.com/homenews/senate/501970-trump-tweets-spark-fresh-headache-for-republicans</a> </p><p>This is what it looks like after ""Print Preview"" (the other pages are mostly blank): </p><p><a href=""https://user-media-prod-cdn.itsre-sumo.mozilla.net/uploads/images/2020-06-10-08-34-49-9a296b.png"" rel=""nofollow"">https://user-media-prod-cdn.itsre-sumo.mozilla.net/uploads/images/2020-06-10-08-34-49-9a296b.png</a> </p><p>And here's how it looks after ""Simplify Page"": </p><p><a href=""https://user-media-prod-cdn.itsre-sumo.mozilla.net/uploads/images/2020-06-10-08-35-56-aa6e44.png"" rel=""nofollow"">https://user-media-prod-cdn.itsre-sumo.mozilla.net/uploads/images/2020-06-10-08-35-56-aa6e44.png</a> </p><p>Any way to fix this mess? </p>",firefox-770;tips;desktop;windows-10;,firefox,tips,en-US,1322676;1322683;,WebDev
1290637,2020-06-10 08:26:29 -0800,2020-06-10T21:14:04Z,Login in all the time is tedious,"<p>""""""""""""""Hi, new iMac, I just intalled firefox. All OK, I log in to sincronized the account w/ my other devices.  Now, everytime I go into firefox, I'm asked to log in, my account is not on as I open it up, as it happens in other devices. So everytime I need to use it, I'm requested to follow the process of the login in. Anything wrong with the intallation? </p>",firefox-770;sync;desktop;mac-os;,firefox,sync,en-US,1322486;1322765;,mdm2802
1290636,2020-06-10 08:20:12 -0800,2020-06-10T08:39:11Z,Pop-Up Notice,"<p>I keep periodically getting a pop-up notice in the top right of my screen, but only on my laptop (I have a desktop I also regularly use and I generally use the Moxilla Firefox browser on both). The Pop-up purports to be from Firefox. The notice says, ""Firefox can't update to the latest version."" Below that statement it continues, ""Download a fresh copy of Firefox and we'll help you install it."" There are no logo's or any other representation it is actually from Firefox. I suspect it is a scam of some sort. Please advise...a legitimate notice from Firefox or a scam? </p>",other;desktop;firefox-760;windows-10;,firefox,other,en-US,1322487;1322488;,anastasiaanthony8
1290635,2020-06-10 08:13:37 -0800,2020-06-10T11:29:33Z,firefox disappeared overnight from Windows 10 enterprise v1909. Download Firefox installer 77.0.1 doesn't work,<p>firefox disappeared overnight from Windows 10 enterprise v1909. Download Firefox installer 77.0.1 doesn't work </p>,download-and-install_1;desktop;,firefox,download-and-install,en-US,1322477;1322500;1322504;1322508;1322510;,jeffbarnes1945
1290632,2020-06-10 08:05:09 -0800,2020-06-10T08:45:47Z,Report: Exaktime does not work in the most recent Firefox update.  Forced to use another browser for the time being.,"<p>Report: Exaktime does not work in the most recent Firefox update.  Forced to use another browser for the time being.  Running Windows 10. </p><p>By the way, Firefox should seriously consider allowing people to report issues without signing up or signing in.  Where is your 'Contact Us' link???  I'm happy to report issues, but taking the time to sign up, making up a password and giving personal information is asking a little too much when you've already inconvenienced me with your software issue.  I like your browser, but I hated giving you this feedback.  Another point, do you really want negative comments like this to show up on your website? </p>",firefox-770;websites;desktop;windows-10;,firefox,websites,en-US,1322474;1322475;1322478;1322482;1322483;1322492;,ti89todd
1290630,2020-06-10 08:00:07 -0800,2020-06-11T06:41:41Z,Firefox donation,"<p>I would like to make a donation to Firefox to support the work they do, when I click the make a donation link that shows up in the about firefox window it does not take me anywhere, all other links work. Thank you in advance. </p>",firefox-770;other;desktop;mac-os;,firefox,other,en-US,1322490;1322876;,asantelices51
1290629,2020-06-10 07:55:34 -0800,2020-06-10T12:40:55Z,Language changed to English when install new version,<p>Each time after installing new version my Hebrew screen changed to English (left to right and english menu) </p><p>thanks </p>,firefox-770;other;desktop;windows-10;,firefox,other,en-US,1322536;1322589;,arnon.mann
1290625,2020-06-10 07:39:58 -0800,2020-06-10T21:17:27Z,firefox,"<p>since today I cant open web browser nor links from emails to websites, Each time I get error messages. In settings, ff is shown as default browser. have tried re installing but no solution so far? many thanks </p>",desktop;fix-problems;,firefox,fix-problems,en-US,1322472;1322480;1322766;,coxchris0
1290619,2020-06-10 06:35:44 -0800,2020-06-10T19:13:13Z,Multi-Account Containers,<p>Need Choice to Open BookMark in Multi-Account Containers. </p><p>Can we have a choice when you right-click on a bookmark in the Bookmarks Bar to open the item in a Container? </p>,customize;desktop;firefox-760;mac-os;,firefox,customize,en-US,1322452;1322557;1322722;,mpruntyjr
1290618,2020-06-10 06:33:33 -0800,2020-06-10T07:24:07Z,"Addon - only button ""Only with Firefox - Get Firefox now"", no button to install the Addon","<p>I want to install ""Free Download Manager extension"" for Firefox. But instead of ""install Addon"" I see only the button ""Only with Firefox - Get Firefox now"". I use Firefox from the beginning, current version 77.0.1.(64-Bit). I look hours for help, found nothing. Please help. Regards Manfred </p>",firefox-770;customize;desktop;windows-7;,firefox,customize,en-US,1322450;1322451;,Manfred_Dlugosch
1290615,2020-06-10 06:19:23 -0800,2020-06-10T06:33:25Z,Websites load to long,<p>Websites are loading forever. Chrome is faster. </p>,websites;desktop;,firefox,websites,en-US,1322443;1322444;1322446;1322447;1322449;,umpio09672
1290614,2020-06-10 06:16:31 -0800,2020-06-10T06:24:00Z,Cant open Browser or email links,"<p>Since MS installed new version of Edge I cant access Frefox at all! many thanks, </p>",desktop;fix-problems;,firefox,fix-problems,en-US,1322442;,coxchris0
1290612,2020-06-10 06:11:06 -0800,2020-06-11T03:38:29Z,email,<p>Every time someone asks me for an email response and sends me an email it appears in 'Edge' or some MS program. I want to receive and post emails by 'firefox' only. </p>,firefox-770;sync;desktop;windows-10;,firefox,sync,en-US,1322455;1322818;1322857;,vanzelm1
1290611,2020-06-10 06:09:29 -0800,2020-06-10T06:11:04Z,How to sync,<p>Hi everyone. I want to know how to sync automatic. Thank you </p>,sync;desktop;,firefox,sync,en-US,1322436;,mirkm61309
1290609,2020-06-10 06:04:36 -0800,2020-06-10T06:18:07Z,logins & passwords?,"<p>WTF Happened to 90% of my logins &amp; passwords? I just updated Firefox to the new Beta version and now all I have are 8 f-ing logins &amp; passwords. I had over 80!  How do I get them back? I have never had this issue before, please help me!!!!!!!!!!!!!!!!!! </p>",firefox-780;beta;desktop;privacy-and-security_1;windows-81;,firefox,privacy-and-security,en-US,1322438;1322439;,rjspear
1290608,2020-06-10 05:45:04 -0800,2020-06-10T06:12:06Z,lost bookmarks,<p>I have just updated firefox and can no longer find my bookmarks </p>,firefox-770;bookmarks;desktop;windows-10;,firefox,bookmarks,en-US,1322437;,tonywild2001
1290607,2020-06-10 05:40:20 -0800,2020-06-10T05:46:37Z,How do I make the toolbars actually hide in fullscreen mode on MacOS?,"<p>I'm trying Firefox on MacOS and from what I understand, the toolbars should hide in full screen mode and appear only on mouse over. Except they do not. </p><p>I tried a clean profile, but to no avail. On Windows it works, though. </p><p>Any idea what am I doing wrong? I guess I could use some extension, but shouldn't it work with vanilla Firefox the same way on both platforms? </p>",firefox-770;customize;desktop;mac-os;,firefox,customize,en-US,1322427;1322429;,michal11
1290606,2020-06-10 05:38:55 -0800,2020-06-10T05:53:49Z,Loss or bookmarks and saved passwords after update,<p>Is there are way to revert to an auto backed up version to reclaim the book marks and password information </p>,download-and-install_1;firefox-770;desktop;windows-7;,firefox,download-and-install,en-US,1322432;,joshua_platt
1290605,2020-06-10 05:36:57 -0800,2020-06-10T20:36:39Z,up/down scroll buttons app,<p>Is there a reliable app to install up/down scroll buttons </p>,firefox-770;customize;desktop;windows-10;,firefox,customize,en-US,1322754;,sharonapfeldorf
1290604,2020-06-10 05:30:57 -0800,2020-06-10T19:02:00Z,Bad Request  Your browser sent a request that this server could not understand. Size of a request header field exceeds server limit.,<p>Bad Request </p><p>Your browser sent a request that this server could not understand. Size of a request header field exceeds server limit. </p><p>wtf! how does one report this to init a fix? This is not a community fix. Stuck! No where to go. Sh1t CS! </p>,firefox-770;desktop;fix-problems;windows-10;,firefox,fix-problems,en-US,1322456;1322491;1322719;,DisgruntaledFoxFirelessUser
1290603,2020-06-10 05:28:56 -0800,2020-06-10T07:23:12Z,unable to reach RDS mode on Microsoft server 2016,<p>Hi for months I have been using Firefox to access SAP Server with Microsoft Server 2016 in RDS mode. Since the last update 77.0.1 Microsoft Server no longer offers to identify me to enter RDS mode. Since then I have to use EDGE to get there Please help me I don't want to use EDGE because of this problem </p>,firefox-770;other;desktop;windows-10;,firefox,other,en-US,1322463;,jlnaud
1290602,2020-06-10 05:07:31 -0800,2020-06-11T03:27:16Z,"I have .mp4, .m4v, and .mkv videos, all with embedded subtitles that I can see in VLC.  How can I see the subtitles in Firefox?","<p>I have .mp4, .m4v, and .mkv videos, all with embedded subtitles that I can see in VLC.   </p><p>How can I see the subtitles in Firefox?  For now, subtitles are in both French and English. </p>",firefox-770;customize;desktop;windows-10;,firefox,customize,en-US,1322465;1322856;,walt.morrey
1290599,2020-06-10 04:32:20 -0800,2020-06-10T15:27:29Z,"[Window Title] C:\Program Files\Mozilla Firefox\firefox.exe  [Content] Impossibile trovare il file ""C:\Program Files\Mozilla Firefox\firefox.exe"". Verificare che il nome del file sia corretto, quindi riprovare.","<p>Io ho riscontrato questo problema,  [Window Title] C:\Program Files\Mozilla Firefox\firefox.exe </p><p>[Content] Impossibile trovare il file ""C:\Program Files\Mozilla Firefox\firefox.exe"". Verificare che il nome del file sia corretto, quindi riprovare. </p><p>Ho provato a seguire i passaggi sul vostro sito ma anche reinstallando mi da lo stesso errore. Se potete aiutatemi, grazie. </p>",other;desktop;,firefox,other,en-US,1322669;,albertosega95
1290598,2020-06-10 04:16:11 -0800,2020-06-10T04:16:11Z,Legendas e picture-in-picture,<p>Alguma maneira de colocar legendas que não estão embutidas diretamente no vídeo com picture-in-picture? </p>,firefox-770;customize;desktop;windows-10;,firefox,customize,pt-BR,"",carlosdias_
1290597,2020-06-10 03:55:16 -0800,2020-06-10T05:10:36Z,Disabling addons according to operating system,<p>due to sync I cannot disable certain addons which serve their only purpose on linux but not on windows like xdm in linux but idm in windows. So how do we work around to disable addons according to os in which it is running? </p>,customize;desktop;,firefox,customize,en-US,1322419;,ankitpaudel20000
1290596,2020-06-10 03:40:18 -0800,2020-06-10T19:39:16Z,one and only one website does not open,"<p>Since about a year or so, I cannot connect to <a href=""http://members.iinet.net.au/~dgreen/PlanimeterVault/index.html"" rel=""nofollow"">http://members.iinet.net.au/~dgreen/PlanimeterVault/index.html</a>. As this is the only website that I'm missing (all others – and I use many! - can be opened as usual),  it seems a browser problem - but I'm not able to find ou which. The error message is ""Firefox is unable to connect to the server <a href=""http://members.iinet.net.au"" rel=""nofollow"">members.iinet.net.au</a>"". Can you give me some advice? </p>",firefox-770;websites;desktop;windows-10;,firefox,websites,en-US,1322396;1322409;1322410;1322418;1322440;1322459;1322498;1322547;1322735;,jea.fischer
1290594,2020-06-10 03:25:49 -0800,2020-06-10T03:48:14Z,Unable to access a specific website,"<p>Why am I not able to access a website on Firefox but other browsers? I was surfing on a website where I clicked on a hyperlink to visit that website(<a href=""https://errorproblems.com/support-for-windows/repair-windows-10/"" rel=""nofollow"">repair windows 10</a>) but it kept loading and buffering for a long time but never opened up properly. Whereas on other browsers I hardly took a second load the website. Can someone tell me why is this happening? and is it just me or is there someone else who is also facing the same issue? </p>",websites;desktop;,firefox,websites,en-US,1322397;,errorproblemss
1290592,2020-06-10 03:16:56 -0800,2020-06-10T03:48:53Z,Update to 76.0 fails everytime,"<p>I use a mid 2011 Mac (16GB of RAM)  which has maxed out on El Capitan 10.11.6. I have 2 issues. Every time I open Firefox, it says that it is trying to install a helper tool which will happen on restarting Firefox. Nothing seems to happen. When I next reopen Firefox this process repeats.  </p><p>I have also downloaded and try to install 76.0 several times but eachtime I restart Firefox I remain on 75.0. </p><p>Any thoughts? </p>",download-and-install_1;firefox-750;desktop;mac-os;,firefox,download-and-install,en-US,1322398;,skitter
1290591,2020-06-10 03:03:36 -0800,2020-06-10T18:30:38Z,"can not zoom ""select“ font size in new version firefox brower","<p>today I update my browser to the new version when I zoom page the ""select"" font size no change </p><p>before the function is ok </p>",desktop;fix-problems;,firefox,fix-problems,en-US,1322388;1322390;1322705;1322706;,kevinma1
