id,created,updated,title,content,tags,product,topic,locale,answers,creator
1290518,2020-06-09 13:30:22 -0800,2020-06-09T13:55:37Z,Color Management Problem  - Wide Gamut Monitor and Firefox 77.01,"<p>I recently had an automatic upgrade to Firefox 77.01 and noticed my monitor color saturation changed.  I use a NEC P221 wide gamut monitor, and I'm aware of the over-saturation issues with wide gamut monitors.  I'm on a 2011 Mac Mini using High Sierra 10.13.6.  In the past when this issue has come up, I'd use the about:config command to adjust Firefox's color management settings.  When I tried adjusting it for the new upgrade, I haven't been able to correct the problem. I tried using different values for the settings and also tried supplying the exact monitor profile name pathway to replace the ""gfx.color_management.display_profile"" setting.  </p><p>I’ve attached a screen shot of my current settings.  Any help/advice/suggestions on how to fix this problem will be greatly appreciated! </p><p>David </p>",firefox-770;other;desktop;mac-os;,firefox,other,en-US,1322183;1322184;1322185;1322194;,davidmschrader
1290517,2020-06-09 13:28:49 -0800,2020-06-09T18:58:26Z,XML Parsing Error: Firefox Opens But Doesn't Work,"<p>So some days ago my firefox browser ran an automatic update and afterwards, it returned this error message: </p><p>""XML Parsing Error: undefined entity Location: chrome://browser/content/browser.xhtml Line Number 46, Column 1: ""   I'm being hesitant with uninstalling it cos I have some important passwords and accounts logged into it.  Please, I need help with this.  </p>",desktop;fix-problems;,firefox,fix-problems,en-US,1322182;1322191;1322273;1322290;,leadwap01
1290516,2020-06-09 13:26:08 -0800,2020-06-09T13:45:35Z,Surface Pro 6 on screen keyboard not working,"<p>When in tablet mode (keyboard folded back or unattached), I can not use the on screen keyboard. When I tap a field (address bar, search bar, or any field on any website that I've tested), the keyboard comes up, then immediately closes again. If I use the on screen keyboard button from the taskbar, the same thing happens: keyboard slides up, window jumps a bit, then keyboard closes again. </p><p>I have already tried adjusting all the settings under about:config with the search ""osk"" as suggested in other threads I've seen. Have also tried disabling all addons, no change. </p><p>Tried on current FF standard version and firefox nightly (newest update on 6/9/2020, whatever the version is). Both have the exact same issue even  after adjusting the settings under about:config. </p><p>I'm not sure how long this has been going on since I never really use tablet mode (primarily use this laptop for coding and classes where I need to type, apparently haven't done any web browsing in tablet mode.) </p><p>Any help is appreciated. </p>",desktop;fix-problems;windows-10;,firefox,fix-problems,en-US,1322175;1322177;1322178;1322189;,iforgot52
1290515,2020-06-09 13:21:25 -0800,2020-06-09T22:49:00Z,A website doesn't show payment information,"<p>We have been using Square Point of Sale websites for a couple of years. All of a sudden in the past couple of days customers or members log in to our website, <a href=""http://www.westminster710rotary.org"" rel=""nofollow"">www.westminster710rotary.org</a> to make a donation and from the Rotary Payments page only the header of the payment window shows up. There should be all the credit card information under the header there, as well. But it is blank. Is there a setting in Options I should choose to keep that from happening?  Thanks, Loren </p>",firefox-770;websites;desktop;windows-10;,firefox,websites,en-US,1322171;1322173;1322187;1322336;,ldonal7880
1290513,2020-06-09 13:13:50 -0800,2020-06-09T17:15:37Z,Mozilla Firefox is installed and verified location yet get error message,"<p>Installed latest Firefox update.  When desktop shortcut icon is selected get this message ""Windows can not find 'C:\Program Files\Mozilla Firefox\firefox.exe'.  Make sure you typed in the name correctly, and try again.'  The program extension is there and when I click on that location get same message.  I think my laptop has been hacked and I need to wipe the hard drive and reinstall windows.  I have other desktop shortcut icons linking to apps that get same message, yet those applications are installed and worked in the past.  Also when I opened Chrome it came up in Chinese language.  The VPN app was not working yet it was yesterday. I have Avast virus protection, yet the scan showed no virus present.  Do I have to wipe drive and reinstall Windows? </p>",other;desktop;,firefox,other,en-US,1322165;1322167;1322168;1322170;1322231;1322256;,dave5mox
1290511,2020-06-09 12:57:15 -0800,2020-06-09T15:38:00Z,Firefox Repeately Asks for Master Password Each Time Any Secure Site Visited During Single Session,"<p>I have a 2.5 year old Windows 10 Dell Inspiron 7000 series, with Windows Security.  I enabled the Firefox password manager recently.  It seems to require that I enter the password whenever I need to access a password enabled site.  It that by design?  I had understood that once the master PW was entered during a session, Firefox would automatically enter the proper credentials to open password protected websites without my having to reenter Firefox's unique master password each time.  If not, what's the point?  Thanks! </p>",firefox-770;privacy-and-security_1;desktop;windows-10;,firefox,privacy-and-security,en-US,1322158;1322159;1322161;1322176;1322226;1322239;,dch23414
1290508,2020-06-09 12:39:43 -0800,2020-06-09T12:39:43Z,Teaching a child not to step on a caterpillar is as valuable to the child as it is to the caterpillar.,"<p><a href=""https://www.merckmanuals.com/home/SearchResults?query=%EC%9D%98%EC%A0%95%EB%B6%80%EC%B6%9C%EC%9E%A5%EB%A7%88%EC%82%AC%EC%A7%80U%26lt%3B%26lt%3B%EC%B9%B4%ED%86%A1BN36%26gt%3B%26gt%3B%EC%9D%98%EC%A0%95%EB%B6%80%EC%B6%9C%EC%9E%A5%EC%83%B5UU%EC%9D%98%EC%A0%95%EB%B6%80%EC%B6%9C%EC%9E%A5%EC%83%B5%EC%B6%94%EC%B2%9CU%EC%9D%98%EC%A0%95%EB%B6%80%EC%B6%9C%EC%9E%A5%EC%95%84%EB%A7%88U%EC%9D%98%EC%A0%95%EB%B6%80%EC%BD%9C%EA%B1%B8U%EC%9D%BC%EB%B3%B8%EC%9D%B8%EC%B6%9C%EC%9E%A5%EB%A7%88%EC%82%AC%EC%A7%80U%EC%9D%98%EC%A0%95%EB%B6%80%EC%B6%9C%EC%9E%A5%EC%95%84%EA%B0%80%EC%94%A8U%EC%9D%98%EC%A0%95%EB%B6%80%EC%B6%9C%EC%9E%A5%EB%A7%8C%EB%82%A8U%EC%9D%98%EC%A0%95%EB%B6%80%EB%AA%A8%ED%85%94%EC%B6%9C%EC%9E%A5"" rel=""nofollow"">link text</a> </p>","",firefox,download-and-install,en-US,"",eustaceray1721
1290507,2020-06-09 12:39:08 -0800,2020-06-09T12:39:08Z,Teaching a child not to step on a caterpillar is as valuable to the child as it is to the caterpillar.,"<p><a href=""https://www.merckmanuals.com/home/SearchResults?query=%EC%9D%98%EC%A0%95%EB%B6%80%EC%B6%9C%EC%9E%A5%EB%A7%88%EC%82%AC%EC%A7%80U%26lt%3B%26lt%3B%EC%B9%B4%ED%86%A1BN36%26gt%3B%26gt%3B%EC%9D%98%EC%A0%95%EB%B6%80%EC%B6%9C%EC%9E%A5%EC%83%B5UU%EC%9D%98%EC%A0%95%EB%B6%80%EC%B6%9C%EC%9E%A5%EC%83%B5%EC%B6%94%EC%B2%9CU%EC%9D%98%EC%A0%95%EB%B6%80%EC%B6%9C%EC%9E%A5%EC%95%84%EB%A7%88U%EC%9D%98%EC%A0%95%EB%B6%80%EC%BD%9C%EA%B1%B8U%EC%9D%BC%EB%B3%B8%EC%9D%B8%EC%B6%9C%EC%9E%A5%EB%A7%88%EC%82%AC%EC%A7%80U%EC%9D%98%EC%A0%95%EB%B6%80%EC%B6%9C%EC%9E%A5%EC%95%84%EA%B0%80%EC%94%A8U%EC%9D%98%EC%A0%95%EB%B6%80%EC%B6%9C%EC%9E%A5%EB%A7%8C%EB%82%A8U%EC%9D%98%EC%A0%95%EB%B6%80%EB%AA%A8%ED%85%94%EC%B6%9C%EC%9E%A5"" rel=""nofollow"">link text</a> </p>","",firefox,download-and-install,en-US,"",eustaceray1721
1290506,2020-06-09 12:23:35 -0800,2020-06-09T17:42:42Z,"When Firefox updated, it disabled my speakers.",<p>When I go back to the old version my speakers work fine.  How do I keep Firefox from updating? </p>,firefox-770;other;desktop;windows-7;,firefox,other,en-US,1322146;1322154;,whitehillguzman
1290505,2020-06-09 12:18:53 -0800,2020-06-09T13:11:49Z,How can I make it so downloads automatically open?,<p>How can I make it so downloads automatically open? </p>,firefox-770;customize;desktop;windows-10;,firefox,customize,en-US,1322143;1322160;,hughesgt
1290503,2020-06-09 12:11:51 -0800,2020-06-09T13:14:29Z,"I erred in clicking ""ok, I got it"" instead of ""disable"" when trying to watch a video; now I have no volume control!","<p>as stated above, in attempting to watch a YouTube video sent in e-mail from a friend, I misunderstood the message I got from Firefox and clicked ""ok, I got it"" instead of ""disable"" and Firefox complete removed the sound from my computer so that now my volume control little icon has completely disappeared!   how can I restore sound to my computer?  I did not want this outcome!! </p>",privacy-and-security_1;firefox-720;desktop;windows-10;,firefox,privacy-and-security,en-US,1322149;1322163;,missp050
1290502,2020-06-09 12:10:39 -0800,2020-06-09T13:17:18Z,Consider Support Multiple Keyword Search,"<p>I just followed <a href=""https://support.mozilla.org/en-US/questions/1177556#answer-1011871"" rel=""nofollow"">this instructions</a> that given by <a href=""https://support.mozilla.org/en-US/user/jscher2000"" rel=""nofollow"">jscher2000</a>, in order to make things easier to search. I like this feature so much! But unfortunately, it's not supporting multiple keywords. </p><p>Steps to reproduce: 1. Go to YouTube home page 2. Right-click the search box and choose ""Add a Keyword for this search"" 3. Enter a random keyword like: ""frfx"" 4. Now we can use that keyword in the search bar. ""frfr custom_keyword_here"" (This is working well) 5. Go to YouTube search box again and add a new keyword: ""frfx, you, tube"" 6. Now, none of this will work anymore. Even ""frfx"" </p><p>Why this feature would be so great is that because we are human and we can forgot ""things"". Sometimes I make searches like these: i.e. ""rd firefox"" or ""rdt firefox"" or ""reddit firefox"". Don't you? </p><p>Thanks! </p><p><em>Your friendly Firefox user, since 3.0</em> </p>",firefox-770;tips;desktop;windows-10;,firefox,tips,en-US,1322153;1322156;1322157;1322164;1322166;,furkan.turkal
1290501,2020-06-09 11:35:13 -0800,2020-06-09T12:57:19Z,Facebook is glitching due to Firefox browser,"<p>Hi! For several days I've been unable to check notifications and click emoticons on FB. I just spoke with a tech who checked other browsers (Chrome, Safari) as well as my phone and I was able to do both with them all. But I still can't in Firefox. I've checked to make sure I'm updated, and I am. So she suggested I reach out to you. Should I try uninstalling Firefox and re-installing? I'm assuming I'll lose my history? Thank you! </p>",firefox-770;websites;desktop;mac-os;,firefox,websites,en-US,1322136;1322155;,tea4thee
1290498,2020-06-09 11:13:15 -0800,2020-06-09T18:34:29Z,whats app web,<p>No puedo acceder a whatsapweb desde que instale el nuevo Firefox 7.7 </p>,firefox-770;websites;desktop;windows-81;,firefox,websites,en-US,1322283;,cesar.colonia
1290497,2020-06-09 11:11:50 -0800,2020-06-09T11:30:20Z,Windows Cannot Find Firefox,"<p>I used Firefox and then shut my laptop down.  I turned my laptop on after a few hours and received the following error message: </p><p>""Windows cannot find 'C:\Program Files\Mozilla Firefox\firefox.exe'. Make sure you typed the name correctly and then try again."" </p><p>As advised in an earlier post, I ran Malwarebytes and re-installed Firefox.  But I'm still getting the same message.   </p><p>Thank you in advance. </p>",desktop;fix-problems;,firefox,fix-problems,en-US,1322126;,keemusic
1290496,2020-06-09 11:11:00 -0800,2020-06-10T21:06:46Z,Twitter,<p><strong>I just can´t get acces to twitter since I installed the new version of firefox</strong> </p>,firefox-770;other;desktop;windows-81;needsinfo;,firefox,other,es,1322762;,cesar.colonia
1290494,2020-06-09 11:03:18 -0800,2020-06-09T11:12:35Z,Firefox wont open,"<p>On windows 10 when I try to open firefox from the desktop I get a message telling me, ""Windows cannot find C:\Program Files\Mozilla Firefox\firefox.exe Make sure you typed the name correctly."" </p> <ul><li> I've tried opening the application from the program files, and get the same error </li><li>Uninstalling and reinstalling the application  </li><li> Windows isn't letting me into safe mode </li><li> I use Avast Preminum Security </li></ul>",other;desktop;,firefox,other,en-US,1322103;1322107;,thomp3aw
1290493,2020-06-09 10:56:29 -0800,2020-06-10T22:10:57Z,Firefox funktioniert nicht mehr,<p>ich kann auf Firefox nicht mehr zugreifen. Ich habe firefox deinstalliert und anschliesend neuinstalliert Die Fehlermeldung lautet stets: c:\program files\mozilla firefox\firefox.exe konnte nicht gefunden werden </p><p>Ich habe Windows 10 64 Bit </p>,download-and-install_1;desktop;needsinfo;,firefox,download-and-install,en-US,1322200;1322213;1322215;1322236;1322251;1322412;1322481;1322718;1322790;,schliffer
1290492,2020-06-09 10:43:28 -0800,2020-06-09T10:58:18Z,"Help! Need to move Bookmarks, Extensions & Add-Ons to another Mac","<p>My present iMac is failing rapidly and I will be replacing it with a new Mac very. I do not have a Time Machine backup. The only info I really need is how to copy off, to an external drive, all the bookmarks and bookmark structure), extensions, and add-ons I have added to Firefox, and then add them to Firefox on my future Mac. </p><p>Do I just copy the Firefox app to the external drive? I looked in the Macs' base system Library and Preferences, and in my User files, but I do not see anything related to Firefox. </p><p>My old (current) and failing Mac is running the latest version of Catalina, </p><p>Thanks for any info! </p>",download-and-install_1;firefox-770;desktop;mac-os;,firefox,download-and-install,en-US,1322086;1322089;1322092;1322094;,fastdude
1290491,2020-06-09 10:26:24 -0800,2020-06-09T11:19:10Z,firefox keeps freezing and force quit doesn't eliminate an active process which is hidden,"<p>Firefox freezes at least 5 times a day, and I have to do a Force Quit.  But I can't restart my Mac because there is still a version of Firefox running, so I have to press the power button for 5 seconds to shut down.  Upon opening, I'm fine for an hour or two, and then the same problem.  After force quit, it appears Firefox is no longer running, but trying to reopen it, a message says only one version can run at a time. </p>",firefox-770;desktop;fix-problems;mac-os;,firefox,fix-problems,en-US,1322080;1322097;1322116;,glands666
1290490,2020-06-09 10:25:01 -0800,2020-06-10T22:08:04Z,Windows Cannot Find Firefox.exe,"<p>Hi, </p><p>I've been using firefox for a while on this computer now, but this morning I was hit with a popup saying: ""Windows cannot find 'C:\Program Files\Mozilla Firefox\firefox.exe'. Make sure you typed the name correctly, and then try again.""  </p><p>I have so far tried every fix I can find (which aren't many for this glitch), and none have worked. I have tried uninstalling and deleting all folders related to Firefox, and the new install still gives me the same error.  My OS is Windows 10, and I have not had any problems with Firefox before this morning, nor have I made any changes to the files or anything of the sort. Just tried to run it and it gave me this. </p><p>I am at my wits end a bit with this.  Help! </p>",other;desktop;,firefox,other,en-US,1322081;1322083;1322095;1322101;1322110;1322233;1322242;1322243;1322255;1322261;1322512;1322548;1322639;1322642;1322786;,killtoy
1290489,2020-06-09 10:21:04 -0800,2020-06-10T04:59:08Z,"Can no longer ""Save Image As""","<p>I suddenly lost the ability to ""Save Image As"".  Nothing happens when I select ""Save Image As."" </p><p>Things I've tried: </p><p>1.  renaming content-prefs.sqlite file and re-starting. </p><p>2. reinstalling firefox (and running it with no extensions installed) </p><p><br> I'm at a loss.  Please help.  Thank you. </p>",firefox-770;other;desktop;,firefox,other,en-US,1322090;1322091;1322119;1322127;1322129;1322151;1322218;1322386;1322414;,turtlerk
1290488,2020-06-09 10:08:59 -0800,2020-06-09T13:27:10Z,Turn off the zoom on the URL bar in Firefox 77,"<p>Hello, how can the zoom on the URL window be disabled? Instructions on how to do this in about:config for previous versions no longer work. Thanks. </p>",firefox-770;customize;desktop;mac-os;,firefox,customize,en-US,1322078;1322084;1322088;1322093;1322172;,mike.porter1
1290487,2020-06-09 10:00:55 -0800,2020-06-10T22:05:34Z,External hyperlinks do not open in Firefox window,"<p>Clicking on hyperlinks that are in external documents (Word, Excel, or any other) opens webpages in separate Firefox windows outside of the main open Firefox window that reflects all of my customized Firefox settings. These separate window open with Firefox, as is the set default browser; however, none of these separate windows carry over my custom Firefox setting, styles, etc. Also, their tabs cannot be dragged into the main Firefox window as a tab there.  </p><p>I've checked all of my Firefox settings and the support knowledge base, where nothing was found that addresses this issue. Any help would be greatly appreciated. </p>",firefox-770;other;desktop;windows-10;,firefox,other,en-US,1322096;1322098;1322113;1322311;1322318;1322335;1322680;1322682;1322713;1322778;1322783;,al110
1290485,2020-06-09 09:38:54 -0800,2020-06-09T13:29:58Z,Lots of Youtube-Videos not loading,"<p>Hi there, </p><p>since the beginning of June (probably the update with the PiP notification) I noticed that a lot of specific Youtube-videos are endlessly loading (the spinning circle animation) and not showing any controls (play/pause, next video, etc.). It's not like I could try multiple times and sometimes videos load and sometimes they don't, it seems to be specific videos, but I can't figure out what differs them from others. Examples that work: <a href=""https://www.youtube.com/watch?v=Yqy7_zUKyNQ"" rel=""nofollow"">https://www.youtube.com/watch?v=Yqy7_zUKyNQ</a> <a href=""https://www.youtube.com/watch?v=ftuctYN60j0"" rel=""nofollow"">https://www.youtube.com/watch?v=ftuctYN60j0</a> </p><p>Examples that do not load: <a href=""https://www.youtube.com/watch?v=FF3Dr3_h0Hw"" rel=""nofollow"">https://www.youtube.com/watch?v=FF3Dr3_h0Hw</a> <a href=""https://www.youtube.com/watch?v=LAN1LXO1eG8"" rel=""nofollow"">https://www.youtube.com/watch?v=LAN1LXO1eG8</a> </p><p>Generally I could say that about 60% of the videos aren't loading. I tried them in another Browser and also inside of other Software (Discord, Mattermost) where everything seems to work just fine, it's just my Firefox having issues and I really don't want to switch to another browser. </p><p>I really hope somebody can help me, I tried finding a solution, but all the other issues seem to differ from mine or are Mobile-issues. </p>",firefox-770;desktop;fix-problems;windows-10;,firefox,fix-problems,en-US,1322055;1322118;1322120;1322139;1322180;,jenniferroberts1116
1290480,2020-06-09 09:20:21 -0800,2020-06-09T09:20:21Z,Indian fonts on YouTube on MacOS,"<p>Sometimes on YouTube page, some strange fonts appear. It is something in the system which cose this problem, because it appear the same in other brousers. </p>","",firefox,websites,sl,"",david.lozej1
1290478,2020-06-09 09:11:46 -0800,2020-06-10T07:47:51Z,"MOZILLA_PKIX_ERROR_REQUIRED_TLS_FEATURE_MISSING caused by ocsp must staple, SSL labs says stapling is OK","<p>Hi, </p><p>I'm getting a MOZILLA_PKIX_ERROR_REQUIRED_TLS_FEATURE_MISSING error on my website cubox.dev Using Firefox Developer Edition. </p><p>Nginx is configured to ocsp response, and disabling this flag in the advanced settings in Firefox fixes this issue, but I can't ask everyone to do that. SSLLabs are indicating that ocsp stapling is working fine: <a href=""https://www.ssllabs.com/ssltest/analyze.html?d=imonia.fr&amp;s=89.163.242.17&amp;hideResults=on"" rel=""nofollow"">https://www.ssllabs.com/ssltest/analyze.html?d=imonia.fr&amp;s=89.163.242.17&amp;hideResults=on</a> </p><p>Could someone tell me why this is an issue? Is there a problem with the way my server is stapling my responses? You can test against my server: cubox.dev </p><p>Thanks </p>",firefox-780;websites;beta;desktop;windows-10;,firefox,websites,en-US,1322108;1322238;1322333;1322467;,cubox
1290477,2020-06-09 09:02:33 -0800,2020-06-10T07:14:49Z,Keyboard shortcut to switch tabs left and right without page up/down,<p>Is there a way to change the default keyboard shortcut on Windows from ctrl + page up/down to switch tabs left and right to something else if my keyboard doesn't have page up/down keys? I'm already using ctrl + tab to cycle between the most recent tabs. </p>,firefox-770;customize;desktop;windows-10;,firefox,customize,en-US,1322044;1322046;1322050;1322056;1322064;1322302;1322464;,tulpen.mkt
1290476,2020-06-09 08:58:13 -0800,2020-06-10T22:08:49Z,Error message windows did not find firefox.exe. verify that you entered the correct name and try again,"<p>Hello, </p><p><br> I apologize in advance for my low level in English, I am a French internet user who has encountered a problem since this morning. I have Mozilla Firefox on Windows 10. So far, it has worked perfectly. However, I could see today, by turning on my computer that I could no longer access Mozilla Firefox. Indeed, when I click on it, I encounter this error message: </p><p>Windows did not find c: \ program files \ mozilla firefox \ firefox.exe. verify that you entered the correct name and try again </p><p><br> </p><p>I do not understand why I have this message. When I go to C: \ Program files \ mozilla firefox I do have a ""firefox"" icon (exe application). but I clicked on it and it doesn't work. I would like to inform that by using avast, avast updated me mozilla firefox ... I repeatedly uninstall and reinstall mozilla firefox; I even turned off, turn on, and turn on the computer several times but nothing to do, it does not work. </p><p>Can you help me see more clearly please? </p><p>Thanks in advance. </p>",download-and-install_1;desktop;escalate;escalationresolved;,firefox,download-and-install,en-US,1322041;1322042;1322048;1322061;1322102;1322104;1322105;1322109;1322115;1322124;1322135;1322232;1322257;1322787;,franck.dalessandro
1290475,2020-06-09 08:47:25 -0800,2020-06-09T08:51:31Z,sign up via google not working,"<p>I cant sign up/in to a website via my google account. Whats might have gone wrong? could you please help? </p><p>Thanks &amp; Regards, </p>",firefox-770;cookies;desktop;windows-10;,firefox,cookies,en-US,1322029;1322031;,sen.annek111
1290474,2020-06-09 08:46:49 -0800,2020-06-10T02:29:02Z,"I luckily saved my cloud settings and don't know where to find them after a HD crash and reinstall...Lost everything from my Mozilla last night, have fixed the problem but need my stuff back from the clous save!","<p>Dear support and community.  </p><p>My HD had a meltdown last night and I had to reinstall everything. Luckily I saved my settings to the Mozilla cloud just a few days ago and desperately want to get everything back, if at all possible. I had to put in my email address and use a password and it stated 'saved'.  </p><p>I can't for the life of me find out where to go to retrieve my settings.. Please help  </p><p>My apologies for possibly not putting this question in the right category!  </p><p>Best regards  Si </p>",firefox-770;other;desktop;windows-81;,firefox,other,en-US,1322032;1322378;1322380;,simills2014
1290473,2020-06-09 08:41:38 -0800,2020-06-09T17:14:32Z,Unresponsive Scripts and Browser not responding issues,"<p>I am having severe issues with unresponsive scripts and Firefox not responding. Once the scripts stop responding on one page, it spreads to the others I have open. I've cleared cache/cookies/data, I've gone into the configuration and changed the seconds to see if the script will complete, and I've tried the recommended extension (Javascript stop and go?), but then web pages won't load. I'm at a loss as to what else to do.  Could this be a malware/virus issue?  </p><p>The browser also stops responding, and once it gets started, it keeps doing so to the point I can't use the browser. </p>",firefox-770;desktop;fix-problems;windows-10;,firefox,fix-problems,en-US,1322028;1322051;1322123;1322145;1322181;1322188;1322190;1322199;1322219;1322222;1322230;1322235;1322254;,hashbrowngirl23
1290470,2020-06-09 08:31:05 -0800,2020-06-09T17:40:06Z,Préférences,"<p>Bonjour, Je n'arrive pas à garder mes préférences. Elles se reset régulierement..  Pouvez-vous m'aider? </p><p>Hi, I can't keep my preferences settings. It reset all the time. Thank you for your help. </p>",firefox-770;customize;desktop;mac-os;,firefox,customize,en-US,1322198;1322265;,marcelcohen
1290469,2020-06-09 08:27:46 -0800,2020-06-09T08:40:27Z,RE: EVernote not responsive,<p>I have the evernote add on . My problem is  whether i browse or try to login my evernot on the add on the page just goes blank . It wont load or display anything </p>,firefox-770;desktop;fix-problems;linux;,firefox,fix-problems,en-US,1322020;1322025;,kudzaichitewe
1290466,2020-06-09 08:01:30 -0800,2020-06-10T07:55:34Z,How do I view browsing history chronologically?,"<p>In the library I can select a month to see history entries from that month, but I don't see any way to actually view them chronologically. </p><p>The only column with dates is ""last visited"" which obviously will not result in a chronological view if sorted on. </p><p>There's a column called ""source date"" or something similar, but that column is empty. </p>",firefox-770;other;desktop;mac-os;,firefox,other,en-US,1322011;1322012;1322014;1322015;1322018;1322026;1322391;1322470;,onetimename
