id,created,updated,title,content,tags,product,topic,locale,answers,creator
1289441,2020-06-02 23:40:05 -0800,2020-06-03 05:01:40 -0800,Version 77 big problem,"<p>Today when I started Firefox it auto-updated to version 77, and all web-pages looked like a mess of weird symbols like the ones in the screenshot I attached. </p><p>I tried disabling all addons and plugins, and some other stuff but nothing worked. </p><p>So I downgraded to 76.0.1 and everything works fine, it's definetly a problem with version 77. </p><p>I guess I won't be updating until I know this problem was adressed. </p>",desktop;fix-problems;,firefox,fix-problems,en-US,1318593;1318594;1318597;1318600;1318604;1318677;,bayus.firestorm
1289438,2020-06-02 22:49:21 -0800,2020-06-03 04:09:59 -0800,What can I do to compensate for the terrible spell check ability of Firefox/Thunderbird,"<p>I use mostly Chrome browser but it's such a resource, memory and storage hog I've been using FF more.  However, while spell check technically works, it's simply terrible and frustrating to use. With Chrome, I hardly had to add words to my dictionary while with FF/TB many essential basic words are flagged.  </p><p>I read some other posts where FF flags most words, that's not my gripe. The dictionary is pathetic. I can't even find any add-ons/extensions that provide a greater vocabulary. </p><p>Are there some tips and tricks besides adding words one can use here? </p>",firefox-680;desktop;tips;windows-10;,firefox,tips,en-US,1318583;1318656;,tmajer1
1289437,2020-06-02 22:47:27 -0800,2020-06-02 23:19:35 -0800,https://help.music.qugeek.com/1192876,<p>Can't install the app. </p>,download-and-install_1;desktop;,firefox,download-and-install,en-US,1318585;,kamri4242
1289436,2020-06-02 22:37:30 -0800,2020-06-03 04:33:56 -0800,Passwörter sind plötzlich weg!!!!,"<p>Guten Morgen, </p><pre>meine Passwörter sind plötzlich weg, ich möchte keinen Brauser der die Passwörter vergisst. Warum passiert dies immer wieder?   </pre> <p>Es sollte eine sehr einfache Rückhohkung geben und nicht so ein umständliches Suchen nach den vorhandenen Passwörtern und der Rückholung!!!  </p><p>Ich habe ein umfangreiche Internetseite von über 30 Domain etc.  wie soll ich da die ganzen  </p><p>Passwörter merken!!! </p><p>Es ist ein Unding, wenn Firefox plötzlich die Passwörter nicht anzeigt, so ist dies eine Stundenlange Arbeit!!! </p><p>Ich bin sehr unzufrieden mit Firefox </p><p>M F G Eric Hoyer </p>",firefox-700;other;desktop;linux;,firefox,other,en-US,1318664;,Umweltansicht
1289435,2020-06-02 22:25:25 -0800,2020-06-03 01:49:16 -0800,Update,<p>Update </p>,customize;desktop;firefox-450;linux;,firefox,customize,en-US,1318567;1318568;1318623;,othmankhlwy99
1289433,2020-06-02 22:00:34 -0800,2020-06-02 23:04:41 -0800,"login details, bookmarks","<p>I changed the password for the firefox account because I installed a new windows, after which all login details and bookmarks disappeared. during the password change I was not informed that I would lose all data! I let you keep this information in the cloud in trust and you deleted it? Have you gone crazy!?!?!?!? I want to get back my data immediately! I see that a lot of people have a similar problem and you don't do anything about it? How can I trust you at all in this situation? </p>",firefox-770;sync;desktop;windows-10;,firefox,sync,en-US,1318571;1318573;1318578;1318582;,gosukody
1289427,2020-06-02 20:46:00 -0800,2020-06-02 22:47:04 -0800,Problems with text,"<p>New browser, no pages open. No extensions. Encoding cannot be changed. What's wrong? Some pages are also with wrong encoding. </p>",websites;desktop;,firefox,websites,en-US,1318575;1318577;,baso4hno3
1289425,2020-06-02 19:56:23 -0800,2020-06-02 23:45:34 -0800,I use a 4K TV as a monitor and have a minor problem,"<p>As I said, I use a 4K Colour TV (all correctly setup and running) as a monitor and most  times all is fine but occasionally when I switch on my desktop, Firefox shows a small 2K display so I have to double click the title bar to change the display back to 4K. I also use, concurrently, Opera (for it's free inbuilt VPN) and it sometimes does the same thing. This also occurs with Skype AND uTorrent at various times. Because it is so common I suspect my Windows 10 64bit Pro must be sending some sort of signal to cause this behavior? All in all Firefox does this less than the other three Apps   :) </p>",firefox-770;other;desktop;windows-10;,firefox,other,en-US,1318591;,louwin
1289424,2020-06-02 19:31:52 -0800,2020-06-03 05:34:16 -0800,I upgraded to firefox 77 and now my passwords will not sync in lockwise.,<p>I upgraded to firefox 77 on my windows 10 system and now my passwords stored in lockwise are gone and when I try to run the sync to include the passwords they will not sync back </p>,firefox-770;sync;desktop;windows-10;,firefox,sync,en-US,1318590;1318683;,gilrand2
1289423,2020-06-02 19:31:40 -0800,2020-06-02 21:25:04 -0800,Playing video on YouTube and can't make any comments,<p>sudgest </p>,firefox-770;tips;desktop;windows-10;,firefox,tips,en-US,1318558;1318559;,propoman007
1289422,2020-06-02 19:28:10 -0800,2020-06-02 22:46:21 -0800,can't make comments on YouTube video,<p>is there something i have to do? </p>,firefox-770;other;desktop;windows-10;,firefox,other,en-US,1318576;,propoman007
1289421,2020-06-02 19:24:20 -0800,2020-06-03 04:12:03 -0800,Upgraded to Windows 10,<p>I have been running on Windows 7.  Upgraded to 10.  Cannot set Firefox as default browser at this time.  Do I have to download Firefox again?  Will I lose all my saved passwords if I do?  Thanks.  Janice </p>,download-and-install_1;firefox-770;desktop;windows-10;,firefox,download-and-install,en-US,1318581;1318657;,jlarnold425
1289419,2020-06-02 18:14:23 -0800,2020-06-03 00:40:11 -0800,Firefox task manager does not match Windows Task Manager,"<p>With 8 tabs open, Windows task manager shows 58% CPU and 1279 MB memory use in 12 processes. The built in Firefox task manager shows less than 300 MB and mostly ""low"" energy impact. Why is there such a discrepancy between the two task reports?  </p><p>Screenshots explain this better </p>",firefox-770;desktop;fix-problems;windows-10;,firefox,fix-problems,en-US,1318607;,wisedan
1289418,2020-06-02 18:09:11 -0800,2020-06-02 22:33:51 -0800,How can I restore deleted passwords,<p>I accidentally clicked delete all for passwords how can I restore them </p>,privacy-and-security_1;firefox-580;desktop;windows-10;,firefox,privacy-and-security,en-US,1318569;,jaddi_h
1289417,2020-06-02 17:56:44 -0800,2020-06-03 00:09:11 -0800,Can't post to facebook from my browser,"<p>Posting to facebook, this just started happening from out of nowhere:  ""App Not Setup: This app is still in development mode, and you don't have access to it. Switch to a registered test user or ask an app admin for permissions."" </p>",other;desktop;firefox-760;windows-10;,firefox,other,en-US,1318601;,bryantjon
1289416,2020-06-02 17:41:12 -0800,2020-06-02 20:24:06 -0800,"Computer crashed, Firefox history is gone and will not be saved","<p>Hi everybody, I'm running Firefox 77.0 on my 2014 rMBP with OSX 10.11.6. A few hours ago my OS crashed and I reset my computer. Once I did this, I opened everything back as it was pre-crash and all my Firefox tabs and absolutely everything else loaded correctly <em>except</em> for my history.  </p><p>Every time I type a word, no previously visited URLs will load up in my URL field, I checked my History and it seems to have deleted 99% of every site I've visited. The recently closed tabs and windows are still there, and I can reload them if I press cmd+shift+t, however the rest of my actual history seems to be gone. I've reset (normally) my computer a couple more times, repaired disk permissions and whatnot and for some reason it won't even save whatever other sites I've now visited since it was wiped. Am I screwed here? </p>",firefox-770;desktop;fix-problems;mac-os;,firefox,fix-problems,en-US,1318532;1318533;1318544;1318545;1318547;1318549;,nodigits
1289415,2020-06-02 17:27:11 -0800,2020-06-02 17:27:11 -0800,شهد حليم,<p>اواجه مشكلة ف مشاهدة الفديو ع الفيس بوك </p>,sync;desktop;firefox-760;windows-10;,firefox,sync,en-US,"",shahdhaleem79
1289414,2020-06-02 17:20:19 -0800,2020-06-03 07:42:05 -0800,Crash ID: bp-42253fe6-clae-4929-b231-dfe8f0200602,<p>I can not get foxfire to work.  I can't even get the home page.  It keeps coming up with a crash </p>,desktop;fix-problems;,firefox,fix-problems,en-US,1318686;1318726;,gkkmartin
1289413,2020-06-02 17:14:28 -0800,2020-06-03 01:52:46 -0800,Firefox 77 ignoring browser.tabs.showAudioPlayingIcon,"<p>So after updating to Firefox 77.0, I have noticed that despite having <strong>browser.tabs.showAudioPlayingIcon</strong> set to false, it Firefox insists on placing the audio icon in my tabs regardless. </p><p>Is there a way to get rid of it, perhaps with CSS or something? </p>",firefox-770;customize;desktop;windows-10;,firefox,customize,en-US,1318625;,horonelius
1289412,2020-06-02 17:09:05 -0800,2020-06-02 17:09:05 -0800,Barra de busqueda rapida,"<p>Hola a todos. Que tenga un buen día o noche. </p><p>Escribo esto porque quiero saber si hay una manera de <strong>Desactivar la barra de busqueda rapida</strong>, aquella que aparece abajo de el navegador cuando escribes una palabra fuera de un cuadro de dialogo o de escritura, se que esta herramienta es muy utíl en algunas ocaciones, pero en otras simplemente se vuelve estorbosa. </p><p>Si sabes alguna manera de desactivarla, Por favor, dime, me ayudarías mucho. </p><p>este problema se me da mas que todo porque, en Youtube siempre que quiero activar una tecla de acceso rapido como por ejemplo la K, si funciona. se pausa y reproduce, pero, me abre la barra de busqueda rapida y en algunas ocaciones me lleva a los comentarios. </p><p>es estorboso en algunas paginas que utilizen teclas para ejecutar comandos. </p><p>Si no hay manera de desactivarlo, me pueden decir si Firefox tiene un buzón de sugerencias, donde pueda enviarle mi sugerencia sobre esto, no pidiría que quiten la herramienta, porque aveces en muy utíl, solo que haya una forma, de desactivarlo temporalmente. </p>",firefox-770;customize;desktop;windows-7;,firefox,customize,es,"",geronymusplus678
1289411,2020-06-02 16:59:19 -0800,2020-06-02 17:41:51 -0800,Site Information drop-down is corrupted,"<p>The ""Site information"" drop down on the far left of the address bar is corrupted, showing an infinitely repeating pattern of icons. See attached picture for example. </p>",firefox-770;desktop;fix-problems;windows-10;,firefox,fix-problems,en-US,1318522;1318527;,cormacltighe
1289410,2020-06-02 16:53:17 -0800,2020-06-03 06:52:48 -0800,It takes a long time for Firefox 76.01 on Ubuntu 20.04 to bring up the print dialog box.,"<p>I have a network printer setup on Ubuntu 20.04 (an lpr printer).  In every application, if I select control-P, the print dialog box immediately snaps onto the screen.  But on Firefox 76.01, it takes at least 30 seconds for the print dialog box to appear.  This is the case every time I select control-P.  Printing works as expected, it just takes forever to get the print dialog box to come up. I have tried resetting Firefox and clearing all print-related preferences in prefs.j then restarted Firefox.  Nothing seems to resolve this problem.   I tried Chrome to see if all browsers were affected and it brings up the dialog box quickly.    Has anyone else run into this issue? </p><p>Bob Reed </p>",fix-problems;desktop;firefox-760;linux;,firefox,fix-problems,en-US,1318611;1318705;,rreed1913
1289409,2020-06-02 16:13:39 -0800,2020-06-02 16:13:39 -0800,YouTube,<ol><li> Numbered list item </li></ol>,download-and-install_1;desktop;,firefox,download-and-install,en-US,"",king.580311
1289408,2020-06-02 16:13:20 -0800,2020-06-02 23:30:42 -0800,YouTube,<ol><li> Numbered list item </li></ol>,download-and-install_1;desktop;,firefox,download-and-install,en-US,1318587;,king.580311
1289407,2020-06-02 16:01:29 -0800,2020-06-03 00:55:10 -0800,Lates Upgrade (the last two days) not downloading zip or jpg files,"<p>I teach at James Madison University and must download zip and jpg files for instruction. Sometime within the last 48 hours, Firefox would not download any jpg or zip files. For years now, this has never been an issue.  The tab indicates connecting, the grey shadow passes through the tab and then nothing. I have tried this at different academic sites and the same happens. There is no problem downloading zip or jpg files using Chrome. What happened and how to fix it? </p>",download-and-install_1;firefox-770;desktop;windows-10;,firefox,download-and-install,en-US,1318610;,maddoxarthistory
1289405,2020-06-02 15:48:41 -0800,2020-06-02 15:48:41 -0800,site outlook não abre completamente,<p>Meu brouser não abre completamente o site do outlook e desta forma não consigo logar </p>,firefox-770;websites;desktop;windows-10;,firefox,websites,pt-BR,"",allan.smaniotto
1289404,2020-06-02 15:25:08 -0800,2020-06-02 20:35:16 -0800,Starting Firefox brings up blank page instead of homepage,"<p>After Firefox updated today, it no longer brings up my homepage when I launch the browser. Instead, it's just a blank page (not even a default page). Clicking on the homepage takes me to the correct address. </p><p>&gt;Properties show ""C:\Program Files\Mozilla Firefox\firefox.exe"" with no extension.  </p><p>&gt;I've tried resetting homepage defaults in the options, to no change. </p><p>Is there anyway I can get my homepage to show up when I launch the browser? </p>",firefox-770;desktop;fix-problems;windows-10;homepage;,firefox,fix-problems,en-US,1318507;1318515;,a.mackaman
1289401,2020-06-02 14:58:05 -0800,2020-06-02 15:07:04 -0800,sign in,"<p><em>locking as a dupe of <a href=""https://support.mozilla.org/en-US/questions/1289400"" rel=""nofollow"">https://support.mozilla.org/en-US/questions/1289400</a> </em> </p><p>How do I avoid having to sign in each time? </p>",firefox-770;desktop;fix-problems;windows-10;,firefox,fix-problems,en-US,1318493;,busloans
1289400,2020-06-02 14:56:22 -0800,2020-06-02 22:08:00 -0800,sign in,<p>How do I avoid having to sign in each time? </p>,firefox-770;desktop;fix-problems;windows-10;,firefox,fix-problems,en-US,1318494;,busloans
1289399,2020-06-02 14:47:50 -0800,2020-06-02 22:07:47 -0800,"""Not Signed In""  MSG on next selected file when after first file OK when downloading from Google Drive","<p>I'm using FF 76.0.1 on a Win10 platform.  For testing, I've uploaded a folder that contain multiple MP4's to my Google Drive.  I then Share this drive with my other email.  I then want to download the content of these multiple files to a hard drive folder.  Doing this to test how Download works for Google drive. </p><p>I open my received email and see the Shared invite.  I log into my Google account and select the first file to download (using RT click and Download into a selected directory).  A Save-As folder box opens. Everything works with the file downloading ultimately as a *.mp4 file.  When I go back to the Google drive and attempt to down load a second file, I get the following pop up message... </p><pre>  - You are Not signed in  - You are signed out.  <em>Sign back in</em>, the click 'Retry'....there is a Retry box. </pre> <p>The Sign back in (in the msg) does not work, nor does the Retry box! All that happens is the box refreshes. </p><p>What I end up doing is to close the Google My drive TAB, and re-select the invite email message.  This opens a new tab again that points to my shared folder.  I then select my 2nd file,  and download..everything works.  Now when I try a 3rd file, I end up getting  the same Msg again and need to close the Tab and reload from the email the Google drive. </p><p>I have turned off any AD blocker on the Google drive.  It's almost something is in a cookie or cache.  I don't want to constantly have to reset any of these every time.  Tried once, and made no difference.  Any Idea, maybe something in the FF Settings? </p><p>What I want is to be able to repeatedly pick and download files from Google to my selected folder without having to re-select the email invite. I also notice, that on the second try, I don't get asked for my Google ID/Pass like I did the first time.  It's like I was sent to a third party site (Save-as pop up box) and cannot come back to the folder listing.  It would be nice if the Save-As location could be reused from the previous Save with a check box. </p>",other;desktop;firefox-760;windows-10;,firefox,other,en-US,1318504;,anuhea55
1289397,2020-06-02 14:42:25 -0800,2020-06-03 09:11:49 -0800,New Tab - Previous Tab Audio Delay/Stutter,"<p>On 77.0. </p><p>Noticed that after last update, opening a new tab with audio on the previous tab (such as a YouTube video playing) causes the audio to pause/stutter each time a new tab is opened. </p><p>No other changes to this system, and good amount of resources available in each test.    Would be great if someone could quickly repro.   (I am not discounting a machine-specific cause yet.) </p>",firefox-770;tabs;desktop;windows-10;youtube;youtube77;,firefox,tabs,en-US,1318498;1318776;,robtoe
1289396,2020-06-02 14:15:18 -0800,2020-06-02 22:25:02 -0800,Video Scaling Awful in Firefox,"<p>I'm having a weird problem where 4k videos that are scaled down to say the normal YouTube player size look terrible, hard to find the right word to explain it, but edges are jagged. It improves a lot if I full screen the player to presumably closer to 4k dimensions. </p><p>Changing playback to 1080p looks better than 4k, again I'm sure it's to do with scaling. </p> <ul><li> I don't have this problem when testing the same videos in Internet Explorer.  </li><li> It's not just my videos, other peoples videos are doing it to. </li><li> Updated to the latest version of Firefox. </li><li> Updated my GPU drivers (MSI Nvidia GeForce GTX 1660). </li><li> Tested in Firefox safe mode and disabled/enabled hardware acceleration. </li></ul> <p>I'm running out of ideas, so any suggestions would be greatly appreciated. </p>",firefox-770;other;desktop;windows-10;youtube;youtube77;,firefox,other,en-US,1318480;1318487;1318566;,paul219
1289392,2020-06-02 14:05:55 -0800,2020-06-02 22:02:44 -0800,Download,<p>I can't download using program Utorrent. What's problem ? </p>,download-and-install_1;desktop;firefox-760;windows-7;utorrent;,firefox,download-and-install,en-US,1318492;,manomendes19
1289391,2020-06-02 14:03:25 -0800,2020-06-03 11:20:37 -0800,New Tab Addon,"<p>I have used the newtab addon for years. My home page is <a href=""http://google.com"" rel=""nofollow"">google.com</a>. Just today, I get an error message when clicking the new tab button as follows: Blocked by X-Frame-Options Policy. Does anyone know what is going on here? </p>",firefox-770;other;desktop;windows-10;newtab;xfo-errors;bug1593321;notafirefoxproblem;,firefox,other,en-US,1318462;1318563;1318565;1318596;1318602;1318605;1318755;1318857;,ffrbo
1289387,2020-06-02 13:33:07 -0800,2020-06-03 11:14:08 -0800,Firefox MegaBar,"<p>I don't like the megabar, and I have looked around to see if there are any fixes for the most recent Firefox 77 update that forces that user to have it (like at least one other update, it just assumes that people like it).  I have tried using the userChrome.css file, but that didn't work.  I have also tried going into about:config, which also didn't work.  Is there any possible way to say 'I never want to see this megabar again in my life'?  Or a way to tell the devs that it should NOT be a default option on new updates?  Or a way to turn it off that will always be around, unlike the about:config deal?  Any help would be great.  I attached an image of the megabar. </p>",firefox-770;other;desktop;windows-10;megabar;megabar77;,firefox,other,en-US,1318450;1318457;1318514;1318517;1318538;1318540;1318542;1318543;1318546;1318853;,cdr5of8
1289382,2020-06-02 12:57:22 -0800,2020-06-02 13:24:37 -0800,is there any way to hide the status bar (or pop-up) at the bottom left?,"<p>Hi, I'd like to get rid of the status bar at the bottom left corner. I know it goes away and it seems impossible to remove. But is there any way to remove it? I add an image to show what I want to remove. Thanks in advance! </p>",firefox-770;other;desktop;windows-10;userchromecss;unsuppportedhacks;unsuppported;unsupporteduserchromecss;statusbar;,firefox,other,en-US,1318429;1318434;1318439;,hyeseung97
1289381,2020-06-02 12:39:21 -0800,2020-06-02 13:25:12 -0800,Reproducir vídeo,"<p>[[¿Quién puede emitir las Open Badges?|<a href=""http://chat.cme-equotes.com/webchat/queue.jsp"" rel=""nofollow"">http://chat.cme-equotes.com/webchat/queue.jsp</a>]] </p>",download-and-install_1;desktop;,firefox,download-and-install,en-US,1318432;,alejandraperezgimenez431974
1289380,2020-06-02 12:34:52 -0800,2020-06-02 13:18:49 -0800,Firefox just threw away over 80 URLS and passwords,<p>Firefox just threw away over 80 URLS usernames and passwords Is there any way of getting back to the password manager that worked? </p>,privacy-and-security_1;desktop;firefox-760;windows-10;passwords;dataloss;troubleshootingdetailsmissing;,firefox,privacy-and-security,en-US,1318422;1318435;,aanngcle-firefox2
1289379,2020-06-02 12:30:18 -0800,2020-06-02 21:52:34 -0800,Error Message,"<p>Well hi my name is lesley there website i do i work for a clinic and i need to do inventory out range temperatures well i try to report it then when im done i try to go the next page and it always says "" error with report id. Please close all browser windows and try again i try my best to fix but i cant and its really urgent its been a few months please its really urgent </p>",firefox-770;desktop;fix-problems;windows-10;troubleshootingdetailsmissing;,firefox,fix-problems,en-US,1318428;,lorantes
1289375,2020-06-02 11:58:41 -0800,2020-06-02 21:52:20 -0800,Scroll bars are too narrow on firefox 76.0.1 on windows 10 pc.  How do I increase the width of the verticle scroll bar on  the left so that I can dependably click on it.,<p><strong>bold text</strong>Scroll bars are too narrow on firefox 76.0.1 on windows 10 pc.  How do I increase the width of the verticle scroll bar on  the left so that I can dependably click on it. </p>,customize;desktop;firefox-760;windows-10;,firefox,customize,en-US,1318418;1318423;,blaine1
1289373,2020-06-02 11:50:46 -0800,2020-06-02 11:50:46 -0800,"""Falha na conexão segura"" em diversas páginas","<p>Alguns sites estão com o mesmo problema ao acesso. O erro é descrito como ""Falha na conexão segura"" e sua descrição é ""Ocorreu um erro durante uma conexão com <a href=""http://www.grancursosonline.com.br"" rel=""nofollow"">www.grancursosonline.com.br</a>. PR_END_OF_FILE_ERROR"". Este erro acontece sempre em alguns domínios, tais como wikipedia, grancursosonline, e vários outros. Em outros navegadores, o problema não se repete, e este já persiste a tanto tempo que eu estou considerando trocar de navegador. </p>",websites;desktop;firefox-760;windows-10;,firefox,websites,pt-BR,"",kristhian.lucas
1289372,2020-06-02 11:45:14 -0800,2020-06-03 11:35:11 -0800,Picture in picture,<p>How did I lose the ability to click and drag the picture in picture window around? I can still resize it but can no longer move it around. </p>,other;desktop;firefox-760;windows-10;troubleshootingdetailsmissing;pictureinpicture;,firefox,other,en-US,1318389;1318456;1318746;1318863;,351cougar
1289371,2020-06-02 11:32:05 -0800,2020-06-02 21:51:36 -0800,How do I a set of your devices?  So far an hour of trying has brought anh success!,<p>I have been trying to order a set of your devices.  An hour of trying has brought no success.  Tell me what I  am doing wrong.   Can I order then by telephone from Canada?  THANK YOU. </p><p>W.H.N. Hull </p>,other;desktop;firefox-760;linux;,firefox,other,en-US,1318397;,whnhull29
1289370,2020-06-02 11:23:41 -0800,2020-06-02 11:25:17 -0800,Secure Connection Failed,"<p>""Secure Connection Failed"" shows when I want to enter into my blogsite. please help me. </p>",privacy-and-security_1;desktop;firefox-760;windows-10;certificates;troubleshootingdetailsmissing;,firefox,privacy-and-security,en-US,1318365;,maawaleo915
1289369,2020-06-02 11:16:23 -0800,2020-06-02 22:57:37 -0800,Twitch Highlights and clips jump from nearly the beggining all the way to the end,"<p>When I create a ""highlight"" on twitch and play it back, it plays normally for like 5 secs and then jumps to 5 secs before the end. These highlights like a minute or so and play normally on other browsers. I really loved firefox, just recently switched and would love for this to work. I know nothing's perfect but firefox is close c: I suggest trying to watch a bunch of highlights in twitch, because it doesn't happen in all of them, I'll try to identify a pattern and if I find it I'll tell you when you respond c: </p>",desktop;fix-problems;needsinfo;twitch;,firefox,fix-problems,en-US,1318363;1318579;,armandodcarboni
1289368,2020-06-02 11:09:50 -0800,2020-06-02 21:50:16 -0800,Sound issue with web camera,"<p>Hi, all. I am using the camera: Canyon 2K Quad HD live streaming Webcam CNS-CWC6N and interlocutor hear noises at the background, anyone know what I can do? </p><p>Thank you in advance. </p>",other;desktop;firefox-760;windows-7;webcam;,firefox,other,en-US,1318482;,ioakar1
1289367,2020-06-02 11:05:20 -0800,2020-06-02 11:31:19 -0800,Javascript not working,"<p>Hi can you please help me, how to activate Java script....some website I cannot share certain articles I need, yet I can easily share with Tweeter but not with FB I am technically challenged, is it possible for someone to help me, thank you. </p>",firefox-770;other;desktop;windows-7;troubleshootingdetailsmissing;,firefox,other,en-US,1318352;1318372;,myhotpepper1
