id,created,updated,title,content,tags,product,topic,locale,answers,creator
1295962,2020-07-22 09:22:25 -0800,2020-07-22 09:25:10 -0800,firefox noticeof breach?,"<p>I received a notice supposedly from Firefox that my main email has been breached. I tried to follow the instructions to correct that but was unsuccessful.  If the message is not from Firefox, I guess that's good.  Nevertheless, I want to know if I have a problem and, if so, how to correct it. </p>",mac-os;desktop;privacy-and-security_1;firefox-780;,firefox,privacy-and-security,en-US,1335065;,moira
1295961,2020-07-22 09:19:20 -0800,2020-07-22 09:19:20 -0800,non visibilty of inbox mails  rediffmail at fire fox Browser,"<p>non visibilty of inbox mails  rediffmail at fire fox Browser while all other items like sent mails drafts folders etc ara visible.The inbox mails are visible at other browsers like Google chrome,Microsoft edge etc. </p>",windows-7;desktop;other;firefox-780;,firefox,other,en-US,"",sharmabrajraj.338
1295959,2020-07-22 09:09:43 -0800,2020-07-22 09:22:15 -0800,How to Remove Search Options like Youtube Facebook Reddit Wikipedia and Twitter,"<p>The default search bar always presents the options to search with youtube, facebook, reddit, wikipedia, twitter etc.  (See screenshot).  I don't want these options. How can they be removed? </p>",desktop;customize;windows-10;firefox-780;,firefox,customize,en-US,1335063;,flexp.123
1295958,2020-07-22 09:06:35 -0800,2020-07-22 09:53:37 -0800,Firefox 78 adressbar enlargment - how to disable - old method does not work any more!!!,<p>how to disable  adressbar enlargment  in Firefox 78??? </p><p>THANKS :) </p>,linux;desktop;customize;firefox-780;,firefox,customize,en-US,1335068;1335070;1335076;,haviji9345
1295957,2020-07-22 09:02:59 -0800,2020-07-22 21:58:38 -0800,"When I try to go to Mozilla firefox, it sends me to upgrade Malwarebutes. I can't go any further.","<p>When I try to go to Mozilla firefox, it sends me to upgrade Malwarebutes. I can't go any further. </p>",desktop;sync;windows-10;firefox-780;,firefox,sync,en-US,1335057;1335072;1335197;1335205;,kalkalmanek1
1295956,2020-07-22 09:02:29 -0800,2020-07-22 09:02:29 -0800,pages I send to pocket are not there,<p>how do I get pocket to work? </p>,mac-os;desktop;other;firefox-780;,firefox,other,en-US,"",eyekew
1295954,2020-07-22 08:58:07 -0800,2020-07-22 09:15:28 -0800,Empty email text when viewed using Firefox,"<p>When viewing an email, specifically titled 'Thomas Industry Update', the email content appears blank or empty when viewed with Firefox.  Edge displays the content just fine.   I also noticed a couple of retail web sites that do not work correctly with Firefox but are fine with Edge.  Running Windows 10 and Geek Squad's Web Root anti-virus. Is there a setting I can change? </p><p>Thanks in advance for a prompt response. -John- </p>",desktop;other;windows-10;firefox-780;,firefox,other,en-US,1335059;1335060;,jmonge01
1295950,2020-07-22 08:28:26 -0800,2020-07-22 09:08:37 -0800,Can I run Nightly along with regular Firefox?,"<p>If I install Nightly, will it override my normal Firefox or install along side it?  Thanks! </p>",desktop;tips;,firefox,tips,en-US,1335047;1335058;,chrisadams
1295948,2020-07-22 08:13:52 -0800,2020-07-22 09:18:31 -0800,want to add or delete a quick link on my firefox home page,<p>I want to add or delete a quick link on my firefox home page. No clue how to start </p>,desktop;customize;windows-10;firefox-780;,firefox,customize,en-US,1335050;1335062;,jclovesya43
1295947,2020-07-22 08:11:43 -0800,2020-07-22 08:59:35 -0800,moteur de recherche,"<p>bonjour, depuis la dernière mise à jour (78,0,2esr), le moteur de recherche par défaut sélectionné (duckduckgo) dans le menu ""préférences"" n'est pas conservé en mémoire et revient à yahoo à chaque redémarrage. Y a t il une manip spécifique à faire pour le fixer ?  merci cordialement jean paul </p>",desktop;customize;mac-os-x-109;firefox-780;,firefox,customize,en-US,1335051;,jp.soma
1295940,2020-07-22 07:04:35 -0800,2020-07-22 08:56:44 -0800,Performed Reset of Firefox Lost Bookmarks,"<p>Firefox was running slow and it recommended to perform a reset.  After the reset all of my bookmarks were lost and not restored.  I found the backups of the bookmarks and each of the stored backups gives the same error ""unable to process file"".  I tried this on all of the files.   How can I get my bookmarks restored? </p>",desktop;bookmarks;windows-10;firefox-780;firefox-7802;,firefox,bookmarks,en-US,1335046;,borg1of2
1295939,2020-07-22 06:57:56 -0800,2020-07-22 06:57:56 -0800,Pages fail to load after some time when behind corporate proxy.,"<p>I am using Firefox behind a corporate proxy which uses a fairly complex PAC file to route traffic. This is configured at the OS level and I typically have the ""use system proxy settings"" option checked. </p><p>After a using Firefox for some period of time (generally between 1/2 and hour and 5 hours) external pages stop loading. All the internal pages that that don't need the proxy still load but external pages hang when loading. They appear to start loading the page but always hang before finishing. Once this has started this will happen to all external pages. </p><p>Restarting Firefox fixes the issue. Going into settings and changing the proxy setting will fix the issue (e.g. I have the proxy url used by the system set up in ""automatic proxy configuration URL"" and swapping between that and ""use system proxy settings"" will fix the issue. I have tried downloading the PAC file locally and running off that as well, but I get the same issue (works for a time before I have to swap proxy settings). </p><p>I'm slowly trying to add more and more sites to ""No Proxy for"" list in case it's some kind of circular lock without effect so far. It affects both Windows and Mac, and only Firefox (chrome, IE, Edge and Safari all work without issue). </p><p>I'm not sure how to debug the issue further. I'd like to do some kind of trace route through Firefox to see if when the block hits it is always failing at the same point but I'm not sure how to do that. Where should I start? </p>",mac-os;desktop;fix-problems;firefox-770;,firefox,fix-problems,en-US,"",Laurence.Davies
1295938,2020-07-22 06:52:34 -0800,2020-07-22 06:52:34 -0800,Twitch's Theatre mode doesn't fill up the screen properly when using Firefox,"<p>I've found that when I watch a stream on Twitch, and I use its theatre mode, specifically on Firefox, that it doesn't fill up the screen properly. There is this black bar at the bottom of the screen, above the Windows explorer bar, that is not present not just on other browsers, but also on other computers that I use Firefox on. </p><p>I've cleared both my cache and cookies, and it was still there. I restarted with add-ons disabled, and it was still there. </p><p>But, when I opened said stream in a private window, then it wasn't there. So it must have something to do with my general settings for the browser. </p><p>I'd rather not have to reset my full browser settings, especially as someone who has Firefox sync, so what is there I can possibly change to fix this? I emailed Twitch support about it, and it seems to have mainly to do with my browser rather than their website. </p>",desktop;websites;windows-10;firefox-780;firefox-7802;,firefox,websites,en-US,"",KalKent
1295934,2020-07-22 06:28:47 -0800,2020-07-22 22:23:48 -0800,Logins and Passwords no additional check,"<p>Hi, is there a way to add a check before I view my passwords. It feels like anyone can just click on logins and passwords, click on a password and view it provided they have access to my pc. </p>",desktop;privacy-and-security_1;,firefox,privacy-and-security,en-US,1335207;,mulengabowa53
1295933,2020-07-22 06:18:23 -0800,2020-07-22 06:18:23 -0800,The mic and webcam popup doesn't go away even after the tab is closed. How to solve it? A bug?,"<p>When I go to a website that requests access to my webcam and/or my microphone (and I grant it), a tiny popup comes up over the tab bar. That's fine. But when I close the tab using either or both, the popup doesn't go away. It doesn't contain the mic and/or cam icon(s) anymore, just the Firefox logo, but it doesn't go away and, oh my, it is so annoying. </p><p>The attached images are (1) the popup when I am using my mic in a tab, and (2) the popup when I am no longer using neither mic nor cam anywhere but the popup is still visible. </p><p>I can only remove the Firefox-icon-only popup by restarting Firefox! </p><p>How do I solve this? Is this a bug? </p>",desktop;fix-problems;windows-81;firefox-780;,firefox,fix-problems,en-US,"",alainsr
1295929,2020-07-22 05:51:30 -0800,2020-07-22 05:51:30 -0800,Scanning into a website with a twain scanner,<p>Hi   We use a website that allows us to scan directly to it using a desktop scanner (twain).   This worked in IE but with Firefox it says active x is not supported - is there a solution does anyone know or a plugin that will enable it to work . </p>,desktop;other;windows-10;firefox-780;,firefox,other,en-US,"",alison.reeve
1295928,2020-07-22 05:41:45 -0800,2020-07-22 05:41:45 -0800,Windows restored not maximized,"<p>The problem occurs when doing alt + tab to switch from one application to another and then I position myself on the ifirefox and click on one of the preview images. By doing this the window closes becoming small, and does not remain maximized. If instead I minimize and restore in the same way everything works </p>",desktop;fix-problems;windows-10;firefox-780;firefox-7802;,firefox,fix-problems,en-US,"",mass8
1295927,2020-07-22 05:38:40 -0800,2020-07-22 07:56:58 -0800,System Menu missing.,"<p>My browser firefox 69 does not show Maximize, Minimize and close signs. All other controls are OK, I think </p>",linux;desktop;other;firefox-690;firefox-6902;,firefox,other,en-US,1335029;,roytjames
1295925,2020-07-22 05:31:09 -0800,2020-07-22 05:31:09 -0800,Subject,<p>How can we help? </p>,desktop;privacy-and-security_1;,firefox,privacy-and-security,en-US,"",tthaw1161
1295924,2020-07-22 05:29:23 -0800,2020-07-22 05:29:23 -0800,Subject:,"<p><i>Locking this thread.</i><br><i>Please continue here: [<a href=""/questions/1295925"" rel=""nofollow"">/questions/1295925</a>]</i><br> <a href=""http://example.com"" rel=""nofollow"">link text</a> </p>",desktop;privacy-and-security_1;,firefox,privacy-and-security,en-US,"",tthaw1161
1295921,2020-07-22 05:04:12 -0800,2020-07-22 05:04:12 -0800,Norton Safeweb and SafeSearch working well before a refresh but not since.,<p>Safeweb and Safesearch both working fine before a refresh undertaken.   Norton Account on their website shows that both are installed but only Safeweb is now listed as an Add-on and does not function when searching.    Can anybody suggest what to try to sort this out please.  The search box no longer shows the yellow safeweb icon and results are from Google.  The Norton Safeweb icon is on the task bar so I am really in the dark as to why the add-ons are not working as before. </p><p>Thank you. </p>,desktop;customize;windows-10;firefox-780;,firefox,customize,en-US,"",angela.head
1295920,2020-07-22 04:58:19 -0800,2020-07-22 04:58:19 -0800,Is there a way to word-wrap long lines in the Remote Debugger?,"<p>I haven't used the Remote Debugger in a really long time.  I decided to use it again today on my Mozilla Firefox Portable.  I ran into one problem, and I don't remember what the solution is if there even is one.  Basically when editing my userChrome file in the Remote Debugger, long lines of text do not word-wrap.  I've looked in ""Settings"" and I don't see an option to enable word-wrap on long lines.  I've also tried right clicking the style editor window to see if there was a context menu option and of course there wasn't one.  Is there a solution to my problem? </p>",desktop;other;windows-10;firefox-780;,firefox,other,en-US,"",gaveitatry
1295918,2020-07-22 04:56:03 -0800,2020-07-22 04:56:03 -0800,SITE BLOQUEADO,"<p>TENTO DE TODAS AS FORMAS ENTRAR NO SITE <a href=""http://www.tjmt.jus.br"" rel=""nofollow"">www.tjmt.jus.br</a>, PORÉM DIZ QUE O SITE ESTÁ BLOQUEADO. JÁ SEGUI TODOS OS PASSOS DA SEGURANÇA, PERMITI O ACESSO, MAS CONTINUA BLOQUEANDO. O QUE FAZER? </p>",windows-7;desktop;websites;firefox-780;,firefox,websites,pt-BR,"",jorgeaguiaradv
1295917,2020-07-22 04:44:37 -0800,2020-07-22 08:01:58 -0800,"Sites in ""App Mode"" have no dock Icon","<p>Firefox 'App Mode' is great, except on Chromium browsers like Edge, the App Mode sites install an actual Icon on the Dock and in Launchpad on the Mac. This functionality seems to be missing in FireFox. </p><p>I would like to be able to launch Firefox App Mode sites from my Mac's dock. </p>",mac-os;desktop;customize;firefox-780;,firefox,customize,en-US,1335025;1335041;,benmounseywood
1295916,2020-07-22 04:36:44 -0800,2020-07-22 05:45:08 -0800,Not able to identify zip file for downloading,"<p>I am using Firefox 48 on my windows 10 laptop and I am not able to download the zip file from the browser from my university website, its downloading the file but not as a zip file but in some other format, I tried doing it on the android application after updating to latest version and the same problem occurred. I tried downloading it using my edge browser and it worked. I have uploaded the photos, you can check the file format in which its is downloading in that. </p>",desktop;download-and-install_1;windows-10;firefox-780;,firefox,download-and-install,en-US,1335026;1335028;,mihir19
1295915,2020-07-22 04:17:10 -0800,2020-07-22 09:23:43 -0800,Firefox just fridge.,"<p>Dear Concern, </p><p>Whats wrong with firefox? Why doesn't response normaly? </p>",desktop;fix-problems;windows-10;firefox-780;,firefox,fix-problems,en-US,1335064;,arafathossain338
1295914,2020-07-22 04:11:26 -0800,2020-07-22 06:36:03 -0800,Firefox won't Download files ?,"<p>Hi - I'm having an issue with Firefox, well its been ongoing for some weeks but just getting around to it.. </p><p>My problem is that Firefow will not download files. I have tried the trouble shooting steps and its not a firewall issue because my other browsers will download - as a developer I have all the major browsers installed. </p><p>Also I changed the settings to have Firefox request the download folder for each downlod - but it doesn't. Anyway I am about to reinstall will post back then. </p><p>Maybe should have done that first. </p><p>C. </p>",desktop;download-and-install_1;windows-10;firefox-780;firefox-7802;,firefox,download-and-install,en-US,1335020;1335030;,info2897
1295912,2020-07-22 03:48:58 -0800,2020-07-22 04:02:56 -0800,Missing field on screen,<p>a display of my library record has no book title </p>,desktop;other;windows-10;firefox-780;,firefox,other,en-US,1335012;,earley5395
1295911,2020-07-22 03:47:58 -0800,2020-07-22 22:37:27 -0800,Hotmail.com webpage login issues,"<p>Hi, </p><p>After opening <a href=""http://Hotmail.com"" rel=""nofollow"">Hotmail.com</a> and then click ""sign in"" , the page that loads after that is not the normal page and i cannot proceed after that. I am attaching a screen shot of the page in question. On my other browsers, its works fine. Please advise </p>",desktop;websites;windows-10;firefox-780;,firefox,websites,en-US,1335066;1335073;1335200;1335203;1335210;,mascarenhas.dominic
1295909,2020-07-22 03:37:27 -0800,2020-07-22 03:37:27 -0800,Data breach by undisclosed source,"<p>F-Secure Identity Theft Checker detected that my email was subjected to data breach in 2017 by ""undisclosed source"", that is, government, law enforcement etc. Firefox Monitor did not detect the same breach. Can you advise on the reason for that? </p>",desktop;privacy-and-security_1;windows-81;firefox-780;,firefox,privacy-and-security,en-US,"",jsankelo
1295907,2020-07-22 03:26:43 -0800,2020-07-22 03:28:21 -0800,How to fix Firefox saving pictures in .jpeg and not .jfif format,<p>This guide fixed my issue with saving images in .jfif instead of .jpeg format. Hope this helps. </p>,desktop;tips;windows-10;firefox-780;,firefox,tips,en-US,1335004;,jayporky
1295906,2020-07-22 03:20:57 -0800,2020-07-22 03:20:57 -0800,identified breaches,"<p><strong>Firefox  has identified four breaches of emails, passwords, etc. This is from three websites which I have never used, or signed up for. How is therefore a breach? What do I do? The fourth is from four years ago, from an account which I no longer use, and from which the website refuses me access (Drop box- it's a nightmare) Is this still a threat?</strong> </p>",mac-os;desktop;privacy-and-security_1;firefox-780;,firefox,privacy-and-security,en-US,"",Gillian3
1295905,2020-07-22 02:50:04 -0800,2020-07-22 02:50:04 -0800,Cannot directly enter address without a search taking over,"<p>Since this last update i cannot enter a website url directly in the address bar and go there it automatically searches for results. Ive turned off all ""Option/Search"" functions and a search pulldown appears every time i try and enter a URL or IP address into the address bar. I already have a second search only bar at the end of my address bar as per the images uploaded with this post. </p><p>I dont know who you have doing the updates, this browser has been my default for decades and ive stood by it. Fix it NOW </p>",desktop;websites;firefox-780;,firefox,websites,en-US,"",olias2k9
1295903,2020-07-22 02:34:15 -0800,2020-07-22 02:35:50 -0800,verständigung in Englisch,"<p>Mein Englisch ist äußerst schlecht, sodass ich die Texte nur rudimentär erfassen kann, was nun? </p>",desktop;other;windows-10;firefox-780;,firefox,other,en-US,1334999;,herbert21
1295896,2020-07-22 01:31:50 -0800,2020-07-22 02:02:11 -0800,Facebook page shop not opening with firefox?,"<p>My sister have a facebook page with shop that I help her manage, but for some reason lately we can't access the ""shop"" tab of the page with firefox. </p><p>We are getting The page isn’t redirecting properly error. I cleaned cookies and cache, even tried a new private window, nothing. I tried opening in edge and everything worked like no problem. </p><p>The page is the following. <a href=""https://www.facebook.com/hadrastico/shop"" rel=""nofollow"">https://www.facebook.com/hadrastico/shop</a> </p><p>We experienced problems both in my workstation and my sister's laptop that also use firefox (latest version, windows 10 up to date). </p><p>Any idea? Should I fill a bug or something? </p>",desktop;fix-problems;windows-10;firefox-780;,firefox,fix-problems,en-US,1334995;,nitro912gr
1295895,2020-07-22 01:19:57 -0800,2020-07-22 01:19:57 -0800,Firefox version 78.02 Tab Crash,"<p>Hello Team, </p><p>I'm running one of our proprietary application using Firefox version 78.02 and the Tab crashes without showing any crash report. </p><p>Tried various suggestions to get the crash report but still not able see the report  </p><p><a href=""https://support.mozilla.org/en-US/kb/mozillacrashreporter#w_viewing-crash-reports/"" rel=""nofollow"">https://support.mozilla.org/en-US/kb/mozillacrashreporter#w_viewing-crash-reports/</a> </p><p><a href=""https://errortools.com/windows/how-to-fix-gah-your-tab-just-crashed-error-message-in-firefox-on-windows-10/"" rel=""nofollow"">https://errortools.com/windows/how-to-fix-gah-your-tab-just-crashed-error-message-in-firefox-on-windows-10/</a> <a href=""https://support.mozilla.org/en-US/kb/firefox-crashes-troubleshoot-prevent-and-get-help#firefox:win10:fx77"" rel=""nofollow"">https://support.mozilla.org/en-US/kb/firefox-crashes-troubleshoot-prevent-and-get-help#firefox:win10:fx77</a> <a href=""https://support.mozilla.org/en-US/questions/1280327"" rel=""nofollow"">https://support.mozilla.org/en-US/questions/1280327</a> <a href=""https://support.mozilla.org/en-US/questions/1281636"" rel=""nofollow"">https://support.mozilla.org/en-US/questions/1281636</a> </p><p>Any help on this issue will be appreciate as its impacting 50% of our customers. </p><p>I have attached the Tab Crash issue. </p><p>Thanks, Vincent </p>",desktop;fix-problems;,firefox,fix-problems,en-US,"",vincent.francis
1295894,2020-07-22 01:11:37 -0800,2020-07-22 01:11:37 -0800,"Problems when printing online articles, consisting of more than one page.","<p>When I try to print online describtions or articles, consisting of more than one page by using my Epson WF-2510 the change from one page to the following page does not appear at the right position, so that I loose parts of the articles. What can I do ? What is wrong ? </p>",desktop;other;windows-10;firefox-680;,firefox,other,en-US,"",ivm.muenstedt
1295893,2020-07-22 00:30:30 -0800,2020-07-22 00:30:30 -0800,Not able to browse website,"<p>Hi, </p><p>I am using internet on computer via mobile hotspot. till now everything works fine but from yesterday i am not able to open website. Even google is not opening. Firefox shows error ""Secure Connection Failed: An error occurred during a connection to <a href=""http://www.google.com"" rel=""nofollow"">www.google.com</a>. PR_END_OF_FILE_ERROR"". </p><p>How to fix this error. </p>",desktop;websites;windows-10;firefox-780;,firefox,websites,en-US,"",balajithite321
1295892,2020-07-22 00:14:38 -0800,2020-07-22 00:14:38 -0800,Access MacOS's menu bar while in full screen?,"<p>So on Safari, when I watch videos on Netflix, YouTube, Amazon, whenever I hover my pointer up to, the menu bar shows automatically. While on Firefox, I can't do the same, I either have to press the esc button, or click on exit full screen prompt up top. Is that a permanent Firefox feature or is there a workaround to this? </p>",mac-os;desktop;customize;firefox-780;firefox-7802;,firefox,customize,en-US,"",markmaranon
1295890,2020-07-21 23:55:53 -0800,2020-07-21 23:55:53 -0800,Apply new color theme,<p>I've created and saved a simple theme using Firefox Color - but I can't see how to apply the new theme. I hop you can help. Thank you. </p>,desktop;tips;windows-10;firefox-780;,firefox,tips,en-US,"",stephen41
1295889,2020-07-21 23:55:17 -0800,2020-07-21 23:55:17 -0800,"Restored windows and when I press open with another app for a file, C:\Program Files(x86)\Mozilla Firefox \firefox.ece"" -osint -url ""%"" comes. How do I delete that?","<p>Restored windows and when I press open with another app for a file, C:\Program Files(x86)\Mozilla Firefox \firefox.ece"" -osint -url ""%"" comes. How do I delete that? </p>",desktop;fix-problems;,firefox,fix-problems,en-US,"",cherian97
1295887,2020-07-21 23:42:31 -0800,2020-07-21 23:42:31 -0800,Google Cloud Print,"<p>Hello, </p><p>I would like to ask you if there is any way we could add google cloud print to Firefox? </p><p>I started using Mozilla for almost a week, and I really miss this feature. </p><p>Thank you in advance. </p>",mac-os;desktop;other;firefox-780;,firefox,other,en-US,"",bittorakis_mark
1295883,2020-07-21 22:32:58 -0800,2020-07-21 23:02:33 -0800,page won't open,<p>how do i stop getting this message a web page is slowing down your browser. what would you like to do </p>,windows-7;desktop;fix-problems;firefox-780;,firefox,fix-problems,en-US,1334975;,mp7016
1295882,2020-07-21 22:27:27 -0800,2020-07-21 23:03:40 -0800,files is not open,<p>why i cant open my files </p>,desktop;other;windows-10;firefox-780;,firefox,other,en-US,1334976;,veilside4210
1295881,2020-07-21 22:18:10 -0800,2020-07-21 22:18:10 -0800,Ftp mozilla corruption of £ pound sign.,"<p>I use your ftp app to update my website and have done so for year. After updating with most recent update, the £ sign corrupts and looks like A with a hat on it before £ sign so is distorted character. How do I rectify this. The original document views fine, only when ftpd it corrupts using ftp app. </p>",desktop;other;,firefox,other,en-US,"",info2890
1295879,2020-07-21 22:08:03 -0800,2020-07-21 22:08:03 -0800,Why does Firefox Monitor report my data as breached on sites I never signed up for?,<p>Firefox Monitor reports 8 data breaches to resolve on my Protections Dashboard. They are for sites I never signed up for; some of which I have never heard of. </p><p>Is there a phishing bot buried in the Firefox Monitor software? Should I be clicking on 'resolve' links for sites I never used? There is just something scammy about it. I have a tracking log of every system I have networked with since 1976 and every website since the 1990s. The sites listed are not on my log. </p><p>Has Mozilla been hacked???? </p>,desktop;privacy-and-security_1;windows-10;firefox-780;,firefox,privacy-and-security,en-US,"",caribgoodies
1295877,2020-07-21 21:49:35 -0800,2020-07-21 21:49:35 -0800,Unable to load page - unable to obtain site identification status,"<p>I recently updated Firefox to 78.0.2 running on Ubuntu 18.04. After the update, I could no longer access my website. I emptied all the cookies, cache, history files and everything else and I still couldn't access the site. </p><p>I then upgraded Ubuntu to 20.04 with a brand new install that came with the same version of Firefox.  I still can't access my website. </p><p>On a second computer also running Firefox 78.0.2 on Ubuntu 18.04 I can access my website with no problems. I can also access the website using Google Chrome and from my cell phone and tablets. </p><p>The computer on which I can access my website has the website's certificate permanently stored and I can view it from the site's page info. On the problem computer, there is no certificate stored. When I try to get the certificate, it times out with a message ""Unable to obtain identification status for this site"". No error page pops up and no other information is available. </p><p>Can anyone help out here? </p>",linux;desktop;websites;escalate;certificates;firefox-780;,firefox,websites,en-US,"",wrknight
