id,created,updated,title,content,tags,product,topic,locale,answers,creator
1296048,2020-07-22 22:45:55 -0800,2020-07-22 22:45:55 -0800,Screen not displaying correctly but does in Edge and Chrome!,<p>There is a website that I used today and discovered that it does not display correctly on Firefox although it displays correctly on Edge and Chrome. </p><p>I have attached screenshots of the webpage on all 3 browsers and you can see that the there are 2 ticks missing from the Firefox screen where the text says Available in-store at Karingal and at Pick up Avaliable. </p><p>I tried running Firefox in Safe Mode but it still did not show this screen correctly. </p><p>I am running Firefox for Desktop version 78.0.2 (64-bit). </p><p>Any suggestions on what is causing this and a solution would be helpful. </p><p>Thanks. </p>,desktop;fix-problems;windows-10;firefox-780;,firefox,fix-problems,en-US,"",da4658
1296045,2020-07-22 21:56:51 -0800,2020-07-22 21:56:51 -0800,Problem,"<p>I have a problem I try to access a site <a href=""http://www.contabilitate-administrare-blocuri.ro"" rel=""nofollow"">www.contabilitate-administrare-blocuri.ro</a> from my laptop and it sends me to another site <a href=""http://www.Almautomobile.ro"" rel=""nofollow"">www.Almautomobile.ro</a>. From other PCs I can access <a href=""http://www.contabilitate-administrare-blocuri.ro"" rel=""nofollow"">www.contabilitate-administrare-blocuri.ro</a> without problems only My laptop has a problem. I also used the antivirus and no problem occurs. How can I fix the problem. </p>",desktop;websites;windows-10;firefox-780;,firefox,websites,en-US,"",office173
1296044,2020-07-22 21:55:35 -0800,2020-07-22 21:55:35 -0800,How to build SpiderMonkey as library for application to use?,<p>I have read the public documention on mozilla docs. But it doesn't work. I still cannot learn how to build the SpiderMonkey JS Engine successfully. I try to contact your developer but failed. So I write a forum here. Please help! </p>,desktop;other;windows-10;firefox-680;,firefox,other,en-US,"",jasminefsb
1296043,2020-07-22 20:58:48 -0800,2020-07-22 20:58:48 -0800,To allow a site to accept  cookies(juno and netzero) so I won't have to sign in all the time I check my mail.,"<p>The two sites(Juno and Netzero) tell me my browser is not allowing cookies to be saved, so I have to sign in every time I visit these sites to check my mail. I must not have a setting set right? </p>",desktop;cookies;windows-10;firefox-780;firefox-7802;,firefox,cookies,en-US,"",esharron1510
1296041,2020-07-22 20:20:12 -0800,2020-07-22 23:09:34 -0800,my fire fox crashed and no sound was coming,<p>can you just tell what to do </p>,desktop;fix-problems;windows-10;firefox-780;,firefox,fix-problems,en-US,1335212;,shivamsgoswami2010
1296040,2020-07-22 20:14:41 -0800,2020-07-22 20:14:41 -0800,"Latest Firefox Browser v. 78.0.2 (64-Bit) for macOS Catalina v. 10.15.6 on iMac (Retina 5K, 27 inch, 2019) has changed my Google Calendar","<p>Since 21-July 2020, the latest Firefox Browser v. 78.0.2 (64-Bit) for macOS Catalina v. 10.15.6 on iMac (Retina 5K, 27 inch, 2019) has changed my Google Calendar’s various colours for appointments into only one single colour, and my appointments cannot be edited anymore. </p>",mac-os;desktop;download-and-install_1;firefox-780;,firefox,download-and-install,en-US,"",oldrich1
1296039,2020-07-22 19:57:34 -0800,2020-07-22 19:57:34 -0800,i can not get on to youtube or amazon,<p>every time i try to open these links they fail and show me this even on other browsers what can i do? </p>,desktop;fix-problems;windows-10;firefox-780;,firefox,fix-problems,en-US,"",dariggs
1296038,2020-07-22 19:45:00 -0800,2020-07-22 19:45:00 -0800,Cannot Bookmark Pages After Catalina Update,"<p>I recently updated my Macbook 2020 to Catalina 10.15.6 and since then I have not been able to bookmark a page and Forefox does not remember my history.  I have checked ""remember my history"" in preferences. All my old bookmarks are there and they work fine, it's just that I cannot bookmark any new pages and my browsing history is not recorded/remembered. </p>",mac-os;desktop;bookmarks;firefox-780;,firefox,bookmarks,en-US,"",trantech1
1296034,2020-07-22 19:03:51 -0800,2020-07-22 19:28:36 -0800,ADBLOCKER,<p>I have internet news sites that ask that adblockers be disabled because they allow me to read their articles without paying subscription fees. I have not been able to allow these sites to not be blocked by Firefox but have to go to Microsoft Edge to read these sites. How can I allow these sites permission and avoid being blocked? </p>,windows-7;desktop;customize;firefox-780;,firefox,customize,en-US,1335190;,ramseyjerry
1296030,2020-07-22 18:23:39 -0800,2020-07-22 18:23:39 -0800,Browser crashing after recent Windows update,"<p>I just updated to Windows 2004, and I'm noticing a major problem with Firefox. I don't know if the problem is with Firefox or Windows, but basically, here's what happens: </p><p>-I have multiple tabs open -I put the computer to sleep for about an hour or so, without exiting -When I wake the computer, Firefox becomes unresponsive and freezes -Even if I force it to quit through Task Manager, it's still unresponsive if I launch it again -If I restart, I can use it again </p><p>Is there a way to fix this, or am I just an idiot for installing the new Windows update? </p>",desktop;fix-problems;windows-10;firefox-780;firefox-7802;,firefox,fix-problems,en-US,"",mike.cairns86
1296029,2020-07-22 18:18:31 -0800,2020-07-22 18:18:31 -0800,Enable Audio on iPad,<p>How do I enable audio on iPad? </p>,desktop;sync;,firefox,sync,en-US,"",althia_garvin
1296028,2020-07-22 18:16:20 -0800,2020-07-22 18:16:20 -0800,Enable Audio on iPad,"<p><em>dupe of <a href=""https://support.mozilla.org/en-US/questions/1296029"" rel=""nofollow"">https://support.mozilla.org/en-US/questions/1296029</a> locking this thread</em> </p><p><br> <strong>bold text</strong>Firefox is installed on my iPad. How do I turn on the audio? </p>",desktop;sync;,firefox,sync,en-US,"",althia_garvin
1296026,2020-07-22 18:01:08 -0800,2020-07-22 18:01:08 -0800,"Wouldn't start for months, now won't search","<p>For months the firefox browser just wouldn't open at all. Now it will open and show recommended articles but does not show my frequently used sites as it did before and I am completely unable to search for anything, it will just scroll as if it is loading infinitely. </p>",desktop;fix-problems;,firefox,fix-problems,en-US,"",donovanmcintosh20
1296024,2020-07-22 17:54:36 -0800,2020-07-22 19:31:17 -0800,Firefox Search will not use google,"<p>I have google as my default search engine and have deleted yahoo from the options list.  However, when I search it comes back with yahoo as the search engine.  this just started today and I have not made any changes to browser.  How do I get google back? </p>",desktop;customize;windows-10;firefox-780;,firefox,customize,en-US,1335187;1335191;,westifer64
1296023,2020-07-22 17:49:55 -0800,2020-07-22 21:43:31 -0800,Several issues since doing a refresh for Firefox to speed up desktop,"<p>Several issues since doing a refresh for Firefox to speed up desktop </p><p>Several issues since doing a refresh for Firefox – email links open in new window instead of tab.  New window does not have my bookmarks.  New window will not move to another open window.  Firefox Options does not control my Firefox. </p><p>When I open Firefox Options the top line reads “Your browser is being managed by your organization.” That link opens Enterprise Policies 	 DNSOverHTTPS    	Enabled  false   Locked  true			 </p><p>I still have the “Old Firefox Data” folder on my desktop from the refresh.  I question if it would resolve the issues.  If I delete Firefox and then re-install it, will I be able to find my many years, long list of bookmarks? </p><p>My system shows  78.0.2 (32-bit) Firefox on Windows 10, version 2004 – both latest updates </p>",desktop;other;windows-10;firefox-780;,firefox,other,en-US,1335204;,safeline
1296022,2020-07-22 17:48:26 -0800,2020-07-22 22:24:19 -0800,PESTAÑAS Y VENTANAS,"<p>Por favor, por qué de repente las pestañas que toco me abren una ventana adicional del navegador, es molesto, hay que minimizar la nueva ventana y arrastrar la pestaña con el puntero hasta la ventana más grande inicial, y así con cada pestaña que toco.... </p>",linux;desktop;tabs;firefox-780;,firefox,tabs,es,1335208;,JoseGabriel
1296020,2020-07-22 17:39:05 -0800,2020-07-22 17:39:05 -0800,Bugs in websites,"<p>Just downloaded latest version of Firefox, but now I am having difficulties with certain websits. Some websites crash and other, where I had automaic logins, don't work properly. </p>",desktop;other;windows-10;firefox-780;,firefox,other,en-US,"",rob521
1296019,2020-07-22 17:06:55 -0800,2020-07-22 19:34:24 -0800,FIREFOX DEVEL---->I feel like an overheated steam engine ready to just explode!!!!,"<p>I mean isn't there some sort of notification that can be given prior to initiating these very IMPACTFUL updates so that, even those of us who are prepared can get set and ready or just push the update off until a better time, etc.  Bopping people with insane updates like this is irresponsible.  Thank goodness I have layers of backups so that I could recover in a reasonable amount of time, but it wasn't the ideal moment for me to be thrown into this cauldron.  I feel empathy for the firefox users who don't have any sort of backup or preperation for this kind of 'cruel' and 'unusual' torture.  You do realize that at least 50% of firefox users were just completely destroyed and left to start from scratch.  Someting is wrong with the thought processes in Mozilla-land devel.;  I'd never run a datacenter like the way I just experienced, its unprofessional (downright amateurish) and shows a lack of forethought and planning. </p>",desktop;other;windows-10;firefox-780;,firefox,other,en-US,1335171;1335192;,Solarsails
1296018,2020-07-22 16:49:22 -0800,2020-07-22 16:49:22 -0800,autofill websites,"<p>Everytime I enter the first few letters of <a href=""http://etrade.com"" rel=""nofollow"">etrade.com</a> it automatically fills in etrade.comcardiacchill. How do I prevent this? </p>",desktop;websites;windows-10;firefox-780;,firefox,websites,en-US,"",jpharmer
1296014,2020-07-22 16:26:40 -0800,2020-07-22 16:26:40 -0800,Firefox RAM usage,"<p>hello, I hope in Future Firefox can reduce its RAM usage whether in Browser or Android. I compare the RAM usage of Chrome and Opera. Thank you </p>",desktop;other;windows-81;firefox-780;,firefox,other,en-US,"",weharimaumuda
1296013,2020-07-22 16:18:42 -0800,2020-07-22 18:51:31 -0800,Keyboard shortcut to toggle between windows in Firefox,<p>I see there are many keyboard shortcuts for moving between open tabs in a single window.  Is there a shortcut for moving between open Firefox windows? </p>,mac-os;desktop;other;firefox-780;,firefox,other,en-US,1335180;1335185;,tzimoski
1296008,2020-07-22 15:32:22 -0800,2020-07-22 15:32:22 -0800,My data got removed after changing the password,"<p>Hi, Unfortunately my entire data got removed after changing password and i even aint know that would happen after changing password so i just saw it in troubleshooting. please tell me how can i recover them bcs there’s no data on sync and got erased i need my old data bcs i changed my hard drive and there’s no old backup or folder so as i said i didnt know changing the password would erase the data on sync:)) Please help me recover them Please:)) </p>",desktop;sync;,firefox,sync,en-US,"",playboyzzjj
1296007,2020-07-22 15:08:06 -0800,2020-07-22 15:23:52 -0800,Firefox is saving the wrong password for a login,"<p>Hi, </p><p>As the title suggests, Firefox is saving the wrong password for a login. Here's what I have done so far to fix the problem: 1. I just deleted all saved logins  2. Restarted Firefox 3. Re-entered the correct username and password  </p><p>I keep getting ""test"" as the password instead of what should be the actual password as can be seen in the image. Note, I used a program to whiteout the username. </p>",desktop;other;windows-10;firefox-780;firefox-7802;,firefox,other,en-US,1335163;,everettrome
1295998,2020-07-22 13:15:07 -0800,2020-07-22 14:11:12 -0800,Firefox 78 and the webp file extension for images. How do I disable webp?,"<p>I'd like it if Firefox would automatically convert webp images to jpg or png files instead of the opposite... stop trying to save png or jpg files as webp... and stop serving me webp images when it is optional. I understand there are websites that ONLY display webp format images, but I am also aware that jpg and png files exist on many of these websites as well. I do not want to disable the ability to display webp in the browser, but I want to turn off whatever option is currently turned on. </p><p>I'd like to go back to being able to right click, Save Image As &gt; and end up saving a png or jpg. There have been several websites over the last few weeks that I have visited, and even if the image in the URL is named jpg or png, Firefox tries to save it as a webp. This is complicating my image saving process. I am using the Add-on named ""Save webP as PNG or JPEG"" which works, but slows down my saving process considerably. The Add-on does not remember the last folder I saved an image to, and adds several additional clicks to what used to be a simple process. </p><p>Is there a way in about:config to prevent Firefox from putting webp as the default file format in the Save Image As dialog box? </p><p>Suggesting that I use Internet Explorer or Edge is crazy. I'm not changing browsers. </p><p>You can demo this annoyance by trying to save this image, which is obviously supposed to be a jpg: <a href=""https://media.entertainmentearth.com/assets/images/7c23e8c9a6014c57aa8f5d3e281b3834lg.jpg"" rel=""nofollow"">https://media.entertainmentearth.com/assets/images/7c23e8c9a6014c57aa8f5d3e281b3834lg.jpg</a> </p>",windows-7;desktop;tips;firefox-780;,firefox,tips,en-US,1335124;1335144;,brandon9
1295997,2020-07-22 13:13:48 -0800,2020-07-22 14:08:12 -0800,Shopping Cart wouldnt work.,"<p>I use a Macbook Pro-High Sierra OSX- using Fire Fox V78.0.2 64 bit. I was at the Epson USA website trying to order ink. I kept putting ink cartridges in the shopping cart but nothing happened, shopping cart kept showing empty. This went on for 2 days. I finally emailed Epson, and went through the same thing with them, nothing showed up in the shopping cart, it just wouldnt work. So the Epson guy tells me to use another browser, I bring up Google Chrome and I was able to place my order with no problems. Maybe someone can tell me what happened and how I can fix it. Ive ordered several other things through out today on Fire Fox with no problems, what was happening with the Epson site? </p><p>I appreciate any thoughts or ideas any has. </p>",mac-os;desktop;websites;firefox-780;,firefox,websites,en-US,1335141;,sunnyskyez
1295995,2020-07-22 13:00:51 -0800,2020-07-22 14:09:02 -0800,Search engine,<p>My default search engine is Google but it goes to yahoo - how can I fix? </p>,desktop;customize;windows-10;firefox-780;,firefox,customize,en-US,1335142;,cheetacampbell
1295990,2020-07-22 12:41:54 -0800,2020-07-22 14:10:28 -0800,Is there a spelling autocorrect add-on?,<p>I have a couple of words that my fingers almost always mistype. Autocorrect in Microsoft Word almost always catches and corrects them. Firefox only tags them. Is there a Word equivalent add-on that can bring the autocorrect function into things that I'm typing within the browser? </p>,desktop;customize;windows-10;firefox-780;,firefox,customize,en-US,1335113;1335143;,letkin
1295988,2020-07-22 12:30:46 -0800,2020-07-22 12:58:14 -0800,Firefox Installer is WAY too simplified.,"<p>The Firefox Installer is WAY too simple for my needs. How? There isn't any ""Custom Installation"" or Advanced"" option. When you open the installer, it just installs Firefox. What I want is something to let me choose where to install Firefox. Anyone know how I can do this? I really like firefox, but the installer is WAYYY too simple, please make an advanced options menu, and tell my WHY you made the installer so SIMPLE. How can we change if it creates a start menu folder, or desktop icon? We cant! Please make the installer more advanced, can someone PLEASE tell me how to change the installation location? </p>",desktop;download-and-install_1;,firefox,download-and-install,en-US,1335115;,kennylr2007
1295983,2020-07-22 12:15:55 -0800,2020-07-22 13:10:06 -0800,Open actual URL of pdf to get date posted,"<p>For pdf files I used to be able to open the URL and check (by clicking on the lock icon) to see when the file was posted, but with last update (not sure if Firefox or Windows as both happened at the same time), the only options I get are 1) open in new URL (actually a temporary file on my computer), 2) open it with Adobe reader directly, or 3) download the file.  How do I get back to the original option of viewing the ACTUAL url? </p>",desktop;websites;windows-10;firefox-780;,firefox,websites,en-US,1335118;1335121;,donfaison
1295982,2020-07-22 11:58:31 -0800,2020-07-22 11:58:31 -0800,Tab pinning,<p>How do I stop firefox from pinning tabs altogether? When I unpin a tab it comes back within seconds or comes back when I restart firefox. </p>,windows-7;desktop;tabs;firefox-780;,firefox,tabs,en-US,"",zeebra
1295979,2020-07-22 11:44:24 -0800,2020-07-22 22:10:48 -0800,Can I rearrage the order of my list of bookmarks to place the most used at the top of the list?,<p>Please provide an answer. </p>,windows-7;desktop;bookmarks;firefox-780;,firefox,bookmarks,en-US,1335206;,RASchump
1295978,2020-07-22 11:24:08 -0800,2020-07-22 14:28:39 -0800,How do I recover bookmarks for a laptop with fried hard drive and download them to a new laptop?,"<p>My MacBook Pro hard drive was fried.  I have purchased a new laptop.  Does Firefox have a backup for those files somewhere ""out there"" that I can access to download them into the new computer? </p><p>Thanx, </p><p>John </p>",desktop;bookmarks;mac-os-x-109;firefox-780;,firefox,bookmarks,en-US,1335100;1335105;1335152;,jlleidy56
1295977,2020-07-22 11:19:21 -0800,2020-07-22 14:11:39 -0800,"I can't move my bookmarks into folders anymore (after 7/21/2020, why, what's changed?","<p>I have always been able to move bookmarks into folders to organize them.  That's why we have folders, right?  So now all of a sudden my bookmarks won't move, I can't ""grasp"" them with my pointer.  It doesn't work.  Why is that?  The date I noticed this beginning is 7/21/2020 </p>",windows-7;desktop;bookmarks;firefox-780;,firefox,bookmarks,en-US,1335145;,ruth5
1295976,2020-07-22 11:19:16 -0800,2020-07-22 11:19:16 -0800,Frequent Crashes - Follow-up,"<p>I received the following information from one of your team:    Frequent Firefox Crashes </p><p>cor-el Jul 20, 2020, 5:44:39 PM  OK, I found one crash report from Firefox 78.0.2.  •	Firefox 78.0.2 Crash Report [@ RtlSizeHeap | NS_FaultTolerantHeap::APIHook_RtlFreeHeap ] bp-2544f95b-926b-4b8f-b0e1-6c9740200720  This crash report looks like related to the Windows block list for injected DLLs.  Boot the computer in Windows Safe mode with network support to see if that has effect in case security software is causing problems.  •	<a href=""https://www.bleepingcomputer.com/tutorials/how-to-start-windows-in-safe-mode/"" rel=""nofollow"">https://www.bleepingcomputer.com/tutorials/how-to-start-windows-in-safe-mode/</a>  •	<a href=""https://www.7tutorials.com/4-ways-boot-safe-mode-windows-10"" rel=""nofollow"">https://www.7tutorials.com/4-ways-boot-safe-mode-windows-10</a>  </p><p>Since I am totally blind, I cannot run the computer in SAFE MODE because I won't have speech and screen reader to guide me through it.  I do not have any sighted help at my beck and call to ""mouse"" things through for me.  Perhaps when this social-distancing stuff relaxes a bit so that I can have someone from the Best Buy Geek Squad come here, that person might be able to go further in troubleshooting the crashes.  IN THE MEANTIME, I'll have to GIVE UP ON FIREFOX and use another browser.  In doing that, I mention again that THE CRASHES DO NOT OCCUR IN GOOGLE CHROME, BUT THEY DO IN FIREFOX!  So for now, at least, I have to conclude that there is a Firefox issue which I won't be able to troubleshoot further unless I can get sighted help.  Also, I note that running in SAFE MODE is a ""testing process"" on which I would have to somehow get back to the screen that caused the crashes.  Most of the time, these crashes seem to be happening when I am trying to finalize a purchase and pay for an item.  For now, at least, I AM STUMPED AND, QUITE RELUCTANTLY, GIVING UP ON FIREFOX FOR NOW, though I remain open to any further suggestions which I could carry out without sighted assistance. </p>",desktop;fix-problems;escalate;windows-10;firefox-780;,firefox,fix-problems,en-US,"",knobman
1295975,2020-07-22 11:18:26 -0800,2020-07-22 11:18:26 -0800,Top Sites,"<p>@ New Tab, Top Sites, I have had an icon for yahoo.mail which I click and get to the sign-in. However, todays power on, went directly to first to microsoft propaganda.  I got out of that only to be dumped into Firefox complete browser management page. I don't know the why, but but getting out allowed me to be back to normal everything, except...... Opening firefox my most used, upper left icon for the yahoo.mail had a changed picture. I liked the yahoo icon picture I had. But something changed it into a picture that would be on my most angering picture list. It was ugly. Everything else was normal. I dismissed the icon. I repeatedly went to the mail in site but no yahoo icon at all showed up in either the ""Top Sites"" or the ""Highlights"". Somehow I poisoned my firefox. I can't even get any yahoo icon at all. Help I want that icon picture back but I don't know how to get it. </p>",desktop;websites;windows-10;firefox-780;,firefox,websites,en-US,"",walterlacey43
1295973,2020-07-22 10:55:00 -0800,2020-07-22 11:02:21 -0800,Restore previous session,"<p>Firefox opened today with its page, rather than ""restoring my previous session:.  I notice now that in Options-General I cannot select restore previous session because it and ""warn when quitting the browser"" are greyed out, leaving ""always check firefox is your default browser"" as the only item I can select.  What has happened? </p>",desktop;tabs;windows-10;firefox-780;,firefox,tabs,en-US,1335087;,david309
1295972,2020-07-22 10:53:17 -0800,2020-07-22 10:53:17 -0800,identity theft,<p>Please help me restore and gather my data someone is controlling my phone and stealing it through my emails what should I do </p>,iphone;malware;escalate;customization;,firefox,protect-your-privacy,en-US,"",michellekaurrama16
1295968,2020-07-22 10:21:55 -0800,2020-07-22 11:10:22 -0800,add-on doesn't show in tools even though it's installed & provided ans. does not apply,"<p>TinEye add-on doesn't show in tools even though ""Manage Your Extensions"" shows it's installed, and  the provided answer by Firefox does not answer the question, and it applies to a different add-on and not TinEye anyway. It is already installed, so where is it? It doesn't show in ""Customize Firefox"" section, where one can add more tools, which it is where it's supposed to be found. All add-ons have been updated. Add-ons Manager (Firefox) shows it installed. Thanks! </p>",desktop;customize;windows-10;,firefox,customize,en-US,1335089;,Nisaba
1295965,2020-07-22 10:06:54 -0800,2020-07-22 12:31:55 -0800,visited link color changes,"<p>Have Win 7 Pro, using FF 78.0.2. Searches and page displays are normal until I changed Visited Links color. After doing so, search results and other pages show each item in separate boxes. I can't get rid of the boxes unless I do  a Refresh of FF. Then I get normal page displays., but I lose change to visited link color (as expected). I tried using Visitedlinkenabler – by Ulf3000 but got the same results. Any ideas on how to change visited link color without getting the boxes? I tried the add-on </p>",windows-7;desktop;customize;firefox-780;firefox-7802;,firefox,customize,en-US,1335095;1335098;1335106;,oldman2
1295963,2020-07-22 09:39:48 -0800,2020-07-22 17:56:22 -0800,"Running multiple ""isolated"" windows/sessions","<p>I have been using the Firefox as my primary browser, personally and professionally, for as long as I can remember. At the moment, I am on v78.0.2 (64-bit) on Windows 10 Pro O/S. </p><p>I am not sure if this is the right place or the question. Here's a scenario which I run into on a daily basis. During the course of my day, it is necessary to login to, at least one, site using multiple username/passwords for account management and/or troubleshooting. Typically, any site which requires authentication (username/password) is launched in a private window. If I have to login to the site using another account, I exit FireFox and must login again with new credentials to avoid the site authentication using previously used credentials. For example, Office365, Hotmail, Yahoo, Network Solutions, GoDaddy, etc. As a work-around, I use Firefox as my main browser, and use Chrome as a second browser for new credentials. </p><p>Is there a way in Firefox to open multiple Private Browsing Windows and not share Cookies, TMP files, cache, etc. in order to allow me to use different credentials for those sessions? </p><p>Thank you in advance for your assistance. </p>",desktop;privacy-and-security_1;windows-10;firefox-780;,firefox,privacy-and-security,en-US,1335178;,somaji
