id,created,updated,title,content,tags,product,topic,locale,answers,creator
1295875,2020-07-21 21:31:26 -0800,2020-07-21 23:07:35 -0800,I can't browse in my firefox browser,"<p>I don't know, suddenly it showed me VCRUNTIME140_1.dll missing and reinstall the browser. i tried it, nothing happened, then i refreshed the browser, nothing happened. tell me what to do. </p>",desktop;fix-problems;,firefox,fix-problems,en-US,1334977;,chandrasekargree251
1295874,2020-07-21 20:20:32 -0800,2020-07-22 06:44:55 -0800,Username and passwords not autofilling where they supposed to,"<p>Username and passwords not autofilling where they supposed to on <a href=""https://my.account.sony.com"" rel=""nofollow"">https://my.account.sony.com</a>, and <a href=""https://account.mozilla.org"" rel=""nofollow"">https://account.mozilla.org</a>. will update the list if i encounter any more </p>",desktop;websites;passwords;windows-10;firefox-760;,firefox,websites,en-US,1334963;1334964;1335032;,fackerparadise1w794sar
1295869,2020-07-21 18:29:06 -0800,2020-07-21 19:00:24 -0800,alert for email & password breach - help,"<p>I received a data breach alert from Firefox saying my email address &amp; password had exposed on a particular site, and to change my password for that site. But I do not have an account with the stated site. I have visited it but never opened an account or logged in to it. What action do I now take or should I just ignore this alert and mark it as ""resolved"" ? </p>",desktop;other;windows-10;firefox-780;,firefox,other,en-US,1334949;,jansplace
1295867,2020-07-21 17:48:58 -0800,2020-07-21 17:48:58 -0800,Playing video is extremely choppy,"<p>The problem:  When I try to watch video in firefox, it hitches up. The audio keeps playing fine but it'll freeze up on an frame for ~10 seconds then jump to where the audio is at and freeze again. On lower quality videos, it's relatively better but there's still choppy to the point of unwatchable. Chrome and Edge can both play the higher quality videos with 0 problems. </p><p>Things I've tried: Restarting the computer Reinstalling Firefox ""Refreshing"" Firefox Clearing my cache Launching Firefox in safe mode Changing media.benchmark.vp9.fps Reinstalling my graphics drivers Turning accelerated processing off Decreasing the content processing limit Probably some other stuff I'm forgetting at the moment </p><p>I've tried to switch over to firefox multiple times over the last year or so, and every time I have this issue and eventually just give in and go back to chrome. I'm on Windows 10 on an old-ish laptop, not sure if that helps. </p>",desktop;fix-problems;windows-10;firefox-780;firefox-7802;,firefox,fix-problems,en-US,"",alexnnw
1295866,2020-07-21 17:47:27 -0800,2020-07-21 23:13:16 -0800,Problem with recovery,"<p>... In settings I've chosen to recover tabs each time... Reboot my PC... What I see - just new tab. All previous tabs disappeared. I want to know what the **** I can give any log and information about my system, if you need. Because I don't want to meet this problem again... </p>",desktop;tabs;windows-10;firefox-780;,firefox,tabs,en-US,1334978;,cursedseraph
1295864,2020-07-21 17:07:40 -0800,2020-07-22 11:23:23 -0800,Apple.com sign in page never loads,"<p>I'm on a MacBook running Max OSX 10.14 Mojave. Firefox is up to date (v 78.0.2). The website loads the basics (menu bar up top), and displays a spinning wheel like thing indicating that it's loading. However, it never finishes loading, and I'm never given the opportunity to log in. I've tried clearing the cache, restarting Firefox, disabling add-ons, and (as in the attached picture) using Firefox's safe mode. I get the same result always. </p><p>Any help is appreciated. Thank you. </p>",mac-os;desktop;websites;firefox-780;,firefox,websites,en-US,1334981;1335093;,mangoduck
1295863,2020-07-21 16:51:57 -0800,2020-07-21 16:51:57 -0800,Master Password,<p>I have just set up a Master Password on my iMac as I am concerned that anyone opening Firefox on my computer has access to my passwords. But it only worked once and now does not work even though I thought I was being careful to record the new password. How can I reset it or recover it or cancel it? I can still see logins and passwords on my iPad but concerned that the master password will sync with my iMac and not sure how to stop this. My iMac is 2009 and running OS X El Capitan (10.11.6) </p>,desktop;privacy-and-security_1;escalate;masterpassword;,firefox,privacy-and-security,en-US,"",bruceross1
1295857,2020-07-21 15:28:45 -0800,2020-07-22 04:32:39 -0800,exporting bookmarks,<p>I am running Firefox Developer Edition v79 and I cannot for the life of me find a way to export my bookmarks.  </p><p>I have tried all the methods I could find on this support site and it seams to me like exporting bookmarks is no longer an option. </p>,mac-os;desktop;beta;bookmarks;firefox-790;,firefox,bookmarks,en-US,1334924;1335018;,acacella7
