id,created,updated,title,content,tags,product,topic,locale,answers,creator
1286640,2020-05-10 15:15:43 -0800,2020-05-12T14:08:43Z,importar contraseñas,<p>Buenos dias  Tengo unas contraseña que exporte del firefox y deseo importarla pero no se como hacerlo </p>,other;firefox-7601;desktop;firefox-760;windows-10;,firefox,bookmarks,es,1312139;1312309;,florentetoledano
1286639,2020-05-10 15:15:15 -0800,2020-05-10T19:34:16Z,Bookmarks toolbar is showing incorrect icons for websites.,"<p>Bookmarks toolbar is showing incorrect icons for websites.  For example, my smile.amazon bookmark shows a Target logo.  My Target bookmark shows a Kohl's logo, etc.   How can I fix this?  I'm running Firefox 76.0 64 bit. Windows 7 Professional </p>",bookmarks;desktop;firefox-760;windows-7;,firefox,bookmarks,en-US,1311873;1311890;,lauriewny
1286638,2020-05-10 14:48:37 -0800,2020-05-10T14:48:37Z,Firefox still slower than other browsers 2020,"<p>Okay, so I used to be a big Firefox user the past couple of years, but I switched back to Chrome and then the new Edge. I understand Firefox is the most powerful browser, but all Chromium browsers tend to display the page first. I looked a little bit online for some settings in the about:config to speed up Mozilla, but nothing really worked. </p><p>How can I prioritize page speed display time over power? Is there even a way to do this? I prefer Firefox over Chromium browsers, it's just the page load speed always tends to be slower. </p><p>Thank you! </p>",fix-problems;firefox-7601;desktop;firefox-760;windows-10;,firefox,fix-problems,en-US,"",trent27on
1286637,2020-05-10 14:41:58 -0800,2020-05-10T14:41:58Z,Address bar always suggests a certain site,"<p>When I start to type in Facebook the address bar always comes up with the following site ""<a href=""http://facebook.adblockplus.me/"" rel=""nofollow"">facebook.adblockplus.me/</a>""    </p><p>I've changed search engines, cleared the cache, history, etc., both from within Firefox and with Privazer and this link keeps coming up when I try to go to Facebook. I don't believe it is in my bookmarks as there is no star next to it so I'm not sure where it is ""getting"" this suggestion from but would like to fix this issue. </p><p>Any idea how to ""remove"" this suggestion as nothing I have tried seems to work. </p><p>Thanks </p>",other;desktop;firefox-760;windows-10;,firefox,other,en-US,"",AZBigDog
1286636,2020-05-10 14:27:59 -0800,2020-05-10T23:49:48Z,How to make Firefox treat text with dots in the search bar as search queries and not websites,"<p>In Chrome, for example, I'd insert search queries onto the address bar like ""psycopg2.extensions"", ""someword.someword"" and chrome would interpret those as a search query and would redirect me to my default search engine. </p><p>Firefox, however, treat this as a website URL and proceed to complete with .com </p><p>How can I change this settings? </p><p>Thank you very much! </p>",customize;desktop;firefox-760;windows-10;,firefox,customize,en-US,1311854;1311925;1311926;,daniel.passy
1286635,2020-05-10 13:31:43 -0800,2020-05-12T04:49:29Z,How do I hide tab bar scroll buttons in FF 76?,"<p>Basically the same question I had five months ago (<a href=""https://support.mozilla.org/en-US/questions/1274655)"" rel=""nofollow"">https://support.mozilla.org/en-US/questions/1274655)</a>. </p><p>Before FF 76, I had been using this userChrome CSS to hide the scroll buttons: </p><p>toolbarbutton[class^=""scrollbutton""] { </p><pre>  display: none !important;   } </pre> <p>Now it's stopped working (again). Does anyone know what I need to change? </p>",customize;desktop;,firefox,customize,en-US,1311824;1311841;1311958;1312186;1312197;,practik
1286634,2020-05-10 13:19:15 -0800,2020-05-11T09:58:18Z,how do i keep the top of any webpage visible while scrolling down please?,<p>I need to keep some details at the top of any webpage still visible even while scrolling down the page. Can you help me please?  Thank you Haitch </p>,customize;desktop;firefox-760;linux;,firefox,customize,en-US,1311850;1311960;1311965;1311995;1312010;1312034;,howieda
1286632,2020-05-10 12:45:30 -0800,2020-05-10T18:32:13Z,"I mistakenly synced my iCloud bookmarks and now I cannot delete the ""Other Bookmarks"" folder.","<p>I synced my iCloud bookmarks with Firefox thinking it would save my new bookmarks. This was a mistake - it added all of the previous ones I used in Google Chrome. I have deleted all of the old bookmarks; however, there is an ""Other Bookmarks"" folder that came with it and Firefox does not allow me to delete it; the ""Delete"" option is grayed out. </p>",bookmarks;desktop;firefox-760;windows-10;,firefox,bookmarks,en-US,1311875;,meelo510
1286631,2020-05-10 12:34:54 -0800,2020-05-10T16:35:46Z,Will adding Malwarebytes privacy software to my MWB regular protection cause problems with Firefox Monitor or vice versa? I've been the victim of breaches.,"<p>I've had a hacker or whatever you would call someone who gets into my computer regularly. I have Malwarebytes Virus Protection and am going to get MWB Privacy. My debit card has been frozen x 15 days now without their sending me a new one. What this thug does is go to my email account, sign in as me, and tell them he/I forgot the password. Then he can verify it, and then he does the same thing. For about four months, he came and went, and all he did was change all my passwords. No matter what kind of secure p/w I used, he could always change it. On 04/26, I saw a charge on my debit card for $1.00 from FacebookPay or whatever, a verification charge. I immediately called FBPay and told them that was a fraudulent charge. I asked them to close the FBPay account. They did, but they also, without my permission, froze my card. I immediately reported that to the bank but they were busy merging with another bank, and they lie, so I still don't have access to my stimulus check or my last two paychecks. New bank is assuring me it's in the mail.  Naturally, I want to know what to do when I get my new debit card so the thug won't see it. I figure I can either order things I need from Amazon and eBay and then delete the card, or I could call them and give them the card info. I've been told I need to have this computer wiped clean, but that would leave me with no means of communication or getting my money out, since they only let you get $500 a day.. How do I deal with this thug? Thank you. I don't know much about computers. I'm considering taking it back to the store where I bought it and demanding one exactly like it or better but I don't know if that would go over or not. I can't pay rent, buy food, pay any bills, or do anything because the debit card people have all my money. I need to resolve the problem of my thug before I set up a new computer. Thank you so much for reading this and trying to help me. Marcia </p>",other;desktop;firefox-760;windows-10;,firefox,other,en-US,1311843;1311861;,marciam12
1286630,2020-05-10 12:08:19 -0800,2020-05-11T05:38:52Z,My word text is set for Black. When go to FOX news and try and comment it ONLY prints in yellow. Other sites it prints black. What would cause this?,"<p>My word text is set for black on a white background. On every site but FOX news that's what I see when I comment in a forum. On FOX I see YELLOW, which unless I want a dark background is unreadable on a white background. </p><p>I tried refreshing Firefox and double checked my color selections but nothing has worked. </p><p><br> </p><p>. </p>",fix-problems;firefox-7601;desktop;firefox-760;windows-7;,firefox,fix-problems,en-US,1311876;1311968;,lobo121148
1286629,2020-05-10 11:55:34 -0800,2020-05-10T12:13:49Z,I keep having problems with firefox blocking my searches or when it goes through changing the search site to Bing. I have tried the remedies in the forum pages,"<p>When I type in a word or site name without adding "".com,"" I get ""adcenterexpress"" showing up in the search bar or it might switch to Bing if I put it in the Google search bar(sometimes adcenterexpress come up there too).  I do not want to use Bing. I have tried every relatable advice page on your site without success in changing this. What should I do? Turning off McAfee does not help. I turned off Firefox tracking protection without benefit. Nothing in your forum has helped and keeps taking you in circles. </p>",other;firefox-7601;desktop;firefox-760;windows-81;,firefox,other,en-US,1311809;,LHorne4
1286628,2020-05-10 11:24:00 -0800,2020-05-11T04:50:57Z,How to disable menu bar navigation via alt+_ key shortcuts?,"<p>Actually, my question is totally opposite to <a href=""https://support.mozilla.org/en-US/questions/1281825"" rel=""nofollow"">https://support.mozilla.org/en-US/questions/1281825</a> where the user wants to use Alt+D to navigate the menu bar – in my case menu bar is completely redundant and I would be 100% happy if it was removed. Now when I try to focus on the location bar and quickly type some query I open the menu instead (despite the fact that `ui.key.menuAccessKeyFocuses` is set to `false`) and execute some random action like closing whole browser or a random tab. My habit for pressing Alt+D is so strong that I cannot just move to Ctrl+L without constantly destroying my workflow.  </p><p>I would like to completely disable the navigation via Alt+_ keys on menu bar. I would like it just not to exist. I am using German locales if that matters. How can I achieve it? </p>",customize;desktop;firefox-760;linux;,firefox,customize,en-US,1311897;1311898;1311956;,cib
1286626,2020-05-10 11:03:04 -0800,2020-05-11T01:39:21Z,PDF preview is empty,"<p>Hello when I open a pdf on a website , setting is preview in firefox, the preview tab is empty and the document is not displayed. The same document was visible a month a ago guess I was on version 75. I have disactivated all add-ons, but it doesn't help I am able to show the document in Edge Chromium. </p><p>Is this a known issue an a way to get it resolved </p><p>Regards Oliver </p>",other;firefox-7601;desktop;firefox-760;windows-10;,firefox,other,en-US,1311807;1311935;,oliver.j.kaiser
1286625,2020-05-10 11:02:36 -0800,2020-05-10T11:02:36Z,Where does stuff downloaded from web apps opened as SSB (--ssb) go in Linux?,"<p>For instance: </p><p>I open <a href=""http://whatsapp.com"" rel=""nofollow"">whatsapp.com</a> as a web app in a site specific browser instance using firefox --ssb <a href=""https://web.whatsapp.com"" rel=""nofollow"">https://web.whatsapp.com</a> </p><p>Firefox works well for this. However, if I receive a Whatsapp message with a pdf attachment and I click on it, firefox only says the attachment has been downloaded but does not say where and I cannot find the file in any obvious location. </p><p>Without --ssb, in the same whatsapp web app clicking on an attachment triggers firefox to show a window saying whether to open the file with an application or download it and in the latter case, FF either downloads to the default download location or asks me where to download (depending on my settings). </p>",other;desktop;firefox-760;linux;,firefox,other,en-US,"",sergio.callegari
1286624,2020-05-10 10:44:46 -0800,2020-05-10T12:20:56Z,cannot  get access to passwords,"<p>i  update to version 76 and can no long access my passwords,    keep getting messages enter pin. i got a recovery but enter , ff will NOT accept  it, to to refresh, nothing works changed password password, still not able to access passwords i am locked out, and nothing  i do helps, i have read all the  notions but again nothing s works.   TRIED TO DELETE ACCOUNT AND START OVER BUT WILL NOT ACCEPT PASSWORD.    how can i fix this????  been using ff for about  ten years this is ridiculous.  .  what is the sense of having a  recovery key if it does not help get a recovery. please help AllenMillner </p>",other;desktop;firefox-760;windows-10;passwords-os-auth;,firefox,other,en-US,1311813;,allen6
1286623,2020-05-10 10:37:21 -0800,2020-05-10T19:52:40Z,When I go to cloudflare websites I get Error 1001 Ray ID: 59155673d9adc50c. Please help!,"<p>When I go to <a href=""http://archive.is"" rel=""nofollow"">archive.is</a> for example I get error 1001 Ray...etc. Screenshot below. I googled this problem and it took my to cloudflare's support where user ""domjh"" shared this support page: <a href=""https://support.cloudflare.com/hc/en-us/articles/200168436"" rel=""nofollow"">https://support.cloudflare.com/hc/en-us/articles/200168436</a>. But this doesn't help, as you have to login to your cloudflare account, which I have never had. This problem only occurs with firefox. I have tried other browsers and can access <a href=""http://archive.is"" rel=""nofollow"">archive.is</a> without a problem. Everything is normal. Now I cleared my cookies (which is when this error happened afterwards) and unplugged my modem for a few minutes (about 15) in order to get a new IP address (someone somewhere I read mentioned that might help). This didn't do anything, same error as before. I also went to about:preferences#privacy and clicked ""standard"" (for some reason it was at custom and had been blocking cookies, not sure why, I didn't do that). Then I went to cloudflare support, but you have to have an account to ask questions. I set one up with my email, but then you have to add your website. I HAVE NO WEBSITE! So I don't know what to do, and this has never happened before. This is not a problem on other devices, or on this computer with other browsers. I am using a windows 10 PC and have a dynamic IP address. Please help. </p>",cookies;desktop;firefox-760;windows-10;,firefox,cookies,en-US,1311879;1311892;,rudygrado5
1286622,2020-05-10 10:15:48 -0800,2020-05-10T12:04:16Z,Proč Firefox nezobrazuje při vybrání v kontextovém menu Zavřít panely vpravo hlášení jestli chci zavřít XX panelů?,"<p>Ahoj, jestli poradíte budu rád. </p><p>Dříve to šlo :) asi nějaká položka v configu :/ </p>",bookmarks;desktop;firefox-760;windows-10;,firefox,bookmarks,cs,1311806;,lukas.polcer
1286619,2020-05-10 10:04:02 -0800,2020-05-10T10:04:02Z,Firefox cannot properly access the microphone; it flickers in the system tray and shows that Firefox is rapidlyusing and then not using the microphone.,"<p>Firefox cannot properly access the microphone; it flickers in the system tray and shows that Firefox is rapidly using and then not using the microphone. When I mute the microphone in-app, the flicker stops, and the microphone icon is steady. People cannot hear me speak. I've done all basic troubleshooting, restarted my computer and Firefox, restored all computer settings, done a Firefox reset, and so forth. The microphone works fine elsewhere, including on the same app in Chrome. </p>",fix-problems;desktop;firefox-760;windows-10;,firefox,fix-problems,en-US,"",anthony.d.ritz
1286618,2020-05-10 10:00:50 -0800,2020-05-10T10:30:57Z,"I have multiple Firefox profiles, and I want to have just one. How do I determine which profile I am using? Thank you.",<p>There are no other details I can think of. </p>,other;desktop;firefox-760;windows-10;,firefox,other,en-US,1311784;,drewsnews
1286616,2020-05-10 09:45:34 -0800,2020-05-10T11:29:57Z,Calendar day settings,<p>In the calendar I can't set Sunday as the first day. It shows Monday as the first day. How can I change the setting to a standard week of Sunday through Saturday? </p>,other;desktop;,firefox,other,en-US,1311799;,frankreid07
1286614,2020-05-10 09:22:39 -0800,2020-05-10T12:15:32Z,Why wont Firefox play YouTube as before?,"<p>Why wont Firefox play YouTube as before?  They play fine on my Android tablet that does not use Firefox, but will not play on my Windows computer.  I turned of ""Hardware Acceleration"" under Options in Firefox, but still can not play YouTube. </p>",other;desktop;firefox-760;windows-7;,firefox,other,en-US,1311810;,mastecker
1286612,2020-05-10 08:44:08 -0800,2020-05-10T23:07:21Z,Latest version of Firefox causes intermittent lag spikes,"<p>I have the latest version (76.0.1) and I've noticed that the browser itself is giving me problems with my ping - specifically a high ping spike every 5 seconds. At first I thought it might be my wireless receiver playing up on me (I don't have a hardline connection, it's not an option) as I use a 4G router or my phone as a 4G access point. </p><p>While doing troubleshooting and trying to find ways of making the lag minimise or stop altogether, I upgraded the wireless receiver's drivers and restarted the system. All started out well as it rebooted, I had Pingplotter up and testing a ping to Google, was looking good as the ping stayed mostly in the green (I'm in Australia, high ping is a thing here). So I booted up Firefox, and the ping started going back to the way it was before I rebooted the system, ie. a high ping spike (in the red) every 5 seconds. There's a definite pattern to it as well, as I have saved graphs showing what's going on. </p><p>I'm using Chrome for the time being, but I've been using Firefox for years prior and very minimal hiccups to speak of, until now. This is a BIG hiccup for me, as I use my PC for gaming online, and this ping spike every 5 seconds is unacceptable. </p><p>I'm willing to try out any possible fixes, but at this point it's DEFINITELY a Firefox issue reacting badly with my internet connection. </p>",desktop;fix-problems;,firefox,fix-problems,en-US,1311812;1311910;,vk2farg
1286611,2020-05-10 08:38:04 -0800,2020-05-10T09:52:07Z,It takes 30 seconds when I want to open my Firefox!,"<p>It takes 30 seconds when I want to open my Firefox! i have a best HDD, and that has nothing to do with my hard drive </p>",fix-problems;desktop;firefox-760;windows-10;,firefox,fix-problems,en-US,1311781;,ali13aj80
1286609,2020-05-10 08:09:25 -0800,2020-05-10T08:09:25Z,"On my MacBook Pro w. MacOS 10.15, I've reset cmnd-v for paste to ctrl-v; and now Edit menu shows ^V but it's not working. Other resets to ctrl DO work (^C, ^X)","<p>MacBook Pro 2019 MacOS 10.15x Firefox 76.0.1 64-bit I've successfully reset various hotkeys for Firefox on Mac to use ctrl (^) instead of command. To do this I used System Preferences -&gt; Keyboard -&gt; Shortcuts -&gt; App Shortcuts where there's a section for Firefox.app. There, I've added these resets: Cut                              ^X Copy                           ^C Paste                          ^V Select All                    ^A Find in This Page...    ^F All of these work, except ^V for Paste. The key combo even shows in the Firefox menu bar Edit pull-down menu. But when I have a string of text in the clipboard and use ^V nothing happens (oh, I do see a little flash of the Edit option on the Firefox toolbar any time I hit ^V, but the clipboard content isn't pasted. I still have to use command-V, which is so annoying for this long-time Windows user who has control key shortcuts burned into his muscle memory. Anyone have any idea why ^V reset isn't working? </p>",firefox-7601;customize;desktop;firefox-760;mac-os;,firefox,customize,en-US,"",aronszajn
1286608,2020-05-10 08:04:53 -0800,2020-05-10T08:34:24Z,I want firefox to open with my email accounts,"<p>I must be illiterate, sorry, Firefox always started with my G mail account. after an update it does not do that anymore. How do I get either my e mail account as opening page or Google as opening page.  Help please </p>",other;desktop;firefox-760;windows-10;,firefox,other,en-US,1311761;,Minkasmom54
1286607,2020-05-10 07:45:01 -0800,2020-05-10T07:45:01Z,When I choose 'Open all in tabs' Firefox opens tabs but won't load the websites.,"<p>I have a series of 20 or so webpages that I like to read first thing in the morning.  When I open Firefox and click on ""Open All in Tabs"" it creates a tab for each website, but won't load that website until I select the address bar and press enter.  It doesn't happen all the time, but I'd say 95% of the time. </p>",bookmarks;desktop;firefox-760;windows-10;,firefox,bookmarks,en-US,"",runepad
1286604,2020-05-10 07:30:44 -0800,2020-05-10T09:45:12Z,"After I deleted my history, all my login details were gone. How do I retrieve my log in details? Can I restore my history and all log in details etc?","<p>Hi  </p><p>I am on firefox desktop Windows 7. I recently deleted my history but I lost all log in details as well </p><p>What do I do to get the log in details back ?  </p><p>System restore somehow failed to restore the system so I am not sure if it works, it would bring back my login details </p><p>Thanks </p>",other;desktop;,firefox,other,en-US,1311764;1311777;1311778;,Ahmed2006
1286603,2020-05-10 07:30:04 -0800,2020-05-11T07:14:29Z,how can I restore the profile that Firefox deleted when it auto-migrated to version 76.0.1?,"<p>This morning I launched Firefox as I have always done. Firefox informs me that it has auto-upgraded to version 76.0.1. ""That's good!"" I tell myself. ""Now let's read the news as we always do."" But no! My bookmarks bar is empty. ""Gadzooks!"" I exclaim. ""Oh, well, I'll just have to read the documentation to restore my bookmarks."" But no! As I pore through the documentation, I see nothing about restoring my bookmarks. I see lots of information about restoring my profile (Is that a file for professionals?  </p>",download-and-install_1;desktop;firefox-760;mac-os;,firefox,download-and-install,en-US,1311770;1311984;1311997;,chrisc2
1286602,2020-05-10 07:21:38 -0800,2020-05-10T07:21:38Z,Suchmaschine ändern für google schweiz suche,"<p>Hallo Zusammen </p><p>Seit geraumer Zeit ist Firefox leider sehr von der Suche auf <a href=""http://google.com"" rel=""nofollow"">google.com</a> überzogen.. Um relevantere Suchergebnisse zu erhalten und mal schnell auf eine Suche nur innerhalb der Schweiz zu wechseln sollen unsere Rechner immer über <a href=""http://google.ch"" rel=""nofollow"">google.ch</a> suchen! </p><p>Bis vor kurzem war noch ein Add-On namens ""Google ch"" erhältlich, was nun nicht mehr auffindbar ist. Ein eigener Suchstring konnte ich bis jetzt auch nirgens eingeben und beim drücken des ""Suchmaschine hinzufügen"" Buttons, kam nur die Suchseite der Add-On's, was natürlich nicht weiterhilft.. </p><p>Das ändern der Suchregion in den Einstellungen der Website ist keine Option! </p><p>Gerne kann <a href=""http://google.com"" rel=""nofollow"">google.com</a> auch gleich komplett ersetzt werden. Es kommt nämlich bei der Eingabe von google im Suchfeld auch immer gleich <a href=""http://google.com"" rel=""nofollow"">google.com</a> als Vorschlag obwohl diese Seite nie aufgerufen wird.. Sehr sehr mühsam das Ganze! </p><p>Besten Dank für eure Informationen wie dies behoben werden kann. </p><p>Gruss Roman </p>",firefox-750;other;desktop;mac-os;,firefox,other,en-US,"",r.schuler
1286601,2020-05-10 06:55:26 -0800,2020-05-12T03:57:19Z,Firefox shows itself as an older version than it actually is,"<p>Hey everybody </p><p>I'm having troubles installing an addon. Now I just noticed, that Firefox is communicating an older version than itself, than it actually is. As you can see in the screenshot (hopefull, since I'm using it in German), the website <a href=""https://addons.mozilla.org"" rel=""nofollow"">https://addons.mozilla.org</a> thinks that I'm on v68, while in reality, I just updated it to 76. </p><p>I did play around a bit with addons and settings for data privacy - and I'm pretty confident, that the problem is within a wrongly set configuration - but I can't for the life of me find and reverse it. </p><p>I would really appreciate any pointers you can give me! </p><p>Cheers, Robert </p>",firefox-680;customize;desktop;windows-10;,firefox,customize,en-US,1311744;1311747;1311752;1312182;1312185;1312193;,waldner.robert
1286600,2020-05-10 06:51:59 -0800,2020-05-10T09:08:43Z,"Unable to download .msi file, it’s covering into the web page instead of downloading the MSI file.","<p>Unable to download .msi file, it’s covering into the web page instead of downloading the MSI file. (Screenshot attached).  </p><p>Download working successfully in any other browsers like Google Chrome, Edge, Internet Explorer, Safari... </p><p>[<strong><a href=""https://digitalsigner.pulkitsoft.com/wp-content/uploads/DigitalSigner_Setup_x86.msi"" rel=""nofollow"">https://digitalsigner.pulkitsoft.com/wp-content/uploads/DigitalSigner_Setup_x86.msi</a></strong> Try to Download]  </p><p>Thanks in advance. </p><p>Regards Ram </p>",desktop;fix-problems;,firefox,fix-problems,en-US,1311745;1311772;,pulkitsoft.india
1286598,2020-05-10 06:19:36 -0800,2020-05-10T06:47:10Z,"My Firefox 76 browser reset and my Dashlane Add-On disappeared and I cannot find to reload as Add-On, help please?","<p>My system is Windows 10, up to date and Firefox 76 is my default browser.  I have been using the Dashlane Add-On with Firefox for several months.  Dashlane is still present on my desktop as a stand-alone app but it does not appear in the list of Firefox add-ons for reloading.  Help please. </p>",firefox-7601;customize;desktop;firefox-760;windows-10;,firefox,customize,en-US,1311742;,david245
1286596,2020-05-10 05:37:19 -0800,2020-05-10T21:02:35Z,Unable to use zoom image,"<p>At this URL </p><p><a href=""https://en.chint.com/products/NU6-III%20Low-voltage%20Surge%20Arrestor/8?product_id=507"" rel=""nofollow"">https://en.chint.com/products/NU6-III%20Low-voltage%20Surge%20Arrestor/8?product_id=507</a> </p><p>Only it's possible to move the ""zoom"" at the bottom of the image. </p><p>Any way to zoom all the portions of the image ? </p><p>Thanks </p><p>Itshak </p>",fix-problems;desktop;firefox-760;windows-10;webcompat;,firefox,fix-problems,en-US,1311884;1311895;,itshakgm
1286595,2020-05-10 05:28:52 -0800,2020-05-10T15:38:27Z,"how many times does it take to install firefox, i keep getting pop ups to update, but I have.","<p>after updates everytime I start firefox it asks me to update, a vicious circle jerk </p>",other;desktop;firefox-760;windows-10;,firefox,other,en-US,1311766;1311769;1311779;1311785;1311818;1311820;1311831;1311848;,kansaskarl
