id,created,updated,title,content,tags,product,topic,locale,answers,creator
1286593,2020-05-10 04:45:45 -0800,2020-05-11T04:43:21Z,¿Cómo puedo deshabilitar todas las extensiones con un solo clip desde la barra o menu principal?,"<p>Hola, a la hora de navegar con firefox, cuando tenemos extensiones instaladas, la mayoría de ellas recopilan los datos de las web que visitamos, pero si yo por ejemplo, en un momento dado necesito deshabilitar todas las extensiones a la vez, para por ejemplo rellenar un formulario en una web o cualquier otro asunto privado, cómo realizo esta acción de deshabilitar varias extensiones a la vez, y una vez terminado poder volver a habilitar nuevamente todas a la vez. ¿existe algún botón o pestaña para poderlo hacer todo a la vez y no una por una?. </p><p>Saludos. </p>",firefox-750;customize;desktop;windows-10;,firefox,customize,es,1311826;1311953;,barrera_b
1286591,2020-05-10 04:23:11 -0800,2020-05-10T04:29:51Z,I've been trying to switch between tabs on my browser...but every time i switch the new tab reloads and takes a very long time to show the contents.,<p>The worst part of it is that when i open another window firefox just crashes or freezes. upon getting the crash report it doesnt show any form of crash. its bugging me </p>,fix-problems;firefox-7601;desktop;firefox-760;windows-10;,firefox,fix-problems,en-US,1311728;,taizzemmanuel
1286590,2020-05-10 04:09:09 -0800,2020-05-10T05:19:21Z,Restoring session loads tabs in random order,"<p>Every time I launch Firefox, it shows me the session manager window to restore the tabs from the last session. Although the list of tabs/windows is almost always in the right order, when I restore the tabs, they all load in a random order. Sometimes it even creates an extra window with a few tabs. </p><p>This happens whether I have a few tabs or many tabs. </p><p>Is this the expect behavior? I mean, session manager can't guarantee that the tabs are going to load in the same order as before? </p>",tabs;desktop;firefox-760;windows-10;,firefox,tabs,en-US,1311727;1311729;1311730;1311736;,ricardolcabral
1286588,2020-05-10 02:21:54 -0800,2020-05-10T08:28:29Z,Firefox portable,"<p>Hi Is Firefox portable from this site secure or can I trust this site? <a href=""http://portableapps.com"" rel=""nofollow"">portableapps.com</a> I would like to use it on my usb for online shopping :) regards </p>",privacy-and-security_1;desktop;firefox-760;windows-10;,firefox,privacy-and-security,en-US,1311723;1311725;1311759;,gecko.prv
1286585,2020-05-10 00:35:17 -0800,2020-05-10T03:01:10Z,web not working for FF but working all browsers,"<p>I can’t seem to be able to replicate this on <a href=""https://www.pakainfo.com/what-is-my-screen-resolution-whatismyscreenresolution/"" rel=""nofollow"">my machine</a> (i.e. it looks exactly the same in Chrome and FF). Could you please let me know which Chrome version you’re using (go to the three dots in the top right corner and choose “Help – About Google Chrome” from the menu), as well as your screen resolution. If you don’t know the latter, <a href=""https://www.pakainfo.com/what-is-my-screen-resolution-whatismyscreenresolution/"" rel=""nofollow"">https://www.pakainfo.com/what-is-my-screen-resolution-whatismyscreenresolution/</a> try this website. </p><p>I wished there was an option in settings page (or even an add-on) where you can <a href=""https://www.pakainfo.com/what-is-my-screen-resolution-whatismyscreenresolution/"" rel=""nofollow"">set Firefox's screen resolution</a> (which can be any number, up to the device's display resolution). </p><p>This is not exactly a bug, but it is a very important feature request. </p><p><a href=""https://www.pakainfo.com/what-is-my-screen-resolution-whatismyscreenresolution/"" rel=""nofollow"">https://www.pakainfo.com/what-is-my-screen-resolution-whatismyscreenresolution/</a> </p>",websites;desktop;,firefox,websites,en-US,1311702;1311719;,jdk.king25
1286582,2020-05-09 22:58:24 -0800,2020-05-09T22:58:24Z,Maximized Firefox causes screen overlap,"<p>I have a 4k display on top with 2 UWQHD displays below it, </p><p>When Firefox is maximized on one of the bottom displays, there is a border that seems to overlap onto the 4k display, but only along the bottom to where that bottom display is set. </p><p>I have tried setting in both Windows and Nvidia Control Panel. I have also tried other programs to see if they have the same problem, they do not. </p><p>This problem seems to be exclusive to the Firefox browser on my computer. </p>",fix-problems;desktop;firefox-760;windows-10;,firefox,fix-problems,en-US,"",asxeus
1286581,2020-05-09 22:56:39 -0800,2020-05-09T22:56:39Z,Not able to view on content on Amazon Prime Video.,"<p>When I press the play button, the page reloads instead of playing the video. The issue came after I updated to version 76.0.1 from version 76. Any help is appreciated. </p>",other;desktop;firefox-760;windows-10;,firefox,other,en-US,"",smkatnasa
1286579,2020-05-09 22:44:40 -0800,2020-05-10T05:17:51Z,Disable enlarged search field when opening new tab,"<p>The newest update has a feature which annoys me a lot, and that is that opening a new tab seems to enlarge the search field temporarily. I find it very irritating and causes me to waste a click in my workflow just to get rid of it. I'd very much like a way to disable this feature - it definitely diminishes my usability experience! </p><p>Thanks! /Danny Master of Science Engineering Technology Interaction Design </p>",tabs;firefox-680;desktop;windows-10;,firefox,tabs,en-US,1311734;,dv83
1286576,2020-05-09 20:14:13 -0800,2020-05-11T20:06:03Z,Firefox stopped working,"<p>I have been using Firefox for years as default browser.  This evening, opening it gets a completely blank white screen.  Nothing.  Nada.  I uninstalled it and have tried to reinstall Firefox.  Doesn't work.  What next? </p>",other;desktop;,firefox,other,en-US,1311691;1311754;1311760;1312145;1312149;,PKSchwarz
1286575,2020-05-09 20:04:07 -0800,2020-05-09T20:04:07Z,Mouse cursor isn't disappearing when watching Amazon Video,"<p>Whenever I watch something on Amazon Video's video player when using Firefox my mouse cursor doesn't automatically disappear when it's over the video itself. This issue is specific to Firefox, I don't have this issue when watching an Amazon Video (well) video on Internet Explorer. Would attach an image, but it doesn't capture the still-showing mouse cursor. </p><p>Currently using Firefox Version 76.0.1 with Picture-in-Picture controls disabled. </p>",websites;firefox-7601;desktop;firefox-760;windows-10;,firefox,websites,en-US,"",patfan
1286572,2020-05-09 19:33:34 -0800,2020-05-09T20:49:02Z,"""Ask to save logins"" option won't remain selected no matter what I do","<p>Hello, For some reason, the ""ask to save logins"" option is automatically unchecked every time I start a new Firefox session (despite all the following options being checked off. Please see attached picture for reference). I've already ""refreshed"" Firefox once, which I guess essentially reinstalls the browser. Any time I start a new browser session, I have to go into my privacy settings and manually check the ""ask to save logins"" option and then refresh so that the change is active. I don't know why but if this option remains unchecked, then my logins will not autofill despite this option being checked off. I'm not sure how to fix this or why it even started. </p>",privacy-and-security_1;desktop;firefox-760;windows-10;,firefox,privacy-and-security,en-US,1311684;,milenanesic1
1286571,2020-05-09 19:19:48 -0800,2020-05-09T21:03:47Z,Login deleted after android syncing,"<p>I had one of my logins deleted, I suspect there was an issue while syncing with my android device. I used the Firefox app not the Firefox for android beta. I don't think I accidentally deleted it and if I deleted it, hope the developers add a password blocking for deletion and an option to export them. Thanks for any help. </p>",sync;desktop;firefox-760;windows-81;,firefox,sync,en-US,1311687;,danorait
1286570,2020-05-09 19:16:50 -0800,2020-05-10T14:21:35Z,It is a way to see for each LINK from the Bookmarks the CONTAINING FOLDER in the Bookmarks Bar ?,"<p>It is a way to see for each LINK from the Bookmarks the CONTAINING FOLDER in the Bookmarks Bar ? </p><p><br> Sometims, we save the LINKS in diverse Folders in The Bookmarks. Lets say I find an old bookmarked LINK, then I want to know the Folder that contains it from the Bookmarks Bar </p>",other;desktop;firefox-760;windows-10;,firefox,other,en-US,1311675;1311765;1311830;,tbaracu
1286569,2020-05-09 19:09:04 -0800,2020-05-09T22:18:23Z,Display of search engine in search bar is disturbed,"<p>Although there is no problem in practical use, the condition is not known, but sometimes it is displayed with a large gap between the search engine icons as in the image. </p><p>Is there a way to fix it? If it is a bug, please fix it. </p>",other;desktop;firefox-760;windows-81;,firefox,other,en-US,1311697;,lsdoll02
1286565,2020-05-09 17:07:05 -0800,2020-05-09T18:53:55Z,Youtube files no longer autoplay even though I set the option to allow them to autoplay,"<p>Autoplay was working fine yesterday, but today, for some reason, it refuses to work - even though I have set the option to allow for autoplay. the only change that I think MIGHT have something to do with it would be the fact that I uninstalled Google Chrome from my operating system. </p>",other;desktop;firefox-760;windows-7;,firefox,other,en-US,1311667;1311669;,mnrwest
1286564,2020-05-09 16:43:12 -0800,2020-05-09T16:43:12Z,"Uso o yahoo a 30 anos e tenho 2 gmail mas me sinto preso com firefox ou chromium, liberdade é fundamental a todos.","<p>If I use Firefox my old Yahoo works if I don't use anything from gmail, if I use Chromium it's better to use my new emails (gmail), it's not easy to manage a dispute between you, but that should be indifferent to me. </p>",other;desktop;firefox-760;linux;,firefox,other,pt-BR,"",viottodavi
1286563,2020-05-09 16:40:33 -0800,2020-05-10T15:56:42Z,"Disable ""The information you have entered on this page will be sent over an insecure connection and could be read by a third party""","<p>One only one of my computers, every time I search aliexpress using https I am told  ""The information you have entered on this page will be sent over an insecure connection and could be read by a third party"" I would like to disable this message.  </p><p>I can't see where I can do this in the security settings, which seem to be default standard setting.  </p><p>Please help m(._.)m </p>",privacy-and-security_1;firefox-750;desktop;windows-10;,firefox,privacy-and-security,en-US,1311664;1311699;,timtak
1286562,2020-05-09 16:31:22 -0800,2020-05-09T16:50:31Z,"Why use One Trust, a Clearwater Co? I cannot set a recovery email, because I am opted out of One Trust","<p>I cannot set a secondary email for Firefox, or change anything at all because, as a witness for the court that convicted a gang leader for a police shooting, I cannot make myself too easily found, and invite another attempt on my life. So, please give us a chance to verify without having to hand over data. I will never clear One Trust because I choose not to have that info, especially my address all over the internet. I had to move 7 times, was injured badly in one of 6 attempts. and info aggregators like, One Trust can get me killed. Plus they have just labeled my fallback address as Invalid. </p>",firefox-680;sync;desktop;windows-7;,firefox,sync,en-US,1311658;,wdhc
1286561,2020-05-09 16:20:51 -0800,2020-05-09T21:29:57Z,Autoplay Setting can't make exceptions,"<p>I usually have it set to block audio and video automatically, and when I'm watching actual videos on Youtube, yeah, I want autoplay turned off. BUT when I'm trying to just play some music, I'd like to allow it. However it's FOREVER TOGGLED OFF EVEN WHEN I SET IT TO ALLOW ALL AUDIO AND VIDEO. It will stay on for one song, and then turn it off again. I also can't allow an exception to that SPECIFIC website because it NEVER shows the blocking autoplay settings in the site info bar, and I can't manually add websites to the exceptions list. So I can't add youtube to my exceptions list, can't change the settings for the page, and even if I do it's NOT paying attention to my choice, even when set to allow for ALL websites. </p>",privacy-and-security_1;desktop;firefox-760;windows-10;,firefox,privacy-and-security,en-US,1311666;1311672;1311674;1311679;1311694;,ShadowNell
1286560,2020-05-09 16:09:47 -0800,2020-05-12T05:13:59Z,Sometimes firefox says server not found even when internet is working,<p>Sometimes I get a server not found when I try opening a website. Even if there are other tabs open and internet is working. I have not changes any settings nor has my internet provider. using a VPN soles the issue as does refreshing about 300 times. this isgetting really annoying. i have tried the DNS setting but doesnt seem to work. </p>,websites;desktop;firefox-760;windows-10;escalate;,firefox,websites,en-US,1311668;1311866;1311924;1312052;1312074;1312201;,omerzafeer
