id,created,updated,title,content,tags,product,topic,locale,answers,creator
1286928,2020-05-13 15:52:25 -0800,2020-05-13T15:52:25Z,Continuously have to log in,"<p>I've had to log in to my Firefox account 3,4 or 5 times a day after my computer(running Win10 Home, ver 1909) goes into sleep mode. Any help will be appreciated. </p>",other;desktop;firefox-760;windows-10;,firefox,other,en-US,"",patsfan_1968
1286927,2020-05-13 15:42:36 -0800,2020-05-13T18:00:01Z,"After firefox update on 5-12-20, started up pc this AM and all desktop icons were scrambled, windows error msgs about fax start fail and image transfer",<p>Tried to do a system restore this AM to the last auto restore point--it failed due to a registry fault-tried two other restore points all failed for the same reason. All desktop items were ok on 5-12-20 @ ~ 10 PM when the Firefox update was initiated. As soon as PC was started this AM the error msgs appeared </p><p>Cannot upload word doc or PDF image </p>,fix-problems;desktop;firefox-760;windows-8;,firefox,fix-problems,en-US,1312552;,gstilwell
1286926,2020-05-13 15:37:20 -0800,2020-05-13T15:37:20Z,"I have a Firefox account but whenever I try to use it with Firefox Send it just keeps telling me 'Something went wrong' - Help, please…","<p>I have a Firefox account but whenever I try to login with Firefox Send it just keeps telling me 'Something went wrong', which gives me no idea what I can do to get things right. I have tried deleting my account and creating a new one, but the same thing still happens. I was keen to be able to use Firefox Send and get the extra flexibility offered by signing in, but so far I can only use it with the more limited default options. </p>",other;desktop;firefox-760;windows-10;,firefox,other,en-US,"",colinmbeney
1286925,2020-05-13 15:25:16 -0800,2020-05-13T15:25:16Z,Firefox hangs up on Performing TLS handshake,"<p>Following this old archived thread at <a href=""https://support.mozilla.org/en-US/questions/1170331"" rel=""nofollow"">https://support.mozilla.org/en-US/questions/1170331</a> and following suggestion there, my Firefox v76.0.1 64bit for Ubuntu Linux still hangs. The I can hear excessive hard drive activity and the system in locked. Waiting long enough it sometimes unlocks but when trying to work I have no choice but to force reboot! The exact message is: <em>Performing a TLS handshake to <a href=""http://www.gravatar.com"" rel=""nofollow"">www.gravatar.com</a></em> but that is not a domain I’ve ever visited. Please advise! </p>",other;desktop;,firefox,other,en-US,"",tmp4
1286924,2020-05-13 15:24:35 -0800,2020-05-13T21:42:25Z,"Even when I signout of my Firefox account, all of my logins still show up in form fields",<p>All of my usernames and passwords still show up on my work computer after I signout of my firefox account and even after I clear cache and data. </p><p>My firefox account info is even saved so that anyone can just go to the firefox signin page and sign in with my info. </p>,sync;desktop;firefox-760;windows-10;,firefox,sync,en-US,1312553;1312558;1312581;,atalcott
1286923,2020-05-13 15:07:53 -0800,2020-05-13T15:07:53Z,"When I clicked the RECORD button in an e-mail, a box dropped down in which I clicked DON'T ALLOW, and now I can't record — HOW TO UNDO THIS?","<p>I have said it all in the question above. How can I go back and ALLOW whatever I said NO to, so I can record a video? </p><p>My question from above: When I clicked the RECORD button in an e-mail, a box dropped down in which I clicked DON'T ALLOW, and now I can't record — HOW TO UNDO THIS? </p><p>Thanks, Carol </p>",other;desktop;firefox-760;mac-os;,firefox,other,en-US,"",carolkuz
1286922,2020-05-13 15:01:40 -0800,2020-05-13T18:03:20Z,ALL my bookmarks and history disappeared!!!!   I have added NOTHING new...just opened my browser and nothing!,"<p>I have used Firefox for years. I had my browser open and minimized. When I maximized it, ALL bookmarks and history had disappeared! I have added nothing new! </p>",other;firefox-7601;desktop;firefox-760;windows-10;,firefox,other,en-US,1312554;,DrRitaDrama
1286921,2020-05-13 14:55:47 -0800,2020-05-13T14:55:47Z,Webroot extension missing from Firefox 76,"<p>I updated to Firefox 76.0.1 (64-bit) and now the Webroot Filtering Extension has disappeared. I ran a search for the Webroot extension in Add Ons, but the only result is for some weird ""Theme,"" not the actual extension. Please help! </p>",customize;desktop;firefox-760;windows-10;,firefox,customize,en-US,"",PEB1130
1286919,2020-05-13 14:50:48 -0800,2020-05-13T14:50:48Z,How to unenroll from the macOS Firefox Beta and move from the beta back to release update channel?,"<p>Reinstalling the Firefox application in the macOS way (move Firefox.app from the application folder into trash and move a current (non Beta Version of) Firefox into the application folder) does not work. Firefox somehow remembers that the Beta Channel is active. It will update to the recent Beta on startup/restart. </p><p>I did not try to remove all files created by Firefox, as I do not want to loose my current profile. </p><p>While there seems to be documentation about working with multiple versions of Firefox or how to work with multiple profiles: I am not interested in installing multiple versions of Firefox simultaneously or work with multiple profiles.  </p><p>I simply want to replace my Firefox Beta with the current release... (There may be a problem with profiles being not compatible with an older version of Firefox. However, I feel like it should be possible to stay on the Beta (without updating) until a newer version releases in the release channel to avoid this issue.) </p><p>There does not seem to be any documentation on how to unenroll from the Firefox Beta on macOS. (I googled / used duckduckgo a lot (I searched for a solution every now and then over the time span of multiple months) and nothing relevant turned up.) </p><p>PS: Good job on Firefox for macOS; it replaced safari (which had deprecated a lot of addons at that time) as soon as the beta with improved (macOS) battery life released (the reason why I installed a beta version.) </p>",download-and-install_1;firefox-770;beta;desktop;mac-os;,firefox,download-and-install,en-US,"",maffinmaffinmaffinmaffin
1286918,2020-05-13 14:39:19 -0800,2020-05-13T18:08:09Z,Firefox crashes,"<p>my tabs are still crashing even though i already restarted firefox in safe mode. </p><p>report id: </p><p>bp-f0968be8-d936-4e87-8500-bd2d70200513 	5/14/2020, 5:20 AM 	 </p><p>bp-867e1bb6-c70e-4b1a-8767-9b16e0200513 	5/14/2020, 5:31 AM 	 </p><p>bp-f1506b15-3972-4c09-a34c-81a590200513 	5/14/2020, 5:31 AM 	 </p><p>bp-02ac6b41-bfdb-4709-9549-369300200513 	5/14/2020, 5:31 AM 	 </p><p>bp-36f43b7a-bc14-4127-9932-cadf40200513 	5/14/2020, 5:31 AM 	 </p><p>bp-b3e3cbbd-2073-4fb4-9846-b57690200513 	5/14/2020, 5:31 AM 	 </p><p>bp-da544e61-e9fa-4032-b612-36a450200513 	5/14/2020, 5:31 AM 	 </p><p>bp-499967a1-4b4e-489e-ad0f-ec19f0200513 	5/14/2020, 5:31 AM 	 </p><p>bp-79f8c52a-951c-4efa-a849-a95d90200513 	5/14/2020, 5:31 AM 	 </p><p>bp-f98cc147-1055-497e-80ee-537450200513 	5/14/2020, 5:31 AM 	 </p><p>bp-cd1024ba-37eb-40a3-a319-942df0200513 	5/14/2020, 5:31 AM 	 </p><p>bp-c5ee5dea-d498-47e2-9559-1b3fd0200513 	5/14/2020, 5:31 AM 	 </p><p>bp-1893964f-a311-4d38-8395-cb72f0200513 	5/14/2020, 5:31 AM 	 </p><p>bp-cdb784de-1a6d-4964-ba42-5a2750200513 	5/14/2020, 5:31 AM </p>",fix-problems;firefox-7601;desktop;firefox-760;windows-10;,firefox,fix-problems,en-US,1312555;1312556;,ariannedesdemona
1286917,2020-05-13 14:21:05 -0800,2020-05-13T20:59:21Z,Zmizelo tlačítko plus,"<p>Dobrý den,  zmizelo mi tlačítko plus pro otevření nové záložky. </p>",tabs;desktop;,firefox,tabs,cs,1312543;1312570;,jfred1
1286916,2020-05-13 14:16:38 -0800,2020-05-13T18:11:20Z,Firefox will not open . Firefox shows in taskbar but will not open. Have tried to delete C:\Program Files (x86)\Mozilla Firefox but will not delete because open,<p>Firefox will not open. It shows in the taskbar as being open but it refuses to open up from there. So I am trying to start with a freshly installed Firefox. I downloaded that with no problem. Then I tried to deleting the old by deleting C:\Program Files (x86)\Mozilla Firefox but the file will not completely delete because it says it is still open. I right click on the Firefox indication area in the taskbar and click on close. But it will not close. So I'm stuck between open and close and delete and nothing will work.  I did succeed in deleting 73% of the files but no more than that because it tells me it's still open. Please tell me what other tricks are there? </p>,other;desktop;,firefox,other,en-US,1312557;,hudiburg
1286915,2020-05-13 14:13:25 -0800,2020-05-13T14:13:25Z,Upper border of window going into second monitor,"<p>When I click Maximize on Firefox when it's in my main monitor (My middle of 4), the top border of the window goes into the second monitor above my main monitor, cutting off the bottom 5-10 pixels of any program I put there. It doesn't block the task bar, but any normal program like a browser window or music playing app gets cut off at the bottom. I'm not sure how to fix this. All monitors are at their native 1080p settings. Further, when I fullscreen a YouTube video in the main monitor window, the border goes away and no longer cuts off the bottom of the second monitor. </p><p>I'd provide a screenshot, but it doesn't translate well in picture without the physical monitor borders being there. Any help would be great, thanks </p>",other;desktop;firefox-760;windows-10;,firefox,other,en-US,"",aetheora
1286914,2020-05-13 13:56:28 -0800,2020-05-13T20:57:26Z,Quiero ver contraseñas pero me pide contraseña! Como lo inhabilito?,"<p>Quiero ver mis contraseñas guardadas pero con esta actualización FF v76 al ingresar a ""inicios de sesión y contraseñas"" al querer ver la contraseña de determinado sitio ME PIDE la contraseña para ver la contraseña...es bastante molesto, como quito eso? </p>",privacy-and-security_1;desktop;firefox-760;windows-10;,firefox,privacy-and-security,es,1312569;,jimbohijin
1286913,2020-05-13 13:42:21 -0800,2020-05-13T13:42:21Z,click & drag is unresponsive on webpages displaying oversized images,"<p>Best example is the scanned documents you can view on <a href=""http://Ancestry.com"" rel=""nofollow"">Ancestry.com</a> </p><p>After looking at several, I lose the ability to L click, hold &amp; drag the image around the screen in order to view various sections of the doc. </p>",other;desktop;firefox-760;windows-7;,firefox,other,en-US,"",jsaupp
1286912,2020-05-13 13:31:50 -0800,2020-05-13T14:18:50Z,How do I find history of DuckDuckgo searches in Firefox with win10,"<p>I have read an article that says to click the three (dots) lines, click ""more"" and history of searches will be there. I find no such thing! Is this a firefox problem or DuckDuck go problem? Please help. </p>",other;desktop;firefox-760;windows-10;,firefox,other,en-US,1312541;,im4ou1
1286911,2020-05-13 13:09:35 -0800,2020-05-13T14:07:15Z,"Firefox will not open and I cannot uninstall it.  Both result in the following error message:  Windows cannot access the specified device, path, or file.","<p>I've looked for solutions, and none work.  (Can't change permissions:  Failed to enumerate objects in the container.  Access is denied.) </p><p>There was an issue yesterday with Firefox going through an update every time I opened the browser.  It worked for a short time this morning with the same update issue.  Later on, the icon changed from the logo to something else and I can no longer do anything with it. </p>",desktop;fix-problems;,firefox,fix-problems,en-US,1312540;,themike314
1286910,2020-05-13 12:58:17 -0800,2020-05-13T13:26:35Z,"What is ""media.volume_scale"" ?  Note: using Firefox Developer version.","<p>For controlling volume of embedded videos in web pages, there are two config adjustments. </p><p>media.default_volume media.volume_scale </p><p>Please explain their use and settings. </p>",firefox-770;beta;customize;desktop;windows-81;,firefox,customize,en-US,1312533;,kaosmax4u
1286909,2020-05-13 12:58:13 -0800,2020-05-13T12:58:13Z,Cloudflare is everywhere on mozilla.org ...,"<p>Hello, </p><p>I am very surprised that the <a href=""http://mozilla.org"" rel=""nofollow"">mozilla.org</a> website now hosts a very large portion of its interface on <a href=""http://cloudflare.net"" rel=""nofollow"">cloudflare.net</a>, a notorious tracker. Firefox is getting a lot of features for blocking such trackers ... so where is the coherence ? Is it somehow safe (in terms of privacy) to not block cloudflare on Firefox ? </p><p>Cheers </p>",privacy-and-security_1;desktop;firefox-760;windows-10;,firefox,privacy-and-security,en-US,"",Fffred
1286908,2020-05-13 12:54:43 -0800,2020-05-13T13:43:53Z,I received notice that an egov.ice.gov site will no longer support FireFox by August -- how do I get more info or invite reexamination of this decision?,"<p>For work I use a site at <a href=""http://egov.ice.gov"" rel=""nofollow"">egov.ice.gov</a> </p><p>Today, I received this notification: </p> <h5 id=""w_begin"">BEGIN====</h5> <p>On Monday, Aug. 3, 2020, the Student and Exchange Visitor Program (SEVP) will make changes to the way a user connects to The Student and Exchange Visitor Information System (SEVIS) via browsers and batch software/middleware.  The most notable of these impacts will be the complete lack of support for the Firefox browser. On Monday, Aug. 3, 2020, all versions of Firefox going back to at least v31.3.0 will cease to connect to the SEVIS websites. SEVP recommends the use of either Chrome or Internet Explorer (IE) browsers.  </p> <h5 id=""w_end"">END==========</h5> <p>I send notices to the SEVP helpdesk asking for more information, but I really do not understand the rationale behind this decision. Is there a group at Mozilla that is interested in this kind of issue? </p>",other;desktop;firefox-760;linux;,firefox,other,en-US,1312536;,wmorse
1286906,2020-05-13 12:19:23 -0800,2020-05-13T12:43:09Z,using firefox/google chrome on a domain,<p>We just upgraded to windows 10 and it has been a rocky road to normalcy. My IT department uses Quest for everything. Quest SMA and SDA along with Desktop Authority. The CIO decided they didn't like Edge and wanted to move to a new browser. They did this 2 days before we go live. The question is how do i make  firefox import the Bookmarks. So many articles say try the adm admx files. Tried that..failed. They create a registry entry for it but there not used. I tried finding the file location but firefox has some odd profile naming that changes the folder name. That and the location from the articles doesn't have the file it says to open. As of now I am just lost. I'm not sure how to complete this task of adding bookmarks or the Home Page. I was able to get them setup as the default browser but without the bookmarks or favorite its all moot. We have over 300 users and they are about 3 weeks away from coming back to work. I need a solution or i will have to force them to use Edge(no one wants that even web sites hate edge.). Any assistance would be greatly appreciated. </p>,bookmarks;desktop;,firefox,bookmarks,en-US,1312527;,jeremy.beegle
1286905,2020-05-13 12:03:39 -0800,2020-05-13T18:25:47Z,Sync didn't restore my data after installing new Windows 10 & Firefox,"<p>I assumed sync feature backup my bookmarks and saved passwords and I can readily access them in my new windows! As other browsers does this routinely. So I'd synced in my previous Firefox account just before installing new Windows 10. Now, I cannot access any data of my account. </p><p>How can I restore them? </p>",sync;desktop;firefox-760;windows-10;,firefox,sync,en-US,1312535;1312542;1312560;,aliakbarj
1286904,2020-05-13 11:59:48 -0800,2020-05-13T12:36:36Z,Why does my password work to sign in here but now I have to enter it to see saved passwords & it doesn't work?,"<p>Why was there NO WARNING FROM FIREFOX THAT I WASN'T GOING TO BE ""ALLOWED"" TO SEE MY OWN PASSWORDS STORED BY FIREFOX.    Suddenly today in order to see my saved passwords I have to enter my Firefox password.   I just changed my password successfully a half hour ago and I can use it to sign in here but when I enter the same password to see my  saved passwords it doesn't work. </p><p>I stupidly relied on Firefox to have my passwords available to me but now I can't see them and so I'm locked out of EVERY ONLINE SITE I VISIT (over 50 sites).   THANKS FOR NOTHING FIREFOX for screwing up my  life.  HOW CAN I GET ACCESS TO ALL MY PASSWORDS that UNTIL TODAY I could see.   This is insane. </p>",sync;firefox-7601;desktop;firefox-760;mac-os;,firefox,sync,en-US,1312512;1312518;1312524;1312525;,kcsummer111
1286902,2020-05-13 11:49:05 -0800,2020-05-13T12:51:49Z,Back button not working for this URL,"<p>URL - https://cms.netlify.app/#/collections/posts Go to your search engine and then find the above URL, click into it. Now you can't go back to the search page, no matter how many times you click the back button. </p><p>This used to be javascript tricks done by malicious websites in older days, but I thought modern browsers take care of these behaviors? </p>",websites;desktop;firefox-760;windows-10;,firefox,websites,en-US,1312528;,hirak1984
1286900,2020-05-13 11:22:11 -0800,2020-05-13T12:16:53Z,"Starting today (May 13 2020), I cannot log into Microsoft Outlook on Firefox.","<p>Starting today, I cannot log into Microsoft Outlook on Firefox. It works fine on other browsers, but I would like to be able to use Firefox for email. The error code is:  </p><p><br> AADSTS50011: The reply URL specified in the request does not match the reply URLs configured for the application: '[letters and numbers]'.  </p><p><br> I can log in for a second, but then it logs me out almost immediately. I already tried turning the Enhanced Tracking Protection on and off (since I believe Firefox just recently updated that). But it doesn't make a difference. I also tried doing the ""Firefox Refresh"", but that didn't help either.  </p><p><br> Any ideas? Thank you!! </p>",fix-problems;desktop;firefox-760;windows-10;,firefox,fix-problems,en-US,1312517;,julianna.m.butler
1286899,2020-05-13 11:12:13 -0800,2020-05-13T12:24:23Z,Outlook Logging me out after a few seconds.,"<p>I get this error code when I try to log into Outlook from firefox. No other browser does this. I've cleared cache and restarted computer. Tried it on fresh Firefox install, and checked my Azure AD application settings (no registered apps).  </p><p>Sorry, but we’re having trouble signing you in. AADSTS50011: The reply URL specified in the request does not match the reply URLs configured for the application: 'xxxxxxxx...' </p><p>Any ides? </p>",websites;desktop;,firefox,websites,en-US,1312497;1312498;1312505;1312515;1312521;,curtis.aloia
1286898,2020-05-13 11:01:20 -0800,2020-05-13T11:28:28Z,"I'm on Firefox release 76 - I need to create a backup of my bookmarks to import to another PC, but I can't find an Export option in the Library menu.",<p>There's no Export option on my Library menu - although there's an Import. I also can't see a Backup. I need to create a file of my bookmarks - how can I do this? </p>,bookmarks;firefox-7601;desktop;firefox-760;windows-10;,firefox,bookmarks,en-US,1312501;,Chrislongman
1286896,2020-05-13 10:30:00 -0800,2020-05-13T12:25:59Z,The bookedmark link I've been using for Outlook that worked yesterday no longer works.  It sends a Redirect.  The same link continues to work on other browsers.,"<p>Request Id: 1168dfed-a803-4696-be54-37eac7343200 Correlation Id: 15516a83-6ad9-48b2-957f-c988aa2e3bc0 Timestamp: 2020-05-13T17:13:47Z Message: AADSTS50011: The reply URL specified in the request does not match the reply URLs configured for the application: 'e48d4214-364e-4731-b2b6-47dabf529218'. </p><p>This is the message that came up for me to copy to the administrator.  Does this help? </p><p>When I use the same <a href=""https://outlook.office.com/mail/inbox"" rel=""nofollow"">https://outlook.office.com/mail/inbox</a> on Chrome or Edge, it works fine, but I prefer to use Firefox. </p>",fix-problems;desktop;firefox-760;windows-10;,firefox,fix-problems,en-US,1312494;1312504;1312522;,hpic913
1286895,2020-05-13 10:21:20 -0800,2020-05-13T12:23:46Z,Any way to stop sync asking for MP sign in at every boot,"<p>I'm thinking thinking this is probably a lost cause, but here goes... Is there any way to stop FF Sync from asking my Password (oligarch password) at every boot.  I'm usually in the middle of something when 'pop', the dialog box decides to open, and I have to stop and sign in with my MP to continue.  Can't sync leave a cookie or something and remember who I am from one session to the next?  I am the sole user of the machine. </p>",sync;desktop;firefox-760;windows-10;,firefox,sync,en-US,1312500;1312520;,clutch
1286894,2020-05-13 10:19:55 -0800,2020-05-13T11:32:42Z,saving pages exactly as they appear on website,"<p>When I want to save a page exactly as it appears on a website, I right click on it and then click ""Save page as"" and put it into a folder on my desktop. When I go to the desktop folder and click on what I've saved, all I see is a whole list of meaningless files and no page as viewed on website. How do I save the page as it appears on the website and why don't you have a ""save as"" option like other programs, browsers and platforms do? </p>",other;desktop;firefox-760;windows-10;,firefox,other,en-US,1312496;1312502;1312503;,ALSLAW275
1286893,2020-05-13 10:18:52 -0800,2020-05-13T10:18:52Z,FireFox used to allow docking of a separate window back as a tab in an existing window but doesn't anymore - how do I get this back?,"<p>I have a FireFox window open, and I launch a portal from it which causes a new window to open. I do have ""Open links in tabs instead of new windows"" ticked in FF settings. FF used to allow me to dock the window as a tab in the original window just by clicking and dragging it to the tab area but for some reason it doesn't allow that anymore. How do I get that back? Or is there another way to ensure new windows open as tabs when clicking a function in the original window? </p>",tips;desktop;,firefox,tips,en-US,"",salazone
1286892,2020-05-13 10:03:09 -0800,2020-05-13T12:41:21Z,Can't find dictionary in context menu,"<p>I have the latest English United States Dictionary extension installed and it works for spellcheck OK. Is there a way to use the dictionary to look up a definition? I have tried several extensions, but they all require linking to and opening a separate page. I'm used to the ability in Safari to look up a definition in the context menu. Is that possible with Firefox? </p>",firefox-7601;customize;desktop;firefox-760;mac-os;,firefox,customize,en-US,1312507;1312523;1312526;,kcreary
1286890,2020-05-13 09:29:57 -0800,2020-05-13T09:29:57Z,Why won't Firefox run the Paperless Printer program any longer?,<p>When I click print in Firefox and chose Paperless Printer it would start and run the program. By doing this I save on paper and ink plus I can save in any format that Paperless Printer has. It used to work until approximately a month ago. Paperless Printer still works in I.E. and MS Edge. I've reinstalled P.P. and I also tried refreshing Firefox but nothing helped. Paperless Printer shows as a printer in the list and when chosen the PP program would open up and take over the printing needs and then just store the created file. Now Firefox starts to ready the page(s) to print but PP doesn't open up. </p>,other;firefox-7601;desktop;firefox-760;windows-7;,firefox,other,en-US,"",jimmay2
1286889,2020-05-13 09:27:19 -0800,2020-05-13T10:00:22Z,Chrome:// URI path for an icon in omni.ja,"<p>URI paths can be used to access internal resources in Firefox.  </p><p>For example, the URI: <strong>chrome://mozapps/skin/extensions/rating-won.png</strong> relates to the real physical folder path of: <strong>... /omni.ja!/chrome/toolkit/skin/classic/mozapps/extensions/rating-won.png</strong> </p><p>What is the <strong>chrome://</strong> URI for the this particular icon?: <strong> ... /omni.ja!/contentaccessible/html/folder.png</strong> </p><p>It is higher up the tree than the usual top-level items, and I can't figure out the correct chrome URI for it. </p>",firefox-740;desktop;tips;windows-7;,firefox,tips,en-US,1312483;,Quisquose
