id,created,updated,title,content,tags,product,topic,locale,answers,creator
1287434,2020-05-19 05:26:45 -0800,2020-05-19T14:21:05Z,cannot acces my account on a website,"<p>a website () states ""<a href=""http://Academia.edu"" rel=""nofollow"">Academia.edu</a> no longer supports Internet Explorer."" please upgrade your brower. Yet this does not help: i can nolonger enter into of said website my account. What ever I try; the website repeats said message in a plain document front and face. </p>",websites;desktop;firefox-760;windows-10;,firefox,websites,en-US,1313971;1313980;1313987;1314006;1314016;1314033;1314049;1314117;,Bartholo77
1287432,2020-05-19 05:19:36 -0800,2020-05-19T06:38:23Z,Bookmarks are gone,"<p>I opened firefox and it said that I had an older version and that i should create a new profile online so i did that and logged in.  I use firefox everyday and had never seen this message before.  I created the new profile and logged in and all my bookmarks are gone.  I went to about:profiles and it shows 2 profiles but only the ones that i created yesterday.  Oddly, i don't ever remember creating a profile before this.  I would just open up firefox and it worked like a normal browser. Now that I have a profile the bookmarks aren't there.  Thanks for your help. </p>",bookmarks;desktop;firefox-680;windows-10;,firefox,bookmarks,en-US,1313986;,afav1
1287431,2020-05-19 05:11:29 -0800,2020-05-19T08:26:07Z,"Netflix don't work after update, but with new FF-profile it does","<p>Ok, so I just discovered that my netflix isnt working right since the latest firefox update. When I say it isnt working, I mean there are no preview videos if you hoover your cursor over a watchable object, and if you actually click to play something it goes to the selected show and display a red rotating everlasting ""loading""-ring, without any percentage and there never are any error codes. </p><p>I figured I would try a rollback and did so, only to learn about new firefox profiles. I lost all my addons and settings etc, but netflix worked. Went back to the newest version and my old profile, created a new profile - netflix works.  </p><p>Why not just create a new profile? Well I have many years of addons and preference-changes that would be lost, and frankly its a bloody drag to deal with something like that. </p><p>Is there any way to try to pinpoint the problem here? Ive tried all the googleable stuff, made sure DRM content settings are active etc. etc. Nothing really changed from my side except the new update. </p>",websites;desktop;firefox-760;windows-10;,firefox,websites,en-US,1313989;1314011;,dontopenthat
1287430,2020-05-19 05:07:52 -0800,2020-05-19T05:56:15Z,uBlock prevented loading of some images,<p>I have been having a problem that started a few weeks back. On some websites I could not load some images. Spent a good deal of time trying to fix the issue but to no avail. Tried most everything suggested. Finally disabled uBlock and all works fine now. I thought starting in the safe mode would disable uBlock but apparently it did not. When I disabled it manually it worked. Now I need to find a replacement ad blocker. </p>,privacy-and-security_1;desktop;firefox-760;windows-10;,firefox,privacy-and-security,en-US,1313970;1313976;,tom3holer
1287429,2020-05-19 04:57:15 -0800,2020-05-19T04:57:15Z,Additional Tabs Close Occasionally After Address is Entered,"<p>Just wondering if anyone else is having the same issues, every so often, when I open a new tab and enter a website name and hit enter the tab closes and returns me to the main tab that I had open. It never happens twice in a row and is often unpredictable when it happens. Unsure if it is a bug or just some setting that might be causing it? I am using an up-to-date browser in a windows 10 environment. Thanks for any comments or suggestions. </p><p>- R. </p>",tabs;desktop;firefox-760;windows-10;,firefox,tabs,en-US,"",rylium
1287428,2020-05-19 04:56:26 -0800,2020-05-19T05:19:17Z,"On Startup, I only want one tab to appear on my page. about 12 tabs always come up. I can't figure out why?",<p>I'm trying to open just one tab when I open Mozilla browser. I can't figure out why multiple tabs keep coming up.  </p><p>Many Thanks (in advance) for your help. </p><p>Chuck </p>,tabs;desktop;firefox-760;linux;,firefox,tabs,en-US,1313963;1313965;,sailhopc
1287427,2020-05-19 04:48:51 -0800,2020-05-19T04:48:51Z,My extension setting is gone after sync with firefox developer on same PC,"<p>Hi, I use the <a href=""https://addons.mozilla.org/en-US/firefox/addon/selection-context-search/"" rel=""nofollow"">Selection Context Search</a> extension and had a lot of custom search providers defined for it. It's some hours that I synced my Firefox on PC with the first-used Firefox Developer on same PC. Both are Portable versions from <a href=""http://portableapps.com"" rel=""nofollow"">portableapps.com</a>. I also set the services.sync.prefs.sync.browser.uiCustomization.state = true to sync toolbar customizations. </p><p>Now, I found out all my custom search providers are gone, neither exists on Firefox nor Firefox Dev. Unfortunately I wasn't yet able to find an exported setting file for my extension.  </p><p>Is it possible to somehow recover settings of this specific extension from profile or somewhere? </p><p>Thanks </p>",customize;desktop;firefox-760;windows-7;,firefox,customize,en-US,"",iriman
1287426,2020-05-19 04:46:32 -0800,2020-05-19T05:19:16Z,recover bookmarks,<p>How do I recover bookmarks? </p>,bookmarks;desktop;firefox-760;windows-10;,firefox,bookmarks,en-US,1313958;1313964;,rickdellenbach
1287425,2020-05-19 04:46:24 -0800,2020-05-20T07:24:40Z,maximal upload rate (+download),"<p>Hi! I've just tested my fiber connection (<a href=""http://free.fr"" rel=""nofollow"">free.fr</a>) and with Edge Chromium 81 the upload rate (nperf) is 100 Mbits/s faster than with firefox 76. </p><p>On the same server at the same time or nearly. Is it normal? Can I improve the score with firefox? thanks! </p>",fix-problems;desktop;firefox-760;windows-10;,firefox,fix-problems,en-US,1313993;1313997;1314254;1314255;1314260;,whatiskwt
1287424,2020-05-19 04:42:33 -0800,2020-05-19T05:20:12Z,is free spin prize a fraud?,<p><strong>bold text</strong> </p>,other;desktop;,firefox,other,en-US,1313966;,longmanenglish55
1287423,2020-05-19 04:10:44 -0800,2020-05-19T04:20:23Z,ERROR CONNECTION,<p>error connection feield </p>,download-and-install_1;desktop;firefox-760;windows-7;,firefox,download-and-install,en-US,1313942;,kavir14feb2000
1287422,2020-05-19 04:01:24 -0800,2020-05-19T05:59:31Z,Open bookmark as pinned tab,"<p>I am looking to a way to open specific bookmarks open as pinned tab. If there is no way, accept this as a feature request which can add an option in bookmark properties to enable this bookmark open as pinned tab instead normal tab. Thanks. </p>",bookmarks;desktop;firefox-760;linux;,firefox,bookmarks,en-US,1313978;,amirhossein7464
1287421,2020-05-19 04:01:00 -0800,2020-05-20T05:13:57Z,"Remove ""http:/website -- visit"" link from address bar","<p>Hello, I'm having a problem with the address bar that is driving me insane and I hope someone here can help me... </p><p>I am used to visiting facebook by typing in ""fb"" in the address bar and then clicking on the first link in google. I know, not the fastest way to reach facebook, but I just got used to it too much... </p><p>However, few days ago, firefox started asking me (in a ribbon popup under the toolbar) something along the lines of ""Do you want to go to fb instead?"" (not 100% sure if this was the exact question) and sometime later I stupidly clicked ""Yes"". Now whenever I type in address bar ""fb"" and hit enter, it automatically goes to http://fb/, which of course is a bad link and I only get to a page of my ISP??. </p><p>What is going on? how do I delete this visit link? I spent whole day searching on google and trying various accepted answers that suggest editing userChrome.css or toggling some settings in about:settings. None of these solutions work for me. Farthest I got was with editing the .css so that the visit link is hidden, but in reality the link is still there and when I hit enter it still takes me to the http://fb/ site. </p><p>Thank you and cheers! </p>",customize;desktop;firefox-760;windows-10;,firefox,customize,en-US,1313999;1314224;1314232;,rok.goljat
1287420,2020-05-19 03:51:24 -0800,2020-05-19T04:21:38Z,Why I can't open this website in Mozila Firefox?,"<p>I am trying to open this website <a href=""https://www.dermavilla.com/"" rel=""nofollow"">https://www.dermavilla.com/</a> in Mozilla Firefox, but it can't open. I am getting error your connection is not secure. The connection to <a href=""https://www.dermavilla.com/"" rel=""nofollow"">https://www.dermavilla.com/</a> was interrupted while the page was loading. </p>",websites;desktop;firefox-760;windows-81;,firefox,websites,en-US,1313945;,bhagyashreegupte3
1287419,2020-05-19 03:51:10 -0800,2020-05-19T08:57:17Z,Firefox keeps crashing after installing Netnanny Version 10,"<p>Hi  </p><p>I recently installed NetNanny Version 10 on my laptop. After the installation, every time I open Firefox it will crash and close within 5 seconds.  As soon as I uninstall NetNanny, Firefox will go back to normal. </p><p>I tried uninstalling and re-installing Firefox (V76.0.1, 64-bit) and re-installing NetNanny but the same keeps happening over and over.  Note I also 'disable' NetNanny temporarily, however Firefox will still crash.    </p><p>I will appreciate some help with this. </p><p>Thanks and regards jB </p>",fix-problems;firefox-7601;desktop;firefox-760;windows-10;crash;escalate;bug_1;,firefox,fix-problems,en-US,1313946;1313955;1314018;,jebetancur
1287418,2020-05-19 03:48:33 -0800,2020-05-19T14:59:33Z,most of my css files are not working in firfox but loaded.the same css are working fine in chrome,"<p>hi i'm trying to open my website in firefox but the problem is many css files are not loading in firefox.but there is no issue in loading them. they are loaded in the page but not working.the same files and css inside are working well in chrome.here i give my website link please someone open it in both firefox and chrome and assist me where it goes wrong.<a href=""https://www.office-deals.nl/"" rel=""nofollow"">https://www.office-deals.nl/</a> . i have added 2 images below for showing particularly one content from many.the black bg is the chrome image and the white is for the <a href=""http://firefox.in"" rel=""nofollow"">firefox.in</a> black i have a class named owl-item where the corresponding css from owl-carousel.css  are loaded fine .but in white bg image the css is not displaying but the files are loaded in the page. i give you the structure of my files that i have in my header. </p><p><br> </p><pre>      &lt;link rel=""dns-prefetch"" href=""//<a href=""http://www.google.com"" rel=""nofollow"">www.google.com</a>""&gt;        &lt;link rel=""dns-prefetch"" href=""//<a href=""http://www.google.nl"" rel=""nofollow"">www.google.nl</a>""&gt;        &lt;link rel=""dns-prefetch"" href=""//<a href=""http://www.google-analytics.com/"" rel=""nofollow"">www.google-analytics.com/</a>""&gt;        &lt;link rel=""dns-prefetch"" href=""//<a href=""http://www.googletagmanager.com"" rel=""nofollow"">www.googletagmanager.com</a>""&gt;        &lt;link rel=""dns-prefetch"" href=""//<a href=""http://connect.facebook.net"" rel=""nofollow"">connect.facebook.net</a>""&gt; </pre> <pre>       &lt;link rel=""preconnect"" href=""//<a href=""http://www.google.com"" rel=""nofollow"">www.google.com</a>"" crossorigin&gt;        &lt;link rel=""preconnect"" href=""//<a href=""http://www.google.nl"" rel=""nofollow"">www.google.nl</a>"" crossorigin&gt;        &lt;link rel=""preconnect"" href=""//<a href=""http://www.google-analytics.com/"" rel=""nofollow"">www.google-analytics.com/</a>"" crossorigin&gt;        &lt;link rel=""preconnect"" href=""//<a href=""http://www.googletagmanager.com"" rel=""nofollow"">www.googletagmanager.com</a>"" crossorigin&gt;        &lt;link rel=""preconnect"" href=""//<a href=""http://connect.facebook.net"" rel=""nofollow"">connect.facebook.net</a>"" crossorigin&gt;                &lt;link rel=""stylesheet"" href=""<a href=""https://css.office-deals.nl/bootstrap.min.css"" rel=""nofollow"">https://css.office-deals.nl/bootstrap.min.css</a>""&gt;        &lt;link rel=""stylesheet"" href=""<a href=""https://css.office-deals.nl/main.css?v=2.1"" rel=""nofollow"">https://css.office-deals.nl/main.css?v=2.1</a>""&gt; </pre> <p>	&lt;link rel=""preload"" href=""ext/assets/css/font-awesome.min.css"" as=""style"" onload=""this.rel='stylesheet'""&gt; </p><pre>       &lt;link rel=""preload"" href='<a href=""https://fonts.googleapis.com/css?family=Open+Sans&amp;display=swap'"" rel=""nofollow"">https://fonts.googleapis.com/css?family=Open+Sans&amp;display=swap'</a> as=""style"" onload=""this.rel='stylesheet'""&gt;        &lt;link rel=""preload"" href=""<a href=""https://css.office-deals.nl/owl.carousel.css"" rel=""nofollow"">https://css.office-deals.nl/owl.carousel.css</a>"" as=""style"" onload=""this.rel='stylesheet'""&gt;        &lt;link rel=""preload"" href=""<a href=""https://css.office-deals.nl/owl.transitions.css"" rel=""nofollow"">https://css.office-deals.nl/owl.transitions.css</a>"" as=""style"" onload=""this.rel='stylesheet'""&gt;        &lt;link rel=""preload"" href=""<a href=""https://css.office-deals.nl/animate.min.css"" rel=""nofollow"">https://css.office-deals.nl/animate.min.css</a>"" as=""style"" onload=""this.rel='stylesheet'""&gt; </pre>                  &lt;link rel=""preload"" href=""<a href=""https://css.office-deals.nl/bootstrap-multiselect.css"" rel=""nofollow"">https://css.office-deals.nl/bootstrap-multiselect.css</a>"" as=""style""  onload=""this.rel='stylesheet'""&gt;                              &lt;script src=""<a href=""https://js.office-deals.nl/jquery-1.10.2.min.js"" rel=""nofollow"">https://js.office-deals.nl/jquery-1.10.2.min.js</a>""&gt;&lt;/script&gt;                                                                &lt;link rel=""apple-touch-icon"" sizes=""180x180"" href=""favicons/apple-touch-icon.png""&gt;     &lt;link rel=""icon"" type=""image/png"" sizes=""32x32"" href=""/favicons/favicon-32x32.png""&gt;     &lt;link rel=""icon"" type=""image/png"" sizes=""16x16"" href=""/favicons/favicon-16x16.png""&gt;     &lt;link rel=""manifest"" href=""/favicons/site.webmanifest""&gt;     &lt;link rel=""mask-icon"" href=""/favicons/safari-pinned-tab.svg"" color=""#86c341""&gt; ",websites;desktop;firefox-760;windows-10;,firefox,websites,en-US,1313941;1313944;1314133;,jeenussvd
1287416,2020-05-19 03:31:12 -0800,2020-05-19T11:41:55Z,History doesn't capture all sites,"<p>For some reason my firefox history is always incomplete. E.g. when I search for something on duckduckgo and then visit stackoverflow, it often doesn't add the visited page (in this case stackoverflow) to the history. </p>",websites;desktop;firefox-760;linux;,firefox,websites,en-US,1314055;,xerusx
1287414,2020-05-19 03:17:46 -0800,2020-05-19T09:49:44Z,"Firefox is already running, but is not responding. The old Firefox process must be closed to open a new window.","<p>I've already scanned the old threads with no progress so lets try again. I have a few tabs open on ff. Its working fine, it has NOT crashed. I can copy a link from an email in thunderbird and paste it into ff and a new tab will open to that page.  I can click a link in a document and the tab &amp; page will open. </p><p>However if I just click the link in thunderbird - hey presto ""Firefox is already running, but is not responding. The old Firefox process must be closed to open a new window."" </p><p>It seems TB is not handling the link properly (it always used to!) However the various TB ""fixes"" I can find are either inscrutable, wrong or just dont work. </p><p>Has anyone fixed this? </p>",desktop;fix-problems;,firefox,fix-problems,en-US,1313948;1314036;,johnlerrington1
1287412,2020-05-19 02:58:39 -0800,2020-05-19T02:58:39Z,Top Sites grid reshape,"<p>Hi, </p><p>I use a 3x8 grid of top sites as my home page / new tab page. However, I usually split windows to half of the screen size, and when doing that the grid becomes 3x6 and some sites simply disappear! </p><p>Why not simply reshape the grid by adding extra rows? It would seem the most logical design choice, but I cannot find any setting or extension to do it. </p><p>Also, I feel like the tiles should be resizable since they look a bit small in high-resolution screens, but that's a different topic. </p><p>I don't know if this is the right place to post this, if it is not then please tell me where I should do it. </p>",customize;desktop;firefox-760;linux;,firefox,customize,en-US,"",mrosello
1287411,2020-05-19 02:53:32 -0800,2020-05-19T04:27:38Z,master password,<p>Sign in without master password </p>,other;desktop;,firefox,other,en-US,1313949;,debbielynncb7
1287410,2020-05-19 02:48:56 -0800,2020-05-19T04:29:01Z,Hacker,<p>How do hacker user n pasword </p>,tips;desktop;,firefox,tips,en-US,1313950;,muhammadhariz1375
1287408,2020-05-19 02:40:14 -0800,2020-05-19T15:03:46Z,"when I select bookmark, my homepage opens (sporadic)","<p>Please let me know if anyone has knowledge of this.  When I click on a bookmark, sometimes(more and more often) it just opens my homepage. </p>",bookmarks;desktop;firefox-760;windows-10;,firefox,bookmarks,en-US,1313953;1314134;,truex14
1287407,2020-05-19 02:25:36 -0800,2020-05-19T12:48:56Z,lost bookmarks,<p>I rebooted my computer and all my bookmarks disappeared. I looked for instructions on line but they don't apply to my computer. It says to click on library then bookmarks then restore . I do not have those options. there is no restore button. Why don't they fix this problem. I have wasted an hour and still don't have my book marks back. I have logged in twice. </p>,bookmarks;firefox-730;desktop;mac-os;,firefox,bookmarks,en-US,1314071;,jim1951
1287406,2020-05-19 02:08:12 -0800,2020-05-19T05:15:35Z,Ease of access to my university portal on startup,"<p>Hey guys! I'm a student and so it's useful for me to make my university's student portal as my homepage. However, whenever I start up Firefox, it goes to the 'Authentication required - Mozilla Firefox' popup login area before I can get into my portal. The details are already auto-filled, but I have to hit OK every time. It's more of a quality-of-life and very minor problem, but would there be a way for me to just click the Firefox icon and instantly be logged in automatically? Maybe a custom URL to set as the homepage, or some other way I have to go to make this happen. Thanks so much all! Any replies would be massively appreciated! </p>",tips;desktop;,firefox,tips,en-US,1313960;,jamesv234
1287405,2020-05-19 02:05:41 -0800,2020-05-19T05:16:08Z,Personal bar,<p>Hello I have my personal bar that keeps changing the order of my favorite sites. How do we stop it from moving? Thank you </p>,fix-problems;desktop;firefox-760;windows-10;,firefox,fix-problems,en-US,1313961;,Flash-eure
1287402,2020-05-19 01:14:08 -0800,2020-05-19T01:14:08Z,Firefox and Google Photos problem,"<p>Since the beginning of March, downloading photos on Google photos does not work correctly. Reinstalling the browser or even OS does not fix the situation. Every downloading stuck at some points. The Google advised me to use another browser. I'm sad. </p>",fix-problems;desktop;firefox-760;windows-7;,firefox,fix-problems,en-US,"",nikolay.vdovenko
1287401,2020-05-19 01:13:16 -0800,2020-05-19T01:13:16Z,How to show full url during autofill in urlbar?,"<p>My browsing behaviour involves opening a handful of pages many times a day. So, I start to type the address &amp; the autofill feature completes the url, then I press enter. But, there is a slight inconvenience in FF's autofill feature. In Firefox, it doesn't show the full url, only the homepage of that domain and not any additional paths. In Chrome, it shows the full url along with paths. See the images for example.. 10.254.254.4/0/up is my ISP's login page, so I open it many times. But, I have never opened the 10.254.254.4 ; there is nothing there. Yet, typing '10' shows '10.254.254.4' as first result in FF &amp; '10.254.254.4/0/up' in Chrome. </p><p>How do I customize Firefox that it shows the full address instead of only the homepage? </p>",customize;desktop;firefox-760;windows-7;,firefox,customize,en-US,"",version365
1287399,2020-05-19 00:54:45 -0800,2020-05-19T00:54:45Z,Firefox not showing up in system preferences,"<p>Hey there, so the issue I am having is using microphone and camera on Firefox. It does not ask for permission or show up in MacOS system preferences so I have no option to enable it at all. </p><p>I tried reinstalling Firefox. And everything is updated: </p> <ul><li> Firefox v 76.0 </li><li> MacOS v 10.15.4 </li></ul>",privacy-and-security_1;desktop;firefox-760;mac-os;,firefox,privacy-and-security,en-US,"",w.obiegly
1287398,2020-05-19 00:34:09 -0800,2020-05-19T12:53:46Z,resize location bar for bookmarks toolbar space?,<p>how can i resize the location bar more narrow so i can put more icon on my bookmarks toolbar?as you can see i customize my bookmark toolbar beside on the location bar but the problem is some of my icons gets hide because of the location bar is more wider than bookmarks toolbar </p>,bookmarks;desktop;firefox-760;windows-10;,firefox,bookmarks,en-US,1314074;,lionelperez05
1287396,2020-05-19 00:23:18 -0800,2020-05-19T01:10:30Z,Password Manager,"<p>I happen to be one who simply does not wish to have any program remember or store passwords of any kind, thank you.  An irritating problem I have with Firefox Password Manager is that whenever I log on to any site and the Password Manage box pops up and offers to save my password...once I select ""Never Save"" I expect that choice to be honored and would appreciate it if it were. But it simply isn't.  I must continue to select ""Never Save"" each and every time I log onto any and all websites.  What does ""Never"" mean in this context if the Password Manager continues to circulate the same query every single time?  Is there any way I can simply disable Password Manager and thus avoid this irritation...which is getting very tedious and old.  Please? </p>",customize;desktop;firefox-760;windows-7;,firefox,customize,en-US,1313932;,gregcovy
1287393,2020-05-18 23:52:07 -0800,2020-05-18T23:52:07Z,"When opening Firefox and it's restoring tabs from the previous session, it loads different tabs compared to how I left them. How to fix this?","<p>Imagine the following scenario: 1. I go to a search engine and look for ""dogs"".  2. From the result page I click on a link to a dog page. 3. I close the browser. 4. I open the browser again later.  5. The tab that is supposed to be the restored dog page is the dog result page of the search engine instead.  </p><p>It seems like firefox sometimes isn't saving the actually last page but instead some of the previous ones. </p><p>I am using Firefox 76.0.1 with addons uMatrix, uBlock, OneTab </p><p>Thanks for the help, cheers </p>",tabs;desktop;firefox-760;windows-10;,firefox,tabs,en-US,"",nickels.witte
1287392,2020-05-18 23:38:23 -0800,2020-05-19T00:02:38Z,Viewing PDF-Files in Firefox 76.0.1 not possible - strange behavior,"<p>Hello Community, </p><p>I always used Firefox as PDF-Viewer and it worked fine. But since the last update it is not possible to view PDF-files anymore: whenever I click on a PDF or a link to a PDF - Firefox creates new tabs endlessly. When I quit Firefox and restart it I have lots of new and empty tabs in the browser, but no PDF. It's very annoying because I have to close them all manually and can't view PDFs anymore. </p><p>I have not installed any new software, no registry hacks, have changed nothing in the browsers config, so I suppose it has something to do with the update to 76.0.1 </p><p>Any ideas? Thanks in advance. </p>",tabs;desktop;firefox-760;windows-7;,firefox,tabs,en-US,1313923;,klaus.kolba
1287391,2020-05-18 23:23:18 -0800,2020-05-18T23:23:18Z,How to Troubleshoot the QuickBooks Payroll Error PS033?,"<p>QuickBooks payroll error PS033 appears on the screen with an error message “PS033 error: QuickBooks can’t read your payroll setup files.”This sort of error is usually seen when the file in the CPS folder is damaged. It can also end up in losing some essential data, and also results in download failure of the latest payroll updates and the user is unable to open the company file. It is one of the most commonly seen payroll errors, which hinders the smooth working of the software. Majority of the users find this error to be very much time consuming and difficult to tackle, keeping that in mind, we have come up with this post.  </p><p>We will be discussing the ways to tackle the <a href=""https://www.quickbookspremiersupport.us/quickbooks-payroll-error-ps033/"" rel=""nofollow"">QuickBooks payroll error PS033</a>. So, make sure to read this post carefully. Moreover, for any technical assistance, you can call us at our toll-free number 1-800-969-7370, and our experts QuickBooks support team will be happy to help you. </p>",desktop;fix-problems;,firefox,fix-problems,en-US,"",devinsmith0444
1287388,2020-05-18 22:51:48 -0800,2020-05-18T23:28:45Z,Firefox on all platforms,<p>How to request Firefox a new Feature. </p>,other;desktop;,firefox,other,en-US,1313904;1313906;,rajavarun434
1287387,2020-05-18 22:50:49 -0800,2020-05-18T23:30:53Z,"Be descriptive. Saying ""Playing video on YouTube is always choppy"" will help our volunteers identify your problem better than saying ""Something is wrong"" or ""Firefox is broken"".",<p>for software repair </p>,privacy-and-security_1;firefox-580;desktop;windows-10;needsinfo;,firefox,privacy-and-security,en-US,1313900;1313909;,erych09
