id,created,updated,title,content,tags,product,topic,locale,answers,creator
1286844,2020-05-13 00:42:02 -0800,2020-05-13T09:59:22Z,Vimeo -  Player error  The player is having trouble.,<p>[Ubuntu 20.04 - Firefox 76] When I try to see any Vimeo video I get the error you see in the image </p><p>Player error The player is having trouble. We’ll have it back up and running as soon as possible. </p><p>In Windows10 everything is ok </p>,websites;desktop;firefox-760;linux;,firefox,websites,en-US,1312368;1312371;1312375;1312401;1312407;1312417;1312426;1312473;1312476;1312482;,rob.palloni
1286843,2020-05-13 00:36:08 -0800,2020-05-13T02:06:35Z,"I can't see my saved passwords, even I use (copy and paste) correct login. Please help.","<p>I can't see my saved passwords, even I use (copy and paste) correct login. Please help. </p>",other;desktop;firefox-760;windows-10;,firefox,other,en-US,1312366;1312370;1312372;1312374;1312377;1312378;,katharina.pahlke
1286842,2020-05-13 00:22:02 -0800,2020-05-13T05:58:37Z,Firefox funktioniert nicht mehr,"<p>Es wird kein Absturzbericht versendet. Ich weiß nicht mehr, was ich tun soll. Neuinstallation brachte keine Abhilfe </p>",desktop;fix-problems;,firefox,fix-problems,en-US,1312384;1312398;1312412;,nolure
1286841,2020-05-13 00:14:59 -0800,2020-05-13T00:14:59Z,Why does site asks me to accept privacy policy again on every new tab I open within this site?,"<p>I am a new Linux user with an installation of Ubuntu 18.04 and firefox is the default browser. </p><p>When I visit a site I am asked to accept the site's privacy policy.Once this is done, I click a page within this site to open in a new tab and in the new tab I am asked again to accept the site's privacy policy! This happens in all new tabs I open within a site.  </p><p>I have tried disabling enhanced tracking protection completely or for specific sites (the ""shield"" sign to the left of the site address) but there is no change. I would imagine it is a matter of the site not finding a cookie in my machine, so it doesn't recognize that I have visited the site again and treats me as a new visitor, right? </p><p>I have fiddled with all firefox privacy and security settings but there is no change as well. </p><p>Please enlighten me :) </p><p>thanks in advance </p>",privacy-and-security_1;desktop;firefox-760;linux;,firefox,privacy-and-security,en-US,"",greenguru1978
1286840,2020-05-12 23:26:39 -0800,2020-05-13T01:48:24Z,"The Latex or Math expression in Wiki can not display normaly, how to solve this prolem, for any plugin or?","<p>I set Math of Wiki preferences as the first figure, I try all three options:  </p> <ol><li> Numbered list itemPNG images </li><li> Numbered list itemLaTeX source (for text browsers) </li><li> Numbered list itemMathML with SVG or PNG fallback (recommended for modern browsers and accessibility tools) </li></ol> <p>But the math expressions always display abnormaly like figure 2, how to display it normaly as common habits? Thank you. </p>",customize;desktop;firefox-760;windows-7;,firefox,customize,en-US,1312376;,2440566839
1286838,2020-05-12 23:06:50 -0800,2020-05-13T00:37:46Z,How does Firefox Browser on Windows save user credentials after user logs into a web app?,<p>I'm concerned about the security/privacy aspect of Firefox saving username/passwords for web applications. </p> <ul><li> Where does Firefox save these username/passwords? </li><li> Are these username/passwords encrypted? How are the username/passwords encrypted? </li><li> Who has access to the passwords saved? </li><li> How long are these passwords stored?  </li><li> Do these get cleared when the browser gets uninstalled? </li></ul>,privacy-and-security_1;firefox-7601;desktop;firefox-760;windows-10;,firefox,privacy-and-security,en-US,1312365;,vathreya10
1286837,2020-05-12 22:35:48 -0800,2020-05-12T22:35:48Z,Whenever on YouTube new tabs open without permission in FF V. 76.0.1 only add on is adblock plus.,"<p>While on YouTube , during a few hour session, it opens new firefox tabs to other youtube videos without my permission.   I am using adblock plus.  I've checked everything I can think of. </p>",tabs;firefox-7601;desktop;firefox-760;windows-10;youtube;,firefox,tabs,en-US,"",telomere
1286834,2020-05-12 21:42:52 -0800,2020-05-12T21:42:52Z,Firefox interrupting streaming audio when opening new tab,"<p>Just recently, probably since the latest Firefox update, if I am listening to an audio stream in Youtube, opening a new tab may interrupt the audio briefly. This is new, and did not occur in previous editions. Opening a blank tab does not interrupt the audio. If a tab is opened by a website (referral or by selecting a favorite) it may not interrupt the audio. Opening an eBay page always interrupts the audio (two short interruptions and then the audio continues.) This support page to enter a detailed question caused the audio to be interrupted. Opening one Gmail ID page from another Gmail ID page will interrupt the audio. </p>",fix-problems;desktop;firefox-760;windows-10;,firefox,fix-problems,en-US,"",gridsleep1
1286832,2020-05-12 21:21:27 -0800,2020-05-12T21:21:27Z,How to move context menu after text selection?,"<p>When using Firefox for Windows 10 on a tablet, if you want to select a sentence instead of a word then then context menu always appears at the exact place where you can extend the selection. So you can't. Say you want to select and copy 3 words you long-tap the first word, but when you try to make the selection cover the next 2 words the selector is UNDER the context menu so you can't extend the selection. </p><p>Not sure whether this is a bug or not but it's terrible for mobile users. Is there a way to always have 1 cm distance between the selected word and the menu so you can pull the selector to the right or so? </p><p>Tnx... </p><p>drftr </p>",customize;desktop;firefox-760;windows-10;,firefox,customize,en-US,"",bekpekker
1286831,2020-05-12 20:42:10 -0800,2020-05-12T22:53:04Z,Browser hijacking issue,"<p>Hi,  I noticed that when I visited <a href=""http://Facebook.com"" rel=""nofollow"">Facebook.com</a> the back button gets grayed out. As if <a href=""http://Facebook.com"" rel=""nofollow"">Facebook.com</a> was my first visited page on that tab. How can I prevent this? This isn't an issue on Chrome. Is there a solution somewhere? Will this be fixed soon? </p><p>Cheers! </p>",other;desktop;firefox-760;windows-10;,firefox,other,en-US,1312356;1312359;1312361;,mikael.jonsson
1286830,2020-05-12 20:26:08 -0800,2020-05-13T07:13:18Z,"On Windows 10 running Firefox, pressing strg + n -> new window, same bookmarks and addons -fine. BUT how can i achieve the same result with commandline option?","<p><em>firefox -url <a href=""http://example.com"" rel=""nofollow"">example.com</a></em> -&gt; no bookmarks nor my addons available <em>firefox -p default-release -no-remote -new-instance -new-window</em> -&gt; instance already running (<strong>BUT strg + n shortcut works when using it in browser window. but i want to achieve the same result (with strg + n) via console + commandline option. But how</strong>? </p>",tips;desktop;firefox-760;windows-10;,firefox,tips,en-US,1312387;1312431;,q4rockz
1286826,2020-05-12 18:51:39 -0800,2020-05-12T18:51:39Z,Gostaria de saber como colocar as abas em baixo da barra de endereço. Não encontrei nada sobre isso na iternet.,"<p>Quero a liberdade de escolher onde fica as abas. Antigamente era possível alterar no about:config. Depois que desativaram essa opção, tive de usar uma extensão que deixava o Firefox com a aparência clássica. Agora não consigo de nenhuma forma alterar isso. </p>",firefox-7601;customize;desktop;firefox-760;windows-10;,firefox,customize,pt-BR,"",diego16
1286824,2020-05-12 17:28:48 -0800,2020-05-12T17:43:03Z,Hello all i need help ??,"<p>Hello all i need help when i open my website <a class=""new"" href=""/en-US/kb/new?title=kick+the+buddy+apk"" rel=""nofollow"" title=""Page does not exist."">kick the buddy apk</a> </p><pre>the site speed is very very slow . but when i open another browser its work fine </pre>",desktop;fix-problems;,firefox,fix-problems,en-US,1312341;1312344;1312345;1312346;,alii18851885
1286823,2020-05-12 17:15:45 -0800,2020-05-13T09:24:03Z,Firefox Does Not Keep Source Formatting when Copying into Word,<p>Firefox removes source formatting when copying from a website into Word.  I confirmed this is a Firefox issue because I don't have the same issue with Chrome.  Seems a waste of time to have to use 2 browsers merely so I can copy into Word. </p><p>Please help </p>,websites;desktop;firefox-760;windows-10;,firefox,websites,en-US,1312386;1312466;,kgibson2
1286822,2020-05-12 16:39:47 -0800,2020-05-12T19:08:03Z,"Relentless forcing Microsoft Edge on a FireFox (preferred) client, wanting Firefox only as browser.","<p>A 74 year old non-geek client for personal usage, I switched recently to Firefox as a refuge from ridiculous problems that slowed my pc down. Always present, the relentless agitated veiled threats from Microsoft Edge, and Chrome. Both these two latter browsers were tried with disastrous results. Forcing the use of ME, is refused totally. After a couple of strokes inside the cranium, this one is in a weakened position to handle complications and complexities of market share, plus the 'ever-creepy' move to  control content, based on an ultra-Conservative US view of life.  As a Canadian, born and raised in a sovereign state, I am appalled by such an ugly and pervasive view. I envision a means to take advantage of the considerable skills of Mozilla to simplify and permit this active writer to enjoy the purely informational, educational and entertainment values in life. Please consider how to help. </p><p>Peter (Morris) </p>",other;firefox-7601;desktop;firefox-760;windows-10;,firefox,other,en-US,1312351;,petederek
1286821,2020-05-12 16:39:28 -0800,2020-05-12T19:08:59Z,Dropdown menus aren't working and now Firefox is only black on my screen. What do I do now?,"<p>All of a sudden today, without changing any settings in Firefox, no drop down menus are working (for example, to choose a country for shipping.) I looked up advice in this forum and it said the following: Try Options &gt; (General), then deselect Performance and Use hardware acceleration when available, then restart Firefox - Startup, home page, tabs, and download settings. I did that - deselected Use hardware acceleration and then restarted Firefox and now the screen is only black. Even when I click on Preferences the screen is still black. How do I go back and reselect that and how do I fix my original problem? I am on a MacBook. I tried deleting and reinstalling Firefox but the screen is still black when Firefox is open. I am using Safari to write this, but I need to get back on Firefox. </p>",other;desktop;,firefox,other,en-US,1312352;,memorybee
1286820,2020-05-12 16:29:05 -0800,2020-05-12T22:49:57Z,Specific (Google-owned) website won't open,<p>The following web address won't open up in my FireFox while it does on Chrome  What can be the reason? The parent website that leads to this page does open up but when clicking on the link at the top right corner showing <em>Message for Web</em> an empty browser window open up. I cleared all cookies and cache in both Chrome and FireFox browsers. </p>,websites;firefox-7601;desktop;firefox-760;windows-7;,firefox,websites,en-US,1312330;1312349;1312354;1312355;1312360;,Snaky2011
1286819,2020-05-12 16:27:21 -0800,2020-05-13T08:40:23Z,Firefox Send cant download it always gets an Error,<p>My friend did put a Video on Firefox Send its 2 hours long and has 2 GB I want to download it but when I do so and im at 51% it stops and says that there is an Error. </p>,fix-problems;desktop;firefox-760;windows-10;,firefox,fix-problems,en-US,1312388;1312389;1312428;1312429;1312430;1312453;,philphantg
