id,created,updated,title,content,tags,product,topic,locale,answers,creator
1286120,2020-05-05 08:18:25 -0800,2020-05-05T08:18:25Z,"What does ""Facebook container needs extension tabs"" mean?","<p>In Firefox about:preferences I get a message that says ""An extension, Facebook container needs extension tabs."" What does this mean and how do I fix it? </p>",privacy-and-security_1;firefox-750;desktop;windows-10;,firefox,privacy-and-security,en-US,"",brianrh1
1286118,2020-05-05 08:06:36 -0800,2020-05-05T08:06:36Z,Change color of menu pop ups,"<p>Hi, </p><p>I have a red theme (Red Fade) which I like. </p><p>However the menus when you click anything on the menu bar (File, Edit etc) remain the default colour (see screenshot attached). I would like these to be red also. Is it possible to change this background colour preferably using the userChrome.css file or alternatively an add-on? I know how to edit the userChrome file, so would like the code if possible please. </p><p>Thanks in advance, Paul. </p>",customize;desktop;firefox-760;windows-10;,firefox,customize,en-US,"",lafargeotte
1286117,2020-05-05 07:55:21 -0800,2020-05-05T07:55:21Z,Unable to trigger URL automatically using Windows 10,"<p>I am a user of Mike's Weather Page (and have used it for years). I disable my ad blocker when using it because on the top of the right-hand side, his Facebook page is vertically bookended with ads. I am using MS System 10. </p><p>The site works well with Chrome, and I can see his Facebook page displayed. But I am unable to see his Facebook page and the bookend ads with Firefox. All I see is the hotlink URL for his Facebook page, which, if I click on it, opens a new window containing his Facebook page. </p><p>How do I get the Facebook page to open within Mike's Weather Page? </p><p><a href=""https://spaghettimodels.com/"" rel=""nofollow"">https://spaghettimodels.com/</a> </p><p>Thanks. </p>",firefox-750;other;desktop;windows-10;,firefox,other,en-US,"",tscohen
1286116,2020-05-05 07:47:09 -0800,2020-05-05T07:47:09Z,Hide tab bar with one tab Firefox 76,"<p>My hide tab bar with one tab code has broken with 76.  The tabs themselves remain collapsed, but the bar remains.  Here's my userChrome file: </p><p>[code]/* Modify to change window drag space width */ </p> <dl><dd>root[tabsintitlebar=""true""] #nav-bar{ --window-drag-space-width: 24px } </dd></dl> <p>.titlebar-buttonbox-container{ </p><pre> position: fixed;  display:block !important;  top:0;  right:0;  height: 40px; </pre> <p>} </p> <ol><li>toolbar-menubar[inactive] &gt; .titlebar-buttonbox-container{ opacity: 0 } </li></ol> <dl><dd>root[sidemode=""maximized""] &gt; #navigator-toolbox{ padding-top: 8px !important; } </dd><dd>root[sizemode=""maximized""] .titlebar-buttonbox-container{ top: 8px } </dd></dl> <dl><dd>root[uidensity=""compact""] .titlebar-buttonbox-container{ height: 32px } </dd></dl> <p>.titlebar-buttonbox-container &gt; .titlebar-buttonbox{ height: 100%; } </p> <ol><li>titlebar{ </li></ol> <pre>-moz-box-ordinal-group: 2;  -moz-appearance: none !important; </pre> <p>} </p> <dl><dd>root[tabsintitlebar=""true""] #nav-bar{ </dd></dl> <pre> padding-right: calc(138px + var(--window-drag-space-width,0px));  padding-left: var(--window-drag-space-width,0px) </pre> <p>} .titlebar-placeholder, </p> <ol><li>TabsToolbar .titlebar-spacer{ display: none; } </li></ol> <p>/* Also hide the toolbox bottom border which isn't at bottom with this setup */ </p> <ol><li>navigator-toolbox::after{ display: none !important; } </li></ol> <p>/* Menubar on top patch - use with Fx65_tabs_on_bottom.css */ /* Only really useful if menubar is ALWAYS visible */ </p> <ol><li>navigator-toolbox{ margin-top: 22px } </li><li>toolbar-menubar{ </li></ol> <pre> position: fixed;  display:block !important;  top: 0px;  height: 22px;  margin-top:1px;  width: 100%;  overflow: hidden; </pre> <p>} </p> <ol><li>toolbar-menubar .titlebar-buttonbox-container{ height: 22px; } </li><li>toolbar-menubar .titlebar-button{ padding: 2px 17px !important;  } </li></ol> <p>/* This will allow you to MAYBE put some items to the menubar */ </p> <ol><li>toolbar-menubar &gt; *{ float: left } </li><li>toolbar-menubar .toolbarbutton-1 { --toolbarbutton-inner-padding: 3px } </li></ol> <p>/* Makes tabs toolbar items zero-height initially and sets enlarge them to fill up space equal to tab-min-height set on tabs */ /* Firefox 65+ only */ /* !!USER!! -  REMOVE ALL BUTTONS you can from the tabs toolbar */ </p><p>/* Configurable window drag space  */ </p> <dl><dd>root[sizemode=""normal""] #nav-bar{ --window-drag-space-width: 20px } </dd></dl> <ol><li>titlebar{ -moz-appearance: none !important; } </li><li>tabbrowser-tabs, #tabbrowser-tabs &gt; .tabbrowser-arrowscrollbox{ min-height: 0 !important; } </li></ol> <dl><dd>root:not([customizing]) #tabbrowser-tabs .tabs-newtab-button, </dd><dd>root:not([customizing]) #TabsToolbar .titlebar-button{ </dd></dl> <pre> -moz-appearance: none !important;  height: 0px;  padding-top: 0px !important;  padding-bottom: 0px !important;  -moz-box-align: stretch;  margin: 0 !important; </pre> <p>} </p> <ol><li>tabbrowser-tabs .tabbrowser-tab{ height: var(--tab-min-height) } </li><li>tabbrowser-tabs .tabbrowser-tab[first-visible-tab=""true""][last-visible-tab=""true""]{ </li></ol> <pre> visibility: collapse !important; </pre> <p>} </p><p>/* Button re-styling */ </p> <ol><li>tabbrowser-tabs .tabs-newtab-button:hover{ background-color: var(--toolbarbutton-hover-background) } </li><li>tabbrowser-tabs .tabs-newtab-button &gt; .toolbarbutton-icon{ </li></ol> <pre> padding: 0 !important;  transform: scale(0.6);  background-color: transparent !important; </pre> <p>} /* Extra top padding  in maximized window */ </p> <dl><dd>root[sizemode=""maximized""] &gt; #navigator-toolbox{ padding-top:7px !important; } </dd></dl> <p>/* Fix window controls not being clickable */ </p> <ol><li>toolbar-menubar:hover{ </li></ol> <pre> min-height: calc(var(--tab-min-height) + var(--space-above-tabbar) - 1px) !important;  height: calc(var(--tab-min-height) + var(--space-above-tabbar) - 1px) !important;  -moz-appearance: initial !important; </pre> <p>} </p> <ol><li>nav-bar{ padding: 0 var(--window-drag-space-width,0px) } </li></ol> <p>/* Hide blue stripe on active tab */ .tab-line[selected=""true""] { </p><pre> opacity: 0 !important; </pre> <p>} </p><pre>#toolbar-menubar, #menubar-items, #main-menubar { background-color: #F8F8FB !important; background-image: none !important; </pre> <p>} </p><pre>#TabsToolbar, #menubar-items, #main-menubar { background-color: #F8F8FB !important; background-image: none !important; </pre> <p>} </p><p>/* Change Color of Active tab */ </p><p>/* Change Color of Normal Tabs */ tab:not([selected=”true”])  { 	background-color: rgb(240,240,245) !important; 	color: black !important; } </p><p>/* Hide solo tab */ </p> <ol><li>tabbrowser-tabs tab[first-visible-tab=""true""][last-visible-tab=""true""] { </li></ol> <pre> visibility: collapse; </pre> <p>} /* Hide New Tab Button immediately next to solo tab */ </p> <ol><li>tabbrowser-tabs tab[first-visible-tab=""true""][last-visible-tab=""true""] + toolbarbutton { </li></ol> <pre> visibility: collapse; </pre> <p>} <a href=""/code"" rel=""nofollow"">/code</a> </p><p>Any help is appreciated. </p>",customize;desktop;firefox-760;windows-7;,firefox,customize,en-US,"",Leafsdude
1286115,2020-05-05 07:41:14 -0800,2020-05-05T07:41:14Z,how do I make the drag corners bigger?,"<p>I think I messed up my theme somehow on linux, I dont remember how but now I can only resize the firefox window from the top and the left border. Is there a setting I can use to make it work from all sides again? </p>",beta;customize;desktop;firefox-760;windows-10;,firefox,customize,en-US,"",ivobrunnbauer
1286114,2020-05-05 07:39:29 -0800,2020-05-05T07:39:29Z,Disable Firefox monitor,<p>Looking for a way to completely disable firefox monitor as it is all placebo effect. </p>,customize;desktop;firefox-760;windows-10;,firefox,customize,en-US,"",dracus.dragonstar
1286113,2020-05-05 07:31:58 -0800,2020-05-05T07:31:58Z,Why is Firefox placing thousands of cookies on my computer even though I have full privacy settings?,<p>Why is Firefox placing thousands of cookies on my computer even though I have full privacy settings? </p>,privacy-and-security_1;firefox-750;desktop;windows-10;,firefox,privacy-and-security,en-US,"",robert.cox1
1286111,2020-05-05 07:14:57 -0800,2020-05-05T07:14:57Z,American Express Site Scripting Issues - won't log on via main page; 10x tries to log-off,"<p>Has anyone else noted issues with AmEx site?   Using Win10/FF76, with NoScript 11.0.25 (&amp; previous).   NoScript is only extension.    </p><p>Since AmEx redesigned their website several (many?) months ago, I've had increasing issues using Firefox to log-on the site via their (bookmarked) new log-in page (a bookmarked link to their old log-on page still works, as do all my other banking/financial sites, as well as 98% of other sites).   Log-on button reacts when clicked, but no action - doesn't seem to run its script.   Initially, allowing permissions multiple cycles using NoScript (as is typical for some sites, as scripts load) was sufficient (I try to reduce scripts to minimum necessary, always excluding Facebook scripts).   Logging on via link from AmEx home page sometimes worked slightly better.   However, internal site functions seemed to need multiple refreshes on load.   Within the last two months, only completely disabling NoScript for AmEx tab worked.  Today, not even disabling or uninstalling NoScript completely worked.   In addition, today cannot log-out of AmEx site without multiple (~10x) clicks on the log-out button (webpage seems to gradually close down functionality with each click and twirl of the script indicator, similar to functionality loading issue previously noted). </p><p>Clearing all cache and cookies (per FF forum help) works one time - log-on can be accomplished with two attempts, but log-out continues problematic.  Subsequent log-ons problematic. </p><p>As before, problem repeated on other computers (today, two other computers using Win10/FF76; one with a new Win10 and FF install w/o NS). </p><p>Previously, other browsers unaffected (Old MS Edge, Opera).   Today, using MS Chrome Edge, AmEx site worked without problem.  However, noted that AmEx log-on page loaded with Edge was old-style (that still works with FF, also), not new.   All SSL certs (FF and Edge) verified. </p><p>AmEx doesn't have any link to their Web Support - I guess I have to write them a letter..  Suspect it's a problem on their end, not FF, but have run into several sites lately where FF either doesn't run well, or is specifically not supported.   Don't want to give up privacy features and independence of FF, but would like some ammo to hit AmEx with, if it's indeed an engineered problem with their site. </p>",websites;desktop;firefox-760;windows-10;,firefox,websites,en-US,"",co_gringo
1286110,2020-05-05 07:12:59 -0800,2020-05-05T07:12:59Z,"Why has it been so hard to develop Tab Mix Plus for Firefox, or develop FireFox to incorporate those options?","<p>No, i am not being a smart@$$, i just was wondering. </p><p>It <em>seems</em> to me that Tab Mix Plus was a very popular extension, not just one of my favorites. Because of this, i would think that if the structure of FireFox would allow, someone would probably by now have created a compatible version. This leads me to think there must be some aspects that can be handled by an extension, and some that can not due to internal coding. </p><p>I can't understand why the FireFox development team wouldn't work with the community to provide those Tab Mix Plus enhancements to the internal coding that no longer can be created by an extension. It would seem like the competitive thing to do, so i must believe that there either is a real security reason, or simply the old extension was not as popular as i think it was. </p><p>I'm afraid i must admit that it has been so long that there are probably many alternative replacements to the Tab Mix Plus features that i don't recall, yet i really did prefer a setting to open links in a new tab rather than having to hold down Ctrl at the same time of clicking - i know it seems picayune, but it still is a preference! </p><p>I only mess around with VBA, so please use the ""big print and pictures"" method of explanation :) </p><p>Thank-you for your thought! </p>",firefox-750;customize;desktop;windows-10;,firefox,customize,en-US,"",brucemc777
1286109,2020-05-05 06:59:36 -0800,2020-05-05T06:59:36Z,I'm developing website. In css media query @media (pointer: coarse) is true. But I'm working on laptop without touchscreen. Why? Is there is any workaround?,"<p>I'm developing website. In css media query @media (pointer: coarse) is true and @media (pointer: fine) is false. But I'm working on laptop without touchscreen.  In attachment there is screenshot from <a href=""https://developer.mozilla.org/en-US/docs/Web/CSS/@media/pointer"" rel=""nofollow"">https://developer.mozilla.org/en-US/docs/Web/CSS/@media/pointer</a> It shows what I'm talking about. Only Firefox has this behavior. Ie11, Edge, Chrome working as expected (css media query @media (pointer: coarse) is false and @media (pointer: fine) is true). </p><p>So question, why FF behaves this way? is it a bug? Is there is any workaround for Firefox? </p>",firefox-750;websites;desktop;windows-10;,firefox,websites,en-US,"",cjorange
1286108,2020-05-05 06:52:23 -0800,2020-05-05T07:48:49Z,Adware hidden in Firefox Account,"<p>I recently observed that when I visit a certain page (not a website, but a certain page in the website), it seems to be attempting to load flashing the ""X"" repeatedly. After a few seconds it stops and within 10 seconds I am then redirected to a scam survey website asking me how satisfied I am with my internet provider. I immediately assumed the worst and ran McAfee scans, cleared cache, Malwarebytes free trial scans and no joy. </p><p>Then I logged into another computer and loaded up the same page. Please note instead of logging into Firefox and clicking on my bookmark, I simply went to the website, logged in and went to the page. It is the same link in the end. Nothing happened. I thought it was something wrong with my PC at this stage. </p><p>I then decided to log into Firefox to see if that would yield different results. I logged in on the other computer that had not presented the spam yet. I clicked the bookmark and it did it. The spam page loaded. From this I understand whatever is causing the problem is in my Firefox Account data. </p><p>I then immediately logged out of Firefox on the second computer, uninstalled it and then redownloaded it. Without logging in, the spam still comes up. I am lost. Neither McAfee, Malwarebytes or AdwCleaner find it. </p><p>The link for the spam is different every time, usually ending in "".xyz"". </p><p>Before the spam was present, the page always had a normal padlock beside the URL. Now,sometimes not always, when the spam is going to come up it has an orange warning symbol and say some elements are not secure, and it says something about images. </p><p>The page it occurs on is on eBay, and I have used this site no problem for years. It only occurs on my regional message page specific to my country, not on the message page on ""<a href=""http://ebay.com"" rel=""nofollow"">ebay.com</a>"". </p><p>Any help greatly appreciated. </p>",privacy-and-security_1;desktop;,firefox,privacy-and-security,en-US,1310547;,glencrowe404
1286105,2020-05-05 05:59:09 -0800,2020-05-05T06:00:52Z,Download videos,"<p>When I download videos, it's longer than the initial wait. It's usual faster than that. Please help me out. </p>",download-and-install_1;firefox-750;desktop;windows-10;,firefox,download-and-install,en-US,1310541;,Cooldude2
1286104,2020-05-05 05:39:52 -0800,2020-05-05T05:42:18Z,I get a squashed font using the Nextdoor website; it doesn't happen using Microsoft Edge,"<p>See image below. I tried to attach the Microsoft Edge image too but that would not upload. Device is a PC, Intel Core 2 Duo, E8400 @ 3 GHz; RAM: 8GB; 64 bit-based processor System is Windows 10 (up-to-date); version: 1903, 22/10/2019; OS build 18362.778 Firefox version is 75.0 (64-bit) </p>",firefox-750;websites;desktop;windows-10;,firefox,websites,en-US,1310537;,ian66
1286103,2020-05-05 05:19:00 -0800,2020-05-05T05:19:00Z,how to disable hand cursor,"<p>While hovering over the text of a link, the cursor changes into a hand. This has the effect, that i cannot select text from that link anymore, but instead, the whole link is dragged as if it were an image. </p><p>Not only the dragging is annoying, but also the form of the cursor, as i find it less precise. </p><p>How can i disable the changing into a hand cursor once and for all? </p>",firefox-750;customize;desktop;linux;,firefox,customize,en-US,"",7dev70
1286102,2020-05-05 05:15:54 -0800,2020-05-05T05:15:54Z,My 'my ebay' section redirects to 3rd party malicious webpage,"<p>Hi I hope your all well.  </p><p>Since this morning I have been having trouble with my ebay account. When I click into any of the tabs within the 'myebay' section. After a few seconds the page directs me to a 3rd party malicious page which looks like it is coming from my service provider and it asks me to complete a survey for a prize.  </p><p>I contact my ISP, surprise!! Turns out it isn't genuine. I then turned to ebay and they know nothing of it. I have tried chrome browser and it isn't happening there. ISP tech guys and ebay tech guys all say it is the browser.  </p><p>It is constantly happening and I think it is only with the 'myebay' section of ebay.  </p><p>This is the URL; https://eu.moneysavingexpertelectricity.xyz/2595eee0cdf090a2fd29f02d9bfd3cea/index.html?ip=84.203.92.236&amp;trackid=202005051210361924 </p><p>Can someone please help. Thanks Dom </p>",privacy-and-security_1;firefox-750;desktop;windows-10;,firefox,privacy-and-security,en-US,"",robinsdo
1286101,2020-05-05 05:09:08 -0800,2020-05-05T05:09:08Z,"Aruba Web Interface ""SEC_ERROR_REUSED_ISSUER_AND_SERIAL"" after factory reset","<p>The AP I am currently trying to set up seems to be issuing a new certificate with each factory reset. I deleted the certificate server, but the site still wont let me pass the error. How do i avoid this, this is massively preventing work on my project right now and i am forced to use another browser. I do not know the CA or the name of the certificate itself and i cant find anything with a similar name in the list. </p>",firefox-750;desktop;fix-problems;windows-10;,firefox,fix-problems,en-US,"",laurens.peschko
1286100,2020-05-05 04:25:23 -0800,2020-05-05T04:25:23Z,Firefox has suddenly stopped working for me after 2 years on this computer. Is Windows10 blocking it?,"<p>Firefox is my default browser. This week, when I click on its icon nothing happens. Explorer works OK but I prefer to use Firefox. I have reinstalled Firefox but to no avail. What do I do? Why am I having this problem? </p>",other;desktop;,firefox,other,en-US,"",TOMO111111111
1286099,2020-05-05 04:05:28 -0800,2020-05-05T04:05:28Z,"When I click on a link within a page, it says ""This page isnt redirecting correctly""","<p>I am using Windows  Home Premium 64bit, Firefox version 75. When I click on the log in for LOGIN with DS LOGIN, I get this page isnt redirecting correctly. Worked fine on Microsoft Edge. Any idea why this just started happening? This page has worked for a very long time.  ""The page isn’t redirecting properly </p><p>An error occurred during a connection to <a href=""http://myaccess.dmdc.osd.mil"" rel=""nofollow"">myaccess.dmdc.osd.mil</a>. </p><pre>   This problem can sometimes be caused by disabling or refusing to accept cookies."" </pre> <p><a href=""https://infocenter.humana-military.com/beneficiary/service/account/login?SecurityMessage=Invalid+or+expired+credentials.+&amp;SecurityHttpCode=401&amp;returnUrl=%2fbeneficiary%2fservice%2fHome%2fContactUs"" rel=""nofollow"">https://infocenter.humana-military.com/beneficiary/service/account/login?SecurityMessage=Invalid+or+expired+credentials.+&amp;SecurityHttpCode=401&amp;returnUrl=%2fbeneficiary%2fservice%2fHome%2fContactUs</a> </p>",firefox-750;other;desktop;windows-7;,firefox,other,en-US,"",Steves396lt1
1286096,2020-05-05 02:15:32 -0800,2020-05-05T02:15:32Z,Why is Firefox caching my site?,"<p>Hello, I have deployed a new version of my site (internal, sorry) and Firefox keeps caching it although I don't see the reason for it. </p><p>This is the info about it in 'about:cache' (I deployed a new version at 10:20): </p><p>key:    https://[URL-OF-THE-SITE]/ fetch count:    6 last fetched:   2020-05-05 10:17:05 last modified:  2020-05-05 10:23:31 expires:    2020-05-05 11:04:08 Data size:  5758 B Security:   This is a secure document. </p><p>[...] </p><p>request-method: GET </p><p>response-head: </p><p>HTTP/2 200 OK server: nginx/1.17.4 date: Tue, 05 May 2020 07:13:10 GMT content-type: text/html content-length: 5758 last-modified: Mon, 04 May 2020 12:43:21 GMT etag: ""5eb00de9-167e"" accept-ranges: bytes referrer-policy: no-referrer strict-transport-security: max-age=31536000 X-Firefox-Spdy: h2 </p><p>original-response-headers: </p><p>server: nginx/1.17.4 date: Tue, 05 May 2020 07:13:10 GMT content-type: text/html content-length: 5758 last-modified: Mon, 04 May 2020 12:43:21 GMT etag: ""5eb00de9-167e"" accept-ranges: bytes referrer-policy: no-referrer strict-transport-security: max-age=31536000 X-Firefox-Spdy: h2 ctid:   1 uncompressed-len:   0 net-response-time-onstart:  315 net-response-time-onstop:   319 </p><p>In the Firefox Developer Tools I always get ""5,62KB (raced)"" (see attached image) and looking at my server logs, it does actually fetch the page, but it still shows an old version. The content supplied by the server is definitely the new version and other browsers don't seem to have this problem. </p><p>Thanks in advance for your help! </p><p>Edit: The etag has changed between the two versions. </p>",firefox-750;websites;desktop;linux;,firefox,websites,en-US,"",firefox-till
1286095,2020-05-05 02:09:53 -0800,2020-05-05T02:09:53Z,"my bookmarks content disapperd, i tryed many time to log in \change password but same issue,unfortualny i format my device and continted was there 3/5/2020","<p>- restore my previous content in bookmark toolbar, its shown empty now </p>",bookmarks;firefox-750;desktop;windows-10;,firefox,bookmarks,en-US,"",swarkooK
1286094,2020-05-05 01:37:33 -0800,2020-05-05T01:37:33Z,Problemas de acceso a Facebook,"<p>Hola a todos,  Tras instalar la última versión de Firefox (la que tenía instalada era más antigua que Matusalem) ahora estoy teniendo problemas para acceder sobre todo a Facebook, y a determinadas webs que antes si podía acceder. ¿Sabéis que puede estar pasando? Ya he verificado todo lo relativo a Cookies, pero no consigo decirle que me deje en paz ciertas Cookies. En fin, seguiré investigando. </p><p><br> <a href=""https://www.todoporteros.es"" rel=""nofollow"">Guantes de Portero</a> </p>",privacy-and-security_1;desktop;,firefox,privacy-and-security,es,"",carlos.benitez.hurtado
1286093,2020-05-05 01:28:25 -0800,2020-05-05T03:45:47Z,"I need an admin to remove my email address from the ""this address bounced"" list","<p>I am having the same problem as <a href=""https://bugzilla.mozilla.org/show_bug.cgi?id=1459780"" rel=""nofollow"">https://bugzilla.mozilla.org/show_bug.cgi?id=1459780</a> <a href=""https://bugzilla.mozilla.org/show_bug.cgi?id=1479607"" rel=""nofollow"">https://bugzilla.mozilla.org/show_bug.cgi?id=1479607</a> </p><p>I had accidentally deleted the email address I use from my email server before trying to sign back in to Firefox Sync. I added it back, and made sure that it works. However, it is impossible for me to sign in at all any more because I'm getting the ""Your Email was just Returned. Mistyped Email?"" error. </p><p>Please remove my email address from the bounce list so that I can sign in. </p>",firefox-750;sync;desktop;mac-os;,firefox,sync,en-US,1310513;,firefox654
1286091,2020-05-05 01:26:54 -0800,2020-05-05T01:26:54Z,Oculus rift does not work in vr mode,"<p>when i go into vr mode, for example in apainter, I can see on my monitor that it senses my motions but i can only see my home screen in oculus, nothing pops up, I have already tried everything that was suggested which is: going to nvidia control panel(turned up the power management settings), reinstalled firefox, restared oculus, reticked the setting that allows apps from unknown sources in oculus app, updated my nvidia drivers and restarted my pc. I have no where else to go now and I could really use some help.  P.S: I use oculus rift, my gpu is Nvidia gtx 980Ti and I don't have an integrated gpu because my processor is Amd ryzen 1600 </p><p>I FOUND MY ISSUE: I CLICKED TO ADD AN EXTERNAL APP ON OCULUS APP AND THEN ADDED FIREFOX.EXE </p>",firefox-750;other;desktop;windows-10;,firefox,other,en-US,"",emilis.vaickus
