id,created,updated,title,content,tags,product,topic,locale,answers,creator
1286888,2020-05-13 09:19:40 -0800,2020-05-13T12:23:37Z,"""Automatically clearing cache and site data"" is not working","<p>I tried following the instructions for ""automatically clear the cache"" here: <a href=""http://mzl.la/18byRQJ"" rel=""nofollow"">http://mzl.la/18byRQJ</a>  Which basically say to go to Options - Privacy &amp; Security Settings In the drop-down menu next to Firefox will, choose Use custom settings for history. Select the check box for Clear history when Firefox closes. Beside Clear history when Firefox closes, click the Settings… button. The Settings for Clearing History window will open. In the Settings for Clearing History window, put a check mark next to Cache. </p><p>I did this. I also have check marks next to Cookies, Active Logins, Site Preferences, and Offline Website Data. But I was still finding that when I looked at ""Cookies and Site Data: Your stored cookies, site data, and cache are currently using __ of disk space"" just after closing and reopening Firefox, the amount of disk space used would still be a significant amount, and so there were times when I needed to manually clear the data (we have been told by a cloud-based ERP we use, that clearing the data is recommended when their pages are not loading optimally).  But I should not have to be doing this manual clearing; it is supposed to be happening automatically when Firefox is closed and reopened. I noticed that slightly below ""Cookies and Site Data: Your stored cookies, site data, and cache are currently using __ of disk space"" in the latest versions of Firefox there is now a check-box that says ""Delete cookies and site data when Firefox is closed."" For me it was unchecked. I was confused as to why I should have to check this box since it should already be covered in the Settings for Clearing History window, but I checked the box just to cover all my bases. I also clicked on the ""Manage Permissions"" button beside ""Delete cookies and site data when Firefox is closed,"" and made sure that there were not any exceptions populating it. There were not.  But there are times when after closing and reopening Firefox, I will still find a significant amount of disk space being taken up in ""Cookies and Site Data: Your stored cookies, site data, and cache are currently using __ of disk space"" and the only way I can figure out to get it to clear is to clear it manually. What is causing this? How can I get it to all clear automatically when closing Firefox? </p>",privacy-and-security_1;desktop;firefox-760;windows-10;,firefox,privacy-and-security,en-US,1312478;1312506;1312519;,keriksen
1286887,2020-05-13 09:08:40 -0800,2020-05-13T09:08:40Z,How to stop FF auto-resetting my keyboard when cursor enters a password field?,"<p>My system auto-loads a custom keyboard map (via Xmodmap or xkbcomp) on login. As long as the cursor does not enter a password field on a page displayed in FF, the key map remains functional until I logout. </p><p>After a recent FF update, whenever the cursor does enter a password field in FF, the keyboard map is blown away (returns to standard qwerty). This creates an incredibly annoying workflow: Enter password &gt;&gt; Halt &gt;&gt; Manually reload keymap &gt;&gt; Resume </p><p>No other browser or program does this so I'm sure it's a FF problem. I've already started migrating all password-entry sites to Chrome, but this is a workaround. How to fix? .. (FF 76.0, Ubuntu 18.04.4) </p>",other;desktop;firefox-760;linux;,firefox,other,en-US,"",FFnut
1286886,2020-05-13 09:03:25 -0800,2020-05-13T09:28:31Z,How do I move vertical scrollbar from left to right of screen?,"<p>Firefox Browser, version 76.0.1 Windows 10 Question is above. I will repeat it. How do I move the vertical scrollbar from left to right side of screen? </p>",other;desktop;firefox-760;windows-10;,firefox,other,en-US,1312463;1312469;,Nisaba
1286885,2020-05-13 08:58:14 -0800,2020-05-13T08:58:14Z,stop sorting my bookmarks,<p>I can't stop Firefox from sorting my bookmarks even though I have unsorted listed.  They never used to do this in Firefox.  I had to reinstall windows 10 and firefox and it seems ever since then I can't stop Firefox from sorting my bookmarks alphabetically.  I move then to a special order that I want them in and open and close a few times and it seems they are back to a different order. </p><p>I was ALWAYS able to catagorize them in the order I found most helpful but now firefox takes over and resorts them the way it wants to. </p><p>How do I get back to the way it was. </p>,bookmarks;desktop;firefox-760;windows-10;,firefox,bookmarks,en-US,"",Barry35
1286884,2020-05-13 08:43:37 -0800,2020-05-13T08:43:37Z,I cannot sign in to Slack on Firefox on mac but can using Safari.,<p>When I click the Sign In button to Slack on Firefox nothing happens.  No problem signing in using Safari.  Just upgraded my mac to Catalina OS.  Security and add blockers were disabled. </p>,websites;firefox-7601;desktop;firefox-760;mac-os;,firefox,websites,en-US,"",davidrempel
1286880,2020-05-13 08:18:01 -0800,2020-05-13T10:17:04Z,Firefox 76.0.1 seems to be ignoring the HOSTS file,"<p>Windows 10, firefox 76.0.1 </p><p>All of a sudden Firefox is serving up ads which used to be blocked by my HOSTS file. </p><p>Edge and Internet Explorer still seem to be using the HOSTS file OK. </p><p>Also, Firefox in a private window seems to use the HOSTS file. </p><p>I have deleted cookies and cache - no help. </p><p>Attached 3 screenshots, same site, banner Chevy ad with Firefox, hosts file blocks the Chevy ad in a Firefox private window and in Internet Explorer </p>",privacy-and-security_1;desktop;firefox-760;windows-10;,firefox,privacy-and-security,en-US,1312460;1312471;1312486;1312491;,islanderalmost
1286879,2020-05-13 08:13:46 -0800,2020-05-13T08:13:46Z,"Last Firefox Update messed up my own Security Certificates, and now I cannot access my Bank!","<p>Just tried to access my companies Homebanking website, and realized Firefoz didn't ask for my Security Certificate no more, therefore the Homebanking site will not allow me to perform any actions! </p><p>Can you help? </p><p>Mozilla: Why do you do such upgrades without making sure they will not disturb people's life?!? </p>",privacy-and-security_1;firefox-7601;desktop;firefox-760;mac-os;,firefox,privacy-and-security,en-US,"",eloi1
1286878,2020-05-13 08:00:10 -0800,2020-05-13T09:03:43Z,Updated to Windows 10.  My Printer is my default and recognized in any other Browser except Firefox.  Won't even show up. Only Onenote does.  Cannot find it.,"<p>When I go to print menu and select print, I get a box that shows me two options to print.  One from Microsoft XPS Doc Writer and one from OneNote for Windows 10.  My default printer isn't even shown.  When I go to find printer, I get an icon with a computer that says USER-PC.  I have gone in and selected my printer to be the default.  It won't even show up.  However, when I go to print from Explorer or any other area besides Firefox, which I love, it shows up and works perfectly.  How do I get Firefox to default to that printer.  I don't even know what XPS Doc Writer is or OneNote.  I am not a tech person, so if you have a solution, could you please give me a step-by-step that even an idiot could understand?  Your wisdom and kindness are appreciated greatly.  If you would like to communicate with me privately, that is great.  I just don't want my email out there for the world, as you may already have guessed.  Thank you in advance for you patient understanding. P.S. I do have the current version of FF. </p>",other;desktop;firefox-760;windows-10;,firefox,other,en-US,1312456;,gunnyandburlap2
1286874,2020-05-13 07:23:21 -0800,2020-05-13T10:03:25Z,"I randomly lose bookmarks. I save them to a subfolder and check that they are in fact there. a few days later, gone. Yes, I tried restoring and checked history.","<p>The backup is a week old. The history is incomplete. BUT it was there yesterday. It's happened before, and doesn't seem related to updates. Any thoughts? </p>",bookmarks;desktop;firefox-760;windows-10;,firefox,bookmarks,en-US,1312485;,a_vine
1286873,2020-05-13 07:11:49 -0800,2020-05-13T19:28:06Z,"Can't Up Or Download, FFox 76.0.1 Freezes","<p>I just had my OS reinstalled with Win 10 32 bit on my 64 bit system. When I try to up or download anything from the web, FFox freezes and need to exit it with End Task. Could the 332 bit win 10 be the problem? </p><pre>I tried it in safe mode, same problem.  </pre> <p>are there some settings I can look at? I tried Chrome and no problem downloading, Hope someone can help I like FFox more then the others.  </p><p>even when I go to clear cookies from a site like this one <a href=""https://www.sandiegouniontribune.com/"" rel=""nofollow"">https://www.sandiegouniontribune.com/</a> by clicking the padlock icon, and select Clear Cookies and Site data, it freezes.  </p><p>I can download and Save programs top right of the screen. </p>",fix-problems;firefox-7601;desktop;firefox-760;windows-10;,firefox,fix-problems,en-US,1312537;1312538;1312561;1312564;,JoeFromSD
1286872,2020-05-13 06:18:51 -0800,2020-05-13T09:46:31Z,The page isn’t redirecting properly  No help options fix this.,<p>I tried all the options available to fix the redirecting problem. </p><p>Cleared history and cache/cookies uninstall and reinstall firefox No change </p><p>The page works in IE </p><p>All the help pages and videos is pre-2020. Can this be a Firefox update problem? </p>,fix-problems;desktop;firefox-760;windows-10;,firefox,fix-problems,en-US,1312443;1312477;,info2369
1286871,2020-05-13 05:44:58 -0800,2020-05-13T10:31:31Z,How do you make the Search and Address Boxes behave like regular input fields?  I always have to click twice slowly before I can edit.,"<p>Look, I know I'm the only one who is annoyed by this.  The address box and search box *look* like regular text input fields, but when I click inside one of them, all the text is selected.  In a regular input field, the cursor is placed where I clicked.  To select a word, you double click.  To select all the text, you triple click. </p><p>All the other browsers do this, so I understand why it has to be like this.  But could I have a customization option where I can turn this off?  I *think* there was a time when Firefox didn't do this.  Those were the good old days! </p>",customize;desktop;firefox-760;windows-10;,firefox,customize,en-US,1312461;1312492;,harry.pehkonen
1286870,2020-05-13 05:43:15 -0800,2020-05-13T05:43:15Z,Unable to close responsive design mode,"<p>At least as recently as Developer Edition 77.0b5. Neither the keyboard shortcut nor the UI ""x"" button closes the mode. This is developer edition 77.0b5 on MacOS 10.14.6. For a handful of beta versions it seems inconsistent (sometimes worked sometimes didn't work) but now it seems like this happens every time. I'm not sure when I first noticed the issue. </p>",firefox-770;other;beta;desktop;mac-os;,firefox,other,en-US,"",darby3
1286869,2020-05-13 05:27:35 -0800,2020-05-13T13:59:11Z,Any possibility to read clipboard data using javascript in Firefox without user triggered ctrl+v event. Chrome prompts user for clipboard access permission.,"<p>I am trying to read clipboard data using navigator.clipboard.readText() I get readText not a function whereas I can see that navigator.clipboard.writeText() is available.  When I tried manually triggering ctrl+v I was able to access the data using event.clipboardData.getData().  </p><p>I want a solution where the readText or getData should work without user intervention, provided the user is asked for permission before  accessing clipboard, the way it happens in Chrome. </p>",privacy-and-security_1;desktop;firefox-760;windows-10;,firefox,privacy-and-security,en-US,1312539;,swatimhatre16
1286867,2020-05-13 05:21:48 -0800,2020-05-13T05:21:48Z,"On Firefox for Mac, when I switch mac accounts Firefox freezes when I return from another account","<p>On Mac OS Catalina 10.15.4, if I'm logged into mac account X and launch Firefox, then I switch to mack account Y, when return back to mac account X my Firefox browser freezes.  I usually have to quit Firefox and restart it to get it working again. </p><p>Not sure if others are having this issue, but would appreciate a fix if possible. </p>",other;desktop;firefox-760;mac-os;,firefox,other,en-US,"",todd16
1286866,2020-05-13 05:07:53 -0800,2020-05-13T05:07:53Z,"pop-up windows from apps say ""cookies disabled""","<p>Hi there, I've encountered an issue with a couple of PC Desktop Apps (Microsoft Teams, Kindle for PC), where there is a pop-up window to log in, but I cannot because it says that cookies are disabled. I have enabled cookies and pop-up windows and can log in to both my Amazon and MS accounts (thought my work authorisation website) without any problems at all just using the normal Firefox window, but the small <a href=""http://log.in"" rel=""nofollow"">log.in</a> pop-ups just keep demanding cookies and saying they don't have any.... </p><p>I am on Windows 7 using the latest Firefox update - and yhelp woul be greatly appreciated!  </p><p>AGF </p>",cookies;desktop;firefox-760;windows-7;,firefox,cookies,en-US,"",agfoxford
1286865,2020-05-13 04:16:02 -0800,2020-05-13T04:16:02Z,Since FF75/76 have to clear cache every time to see Google Maps Traffic,"<p>Routing display also needs cache cleared to show, with or without traffic. Also some roads don't always appear until cache cleared. Clearing cache immediately shows routing/traffic. Was fine in earlier versions. </p>",websites;desktop;firefox-760;windows-7;,firefox,websites,en-US,"",henrybluebottle
1286863,2020-05-13 04:02:22 -0800,2020-05-13T06:29:06Z,Using KDE5 Plasma proxy settings (or likewise in Firefox),"<p>Is there a way to make Firefox use socks5 proxy settings from KDE5 Plasma network settings, like Chromium does? </p><p>There is a very powerful option in that settings which makes exceptions list reversed, so proxy is used only for the addresses in the exceptions list and all other addresses use direct connection. </p><p>Or, is it possible to do such reversed exceptions list in the Firefox proxy settings? </p>",other;desktop;firefox-760;linux;,firefox,other,en-US,1312414;1312421;,am.advmark
1286862,2020-05-13 04:01:14 -0800,2020-05-13T04:38:02Z,It doesn't appear your computer can support WebGL.,"<p>User Agent: Mozilla/5.0 (X11; Ubuntu; Linux x86_64; rv:76.0) Gecko/20100101 Firefox/76.0 </p><p>This is a server that I'm trying to use for a WebGL-based python library 'vpython' from Mac. It is equipped with 4 NVIDIA RTX2080, Driver Version: 435.21       CUDA Version: 10.1 </p><p>Via SSH, X11 and xQuartz, I have reached to connect these two computers, then I got faced to this error message shown as: 'It doesn't appear your computer can support WebGL. Click here for more information(this is directed to <a href=""https://support.mozilla.org/en-US/kb/upgrade-graphics-drivers-use-hardware-acceleration#firefox:linux:fx76.'"" rel=""nofollow"">https://support.mozilla.org/en-US/kb/upgrade-graphics-drivers-use-hardware-acceleration#firefox:linux:fx76.'</a> </p><p>From the page 'about:config', webgl.disabled set as false. </p><p>From the page 'about:support',  WebGL 1 Driver Renderer is described as </p><p>WebGL creation failed:  </p> <ul><li> Refused to create native OpenGL context because of blacklist entry: FEATURE_FAILURE_GLXTEST_FAILED </li><li> Exhausted GL driver options. </li></ul> <p>with a detailed description as; </p><pre>GLXtest process failed (exited with status 1): X error occurred in GLX probe, error_code=160, request_code=149, minor_code=6 </pre> <p>While I am reluctant to try overriding the blacklist, any other opinion is not showing.. </p><p>Any comments would be appreciated. </p>",desktop;fix-problems;,firefox,fix-problems,en-US,1312396;,chaos9328
1286861,2020-05-13 03:56:42 -0800,2020-05-13T03:56:42Z,pen tablet interface not working on Sketch.io and MIro... since?,"<p>Hi there, I discovered that my Wacom tablet input does not get processed on web pages. Drawing on <a href=""http://sketch.io"" rel=""nofollow"">sketch.io</a> or miro doesn't work anymore. Does work perfect in Chrome browser however... Any clue about this? Pen is not drawing at all in <a href=""http://sketch.io"" rel=""nofollow"">sketch.io</a> In miro I get false datapoints (non-smooth lines) as if input has enourmous distortion </p>",fix-problems;desktop;firefox-760;windows-10;,firefox,fix-problems,en-US,"",oscar3
1286860,2020-05-13 03:53:23 -0800,2020-05-13T09:27:43Z,"What is synced (is supposed to be synced) by ""options""?","<p>I was really looking forward to use Firefox Sync in order to spread my <strong>options</strong> over my devices, far less important are bookmarks and logins (for which I prefer KeePass). I thought that I will no longer have to set all my options like </p> <ul><li> customized address bar, control and menu bar </li><li> configurations within ""about:config"" like accesskey, full screen notification delay ... </li><li> search engines with ther shortcuts </li></ul> <p>Actually none of those is synced. What else is left to be meant by ""options""? Is there an addon that syncs those (for me most important) configurations? Or is it a planned upcoming feature? </p><p>Bookmarks, logins and passwords are rather easy to transfer, while the configs (search engines, their shortcut, about:config customizations etc.) have to be set up laboriously on every single Firefox installation. </p><p>Thanks in advance -Robbie. </p>",sync;desktop;firefox-760;windows-10;,firefox,sync,en-US,1312468;,San.Jacinto
1286856,2020-05-13 03:35:32 -0800,2020-05-13T03:35:32Z,"Fire Fox on my ipad has a ""Flame"" I can click on to erase a search I completed. How do I get the same option on my desk top computer?","<p>Fire Fox on my ipad has a ""Flame"" I can click on to erase a search I completed. How do I get the same option on my desk top computer? </p>",customize;desktop;firefox-760;windows-10;,firefox,customize,en-US,"",gdthorst
1286854,2020-05-13 03:10:22 -0800,2020-05-13T07:48:42Z,"How to migrate profiles when upgrading from one ESR minor version to another, e.g. from ESR 68.x to ESR 68.y?","<p>We currently would like to upgrade our centrally installed Firefox ESR version and would like users to keep their settings and be disrupted minimally. Specifically we would like to upgrade from 68.4.2 to the current 68.8. </p><p>I am aware that as of Firefox 67 a dedicated profile version is used for each Firefox version (<a href=""https://support.mozilla.org/en-US/kb/dedicated-profiles-firefox-installation)"" rel=""nofollow"">https://support.mozilla.org/en-US/kb/dedicated-profiles-firefox-installation)</a>. </p><p>I had assumed that as it is only a minor upgrade of the same ESR version a new profile would not be necessary, however it creates a new empty profile by default. </p><p>The suggested solution to use Firefox Sync is not an option as creating Firefox Sync accounts for all our users would even be more overhead. </p><p>Is it indended behaviour that new profiles are created for the same ESR (major) version? Is there a simple way to migrate existing profiles? </p><p>Thanks. </p>",download-and-install_1;firefox-680;desktop;linux;,firefox,download-and-install,en-US,1312438;,junk-code
1286852,2020-05-13 02:22:00 -0800,2020-05-13T02:22:00Z,"I am running CentOS 7 with dark theme, and when opening forms in firefox, the text box background and the letters inside them are both colored black","<p>I am running CentOS 7 with dark theme, and when opening forms in firefox, the text box background and the letters inside them are both colored black making it impossible to write any thing inside the text box. </p><p>Though the problem is not with every website, only a few and definitely when I when filling Credit/Debit card details for online payment. I am also proving  a screen shot from <a href=""http://opensourceforu.com"" rel=""nofollow"">opensourceforu.com</a> website, which is their subscription form, which I cannot fill because everything in the text bos is dark. The subscription page url is ""<a href=""https://subscribe.efyindia.com/electronicsforu/subscription/giftsOSFY.asp"" rel=""nofollow"">https://subscribe.efyindia.com/electronicsforu/subscription/giftsOSFY.asp</a>"" </p><p>So, what can be done, to either change the color of the background or of the text to solve this problem. </p>",other;desktop;linux;,firefox,other,en-US,"",nileshkumar
1286851,2020-05-13 02:08:07 -0800,2020-05-13T08:26:12Z,In some drop down lists a random sign or extra letter appear when tab to the field...,"<p>I have now for a couple of months having problems when entering a drop down field in our case system. </p><p>I use the keyboard very often and I experience that everytime I tab from one field to the next it automatically enters one letter or sign at once, which means when I start typing I need to delete it all plus the wrong value and reenter. It is small but SUPER annoying! Please see my screenshot for where the sign is entered.. It can also randomly pick another letter.  See videos as well: <a href=""https://www.screencast.com/t/3Vlm2GUz"" rel=""nofollow"">https://www.screencast.com/t/3Vlm2GUz</a> I keep trying to write either Timesheet or Project.. It differs which extra letter that is put in front.. <a href=""https://www.screencast.com/t/gyjW8GWsz"" rel=""nofollow"">https://www.screencast.com/t/gyjW8GWsz</a> here you see the weird tag. </p><p>I have trouble shoot all these: •	Tested out ?noapps to rule out any installed Support apps causing issues •	(You were able to reproduce the issues both with and without any apps running, but I wasn't able to see the same behavior with apps either enabled or disabled.) •	Clearing browser cache / cookies / incognito mode / different browsers •	Clean boot mode in Windows •	Different computers •	IT team wasn't able to replicate the issues in Firefox, but could reproduce the issues when remotely accessing your computer. •	Experiencing the issues in Firefox, but Chrome doesn't show the same symptoms •	Different connection types (wired on old PC, wireless on new PC) •	Tested out different keyboards / hardware •	Confirmed no VPN software running / using built-in Windows Defender •	HAR network file shows normal network activity </p><p>Please help!!!! </p>",fix-problems;desktop;firefox-760;windows-10;,firefox,fix-problems,en-US,1312447;,sch31
1286850,2020-05-13 01:23:01 -0800,2020-05-13T05:28:56Z,Materialize design CSS seems to render badly in Firefox,"<p>A lot of pages that uses materialized design CSS framework seems to have issues rendering correctly in Firefox. I see all strange CSS properties or HTML elements instead of the correctly rendered version. Not sure if it is only an issue with materialized design or a deeper issue, but I have seen this happening on multiple sites. For example this link: </p><p><a href=""https://developers.google.com/admin-sdk/directory/v1/reference/users#resource"" rel=""nofollow"">https://developers.google.com/admin-sdk/directory/v1/reference/users#resource</a> </p><p>You can see the different results between Chrome and Firefox in the attached images. </p><p>Running Ubuntu 18.04 KDE and Firefox 76.0.1 64-bit </p>",fix-problems;desktop;firefox-760;linux;,firefox,fix-problems,en-US,1312373;1312406;,gustav.fosker
1286849,2020-05-13 01:19:27 -0800,2020-05-13T03:50:06Z,How to fix untrusted website,"<p>Hi. I need help normally I just click on the download link click download. But I get error 404 or not trusted website please help. I downloaded anime on a site called gogoanime. It goes to <a href=""http://videostreaming.io"" rel=""nofollow"">videostreaming.io</a> then I click on the download link then it download. There is no other site to download the anime which is a Japanese cartoon which is translated into English I want to complete my collection but I can't download any anime because of error 404 or untrusted website I need it fix as soon as possible. I can't watch it online because I don't have enough data to do so. I still have to download 404 different. Firefox is broken anime and I am being hindered here for no reason. Please help me </p>",desktop;fix-problems;,firefox,fix-problems,en-US,1312394;,johanventer61
1286848,2020-05-13 01:09:21 -0800,2020-05-13T03:51:40Z,"Extention ""flash&video download"" stopped working after installing the latest firefox update",<p>As mentioned above this extention stopped working yesterday after automatic installation of the firefox update. The extention icon is still visible but greyed and it won't light up when a dowloadable video is present. A white block is shown when rightclick on the icon. </p>,customize;desktop;firefox-760;windows-10;,firefox,customize,en-US,1312395;,thipa
1286846,2020-05-13 00:57:30 -0800,2020-05-13T00:57:30Z,how can I print websites using Firefox under windows 10 on my dell xps15 and by hp colorjet 281fdw,"<p>I would like to print cooking recepies from the ESSEN und TRINKEN which I can show on my screen of my dell xps15 using the hp cl 281fdw printer. When I start the printing, there is just a message ""peparing print"" but nothing happens even after 15 minutes. On the other side using google the print is no problem at all. So I would like to ask how I can get the same results using firefox </p>",other;desktop;firefox-760;windows-10;,firefox,other,en-US,"",h.bock1
1286845,2020-05-13 00:56:11 -0800,2020-05-13T08:37:28Z,過去のプロファイルを取得する方法はありますか？,<p>サイトに設定していたパスワードを確認したかったのですが、誤って別のパスワードで更新してしまったため、1か月前だったり、過去のプロファイルを取得できたりはしないでしょうか？ </p><p>よろしくお願いします。 </p>,other;desktop;firefox-760;windows-10;,firefox,other,en-US,1312452;,shsxax
