id,created,updated,title,content,tags,product,topic,locale,answers,creator
1286086,2020-05-04 22:40:24 -0800,2020-05-04T22:40:24Z,Unable to run HPE SUM from SPP ISO - SEC_ERROR_UNKNOWN_ISSUER.,"<p>Hi, </p><p>Just downloaded the latest HPE Service Pack for ProLiant (SPP). It's an ISO which contains a site for updating server firmware. When I run it, it automatically starts Smart Update Manager and tries to launch in a tab in the default browser. Firefox says ""Did Not Connect: Potential Security Issue"" with the error code SEC_ERROR_UNKNOWN_ISSUER. I looked at the KB for that and it's not relevant (using MS Defender). If I try it with Chrome, it throws a warning but allows me to make an exception. Is this a known issue? I can't seem to find anything online about it. </p><p>Running Firefox 75.0 Build 20200403170909 on Win 10 Ent x64 10.0.18362.778. </p><p>Certificate details pic attached. </p><p>Rgds, </p><p>Ali </p>",privacy-and-security_1;firefox-750;desktop;windows-10;,firefox,privacy-and-security,en-US,"",alistair.francis
1286085,2020-05-04 22:19:21 -0800,2020-05-05T00:31:52Z,bookmarks changed,"<p>Hi, Since yesterday, after changing my passwort for firefox account my bookmarks are totally changed into very old ones. Where from got Firefox these old bookmarks (2 or more years old) and how can I get back my actual list of bookmarks? </p>",bookmarks;firefox-750;desktop;mac-os;,firefox,bookmarks,en-US,1310501;,hellwig60
1286084,2020-05-04 21:06:44 -0800,2020-05-04T21:06:44Z,Cannot access forgotten/deleted website,"<p>Some time ago I removed a website form the New Tab Top Sites list. I'm pretty sure I did it via the '. . . &gt; Delete from history' option. At the time I got a warning message similar to 'This action cannot be undone'.  </p><p>That was fine, but since then I cannot visit the website directly via the address bar or via the link that tends to appear in  New Tab &gt; Top Sites. What I've been doing is searching on DuckDuckGo then clicking that link, which works fine. That search is conveniently on my Top Sites list. I can access the site direct in another browser.  </p><p>I recently had to reset my password for the site and now the reset link doesn't work. All the help I've found doesn't mention any problem like this. </p><p>How do I unforget/undelete/unblock this site? Help! </p>",firefox-750;websites;desktop;linux;,firefox,websites,en-US,"",garethic
1286083,2020-05-04 20:32:14 -0800,2020-05-05T08:17:00Z,Restoring discarded tabs,"<p>After needing to do heavy maintenance due to a malware/malvertising issue that cropped up, I needed to restart and refresh Firefox a couple of times. While all the tabs are still present, they are now ""discarded"". I am fully unable to restore them, currently. Googling has not given me any real insight as to what is going on. </p><p>I did have Tab Suspender extension/app in use, so perhaps I should have disabled that and refreshed all the tabs. Impossible to say now, and hindsight is not exactly helping me restore any of this. </p><p>I have a lot of tabs, and I have managed to copy the titles of each tab, so I should theoretically be able to find each one again. However, if there is an easier method to restore all my tabs, I'd prefer that. </p><p>Any help would be greatly appreciated. </p>",tabs;firefox-750;desktop;windows-10;,firefox,tabs,en-US,1310477;1310531;1310556;,ihmislehma
1286082,2020-05-04 20:14:24 -0800,2020-05-04T23:42:09Z,How do I stop Firefox from saving the tabs from previous sesions?,<p>How do I stop tabs from previous sesions appearing the next time I open Firefox? </p>,firefox-750;customize;desktop;windows-10;,firefox,customize,en-US,1310486;1310498;,marcelogabriel
1286080,2020-05-04 18:38:09 -0800,2020-05-04T18:38:09Z,Firefox won't stop prompting me for master password,"<p>Hello, </p><p>Long-time Firefox user here. I'm running Firefox (version 75.0, auto-updates enabled) on a Windows 10  (Version 10.0.18362 Build 18362) desktop PC. I'm using the built-in Firefox password manager, although as a general practice I do not log into it using my master password unless absolutely needed (for example, to check my email or Slack). For the vast majority of the general browsing I do, I stay logged out of my accounts. </p><p>This has worked just fine for years. However, lately Firefox keeps prompting me to enter my master password, and won't stop prompting me for my password while I'm browsing. Oftentimes I'll randomly receive the prompt, often on sites that should not be asking for a password, such as a blank New Tab or sites that don't have any associated data in my password manager. </p><p>What's frustrating is that, when I close the prompt, Firefox will immediately re-prompt me again to enter my master password, despite me not wanting to log in (or on some sites, not having an account or even a login page). It will keep repeating this prompt incessantly, sometimes for 5-6 times before going away briefly, only to reoccur when I navigate to a new site.  </p><p>My browser is configured to be a bit more privacy-conscious, and I'm wondering if this may be causing this behavior. In Options &gt; Privacy and Security, I've set Custom blocking for the following items: - Cookies (all third-party sites) - Tracking content (in all windows) - Cryptominers - Fingerprinters I have also set my browser to delete cookies and site data upon closure.  </p><p>I am using the following plugins, with auto-updates enabled: uBlock Origin HTTPS Everywhere Privacy Badger Decentraleyes Cookie Autodelete Firefox Mult-Account Containers Facebook Container </p><p>I've searched the support forums for help on this topic and found the two articles below. However, after trying the offered solutions, neither fixed the underlying behavior. Also note that I am not using any third-party antivirus solutions, like ESET Internet Security and Avast, which have been known to cause similar issues with the Firefox password manager. Here are the articles I found: <a href=""https://support.mozilla.org/en-US/kb/firefox-keeps-asking-me-master-password"" rel=""nofollow"">https://support.mozilla.org/en-US/kb/firefox-keeps-asking-me-master-password</a> (I tried these steps and still had the same behavior happen) <a href=""https://support.mozilla.org/en-US/questions/1176785"" rel=""nofollow"">https://support.mozilla.org/en-US/questions/1176785</a> (this just disables the Password Manager, something I ideally would not have to do to stop this behavior) </p><p>Can anyone provide any insight into why Firefox keeps doing this? I love Firefox but lately it's become a drag to use because of this. Thanks all. </p>",firefox-750;desktop;fix-problems;windows-10;,firefox,fix-problems,en-US,"",andre.tom
1286078,2020-05-04 17:36:19 -0800,2020-05-05T08:28:03Z,Firefox try's to open new tab before opening hoepage,<p>Firefox try's to open new tab wasting 10 to 15 seconds before finally opening my homepage.   Thank's in advance! </p>,firefox-750;desktop;fix-problems;windows-10;,firefox,fix-problems,en-US,1310478;1310492;1310495;1310559;,reinvestorbroker
1286077,2020-05-04 17:31:00 -0800,2020-05-05T07:09:39Z,"How can I tell if iCloud.com does not allow for passwords to be saved in FF, for security reasons?","<p>How can I tell if <a href=""http://iCloud.com"" rel=""nofollow"">iCloud.com</a> does not allow for passwords to be saved in FF, for security reasons? . . . I think this must be the reason . . . I'm using the latest, up-to-date versions, of Win 10 and FF </p><p><a href=""https://www.icloud.com/"" rel=""nofollow"">https://www.icloud.com/</a> </p><p>Usernames and passwords are not saved . . . <a href=""https://support.mozilla.org/en-US/kb/usernames-and-passwords-are-not-saved"" rel=""nofollow"">https://support.mozilla.org/en-US/kb/usernames-and-passwords-are-not-saved</a> </p><p>Websites prohibit password saving </p><p>Some websites do not allow for passwords to be saved for security reasons. If you have followed the steps above, but are still not prompted to save a password when logging in to a certain website, that site may have disabled password saving. </p>",firefox-750;websites;desktop;windows-10;,firefox,websites,en-US,1310479;1310544;,sludge7051-x
1286076,2020-05-04 17:14:05 -0800,2020-05-04T22:19:21Z,Several Facebook operations are missing starting May 3 but are okay if I use Safari. My default browser is Firefox.,"<p>Beginning May 3, Facebook is not functioning fully on Firefox.  </p><p>In my groups, including the one for which I am the administrator, the space that displays at the top of the feed and reads, ""Write something..."" is missing. This means I cannot post to the groups. I can post to my personal page but the buttons in the dropdown ""..."" do not work. I cannot edit or delete anything I post. </p>",firefox-750;desktop;fix-problems;mac-os;,firefox,fix-problems,en-US,1310459;1310465;1310475;1310488;,parrishh
1286075,2020-05-04 16:54:17 -0800,2020-05-04T21:06:19Z,Upgrading to Windows 10 seems to have deleted ALL my stored passwords on Firefox accounts?,"<p>I have two Firefox accounts. One of them was logged in and saving all my logins and passwords like normal, all was good... Then I did a Windows 10 upgrade, and these passwords are nowhere to be found on either of my accounts. I thought that these were saved to the account not the computer??? I'm hoping to get these back, because there were a lot... :(  Thanks for any advice. </p>",firefox-750;sync;desktop;windows-10;,firefox,sync,en-US,1310480;1310483;,sigourneyellen
1286074,2020-05-04 16:18:26 -0800,2020-05-04T23:39:00Z,When I try to login to my Bank of America account the password box is permanently grayed out so I am unable to login.  Thank god for Safari.,"<p>May 4, 2020.  I am using the current Firefox on a new MacBookPro laptop with the current MacOS.  I tried to login to my Bank of America account and the password box is permanently grayed out.  So I cannot access my BoA account.  Safari works fine. </p>",firefox-750;other;desktop;mac-os;,firefox,other,en-US,1310460;1310462;1310476;1310481;1310496;,cnewsom
