id,created,updated,title,content,tags,product,topic,locale,answers,creator
1287386,2020-05-18 22:48:52 -0800,2020-05-18T23:41:46Z,Problem loading page-This problem can sometimes be caused by disabling or refusing to accept cookies.,"<p>I have been trying to log into facebook and I keep receiving this message (Problem loading page-This problem can sometimes be caused by disabling or refusing to accept cookies.). It happened a couple of times, I checked the privacy setting, I tried to delete ""recent history"" , then clear all cookies and manage privacy setting and it worked but after a couple of days there we go again. It has been a nightmare frankly, I do not know what else to do. Please help! </p>",cookies;desktop;firefox-760;mac-os;,firefox,cookies,en-US,1313913;,maighoussub
1287385,2020-05-18 22:46:16 -0800,2020-05-19T01:12:31Z,salary,<p>salary </p>,download-and-install_1;firefox-740;desktop;windows-7;needsinfo;,firefox,download-and-install,en-US,1313899;1313933;,sallar.badiyian
1287384,2020-05-18 22:18:45 -0800,2020-05-18T23:15:08Z,easiest way to copy bookmarks to new profile,"<p>Hello </p><p>How can I distribute the bookmarks to new profiles, ( without import steps ) ? it is not just one file, like internet explorer ? is it possible the remove the ""Make Firefox your default browser"" message ? by regkey ? </p><p>Thanks </p>",bookmarks;desktop;,firefox,bookmarks,en-US,1313903;,egana1
1287383,2020-05-18 22:00:02 -0800,2020-05-20T15:58:34Z,How to view HTML DOM property when selecting elements in Inspector?,"<p>Hi When I open Inspector from Firefox Developer Tools and select an HTML node, inspector shows numerous CSS related items for that node (like Rules, Layout, Computed, etc), but it does not show basic HTML DOM properties. In particular, I need to see innerText property for the currently selected node (and then walk through HTML tree watching innerText for every node). I found that I can do Right Click, Show DOM properties and than it prints all properties to the Web Console window, but this is not convenient: I have to repeat this Right Click thing for every element and search for innerText every time. This will take forever. So, question: is it possible to somehow show innerText for the current node automatically (like those CSS items are shown)? Thank you </p>",other;firefox-720;desktop;windows-10;,firefox,other,en-US,1313928;1314044;1314058;1314188;1314294;1314437;,jhnlmn
1287382,2020-05-18 21:59:16 -0800,2020-05-18T21:59:16Z,allow pop ups,<p><strong>bold text</strong> </p>,privacy-and-security_1;desktop;,firefox,privacy-and-security,en-US,"",prasanth.ktp
1287380,2020-05-18 20:19:39 -0800,2020-05-19T14:47:59Z,spacebar doesn't work,<p>when I type in the comment section of one particular site my spacebar won't work as I type.  All of the words run together.  I have to go back and separate them manually. </p>,other;desktop;firefox-760;mac-os;,firefox,other,en-US,1313891;1314039;1314127;,hbroy04
1287378,2020-05-18 20:14:45 -0800,2020-05-18T21:59:53Z,Windows 10,<p>I have windows 10 (not 10S) in my laptop and I am not able to download firefox. Would really appreciate some help. </p>,download-and-install_1;desktop;,firefox,download-and-install,en-US,1313892;,tsnv.afrin
1287376,2020-05-18 19:55:30 -0800,2020-05-19T00:30:50Z,Firefox icon disappears when I shut down computer,"<p>I've installed Firefox on my MacBook Air laptop, but every time I turn off my computer, the icon to access Firefox disappears from my shortcuts bar and I have to go back to my downloads folder, double click on the ""Firefox 75.0.dmg"" file and re-install Firefox. Meanwhile, all my bookmarks on Firefox are lost and have to start everything anew like a new customer each day. My membership email is the only thing that is retained therefore day-to-day. I've checked the settings and have even made Firefox my default browser but that hasn't helped. I should add that I also have Express VPN. When I add Firefox to the ExpressVPN's shortcuts, again it stays there only until I turn off the computer. Meanwhile, Google Chrome and my email icons remain on the VPN startup window and don't go away as does Firefox. Jacob </p>",download-and-install_1;firefox-750;desktop;mac-os;,firefox,download-and-install,en-US,1313929;,HAAvedissian
1287375,2020-05-18 19:53:09 -0800,2020-05-18T19:53:09Z,Página em branco para alguns sites,"<p>Estou com um problema para abrir alguns sites. Quando digito na barra de endereços e clico, ele busca o site mas traz a página completamente em branco. Não é possível ler nenhuma informação.  </p><p>Não fiz nenhuma alteração em configurações para que para alguns endereços o Firefox traga as páginas em branco. Quem sabe o motivo? </p><p>Como posso resolver? </p>",fix-problems;desktop;firefox-760;linux;,firefox,fix-problems,pt-BR,"",edmarrp
1287374,2020-05-18 19:49:05 -0800,2020-05-18T23:35:33Z,Book Marks / Tabs,<p>Why are bookmarks/tabs not saved? </p>,tabs;desktop;firefox-760;mac-os;,firefox,tabs,en-US,1313893;1313911;,swestberg
1287373,2020-05-18 19:39:14 -0800,2020-05-18T22:02:18Z,"Home page, reset to a different page",<p>'<em><strong>Im continuing to use Firefox browser but dont know how to rest the home page.  I have domains and other interests.'</strong></em> </p>,"",firefox,other,en-US,1313894;,beestree123
1287372,2020-05-18 19:33:11 -0800,2020-05-18T19:33:11Z,"Login bouncing, and so on","<p>I can log in, then after some time on the browser in and out of a few web pages, I notice I am not logged in anymore. I must have been disconnected, I can never figure out why. And I cannot use my Bitwarden to automatically log in, it takes a while and it happens many times an evening. I have tried isolating and selecting the cookies. That does not seem to help. </p>",sync;desktop;firefox-760;windows-10;,firefox,sync,en-US,"",hhassan30
1287371,2020-05-18 19:18:29 -0800,2020-05-18T19:18:29Z,Add On Log In Error,<p>I get an error when logging into the Add on section. No way to check my password and no info as to what is wrong.... </p>,customize;desktop;firefox-760;windows-10;,firefox,customize,en-US,"",jmillerah
1287370,2020-05-18 19:15:24 -0800,2020-05-19T17:50:54Z,"The logo image is blown up to the browser size, then reduce to normal when refresh","<p>When refresh the page, the logo image appears as big as the browser size, then the image returns to it normal size when the whole page is load.  The issue is only appeared in Firefox 64 bits version. Either Chrome or the Firefox 32bits version works fine. My website is created using Angular 6 </p><p>Firefox 76.0.1 (64-bit) </p>",websites;desktop;,firefox,websites,en-US,1314082;1314094;1314164;,huu.lam
1287368,2020-05-18 18:43:28 -0800,2020-05-20T09:25:34Z,How do I login to my Firefox account?,<p>How do I login to my Firefox account? How can there be 2885 results to this question? I would like to be able to login to all things Firefox with one ID and Password. </p>,other;firefox-7601;desktop;firefox-760;needsinfo;,firefox,other,en-US,1313959;1314288;1314296;,falconeddie
1287367,2020-05-18 18:42:22 -0800,2020-05-19T13:00:54Z,Make desktop shortcut open new window,"<p>I can't seem to figure out how to have the desktop shortcut for Firefox open a new window even when I have a window already open.  As it is, when I click on the shortcut when I have a Firefox window already open, it simply opens a new tab.  I do want to keep links opening in new tabs, I just want to be able to open a new window with the shortcut.  Is there a way of doing this? </p><p>I'm working with Windows 10 Home on a Lenovo laptop. </p>",customize;desktop;firefox-760;windows-10;,firefox,customize,en-US,1314080;,milletclark
1287365,2020-05-18 18:16:58 -0800,2020-05-19T13:57:59Z,"My logins were revoked - I reset my password, and all saved passowrds have disappeared",<p>I'm scared af. Hundreds of password are saved on my firefox. My active logins were revoked and I had to reset the password to login to my firefox on windows. Turns out all my passwords are gone.  </p><p>I have no email from firefox notifying of the suspicious login.  </p><p>What I can do? </p>,firefox-770;privacy-and-security_1;beta;desktop;windows-10;needsinfo;,firefox,privacy-and-security,en-US,1314085;1314101;1314108;,mastsethi
1287359,2020-05-18 17:39:20 -0800,2020-05-19T16:17:46Z,Bookmark restores and synching of older bookmarks,"<p>I have two desktops and two laptops, all set to sync with the same account.  Normally everything works great, a bookmark changed on a desktop changes on the other sync'd devices. But, today I turned on one of my laptops that hasn't been on for awhile and the bookmarks on it were quite outdated. It sync'd up so the other computers now have the older bookmarks :( I went to my desktop, restored a good bookmark backup file from yesterday but it reverted back to that old bookmarks file from my laptop. Is there a way I can control this better when powering on a laptop with old bookmarks? I assumed in this case it would sync and get current bookmarks instead of syncing up old bookmarks and my other computers then syncing down those older bookmarks. Help unconfuse me so this doesn't happen again, please. </p>",bookmarks;desktop;firefox-760;windows-10;,firefox,bookmarks,en-US,1314142;1314144;,markandlyndon
1287357,2020-05-18 17:19:57 -0800,2020-05-19T16:40:01Z,Sound not going to wireless headset even though settings are correct,"<p>Just got a bluetooth headset.  Works on my music player, but not on youtube or soundcloud or probably anything in Firefox.  I am on the Firefox 76.0.1 on Ubuntu 18.04.  Settings: Sound set to Headset Riff Wireless; Bluetooth has Riff Wireless connected.  The sound works, but is still coming out of my computer on Firefox.  Don't have another browser to test it.  Thanks in advance for your help! </p>",other;desktop;firefox-760;linux;,firefox,other,en-US,1314143;1314150;,foster.j.lynn
1287356,2020-05-18 17:19:50 -0800,2020-05-20T16:40:23Z,Problema de subida de videos en Facebook,"<p>No puedo subir videos a facebook, lo que normalmente se puede hacer. necesito ayuda por favor. Solo con firefox (al que decidi migrar) no puedo subir los videos que su peso es menor a los 200 MB. lo dejo cargando pero nunca se activa la opcion de publicar. - ya en intentado reinstalar firefox - eliminar completamente firefox y re instalarlo - arrastrar el archivo y subir con el explorador del ordenador tambien lo he intentado. </p>",other;desktop;firefox-760;windows-10;,firefox,other,es,1314444;,aureliuscusco
1287355,2020-05-18 17:18:53 -0800,2020-05-18T18:14:17Z,ATT Yahoo keeps logging off in Firefox browser,"<p>I keep getting kicked off ATT Yahoo from Firefox, multiple times a day.  I have refreshed the browser, cleared cache and cookies, put att yahoo in the excepted sites for privacy, operated in safe mode and private browsing (happens then, too), and of course, checked the ""keep me signed in"" box.  Also, the sign-in window is very different than it is on IE or how it used to be on Firefox the last time I signed in before the problem started.  I DO NOT have this problem when using IE so I pretty certain its Firefox.  Anything, not too technical, I can try?  I definitely prefer Firefox to IE but I can't go through the sign in process every 30 minutes.  Come on Firefox, I know you can fix this. </p>",fix-problems;desktop;firefox-760;windows-81;,firefox,fix-problems,en-US,1313870;,lilwackywafer
1287354,2020-05-18 17:18:26 -0800,2020-05-18T17:19:30Z,"Firefox auto-resetting Passwords, Logins, and history","<p>This has happened now on two different machines, with two different accounts that have had no carryover between them. </p><p>Every few months, for no reason at all, firefox will just ""forget"" every login. It will forget all page history. It will remember what add-ons are present and will keep the bookmarks, but everything else? Gone. </p><p>It is incredibly frustrating and this current account (my father's) is only a month or two old, having set it up on his new computer. </p><p>Yes, it does happen in safe mode, and no, factory resetting Firefox is the exact opposite of what we want to happen. </p>",other;desktop;firefox-760;windows-10;,firefox,other,en-US,1313859;,jollygreenj1
1287350,2020-05-18 17:07:51 -0800,2020-05-18T17:17:24Z,"When I look at amazon.com, it looks like this.  Whatg have I done?","<p>One day, I noticed that all <a href=""http://Amazon.com"" rel=""nofollow"">Amazon.com</a> pages look like this.  I have no idea what I have done to cause this.  What did I do? </p><p>I am using Raspbian on a Raspberry Pi 4 </p><p>I have lost everything except some of the basic text.  Other pages (non-Amazon) work fine. </p>",firefox-680;websites;desktop;linux;,firefox,websites,en-US,1313856;,ted.kell
1287347,2020-05-18 16:30:48 -0800,2020-05-19T01:03:41Z,Widevine and OpenH264 not installing,"<p>I have been trying for a long time to get firefox to install either of the two add ons (preferably both), Widevine and OpenH264 but have gotten no result. I have tried just about every solution I have seen online. I have re-installed, tried manual install, using about:config, clearing the HOSTS file, etc. Please tell me there is some way to force these to install. It is driving me mad. </p>",customize;desktop;firefox-760;windows-10;,firefox,customize,en-US,1313863;1313931;,thomasmodrallsperling
1287345,2020-05-18 16:24:01 -0800,2020-05-18T18:16:12Z,SET  MY  LANGUAGE  AS  ENGLISH  UNITED  KINGDOM  PLEASE,<p>PLEASE  SET  MY  LANGUAGE  AS  ENGLISH  UNITED  KINGDOM  PLEASE </p>,firefox-680;websites;desktop;windows-10;,firefox,websites,en-US,1313871;,douglaswiggywiggins3888888
