id,created,url,title,content,tags,product,locale
1288139,2020-05-24 10:29:28 -0800,https://support.mozilla.org/questions/1288139,Logon details and passwords getting lost repeatedly,"Firefox (latest version) security settings / password manager keeps on losing my logon details and passwords even though I always click on ""Save Password"", they don't seem to get stored.  Am I supposed to manually add/edit the login details in the FF security screen? Surely they ought to get stored auaomatically, as before?  This is a new thing, it always worked great before but now I am at the point of abandining Firefox entirely.  I use Bitdefender AV and tend to reboot every day. I use my notebook for work and need to be logged in to about a dozen different tabs so it is infuriating to have to look up the logon details again every day, and often I have to do password resets.  I am running Windows 10 with all patches up to date. ",privacy-and-security_1;desktop;firefox-760;windows-10;,firefox,en-US
1288141,2020-05-24 10:45:48 -0800,https://support.mozilla.org/questions/1288141,treats,Any chance you guys could help me with a shopping list I have as it's the first time I have been able/ allowed to try myself to treat myself. Thank you  very much and I would appreciate very much thank ,other;desktop;,firefox,en-US
1288142,2020-05-24 10:47:36 -0800,https://support.mozilla.org/questions/1288142,Bookmarks not syncing,"I have an android with Firefox installed, and a Mac where I also use Firefox. When I first installed Firefox on each, the bookmarks matched. I do the bulk of work on my laptop, but occasionally have articles I wish to bookmark on my phone. I have done a sync, but when I go to access the bookmarks on my phone, they are not updated to what is on my laptop.  When I check to see what devices I have connected through Firefox, my phone does not show up, and when I hit the link to ""connect a device"" all it does it take me to a link to send a text to invite my phone to install it. Which, it's already installed.  I really need these bookmarks to talk to each other properly. What am I missing? ",bookmarks;desktop;firefox-760;mac-os;,firefox,en-US
1288143,2020-05-24 10:55:21 -0800,https://support.mozilla.org/questions/1288143,Video playback stutters on battery power only on Firefox,"Hi,  I noticed that when watching a video on YouTube or Hulu in my browser, on battery power, every few seconds the video will quickly stop and start, stutter, skip, whatever you want to call it.  It is a fraction of a second but very frequent. It is only when I am on Firefox, not when I am watching video on a desktop app. Microsoft Edge works fine on Hulu and Youtube.  I tried troubleshooting the following with no changes:   Updated various drivers, video, monitor etc.  Tried in Firefox safe mode  Uninstall and reinstall Firefox  Firefox and Windows is up to date  I have a dedicated GPU Nvidia Geforce RTX and Firefox and Edge are both set to use my Intel CPU  I looked at power settings and    ""Wireless adapter settings"" is on Max Performance for both Plugged in and On Battery.    Intel (R) Graphics Settings are is on Max Performance for both Plugged in and On Battery.   ""Processor Power Management"" > ""Minimum Processor State"" > ""On Battery"" is at 5% and I tried changing it to 100% but there was no difference...",fix-problems;desktop;firefox-760;windows-10;,firefox,en-US
1288145,2020-05-24 11:01:55 -0800,https://support.mozilla.org/questions/1288145,treats,"Hey again guys just wondering if you can help me yet, am going threw a rough ride can do with something to make things just a bit more bareable cheers guys am desp or wouldn't be asking right out like this xx ",privacy-and-security_1;desktop;,firefox,en-US
1288147,2020-05-24 11:48:34 -0800,https://support.mozilla.org/questions/1288147,Google vs. Yahoo,"I have my search engine set to Google, but lately when I start searching it automatically switches to Yahoo.  Why? PK ",other;desktop;firefox-760;windows-7;,firefox,en-US
1288149,2020-05-24 12:06:01 -0800,https://support.mozilla.org/questions/1288149,firefox browser,how to disable private browsing in firefox ,other;desktop;firefox-760;windows-10;,firefox,en-US
1288150,2020-05-24 12:06:02 -0800,https://support.mozilla.org/questions/1288150,Write killer subject lines,bold text italic text   Numbered list item   Bulleted list item ,download-and-install_1;firefox-770;beta;desktop;windows-7;,firefox,en-US
1288151,2020-05-24 12:07:02 -0800,https://support.mozilla.org/questions/1288151,Write killer subject lines,bold text italic text   Numbered list item   Bulleted list item ,download-and-install_1;firefox-770;beta;desktop;windows-7;needsinfo;,firefox,en-US
1288154,2020-05-24 12:17:10 -0800,https://support.mozilla.org/questions/1288154,when using google docs in mozilla firefox right click paste does not work - requ,"Is there a fix in Firefox for this  when using google docs in Mozilla Firefox, my default broser, the right click paste does not work - Firefox requires Ctl. V instead  Thanks  Mark ",customize;desktop;firefox-760;windows-10;,firefox,en-US
1288155,2020-05-24 12:39:31 -0800,https://support.mozilla.org/questions/1288155,how to disable private browsing,how to disable private browsing in firefox ,other;desktop;firefox-760;windows-10;,firefox,en-US
1288158,2020-05-24 13:08:06 -0800,https://support.mozilla.org/questions/1288158,"Youtube 2k and above ,video freeze","With latest update 76.0.1 i can no longer watch 2k and above youtube videos.  Sound will work, but video is frozen. CPU usage goes to 100% then randomly video would unfreeze and start working at that moment cpu usage drops down to 20% only to freeze video second later again with high cpu usage. Whats going on? win10x64 intel 2500k nvidia 1050 16gb ddr3 ssd Chrome is working fine. If i revert firefox to older versions video works normally. ",websites;desktop;firefox-760;windows-10;,firefox,en-US
1288159,2020-05-24 13:10:23 -0800,https://support.mozilla.org/questions/1288159,Extension shortcuts are not persistant,Customizable extension shortcuts work for X amount of time but (seemingly when extensions update) the user-defined shortcuts are erased and need to be reset. Is there a fix for this? ,customize;desktop;firefox-760;windows-10;,firefox,en-US
1288160,2020-05-24 13:27:56 -0800,https://support.mozilla.org/questions/1288160,Firefox 76.0.1 (64 bit) freezes on MacOS Catalina 10.15.4 freezes,"Hi,  I've just installed MacOS Catalina 10.15.4 and as soon as I ran Firefox i noticed that after a few minutes (variable)  it hangs when attempting to populate a new tab (with anything).  All other existing tabs are then blank (white screen with spinning grey wheel in the centre). Firefox worked fine on MacOS Mojave prior to the upgrade.  When this happens I can do nothing. If i press command-option-esc to show (and cancel) processes it shows 'Firefox (not responding)'. Firefox can be force quited and will be removed from the display but when I tap on the Firefox icon to restart it just bounces up and down and never starts. I am forced to attempt a shutdown of MacOS but when I issue a 'Shutdown' macOS never shuts down going to the desktop screen and having a spinning wheel. I am forced to press and hold the power button on my iMac (2.7 Ghz Quad-Core Intel Core i5, 8GB 1600 Mhz memory.... I know it's old but it conforms to the spec required for Catalina) to force a shutdown.  If I leave Firefox running unatte...",desktop;fix-problems;,firefox,en-US
1288163,2020-05-24 14:11:07 -0800,https://support.mozilla.org/questions/1288163,Sound from web page once visited persists at startup despite cookies being delet,"Greetings. Each time I open Firefox 76.0.1 on my iMAC OS 10.14.6 I have to listen a minute or so to frog calls. The problem began after I visited this page, which is the source of the sound: http://www.californiaherps.com/frogs/pages/p.regilla.sounds.html. To try to fix this, I've deleted all cookies and long ago closed the page with the frog call on it. Unfortunately,  I sent this URL to a friend who subsequently developed the same problem. She is on a different browser, I think Chrome, and has Microsoft OS.  MalwareBytes can detect no problem with my system.  How do I rid my Firefox of these frog calls? This does not happen when I open Safari or Chrome but I like using Firefox better. Thanks in advance for your help, Susan ",other;desktop;firefox-760;mac-os;,firefox,en-US
1288164,2020-05-24 14:12:24 -0800,https://support.mozilla.org/questions/1288164,history cancel - not working,"Hello, I use to clear history every 2 months, but since some months the normal cancel history procedure doesn't work at all. Is there any toerh way to cancel history. I don't want to delete bookmarks and other settigns. ",privacy-and-security_1;firefox-750;desktop;mac-os;,firefox,en-US
1288166,2020-05-24 14:25:17 -0800,https://support.mozilla.org/questions/1288166,redirection,keep being redirected from tagged.com to widgetserver.com ,download-and-install_1;desktop;firefox-760;windows-10;,firefox,en-US
1288167,2020-05-24 14:32:20 -0800,https://support.mozilla.org/questions/1288167,bajar una nuvea vercion,bold text ,download-and-install_1;firefox-660;desktop;linux;,firefox,en-US
1288171,2020-05-24 15:07:08 -0800,https://support.mozilla.org/questions/1288171,steaks on screen,Just downloaded FF for new computer and am having problems with flashing horizontal streaks. Is there fix? ,fix-problems;desktop;firefox-760;windows-10;,firefox,en-US
