id,created,updated,title,content,tags,product,topic,locale,answers,creator
1288460,2020-05-27 01:58:33 -0800,2020-05-27 02:36:41 -0800,error message,"<p>I am getting an error message at the bottom of the page when I use Firefox. It says Mozilla Firefox seems slow... to... start. And wants me to click on a button to find out how to speed it up. Is this genuine and from Mozilla or is it a scam? I know I am probably sounding a bit paranoid but I am really careful these days. Cheers, Dave </p>",other;desktop;firefox-760;mac-os;,firefox,other,en-US,1316245;1316246;,davepoole
1288459,2020-05-27 01:35:26 -0800,2020-05-27 02:37:17 -0800,Whatscan,<p>Whatscan download </p>,download-and-install_1;firefox-400;desktop;linux;,firefox,download-and-install,en-US,1316247;,35292
1288456,2020-05-27 01:21:37 -0800,2020-05-27 01:21:37 -0800,Necesito un código nuevo para poner en funcionamiento el buscador mozilla en el móvil.,<p>Necesito un código nuevo para poner en funcionamiento el buscador mozilla en el móvil. </p>,sync;desktop;,firefox,sync,en-US,"",davidmontielpunzano
1288455,2020-05-27 01:16:26 -0800,2020-05-27 01:16:26 -0800,"Firefox, McAfee Web Advisor and BT Yahoo Email....Not Happy Together?","<p>I use Firefox as my main browser on my Windows 10 Laptop. It has McAfee Web Advisor installed. </p><p>About a week ago, I discovered that I could no longer login to my BT Yahoo Email Account using Firefox while McAfee Web Advisor was enabled. They'd worked perfectly together until then. </p><p>Now, if I'm using Firefox, I have to disable McAfee Web Advisor when I want to look at my Emails.  </p><p>BUT if I use one of the other browsers I have installed, I don't have to do this. My other three browsers, BT Yahoo Email and McAfee Web Advisor continue to work perfectly together. </p><p>Has anyone come across this problem and if so, is there a fix you could suggest, please? </p>",other;desktop;,firefox,other,en-US,"",cliveparsons
1288452,2020-05-27 00:15:42 -0800,2020-05-27 00:15:42 -0800,Script blocking,<p>How do I stop Firefox from disabling scripts ? </p>,privacy-and-security_1;desktop;firefox-760;windows-7;,firefox,privacy-and-security,en-US,"",tomdysart
1288447,2020-05-26 21:45:45 -0800,2020-05-26 22:54:31 -0800,YouTube with Firefox,"<p>I can't use YouTube with Firefox on Mac. When I open YouTube, it acts like it is stuck and keeps reloading a previous page, over and over every 3 seconds so I can't click on anything. Strange. Yes, I cleared the Cache and it didn't help. I had an old mac and had the same problem and my new mac was just purchased this year. Any ideas? </p>",other;desktop;firefox-760;mac-os;,firefox,other,en-US,1316228;,gwayman
1288445,2020-05-26 21:03:41 -0800,2020-05-26 21:03:41 -0800,Change desktop icons from 150x back to 125x font size.,<p>Give me instructions to change  desktop icons from 150x back to 125x font size. </p><p>Vinnie </p>,customize;desktop;firefox-760;windows-10;,firefox,customize,en-US,"",vccjr9
1288444,2020-05-26 20:42:54 -0800,2020-05-26 20:42:54 -0800,One Password doesn't work as a plugin,<p>Hello: </p><p>Does Firefox make it hard for OnePassword to work in the browser because they want us to use their manager? The OnePassword add-on is ghosted in the toolbar and can't be clicked or used. </p><p>Thanks! </p>,customize;desktop;firefox-760;windows-10;,firefox,customize,en-US,"",cls3b86
1288442,2020-05-26 20:34:54 -0800,2020-05-26 20:34:54 -0800,Not syncing between computers,"<p>Since the latest upgrade, Firefox is not syncing tabs between computers.  It recognizes that the computers are synced, but there is no longer an option to go to tabs on the other computer. </p>",sync;desktop;firefox-760;windows-7;,firefox,sync,en-US,"",platonicadv
1288440,2020-05-26 19:50:33 -0800,2020-05-27 19:29:23 -0800,Unable to download and add extensions,"<p>When I try to add extensions with Firefox, I get this error message: ""Download failed. Please check your connection."" The add-on's I want to add are all ""recommended"" ones, e.g. lastpass, and not questionable ones. I have checked my firewall, but that does not seem to be the issue. And I can add extensions to other browsers but Firefox is the one I prefer. </p>",fix-problems;desktop;firefox-760;windows-10;,firefox,fix-problems,en-US,1316248;1316392;1316449;,kathleenpwood
1288439,2020-05-26 19:46:17 -0800,2020-05-26 19:46:17 -0800,Outlook,"<p>For the past two months, every time I click on my Outlook bookmark to get my emails, it never works the first time. You must always click a first time, then a second time. Hint: it's only with Outlook. All the other bookmarks work well. </p>",bookmarks;desktop;firefox-760;windows-10;,firefox,bookmarks,en-US,"",rogberube
1288438,2020-05-26 19:39:05 -0800,2020-05-26 19:39:05 -0800,add to closed captions or live interact on JTV,"<p>How can i interact with live tv/JTV or add some subtiles in closed captioning ,my ass hole so called friends been doing it for years any suggestions </p>",fix-problems;,firefox,chat-and-share,en-US,"",tshaw9386
1288437,2020-05-26 19:30:46 -0800,2020-05-26 21:17:40 -0800,How do I stop Mozilla firefox updating?,<p>I need firefox to stay at version 52 to accommodate a work website. It keeps automatically updating to later versions. I have a mac. How do I prevent this? its 52 ESR </p>,download-and-install_1;desktop;,firefox,download-and-install,en-US,1316211;1316213;1316216;,nabil.seery
1288434,2020-05-26 18:03:17 -0800,2020-05-26 18:31:28 -0800,How Do I Disable Lockwise?,"<p>I'm not sure when lockwise went from an optional add on to ""you know what I'm just going to run myself anyway"" but I already have a password manager and I want to disable Lockwise. Every article or help post I find  insists Lockwise is an Addon but it's not in that list and when i go to the Logins &amp; Passwords tab I can see what Lockwise is doing but I can't do anything about it let alone switch it off. </p><p>I've been using Lastpass for years and I'm more than happy with it and I find Lockwise competing with Lastpass and pushing itself to the front of the queu when entering passwords on sites and I don't want that.  </p><p>How do I disable it please? </p>",privacy-and-security_1;desktop;firefox-760;windows-10;,firefox,privacy-and-security,en-US,1316195;1316196;,damionis
1288433,2020-05-26 17:53:24 -0800,2020-05-26 18:33:46 -0800,Top Sites Section in Home Page disappeared.  HOw can I get it back?,"<p>I wanted to delete one item from the Top Sites section of my Home Page on Firefox, but instead I removed the entire row.  How can I get it back?  </p><p>Thank you for any hep you might be able to provide. </p>",other;desktop;firefox-760;windows-7;,firefox,other,en-US,1316194;1316197;,AnthonyMalina
1288430,2020-05-26 17:20:56 -0800,2020-05-26 19:49:34 -0800,network.trr.mode = 3,"<p>Hello Community! I have been a FF user for a couple of years now and really enjoy the browser - thanks for all the hard work. The last FF update to ver 76 has been a struggle as I use DoH and I set network.trr.mode = 3 (no non-DoH fallback allowed) however the update has broken this. I even completely reinstalled the OS (linux - pop) with a full clean install of FF with the same results. This is also the case on all my machines no it's for sure FF 76. Any ideas? Here are my config settings: </p><p>network.trr.mode = 3 network.trr.custom_uri = <a href=""https://mozilla.cloudflare-dns.com/dns-query"" rel=""nofollow"">https://mozilla.cloudflare-dns.com/dns-query</a> network.trr.bootstrapAddress - 1.1.1.1 </p><p>No pages will load however when i set network.trr.mode back to '2' all works fine again. </p>",privacy-and-security_1;desktop;firefox-760;,firefox,privacy-and-security,en-US,1316198;1316204;,chris.d.green
1288427,2020-05-26 17:09:10 -0800,2020-05-26 18:18:23 -0800,My google maps disapear after a couple 2nds?,"<p>when i click on a google map, its pops up for a second then disappears? </p><p>anyone know why  and how to fix it </p><p>thanks </p><p>v </p>",websites;desktop;firefox-760;windows-10;,firefox,websites,en-US,1316193;,vinydapoon
1288423,2020-05-26 16:41:56 -0800,2020-05-26 18:16:02 -0800,Toolbar - URL & Search uneven lengths,"<p>It use to be after sizing the URL and Search to be even lengths, and then in Customize placing the Reload icon between them, the 2 windows would remain relatively the same length.  Now, however when completing the steps the Search window is reduced considerably (see attached).  How to get the URL and Search portions more or less equal? </p>",customize;desktop;firefox-760;windows-7;,firefox,customize,en-US,1316192;,svelt
1288418,2020-05-26 15:42:10 -0800,2020-05-26 15:42:10 -0800,Browser LOCKS out right side of screen,"<p>OK, I have no question that some wacky combination of keystrokes has gotten me into the issue I have, Im a poor typist at best and not really getting any better. </p><p>But Im cruising through my day and all of a sudden my Browser Linux Mint installation of V71, shifts EVERYTHING to about 1/3 of my screen width on the LEFT and leaves the other 2/3 completely inaccessible. </p><p>Rebooting doesn't help, hard shutdowns no go. I have more that 1 copy open (3 MAX), and the other 2 arent effected, just the one that was my primary. </p><p>This has occurred before and in the past it EVENTUALLY resolves itself. But Id love to know what Im doing wrong so I can NOT do it, as well as a solution? </p><p>Thanks hopefully I can post my screenshot. </p><p>J </p>",firefox-710;desktop;fix-problems;linux;,firefox,fix-problems,en-US,"",jerometnt
