id,created,updated,title,content,tags,product,topic,locale,answers,creator
1288589,2020-05-27 22:26:06 -0800,2020-05-27T22:29:01Z,img src url not resolving when it is a GET request to a jsp page,"<p>I think this is a bug, but thought I'd ask here first. </p><p>On FireFox 76.0.1, Windows 10, 64 bit </p><p>This is not resolving (names changed for privacy) </p><p><img alt=""none"" src=""http://somewhere.com/GetUserImage.jsp?user=someone""> </p><p>The URL resolves correctly when used alone. Clicking View Image on the browser right mouse menu on the alt ('none') link also resolves correctly. According to the dev console Network tab, it's not even trying to access the specified URL, and hovering over it on the Inspector tab reports ""Cannot load image"" </p><p>The page containing that image definition works correctly in Chrome, Edge beta, and Opera. </p><p>Thanks! Dan </p>",other;desktop;firefox-760;windows-10;,firefox,other,en-US,1316466;,other5
1288587,2020-05-27 21:49:14 -0800,2020-05-28T04:22:40Z,Time is wrong/Only In FF/4hrs fast,"<p>Hello, </p><p>My time is wrong in Firefox. When I see the time stamps of my productivity on any social or business site, they are about 4 hours ahead.  In other browsers (Chrome &amp; Edge), everything is fine. In Windows, my time is properly set. This includes my Time Zone in Control Panel as well.  </p><p>I have uninstalled Firefox, restarted, and did a fresh install. I am having the same issue. </p>",firefox-680;desktop;fix-problems;windows-10;,firefox,fix-problems,en-US,1316505;,sam41rocks
1288586,2020-05-27 21:44:59 -0800,2020-05-27T23:55:22Z,firefox is broken,<p>hello my firefox browser is ad-blocker i have now big problem can jou help my? </p>,fix-problems;desktop;firefox-760;windows-10;,firefox,fix-problems,en-US,1316477;,ckwakkenbos5
1288585,2020-05-27 21:41:11 -0800,2020-05-27T21:41:11Z,Send tab to devices not working from some iOS apps,"<p>At one point this used to work, but it seems to have stopped working recently. </p><p>I use the Send to Device feature frequently, but certain share combos don't seem to work at all. </p><p>What works: </p> <ul><li> iOS Firefox to desktop </li><li> iOS Safari to desktop </li><li> iOS Edge to desktop </li><li> Some random iOS apps (IMDB, Amazon) to desktop </li><li> Desktop Firefox to iOS Firefox </li></ul> <p>What doesn't work: </p> <ul><li> iOS Twitter to desktop </li><li> iOS Facebook to desktop </li><li> iOS Reddit to desktop </li><li> iOS Google Chrome to desktop </li><li> iOS Yelp to desktop </li></ul> <p>I'm on Firefox 76.0.1 (Windows 10) and iOS 13.5. </p>",sync;firefox-7601;desktop;firefox-760;windows-10;,firefox,sync,en-US,"",phil.park
1288583,2020-05-27 21:30:55 -0800,2020-05-27T23:57:08Z,Want to be able to resize firefox screen. Now it is full screen even after clicking the arrow button.,<p>See subject. Mozilla always in full screen and is not adjustable to see windows behind it. </p>,customize;desktop;firefox-760;windows-10;,firefox,customize,en-US,1316478;,jamesmckibben
1288581,2020-05-27 20:35:57 -0800,2020-05-27T23:57:41Z,search app,<p>I don't know what I'm doing. I  thought the all word open and let me search like chrome does. What an in doing wrong </p>,desktop;fix-problems;,firefox,fix-problems,en-US,1316479;,linsuejons
1288580,2020-05-27 20:19:28 -0800,2020-05-27T23:58:41Z,opening uncommanded windows,"<p>As of today, no change to Firefox, it tries to open what appears a speed dial item in a new window. This is being done without any input from me. If I hover over task bar and close new window a new different one tries to open. </p>",fix-problems;desktop;firefox-760;windows-10;,firefox,fix-problems,en-US,1316480;,SniperDog
1288576,2020-05-27 19:40:32 -0800,2020-05-28T00:01:23Z,FINDING A NEW FOLDER,"<p>When I create a new folder in Firefox, it disappears. Where are they. When there were few, they would show up at the bottom of the bookmarks. Now, there is nothing there. </p><p>ALSO - How can I decide where a new folder goes? </p><p>Thank you </p>",other;desktop;firefox-760;windows-10;,firefox,other,en-US,1316481;,idaho70
1288575,2020-05-27 19:24:39 -0800,2020-05-27T19:24:39Z,Sign-in options & change of browser personalization,<p>I want to disengage my Firefox browser from Microsoft Edge &amp; get the Top menu items when I sign in to Yahoo. Thanks. </p>,customize;desktop;,firefox,customize,en-US,"",susanhart2
1288574,2020-05-27 19:22:37 -0800,2020-05-27T23:50:27Z,Firefox update,"<p>Hi there, long time firefox user here, but I have a problem. It seems there was an update to fire fox last night and this morning when I tried to launch Firefox I get this ""Windows cannot find 'C:\Users\Lynn\AppData\Local|Mozilla Firefox\firefox.exe'. Make sure you typed the name correctly, and then try again.""  This comes up each time I launch Firefox.  I've looked on line for help and I am at a loss. I can't get the browser to run &amp; I'm afraid that the bookmarks that I've had on there for many years may have been lost. Can anyone help me with figuring out what I need to do to fix this, I've loved Firefox from day 1 when I installed it and this is really the first time I've had a problem like this. Any help would be appreciated, thanks </p>",other;desktop;,firefox,other,en-US,1316450;1316460;1316473;1316474;,LPalmer169
1288573,2020-05-27 19:02:34 -0800,2020-05-27T23:31:52Z,Firefox icon keep showing on the taskbar after video call ended,"<p>Is there any way to remove it? It's not that bad, just a slight annoyance. </p>",other;desktop;firefox-760;windows-10;,firefox,other,en-US,1316458;1316470;,fazarmc
1288572,2020-05-27 18:49:49 -0800,2020-05-28T07:05:09Z,"Firefox won't close, or fill the screen from its thumbnail.","<p>Firefox won't close.  The icon is there on the Bar, but putting the arrow over the icon brings up the last page open, which won't close (using the X in the upper right corner), or open on the screen, (either by click or double-click). </p>",desktop;fix-problems;,firefox,fix-problems,en-US,1316540;,danielkastenholz
1288571,2020-05-27 18:47:06 -0800,2020-05-27T19:37:22Z,Recurrent Crashing Despite Clean Re-Install,"<p>My firefox keeps crashing despite a clean re-install. It'll all for Crash Reason: EXCEPTION_BREAKPOINT </p><p>Here's the latest crash report: </p><pre>ID: f8644152-4413-42b0-9b20-787280200528 </pre> <p>Signature: mozilla::psm::GetXPCOMFromNSSError </p><p>Signature 	mozilla::psm::GetXPCOMFromNSSError More Reports Search UUID 	f8644152-4413-42b0-9b20-787280200528 Date Processed 	2020-05-28 01:39:53 UTC Uptime 	900 seconds (15 minutes) Last Crash 	908 seconds before submission (15 minutes and 8 seconds) Install Age 	1,484,225 seconds since version was first installed (2 weeks, 3 days and 4 hours) Install Time 	2020-05-10 20:53:22 Product 	Firefox Release Channel 	release Version 	76.0.1 Build ID 	20200507114007 (2020-05-07) Buildhub data OS 	Windows 10 OS Version 	10.0.18363 Build Architecture 	amd64 CPU Info 	family 6 model 142 stepping 9 CPU Count 	4 Adapter Vendor ID 	 </p><p>Intel Corporation (0x8086) </p><p>Adapter Device ID 	 </p><p>HD Graphics 620 (0x5916) </p><p>Startup Crash 	 </p><p>False </p><p>MOZ_CRASH Reason (Sanitized) 	 </p><p>MOZ_CRASH(Function failed without calling PR_GetError) </p><p>Crash Reason 	EXCEPTION_BREAKPOINT Crash Address 	0x7ffda214cb27 EMCheckCompatibility 	 </p><p>False </p><p>App Notes 	 </p><p>FP(D00-L1000-W00001000-T000)  Has dual GPUs. GPU-#2: AdapterVendorID2: 0x000b, AdapterDeviceID2: 0x000b, AdapterSubsysID2: 081c1028, AdapterDriverVersion2: DWrite? DWrite+ WR? WR- OMTP? OMTP+3  </p><p>Processor Notes 	 </p><p>processor_ip-172-31-29-32_us-west-2_compute_internal_7; ProcessorPipeline </p><p>Crashing Thread (6), Name: Socket Thread Frame 	Module 	Signature 	Source 	Trust 0 	xul.dll 	mozilla::psm::GetXPCOMFromNSSError(int) 	security/manager/ssl/NSSErrorsService.cpp:76 	context 1 	xul.dll 	mozilla::net::nsHttpConnection::EnsureNPNComplete(nsresult&amp;, unsigned int&amp;) 	netwerk/protocol/http/nsHttpConnection.cpp:551 	cfi 2 	xul.dll 	mozilla::net::nsHttpConnection::OnSocketWritable() 	netwerk/protocol/http/nsHttpConnection.cpp:1975 	cfi 3 	xul.dll 	mozilla::net::nsHttpConnection::OnOutputStreamReady(nsIAsyncOutputStream*) 	netwerk/protocol/http/nsHttpConnection.cpp:2526 	cfi 4 	xul.dll 	mozilla::net::nsSocketOutputStream::OnSocketReady(nsresult) 	netwerk/base/nsSocketTransport2.cpp:518 	cfi 5 	xul.dll 	mozilla::net::nsSocketTransport::OnSocketReady(PRFileDesc*, short) 	netwerk/base/nsSocketTransport2.cpp:2322 	cfi 6 	xul.dll 	mozilla::net::nsSocketTransportService::Run() 	netwerk/base/nsSocketTransportService2.cpp:1095 	cfi 7 	xul.dll 	nsThread::ProcessNextEvent(bool, bool*) 	xpcom/threads/nsThread.cpp:1220 	cfi 8 	xul.dll 	NS_ProcessNextEvent(nsIThread*, bool) 	xpcom/threads/nsThreadUtils.cpp:481 	cfi 9 	xul.dll 	mozilla::ipc::MessagePumpForNonMainThreads::Run(base::MessagePump::Delegate*) 	ipc/glue/MessagePump.cpp:332 	cfi 10 	xul.dll 	MessageLoop::RunHandler() 	ipc/chromium/src/base/<a href=""http://message_loop.cc:308"" rel=""nofollow"">message_loop.cc:308</a> 	cfi 11 	xul.dll 	MessageLoop::Run() 	ipc/chromium/src/base/<a href=""http://message_loop.cc:290"" rel=""nofollow"">message_loop.cc:290</a> 	cfi 12 	xul.dll 	static nsThread::ThreadFunc(void*) 	xpcom/threads/nsThread.cpp:464 	cfi 13 	nss3.dll 	_PR_NativeRunThread(void*) 	nsprpub/pr/src/threads/combined/pruthr.c:399 	cfi 14 	nss3.dll 	pr_root(void*) 	nsprpub/pr/src/md/windows/w95thred.c:139 	cfi 15 	ucrtbase.dll 	thread_start&lt;unsigned int (__cdecl*)(void*), 1&gt; 		cfi 16 	kernel32.dll 	BaseThreadInitThunk 		cfi 17 	ntdll.dll 	RtlUserThreadStart </p><p>Would appreciate any insights so that I can continue to use Firefox - thanks! </p>",fix-problems;desktop;firefox-760;windows-10;,firefox,fix-problems,en-US,1316452;1316453;,khamil
1288569,2020-05-27 18:12:02 -0800,2020-05-27T18:48:58Z,sync fails to work across devices,"<p>i Am having trouble getting sync to work between my desktop and laptop.  I have tried reinstalling firefox with no luck.  I created a new profile and imported my bookmarks in and no luck.  here is a paste of the log file. I would appreciate any help.  </p><p>1590627953950	Sync.SyncScheduler	DEBUG	Next sync in 600000 ms. (why=schedule) </p><p>1590627953951	FirefoxAccounts	TRACE	not checking freshness of profile as it remains recent </p><p>1590627953951	FirefoxAccounts	TRACE	not checking freshness of profile as it remains recent </p><p>1590627975703	Sync.Service	DEBUG	User-Agent: Firefox/76.0.1 (Windows NT 10.0; Win64; x64)  FxSync/1.78.0.20200507114007.desktop </p><p>1590627975703	Sync.Service	INFO	Starting sync at 2020-05-27 21:06:15 in browser session VGSbX3nLWaDr </p><p>1590627975703	Sync.SyncScheduler	DEBUG	Clearing sync triggers and the global score. </p><p>1590627975704	Sync.Status	INFO	Resetting Status. </p><p>1590627975704	Sync.Status	DEBUG	Status.service: success.status_ok =&gt; success.status_ok </p><p>1590627975705	FirefoxAccounts	TRACE	not checking freshness of profile as it remains recent </p><p>1590627975705	FirefoxAccounts	TRACE	not checking freshness of profile as it remains recent </p><p>1590627975705	FirefoxAccounts	TRACE	not checking freshness of profile as it remains recent </p><p>1590627975809	Sync.Resource	DEBUG	GET success 200 https://sync-596-us- <a href=""http://west-2.sync.services.mozilla.com/1.5/93597766/info/collections"" rel=""nofollow"">west-2.sync.services.mozilla.com/1.5/93597766/info/collections</a> </p><p>1590627975809	Sync.Service	DEBUG	Fetching server configuration: <a href=""https://sync-596-us-west-2.sync.services.mozilla.com/1.5/93597766/info/configuration"" rel=""nofollow"">https://sync-596-us-west-2.sync.services.mozilla.com/1.5/93597766/info/configuration</a> </p><p>1590627975810	FirefoxAccounts	TRACE	not checking freshness of profile as it remains recent </p><p>1590627975912	Sync.Resource	DEBUG	GET success 200 https://sync-596-us- <a href=""http://west-2.sync.services.mozilla.com/1.5/93597766/info/configuration"" rel=""nofollow"">west-2.sync.services.mozilla.com/1.5/93597766/info/configuration</a> </p><p>1590627975912	Sync.Service	DEBUG	Fetching global metadata record </p><p>1590627975912	Sync.Service	DEBUG	Weave Version: 1.78.0 Local Storage: 5 Remote Storage: 5 </p><p>1590627975912	Sync.Service	DEBUG	Fetching and verifying -- or generating -- symmetric keys. </p><p>1590627975912	Sync.Service	INFO	Testing info/collections: {""bookmarks"":1590624877.61,""passwords"":1590627962.64,""meta"":1590626330.79,""crypto"":1520384595.02,""clients"":1590627957.9} </p><p>1590627975912	Sync.CollectionKeyManager	INFO	Testing for updateNeeded. Last modified:  1520384595.02 </p><p>1590627975912	Sync.Synchronizer	DEBUG	Refreshing client list. </p><p>1590627975913	Sync.Engine.Clients	INFO	0 outgoing items pre-reconciliation </p><p>1590627975913	Sync.Engine.Clients	DEBUG	Resetting clients last sync time </p><p>1590627975913	FirefoxAccounts	TRACE	not checking freshness of profile as it remains recent </p><p>1590627976053	Sync.Collection	DEBUG	GET success 200 https://sync-596-us- <a href=""http://west-2.sync.services.mozilla.com/1.5/93597766/storage/clients?full=1&amp;limit=1000"" rel=""nofollow"">west-2.sync.services.mozilla.com/1.5/93597766/storage/clients?full=1&amp;limit=1000</a> </p><p>1590627976056	Sync.Engine.Clients	INFO	Records: 0 applied, 0 successfully, 0 failed to apply, 0 newly failed to apply, 6 reconciled. </p><p>1590627976056	Sync.Engine.Clients	DEBUG	Refreshing the known stale clients list </p><p>1590627976057	Sync.BulkKeyBundle	INFO	BulkKeyBundle being created for undefined </p><p>1590627976057	Sync.Engine.Clients	INFO	Hiding stale client iDv2s3oTXlyL - duplicate device id f098df0ecf5e883dc268717e23407391 </p><p>1590627976059	Sync.Synchronizer	INFO	Updating enabled engines: 5 clients. </p><p>1590627976060	Sync.Synchronizer	INFO	Syncing all enabled engines. </p><p>1590627976060	Sync.Engine.Passwords	INFO	0 outgoing items pre-reconciliation </p><p>1590627976060	FirefoxAccounts	TRACE	not checking freshness of profile as it remains recent </p><p>1590627976271	Sync.Collection	DEBUG	GET success 200 <a href=""https://sync-596-us-west-2.sync.services.mozilla.com/1.5/93597766/storage/passwords?newer=1590627833.61&amp;full=1&amp;"" rel=""nofollow"">https://sync-596-us-west-2.sync.services.mozilla.com/1.5/93597766/storage/passwords?newer=1590627833.61&amp;full=1&amp;</a> limit=1000 </p><p>1590627976272	Sync.Engine.Passwords	INFO	Records: 0 applied, 0 successfully, 0 failed to apply, 0 newly failed to apply, 0 reconciled. </p><p>1590627976272	Sync.Engine.Bookmarks	DEBUG	Checking if server sync ID RtdrA0dDiuXK matches existing </p><p>1590627976273	Sync.Engine.Bookmarks	INFO	0 outgoing items pre-reconciliation </p><p>1590627976274	Sync.Engine.Bookmarks	INFO	Records: 0 applied, 0 successfully, 0 failed to apply, 0 newly failed to apply, 0 reconciled. </p><p>1590627976274	Sync.Engine.Bookmarks.Mirror	DEBUG	Merging bookmarks in Rust </p><p>1590627976276	Sync.Engine.Bookmarks.Mirror	DEBUG	Building local tree </p><p>1590627976279	Sync.Engine.Bookmarks.Mirror	DEBUG	Building remote tree </p><p>1590627976280	Sync.Engine.Bookmarks.BookmarkSyncUtils	DEBUG	pushChanges: Processed change records: {""weak"":0,""skipped"":0,""updated"":0} </p><p>1590627976280	Sync.Status	DEBUG	Status for engine bookmarks: error.engine.reason.unknown_fail </p><p>1590627976280	Sync.Status	DEBUG	Status.service: success.status_ok =&gt; error.sync.failed_partial </p><p>1590627976280	Sync.ErrorHandler	DEBUG	bookmarks failed: MergeError: Item -N8o9cZ315HT can't  contain itself(resource://gre/modules/SyncedBookmarksMirror.jsm:1412:5) JS Stack trace: MergeError@SyncedBookmarksMirror.jsm:1412:5 handleError@SyncedBookmarksMirror.jsm:774:22 </p><p>1590627976281	Sync.Doctor	INFO	Skipping check of passwords - disabled via preferences </p><p>1590627976281	Sync.Doctor	INFO	Skipping check of bookmarks - disabled via preferences </p><p>1590627976281	Sync.Doctor	INFO	Skipping validation: no engines qualify </p><p>1590627976281	Sync.Synchronizer	INFO	Sync completed at 2020-05-27 21:06:16 after 0.58 secs. </p><p>1590627976281	Sync.Declined	DEBUG	Handling remote declined:  [""forms"",""history"",""tabs"",""addons"",""prefs""] </p><p>1590627976281	Sync.Declined	DEBUG	Handling local declined:  [""forms"",""history"",""tabs"",""addons"",""prefs""] </p><p>1590627976281	Sync.Declined	DEBUG	Declined changed? false </p><p>1590627976281	Sync.Service	INFO	No change to declined engines. Not reuploading meta/global. </p><p>1590627976281	Sync.ErrorHandler	ERROR	Some engines did not sync correctly. </p><p>1590627976282	Sync.SyncScheduler	DEBUG	Next sync in 600000 ms. (why=schedule) </p><p>1590627976284	FirefoxAccounts	TRACE	not checking freshness of profile as it remains recent </p>","",firefox,sync,en-US,1316434;1316439;,michdad04
1288568,2020-05-27 17:48:16 -0800,2020-05-27T17:48:16Z,My email address is in use by another Firefox account user?,<p>I just tried to add a secondary email address to my Firefox account and get an error message stating that this email address is in use by another Firefox account user (already verified by another user). </p><p>Is there a way of finding out which account it is registered to?  I can't recall ever using this email address in Firefox before? </p><p>Thanks </p>,sync;desktop;firefox-760;windows-10;,firefox,sync,en-US,"",grant.prowse
1288567,2020-05-27 17:46:57 -0800,2020-05-28T09:02:37Z,"Firefox won't open, nor will Firefox Profile Manager","<p>I'm not sure what I can do to fix the problem; the answer I've found uses the Profile Manager and I can't access it, it'll open for a split second then close again. </p>",desktop;fix-problems;,firefox,fix-problems,en-US,1316454;1316576;1316578;1316582;,tommyhandley
1288566,2020-05-27 17:19:27 -0800,2020-05-28T08:45:13Z,impresion defectuosa(solo se permite la primera pagina),<p>al ingresar a una plataforma de estudio (privativa) y al imprimir  para guardar en pdf solo se muestra la primera pagina; quise dejar como impresora predetermianda fox it reader pero no me lo permitio el soft ware </p><p>¿alguna idea para corregir este inconvenietne? </p>,download-and-install_1;desktop;firefox-760;windows-7;,firefox,download-and-install,es,1316577;,vince_campos
1288565,2020-05-27 17:13:09 -0800,2020-05-27T18:06:12Z,Deleting a URL in address bar,"<p>I want to delete a URL in my address bar. I have followed the instructions on a Mozilla support page but that does not work.<br> These are the instructions I have followed: <br> Clearing a single item from the address bar history </p><p>To clear a single item in the address bar history, click the drop-down arrow in the address bar. </p><p>show history address bar 57 </p><p>Press the ↓ down arrow key or move the mouse, to highlight the entry to delete. </p><p>To clear the highlighted item, hold down the Shift key and press Delete on your keyboard. </p><p>--- <br> Nothing happens when I follow these instructions.<br> Can anyone help me? <br> Thanks very much. </p>",other;desktop;firefox-760;windows-81;,firefox,other,en-US,1316431;,richsprt
1288564,2020-05-27 16:57:13 -0800,2020-05-27T17:37:43Z,Firefox is preventing Macbook to sleep,"<p>Since I upgraded my macbook to Catalina, I found that my macbook can longer automatically go to sleep when the lid is open. And the culprit seems to be the firefox browser,  because in the activity monitor, it always shows that firefox is preventing the sleep.  </p><p>Is there any reason that firefox is preventing my laptop to sleep? And how can I turn it off. </p>",other;desktop;firefox-760;,firefox,other,en-US,1316415;1316425;,lajiyoujian25
1288562,2020-05-27 16:28:27 -0800,2020-05-27T18:24:15Z,screen share,<p>when i try to start sharing my screen on google meet it said i must grant permission in order to screen share but there is no option to give permission </p>,privacy-and-security_1;desktop;firefox-760;mac-os;,firefox,privacy-and-security,en-US,1316421;1316428;1316438;,SEY0002
1288561,2020-05-27 15:56:14 -0800,2020-05-27T15:56:14Z,Format önceki Yer imleri,"<p>Merhaba, </p><p>Ekranımda böyle bir hata oluştu. Lütfen yardımcı olur musunuz ?   Yer imleri otomatik gelmedi. </p>",tabs;desktop;firefox-760;windows-10;,firefox,tabs,tr,"",evrim89
